positivePoints,negativePoints,commentText,like,dislike,"ارزش خريد در برابر قيمت","عملکرد سخت افزار داخلي و باتري","کيبورد و تاچ پد","کيفيت صفحه نمايش و بلندگوها","امکانات و قابليت ها","طراحي و کيفيت ساخت"
"کيبورد خوش دست
مقرون به صرفه","کليد End ندارد
سوکت شارژرش جالب نيست","من این لپتاپ رو برای پدرم سفارش دادم و مدتی که راه اندازی و باهاش کردم مشکلی ندیدم. اندازه و وزنش ایده آله.
عملکرد سخت افزارش خیلی خوبه و کیبورد و تاچ پدش خوش دست و روان هست. حروف فارسی هم داره. دکمه پاور هم روی کیبورد هست. فقط کلید End رو پیدا نکردم (خودم برنامه نویس هستم و این قضیه اذیتم میکرد) یه ایراد دیگه هم (که فکر میکنم به همه لپتاپهای ایسوس وارد هست) اینه که پورت شارژر یه کمی لق میزنه و انگار خوب جفت و جور نمیشه (در مقایسه با مک بوک یا لپتاپ خودم که لنوو هست)",1,1,5,3,5,3,3,3
"با توجه به قيمت عاليه","رمش پايين است","فقط رمش پایینه ولی بقیه چیزاش خوبه",0,0,3,3,4,3,5,5
"نسبتت به قيمتش خوبه","جنس بدنه ضعيف","سخت افزار قوی ای نداره ولی برای کسی که خیلی اهل کار با نرم افزار های سنگین و بازی ها نیست و بیشتر برای کاریری عمومی میخواد لپ تاپ خوبیه...البته میشه باهاش بازی اجرا کرد ولی ممکنه یکم اذیتتون کنه",11,0,4,2,2,2,2,3
"از همه نظر عالييه",ندارد,"لپتاب خوبیه و در برابر قیمتش خیلی می ارزه",9,0,5,5,5,4,4,5
,,"برای بازی خوبه",4,18,5,5,5,5,5,3
