positivePoints,negativePoints,commentText,like,dislike,"ارزش خريد در برابر قيمت","عملکرد سخت افزار داخلي و باتري","کيبورد و تاچ پد","کيفيت صفحه نمايش و بلندگوها","امکانات و قابليت ها","طراحي و کيفيت ساخت"
"صفحه نمايش IPS
کوچکي","سرعت سخت افزار فقط براي وبگردي است
شارژدهي کم","لپ تاپ کوچک و خوبی است در شگفت انگیز ارزش خرید دارد
براحتی قابل حمل است
باتری دستگاه شارژدهی بین 3 الی 4 ساعت دارد
صفحه نمایش آن IPS است و از زوایای مختلف تصاویر به خوبی دیده میشود
اسپیکر هاش خوبه
من با تاچ پدش راحت نیستم
کیبوردش حروف فارسی نداره و عربیه
کیفیت ساخت ان متوسط است",0,0,5,3,3,5,3,3
"وزن کم
صفحه نمايش خوب
شارژر کوچک وسبک","تاچ پد خيلي ضعيف
ساپورت ضعيف در سايت توليد کننده","با توجه به قیمت برای کارهای سبک خوبه، وزن کم و اندازه مناسب که برای جابجایی زیاد خوبه، تاچ پدش خیلی ضعیفه و حتما نیاز به ماوس داره، با اتصال دی وی دی درایو اکسترنال دستگاه خاموش شد، سایت تولید کننده ساپورت ضعیفی داره و عملاهیچ درایوری وجود نداره",1,0,4,3,0,3,2,3
"ارزش بسيار بالاي خريد
کيفيت تصوير و صدا عالي
کيبورد و تاچ بسيار خوب
عملکرد باطري عالي
عملکرد سخت افزاري و کيفيت عاي","حافظه داخلي اگر بيشتر بود بهتر بود...","با سلام خدمت دوستان
بنده این لپ تاپ خریداری کردم و از خریدم بسیار راضی هستم و چون دانشجو هستم برام خیلی کاربرد داره مخصوصا""برنامه آفیس و همچنین حمل ونقل و جابه جایی برام راحته و تمام کارایی یک لپ تاپ خوب داره ....ضمنا"" تا الان ایراد یا ضعفی از این لپ تاپ ندیدم .
از دیجی کالا هم بابت قیمت و ارسال به موقع تشکر میکنم .",3,0,5,5,5,5,4,5
"صفحه نمايش خوب سبک . زيبا . قابليت حمل آسان سرعت خوب نسبت به سخت افزار","تاچ پدش بدرد نميخوره که با موس مشکل حل ميشه","ارزش خرید رو داره . و جوابگوی نیاز شما در کارهای معمولی هست .",2,0,5,3,2,4,3,3
"ويندوز 10 اورجينال
روان بودن نسبت به کم بودن سخت افزار رم و سي پي يو
خيلي سبک
جابه جايي راحت و تو دل برو","موقع روشن شدن پايين ال سي دي يه لکه سفيد هست
تعداد کم يو اس بي usb
تاچ پدش يکم منو اذيت ميکنه","من خیلی خوشم اومد و از دیروز یک سره دارم باهاش ور میرم
اولش شاید یکم خندتون بگیره واسه وزن و قیافش ولی واقعن همه کار میتونین بکننین
من واسه فیلم و سریال نگاه کردن گرفته بودم ولی الان همه کار میکنم مثله کامپیوتر رو میزی یه هاب usb بگیرین واسش کلی فلش و هارد وصل کنید حالشو ببرین خلاصه من قبل خرید 2 دل بودم و فکر میکردم اسباب بازی باشه و همش هنگ کنه ولی من هنگ ندیدم تو 24 ساعت فقط صفحه نمایش خیلی کوچیکه حتی یکم کوچک تر از ورقه A4 امکان داره چشمارو ضعیف کنه انتظار یه لپ 5 میلیونی نباید ازش داشته باشین و هی ایراد بگیرین تو این رنج حتی بدون پیشنهاد ویژه بهترینه اگه نظرم کمکتون کرده لایک کنید و اگه سوالی هم داشتین مطرح کنین من سر میزنم به این پست تا جوابتونو بدم",3,0,5,3,4,3,4,4
"وزن کم
کاربردي","ساخت بدنه","با این قیمت که تو پیشنهاد شگفت انگیز بودش یه تبلت لنوو 7 اینچی میشد خرید به درد خیلی از افراد میخوره خیلی سبکه کار راه بندازه سرعت بالا اومدن سیستمش خیلی خوب بود البته نسبت به قیمتش درسته از حافظه 32 گیگی حدود 20 گیگ خالی هستش اما این لپ تاپ یه سیستم ONE DRIVE داره که میتونه 100 گیگ هم اونجا ذخیره کنه که به نظرم از هارد اکسترنال هم بهتره چون هیچ وقت پاک نمیشه مگر اینکه خودتون پاک کنید عملکرد وای فای خوب بود تاچ پد زیاد جالب نیست در لپ تاپ یکم سفت بازو بسته میشه برا روشن کردمش باید 3 ثانیه دکمه پاور نگه داری که این یکم تو ذوق میزنه در کل خیلی خیلی خوبه مخصوصا برا دانش آموزا ن - برای افرادی که یه لپ تاپ خیلی سبک برای کار روزمره میخوان میرن سر ساختمون یا میخوان باهاش از برنامه حسابداریشون پرینت بگیرن عالیه",1,0,4,3,3,4,4,3
"ظرافت
صفحه نمايش
صدا
قيمت در پيشنهاد شگفت انکيز","شارژ دهي کم","سلام در پیشنهاد شگفت انگیز گرفتم و با این قیمت ارزش خرید دارد برای کار های معمولی عالیه فقط باتری آن 4 ساعت بیشتر نمیره",0,0,4,2,5,5,4,3
,,"من کل کارایی که با کامپیوتر خونگیم انجام میدم فقط وبگردی و تماشای فیلم یا گوش دادان به اهنگ و درنهایت چن ماه یه بار کار با آفیس هستش
بنابراین با توجه به قیمت و امکانات و اندازه و وزن این لپ تاپ، به نظرم گزینه خوبی اومد برای خرید و رنگ نقره ایشو سفارش دادم امیدوارم همونطوری که ازش انتظار دارم وقتی که به دستم برسه راضی کننده باشه و از خریدم لذت ببرم",2,0,5,5,5,5,5,5
"نسبت به قيمت عالي","نسبت به قيمت هيچي","میشه روش حساب باز کرد
نه بده که زود خراب شه
نه انقدر وفا دار که بیشتر از 2 سال مفید کار کنه
با تشکر از خودم بابت نظر و دیجی کالا بابت ارسال",2,1,2,3,2,3,5,1
"همه چيش","نسبت به قيمتش نميشه گفت ضعف داره","امروز به دستم رسید و بر خلاف چیزی که فکر میکردم کیفیت ساخت در حد یک لپ تاب رو داره. زاویه دید صفحه نمایش خوبه و کیفیت تصویر هم خوبه. اسپیکرها بد نیست.تاچ موس خوبه و کلیه مولتی تاچ ها رو داره.ولی موقعی که شارژر وصله خوب کار نمی‌کنه.کیبورد حروف فارسی نداره و عربیه ولی کارایی خوبی داره.از اسلت یو اس بی و کارت ریدر خوشم نیومد.رو ویندوز هم چیزی که مربوط به لب تاپ باشه نصب نیست.شارژر هم موقع شارژ دماش یه کم زیاد می‌ره بالا",1,0,5,4,3,5,4,5
"باطري قوي. ويندوز اورجينال. وزن کم","شايد يکم موس دستگاه","منم امروز نقره ایشو به دستم رسید تو شگفت انگیز خریدم
دستگاه رو وقتی باز کردم جا خوردم. خیلی سبک بود وقتی روشنش کردم ویندوز 10 اورجینال داشت و باطریشم این چندساعت مه استفاده کردم خوب جواب داده در کل برای من که کار ایمیل و خوندن کتاب دارم خیلی خوبه و اگر باز هم شگفت انگیز بشه دوتای دیگه میگیرم
چون نمیخواستم تبلت یا گوشی بزرگ بگیرم با این قیمت یک دیوایس عالی خریدم که کار هر دو رو انجام میده",5,1,5,4,4,4,5,3
"قيمت ارزان سبک و خوش دسته",,"تشکر از ارسال به موقع",7,1,5,3,4,3,3,3
"وزن کم","ظرافت در ساخت
قيمت عالي","سلام.من این مدل رو در پیشنهاد ویژه سفارش دادم.با توجه به قیمتش برای کارهای ساده مثل وبگردی.تماشای فیلم و افیس .عالیه و از اونجایی که من یک لپتاپ کوچک سبک میخواستم با تحقیقاتی که انجام دادم به این گزینه رسیدم.در اولین فرصت بعد از بررسی لپتاپ .در مورد جزییات باطری و صفحه نمایش نظر میدم تا دوستان انتخاب راحت تری داشته باشند.ممنون از دیجیکالا",9,1,5,5,5,3,5,3
"صفحه نمايش عالي
وزن فوق‌العاده کم
شارژ دهي مناسب","کيفيت ساخت بدنه کمي پايين است
فضاي ذخيره سازي مي‌توانست بيشتر باشد","در پیشنهاد شگفت انگیز یک دستگاه خریدم ولی بعد از استفاده پشیمان شدم که چرا تعداد بیشتری برای دوستان نخریدم ! چون واسه کارایی مثل وب گردی و مالتی مدیا و همچنین آفیس فوق‌العاده مناسب هست و به خاطر وزن خیلی کمش حملش خیلی راحته و میشه همیشه همراهتون باشه.",7,1,4,4,4,4,4,3
"هنوز مشخص نيست","هنوز مشخص نيست","سلام دوستان امروز توی شگفت انگیز این لب تاب رو خریدم امیدوارم خوب باشه من فقط واسه وب گردی و چاپ فاکتور فروش خریدم کسی هم از دوستان نظرنداده بود درموردش بازم میگم امیدوارم اسباب بازی نباشه و کارمو راه بندازه مرسی از دی جی کالا",2,4,0,3,3,3,3,3
,,"تمام افرادی که قبل من نظر دادن هیچ کدوم باهاش کار نکردن.
چون دیشب که تو پیشنهاد شگفت انگیز گذاشتن هیچ نظری نبود اما امشب نظر گذاشتن. تو یکروز که به دست خریدار نمیرسه پس بدون داشتن کالا میان نظر میزارن. لطفا تا چیزیو نخریدین و استفاده نکردین نظر ندین",8,3,2,1,0,0,1,3
"قيمت مناسب ويندوز اورجينال","ندارد با اين قيمت هيچي نميشه خريد حتي تبلت ويندوزي چه برسه به لپتاپ","لپ تاپ زیر این قیمت برای وب گردی و دانلود خیلی خوبه برای حمل وزن خوبی داره",5,0,5,4,5,4,4,4
"جمع و جور","حافظه و سخت افزار","با سلام
من میخواستم این لپ تاپ رو تو فروش ویژه بگیرم بعنوان لپ تاپ دوم برای محل کار و بیرون بردن بخاطر ضخامت کم و جمع و جور بودنش و قیمت نسبتا مناسب البته فقط در فروش ویژه
اما هرچی فکر کردم نتونستم با حافظه 32 اون و یه سری امکانات کنار بیام که الان دیگه برای موبایل هم کمه چه برسه به لپ تاپ اگر هم بخواهی براش یه هارد اکسترنال یا مموری با حافظه بالا و یا درایوDVD اکسترنال تهیه کنی که دیگه توجیه اقتصادی نداره
درکل گزینه مناسبیه خیلی جمع و جور و نازک و کاربردی ولی ایکاش حداقل تو حافظه داخلیش کوتاهی نمیکرد",2,2,2,1,3,3,1,3
,,"یعنی مگه میشه محصول انقدر بد باشه
اخه یه بازی یا یه برنامه ساده که بریزین توش پر میشه گرافیگشم که بدرد نمیخوره رمشم واسه یک لپ تاپ ضعیفه",0,15,0,0,0,0,0,0
"قيمت مناسب
ظاهر شيک
سبک بود و نازک بودن","کم بودن حافظه داخلي
کوچک بودن صفحه نمايش
نداشتن خروجي مانيتور","امروز سفارش دادم تو پیشنهاد شگفت انگیز قیمتش نسبت به بقیه سایت ها و بازار مناسب تره
فقط حیف که کسی نقد و بررسی نکرده به خاطر اون دو دل سفارش دادم
ولی نسبت به قیمتش باید خوب باشه
اگه دستم رسید تست میکنم نقاط ضعف و نقاط قوتش رو تو نظرات مینویسم
مرسی از دیجی کالای عزیز",11,0,5,3,4,3,4,4
,,"نسبت به قیمتش خیلی جالبه
با این پول هیچی نمیدن",8,4,3,3,3,3,3,3
,,"با این قیمتی که توی پیشنهاد ویژه گذاشته شده ارزش خریدش خیلی بالاست!
البته برای کاربری های معمولی مثل وبگردی و تایپ و آفیس...که آفیس هم رو خودش نصب هست
یه نکته ای هم که هست اینه که صفحه نمایش توی مشخصات گفته شده که IPS LCD هستش ولی توی نقد و بررسی گفته شده که IPS نیست!ولی توی سایت کمپانی سازنده گفته شده که IPS هست.",5,0,5,2,3,3,3,3
سبکي,"اي کاش حافظه هارد بيشتر بود.","خوبه چون قیمتش مناسبه با این قیمت سیستم نو نمیدن چه برسه لپتاب.",11,4,5,2,2,4,2,5
"نمايشگر کوچک
بسيار سبک
پردازنده اينتل","حافظه کم رم و رام","بسیار عالی و کار راه اندازه نسبت به قیمتش
و برای وبگردیو فیلم دیدن مناسبه
بنظرم من مخصوص سنین پائینه
و برای سنین پائین یه گزینه بسیار عالی و خوش قیمته",33,6,5,3,5,3,3,5
"باطري قوي. ويندوز اورجينال. وزن کم","شايد يکم موس دستگاه","منم امروز نقره ایشو به دستم رسید تو شگفت انگیز خریدم
دستگاه رو وقتی باز کردم جا خوردم. خیلی سبک بود وقتی روشنش کردم ویندوز 10 اورجینال داشت و باطریشم این چندساعت مه استفاده کردم خوب جواب داده در کل برای من که کار ایمیل و خوندن کتاب دارم خیلی خوبه و اگر باز هم شگفت انگیز بشه دوتای دیگه میگیرم
چون نمیخواستم تبلت یا گوشی بزرگ بگیرم با این قیمت یک دیوایس عالی خریدم که کار هر دو رو انجام میده",5,1,5,4,4,4,5,3
"قيمت ارزان سبک و خوش دسته",,"تشکر از ارسال به موقع",7,1,5,3,4,3,3,3
"وزن کم","ظرافت در ساخت
قيمت عالي","سلام.من این مدل رو در پیشنهاد ویژه سفارش دادم.با توجه به قیمتش برای کارهای ساده مثل وبگردی.تماشای فیلم و افیس .عالیه و از اونجایی که من یک لپتاپ کوچک سبک میخواستم با تحقیقاتی که انجام دادم به این گزینه رسیدم.در اولین فرصت بعد از بررسی لپتاپ .در مورد جزییات باطری و صفحه نمایش نظر میدم تا دوستان انتخاب راحت تری داشته باشند.ممنون از دیجیکالا",9,1,5,5,5,3,5,3
"صفحه نمايش عالي
وزن فوق‌العاده کم
شارژ دهي مناسب","کيفيت ساخت بدنه کمي پايين است
فضاي ذخيره سازي مي‌توانست بيشتر باشد","در پیشنهاد شگفت انگیز یک دستگاه خریدم ولی بعد از استفاده پشیمان شدم که چرا تعداد بیشتری برای دوستان نخریدم ! چون واسه کارایی مثل وب گردی و مالتی مدیا و همچنین آفیس فوق‌العاده مناسب هست و به خاطر وزن خیلی کمش حملش خیلی راحته و میشه همیشه همراهتون باشه.",7,1,4,4,4,4,4,3
