positivePoints,negativePoints,commentText,like,dislike,"ارزش خريد در برابر قيمت","عملکرد سخت افزار داخلي و باتري","کيبورد و تاچ پد","کيفيت صفحه نمايش و بلندگوها","امکانات و قابليت ها","طراحي و کيفيت ساخت"
,,"سلام دوستان عزیز
نوت بوک بسیار عالی برای برنامه نویس ها به خصوص کاربران لینوکس. بنچمارک ها و سایت های مختلف خیلی از این لپ تاپ تعریف کردین. قیمت بالایی داره که شاید مهم ترین ضعفشه. شاید",2,1,5,5,5,5,5,3
"جنس بدنه صفحه نمايش",ندارد,"در پاسخ دوست عزیز که میگن گرافیک نداره باید بگم مک بوک ها و سرفیس هم گرافیک نداره ولی در عین حال جزو قدرتمندترین لپتاپ های دنیا هستند",5,10,4,5,5,5,3,5
"قدرت پردازش بالا گرافيک عالي کيفيت ساخت عالي","قيمت بالا","یک 13اینچی عالی با طرفدار و رتبه یک فروش لپتاپ دنیا",6,6,3,4,5,4,3,3
,,"این چه لب تابی هست نه زیباست نه گرافیک داره
هر کی گرافیک نمی خواد از این مدل بهتر هم پیدا می شه
واقعا دم لب تاب های ایسوس گرم",12,18,0,0,0,0,0,0
