positivePoints,negativePoints,commentText,like,dislike,"ارزش خريد در برابر قيمت","عملکرد سخت افزار داخلي و باتري","کيبورد و تاچ پد","کيفيت صفحه نمايش و بلندگوها","امکانات و قابليت ها","طراحي و کيفيت ساخت"
"طراحي بسيار زيبا
صداي بلندگو باکيفيت و بلنديه صداي مناسب","زاويه ديد نسبتا محدود","با سلام خدمت دوستان
به نظر من این لپ تاپ نسبت به قیمتش خوبه. شاید سرعت پایین یا زاویه دید کم یه مقدار اذیت کننده باشه ولی اگر می خواهید لپ تاپ ASUS داشته باشید و زیادم هزینه نکنید و همچنین کار با لپ تاپ شما در حد استفاده ی خونگی هست، من پیشنهاد میکنم حتما این لپ تاپ رو تهیه کنید. من از دیجی کالا خریدم و کیفو موس اورجینال با کیفیت همراه لپ تاپ بود و بسیار راضی هستم. موفق باشید",0,0,5,4,4,5,3,5
,,"این لپ تاپ برای مصرف خانگی کاملا مناسبه... دوستانی که میگن ویندوز 7 با سخت افزار مشکل داره و CPU برای ویندوز 10 ضعیفه باید بهشون بگم که خود ویندوز 7 از پشتیبانی مایکروسافت خارج شده و ویندوز 10 ویندوز کارخانه ای تمام لپ تاپ های تولید جدید هست... هیچ مشکلی هم با CPU (حتی با پنتیوم قدیمی ها) نداره... ( این که لپ تاپ ها ویندوز ندارن به دلیل واردات نسخه بدون ویندوز برای قیمت کمتر هست)",0,0,4,4,4,4,3,3
,,"سلام
به نظر من از نظر کیفیت و قیمت مناسبه و ظاهر خوبی داره",0,0,5,3,2,3,4,4
"زيبايي طراحي","عدم پشتيباني از ويندوز 7","نسبت به قیمت خرید خوبی است.
اما عدم پشتیبانی آن از ویندوز 7 متأسفانه من را پشیمان کرد از خرید!",4,6,3,3,3,3,3,3
"داشتن پردازنده گرافيکي nevidia
داشتن تمامي پورت ها",ندارد,"من این لب تاب رو امروز در بیرون دیدم خیلی شیک بود رنگ طلایی برکس نظر دوستان اصلا هم ضعیف نیست مخصوصا پردازنده گرافیکی نویدیا و کلرون تازه ویندوزشم 10 64بیت نصب کردم براش مثل آب خوردنه",13,4,4,4,4,5,4,5
"صداي بلند و واضح","عملکرد بد سي پي يو
عدم پشتيباني درايو ها از ويندوز 7","این ماردبرد برای uefi طراحی شده ویندوز 7 از پورت های usb آن پشتیبانی نمی کنن باید از ویندوز 8.1 یا 10 استفاده کنید که اون هم به خاطر ضعیف بودن سی پی یو به مشکل بر میخورید اصلا انتخاب خوبی نیست",10,10,1,0,3,3,1,2
