"صفحه نمايش عالي، ترک پد فوق العاده جذاب و کارا، صفحه کيبورد بسيار راحت، سيستم قدرتمند سخت افزاري","نداشتن درايو نوري (نقطه ضعف نيست اما اذيت ميکنه)","من 2 هفته این لپ تاپ رو خریداری کردم (از بازار) و قصد دارم تجربیاتم و تحقیقاتم رو خدمتتون عرض کنم ...
کار عمده من برنامه نویسی تحت وب هست و بعد از 3 ماه تحقیق بالاخره تصمیم گرفتم که این لپ تاپ رو خریداری کنم.
باید خدمتتون بگم که تا حالا هیچوقت نا امیدم نکرده و همیشه انتظاراتم رو برآورده کرده ...
از نظر زیبایی و لطافت که حرفی نمیزنم چون اپل حرفی برای گفتن نمیزاره
از نظر سخت افزار هم باید بگم که بسیار سخت افزار قدرتمندی داره و با اینکه من همیشه چندین نرم افزار سنگین رو با هم باز میکنم (Adobe Flash, Photoshop, Dreamweaver و ...) ، هیچوقت شونه خالی نکرده
صفحه نمایشش هم که عالیه و واقعا برای کسانی که در بیشتر عمرشون چشمشون به صفحه نمایش هست مناسبه کار برنامه نویس ها عمدتا تایپ کردنه و من با تایپ کردن با این لپ تاپ هم تجربه بسیار لذت بخشی دارم.
تنها موردی که ممکنه اذیت کنه نداشتن درایو نوری هست که اونم به نظر من عیبش نیست و من هم اعتقاد دارم که نسل CD و DVD داره رو به انقراض میره، اما چون تو ایران خیلیا با اینا کار میکنن ممکنه آدم رو اذیت کنه
که اونم خیلی راحت میتونید براش اکسترنال بگیرید یا مثل من درایو کامپیوترتون رو با مک بوکتون به اشتراک بزارید ...
از نظر حافظه هم باید بگم من هارد اکسترنال دارم و راحت همه فایل هامو میریزم داخلش و حافظه مک بوک برای نرم افزار ها کفایت میکنه (اما به جز نرم افزار و ... فایل ها رو باید حتما در یک حافظه دیگری قرار داد وگرنه با کمبود حجم مواجه میشید)
دوستان اگه کارتون با و یندوز هست و به ویندوز وابسته هستید (از نظر کاربردی) به فکرتون نزنه که بخاید اینو بخرید و روش ویندوز نصب کنید چون با همین قیمت میتونید سیستم های قدرتمندتری هم داشته باشید که ویندوزی باشه
من برای قشرهای دیگه هم بررسی میکنم --->
-- اگه برنامه نویس ویندوز هستید (c# و ...) به هیچ وجه سمت مک نیاید که بعدش بخاید روش ویندوز نصب کنید چون یه کار بی هوده هستش و شما جز خانواده ویندوز هستید ...
-- اگر هم گیمر هستید میتونید این لپ تاپ رو داشته باشید اما اصلا لذت بخش نیست و میتونید لذت گیم رو با سیستم ها و لپ تاپ های دیگه تجربه کنید ...
-- اگر یه کاربر معمولی هستید و عمده کارتون وبگردی، کارهای سبک(ایجاد مقالات و ...) هست، این لپ تاپ تجربه لذت بخشی رو به همراه داره (البته اگه بخاید کمی بیش از حد خرج کنید)
در ضمن من اصلا رو برند خاصی تعصب ندارم (فقط لپ تاپم از اپل هست ولی همیشه دنبال بهترین ها و پرکاربرد ترین ها برای خودم بودم و مک بوک پرو ام اف 839 هم جز انتخاب های موفقم بوده.
امیدوارم مفید بوده باشه ...",14,3,1,1,2,2,1,1
,,"عالی اگه دستت به دهنت میرسه بهترین لپ تاپه کیفیت بالا در کنار قدرت و شارژدهی بالا",5,13,5,5,5,5,5,5
"کيفت صفحه نمايش
باتري با مدت شارژ بالا
بدنه ي مقاوم
سيستم عامل مک
تاچ پد خيلي عالي- وايرلس قوي","جايي لک دست روي بدنش زياد مي موند
صفحه نمايش با کوچکترين اثر دستي کثيف مي زند","برای کسانی که برنامه نویسی می کنند و برنامه هاشون یک ماه یا بیشتر رانش ممکن طول بکشد خیلی عالی . چون اول اگر وسط ران خاموش شد یا خاموش کردی ٫می توانید برنامه از همون جا وسط ران دوبار شروع به کار کنی( نه لینوکس عزیز این دارد و نه ویندوز پر زرق و برق) .دوم اگر حتی دو ماه لب تاپ خاموش نکنی٫ تو اجرایی برنامه ها اصلا گیر نمی کند و هنگ نمی گند ( در برابر ویندوز اگر 3 روز خاموشش نکنی روز سوم حتما حس می کنی که سرعتش کم شده.) سوما باتریش حداقل 5 ساعت می کشد ( در حال اجرای برنامه) که تو بدون دقق و کمبود شارژ می توانی جا به جاش کنی .چهارم اگر یک برنامه ی هنگ کند کل سیستم عامل یا سایر برنامه ت قلف نمی کند که مجبور بشی سیستم عامل ریستارت کنی . که کل مدت زمان که برنامه در حال ران بوده ٫ صفر بشد .
نکته ی دیگه در مورد توانی مدیرت نوتیفیکشن هاست . شما می توانید نتظیم کنید چه اعلامیه ها را و در چه ساعتی نمایش دهد یا اگر به تلویزیون وصل کردید چی را نشون بدهد یا نه . تو ویندوز اگر کنفرس می دادی و لپ تاپ به اینترنت وصل بود باید مطمئن می شدی که تلگرام و یا اعلامیه ها صندوق ایملیت خاموش چون وسطش یکدفه می پرید بالا .( یا هر برنامه ی دیگه ای) اما تو مک خیال راحت چون نتظیم کردی که روی پروژ کتر نشون نده و فقط روی خود مک باشد .
من با صفحه ی 4k لپ تاپ های ایسوس هم مقایسه کردم کفیت تصویر خیلی بهتر بود و حتی صداش هم واقعا زیاد و هم عالی . من علاقه ی زیادی به فیلم دیدن دارم . از نظر من برای فیلم دیدن صدا و کیفیت تصویر بالای دارد( به خاطر مات نبودن تصویر لذت بیشتری دارد) .اما صفحه ی 13 اینچی برای دیدن فیلم کوچک . اما اگر روی تلویزیون ویا خرید کنترل های بلوتوثی TVos را بگیرید . حس خوبی می دهد ٫ مخصوص وقتی که بتوانیم از سری هم استفاده کنیم که عالی .
تنها مشکلی که من بهش خوردم اینکه وقتی به مشکلی بر می خوری به راحتی ویندوز براش جواب پیدا نمی کنی و باید بیشتر بگردی تو اینترنت .
یک چیزی دیگه برای شهرستانی ها پیشنهاد می دهم از دیجیکالا بخرید . چون هرجا که برید بهتون می گند ندرایم و اگر بخواهید از تهران میاریم . اما خودشون هم از دیجیکالا سفارش می دهند و 50 تومان می گذراند روش و شما می دهند و جالب تر وفتی که میری قیمت بگیری از تو سایت دیجیکالا قیمت چک می کنند و بهت می گند . همشون شده مرجعشون دیجیکالا . برای گارانتی هم نگران نباشید . می توانید ببرید نمایندگی گارانتی ارونده با پرداخت 150 هزار تومان گارانتیش کنید . تو شرایطش نوشته یک هفته بعد از خرید باید حداکثر بیارید برای گارانتی . اما برای مک بوک اینم استثناء قائل می شند و حتی خودبردم برای گارانتی٫ البته بعد از گارانتی کردند بهم گفت پول بی خودی دادی ٫ اصلا لازم به گارانتی نیست .",11,1,3,3,3,3,3,3
"صفحه نمايش شيکي و ظرافت سريع و روان بودن","اس‌ اس‌ دي غير قابل تعويض و کم بودن حافظه","لپ‌تاپ خوبیه فقط باتریش اونطوری که میگن نیست اما خوب بدم نیست دقت کنید فقط بعده یه مدت حافظش اذیتتون می‌کنه که بخواین عوضش کنید اس‌ اس‌ دی معمولی‌ نیست و بسیار گرونه به نظرم مدل 840 رو بخرید اون افرادی‌ام که خریدار محصول نیستن و ریویو بیخود مینویسن توجه نکنین اینا دوست دارن که خریدار باشند در ضمن حواستون به باطری هم باشه اینا باطریش تو بازار نیست باهاش خوب تا کنید.",1,1,5,5,5,5,5,5
"[""سبک. زيبا . کيبرد عالي براي کودکان نويسي .دوام بالا""]","[""قيمت زياد .نداشتن پورت دي وي دي ‌. محدوديت در برنامه""]","سلام دوستان من هم از این مدل خریداری کردم و باید بگم که فقط می شه گفت عالیه و سعی نکنید اصلا با لنوو و اسوس مقایسش کنید چون اصلا قابل مقایسه نیست و مشکلات کافی نبودن حجمش هم با یه هارد اکسترنال حل می شه که دو تراش hdd نزدیک 400 تا 500 هست اصلا جای نگرانی نیست ولی به نظر من سری مک بوک mf840 بهتر و کار بردی تره و باید بگم که اگر قصد برنامه نویسی و کار حرفه ای دارید خیلی عالیه و اوردن ویژوال هم براش خیلی راحته و فوق الاده هم بی سر و صداست . بدون نگرانی دو دلی mf840 رو بخرید و 5 تا 8 سال ازش لذت ببرید بدون این که مثل شر کت های دیگه کیفیتش حتی زره ای پایین بیاد.",4,4,4,5,3,5,2,5
,,"سلام دوستان من چند روز پیش اینو تو یه فروشگاه دیدم و باهاش کار کردم به نظرم آگه برای کار های حرفه ای می خواهید بهترین گزینه هست در مورد تاچ پدش هم باید بگم که تاچ پدش قابلیت فورس تاچ داره یعنی یه حالت داره که می تونی فشار بدی که جالب بود .و یه چیز با ابهت بود.",12,0,3,3,3,3,3,3
"[""سبک بودن و عمر باطري بالا""]","[""ارزش خريد بسيار پايين‌ نسبت به امکانات"",""آسيب پذيري بالا"",""سيستم عامل نه چندان حرفه اي""]","با این قیمت اصلا ارزش خرید نداره !نهایتا با این مشخصات فنی 2 و نیم میلیون ارزش داره!
سیستم عاملش هم که واقعا ساده هست و واسه کارای حرفه ای اصلا خوب نیست!سیشتم عامل مک‌ انقدر ساده هست که بیشتر به درد افراد مسن میخوره که توانایی یادگیری زیادی ندارن!
از نظر قدرت هم واقعا پایینه!یه لپتاپ 3 میلیونی بگیری و یه هارد ssd بذاری روش خیلی از این سرعتش بیشتره!
با این همه محدودیت های اپل و قیمت زیاد و امکانات کم نمیدونم چرا کسی حاظر میشه اینو بخره!",3,69,0,2,2,3,2,3
[],[],"درست فکر کنید......
برای مصارف معمولی خوب نیست بهدرد کارای خیلی سنگین و مهندسی خوبه نه واسه فیلم دیدین و امثال این کارا",22,20,5,5,5,5,3,5
,,"لطفا قیمتش رو تصحیح کنین و شگفت انگیز من می خوام بخرم به نظرم از ایر بهتره",10,4,5,5,5,5,5,5
,,"اینقدر نیاوردین،یک هفته پیش خریدمش از یه سایت دیگه...گرانتر از این خریدم و سایت هم زیاد شناخته شده نبود.
متاسفم که یک هفته بیشتر صبر نکردم",22,8,3,3,3,3,3,3
"صفحه نمايش. تاچ بد فوق العاده. سيستم عامل",,"میخواهم خلاصه بگویم که کار کردن با این سیستم عامل بسیار ساده است. بسیار زیبا و روان . همه برنامه ها نصب شده و آماده هستند. صفحه نمایش عالیه برای یه عکاس دامنه رنگی میتونید براش تعریف کنید فتوشاب و لایت رو ادوب بریج کرک شده به راحتی از اینترنت گیرم اومد. بروکسی هم براش فراونه نگران نباشید. باطری و تاچ بد اش هم عالیه. با بلوتوثش هم میتونید فایل بفرستید",30,3,3,5,5,5,5,5
"کيفيت عالى ساخت
صفحه نمايش خيره کننده
تاچ پد و کيبورد عالى
باترى عالى",ندارد.,"از تمامى مسائلى که از اون خبر دارید، مثل کیفیت عالى محصولات اپل، زیبایى و قدرت، طراحى تحسین کننده، متفاوت بودن و مشترى مدارى اپل میگذرم، و سعى میکنم به بعضى ابهامات که براى خودم هم مطرح بود و دو دل بودم که لپ تاپ اپل (مک بوک) بخرم یا نه، در حد توان و تجربه ام پاسخ بدم.
آیا بعد از خرید باید برنامه هاى مختلف نصب کنم؟
اگر کار حرفه اى نمى کنید، مک بوک تمام برنامه هاى مورد نیاز عمومى و اولیه براى کاربر را بطور پیشفرض دارد، مثل پلیر، مرورگر، ویرایش عکس و فیلم، آى ورک(مجموعه مشابه آفیس)مدیریت ایمیل و...
اما اگه حرفه اى کار میکنید، برنامه هاى تخصصى مورد نیازتون رو به آسونى میتونید نصب کنید.
آیا میتوان مثل ویندوز برنامه هاى کرک شده نصب کنم؟
پاسخ مثبت است، شخصا یک پک شامل 22 دى وى دى خریدارى کردم که دریایى از برنامه هاى تخصصى رو موجود داره، مثل مجموعه عظیم ادوب، پلیر، فونت، آفیس، مرورگرها، ویرایشگرهاى ویدیو و صدها برنامه مختلف در تمام زمینه ها. که براحتى کرک میشن و کار میکنن.
آیا نصب برنامه در مک پیچیده است؟
به جرات میگم که به سادگى آب خوردن است، بیشتر برنامه ها با یک درگ و دراپ کردن ساده نصب مى شوند، شخصا فتوشاپ رو در 5 دقیقه نصب و کرک کردم.
آیا کار با مک سخت است؟
ابدا، اگه کاربر مبتدى هستید یکى دو روز طول میکشه که راه بیافتید، اگه هم مثل من اصطلاحا، خوره کامپیوتر هستید، فقط چند ساعت زمان لازم دارید که با مک دوست بشید.
بعضى نرم افزارها براى مک وجود ندارد، راه چاره چیست؟
در دل مک، برنامه بوت کمپ وجود داره، که با تهیه یک فایل ایزوى ویندوز 10 ، 64 بیتى و ریختن اون روى فلش، ظرف 20 دقیقه و با چند کلیک ویندوز رو مى تونید نصب کنید. و سیستم رو با ویندوز استفاده کنید، ویندوز روى مک بوک عالى کار میکند، طورى که فراموش میکنید دارید با مک کار میکنید. اما مطمئنم اگه ویندوز رو هم نصب کنید محاله دل از مکینتاش و اون سیستم عامل زیبا و کاراش بکنید.
آیا لوازم جانبى به مک وصل مى شوند؟ تکلیف قطعاتى که به درایور نیاز دارند،مثل پرینتر چه مى شود؟
هیچ چیز براى من مثل وصل کردن پرینتر اچ پى خودم به مک شگفت انگیز نبود، پرینتر رو وصل کردم، سیستم شناخت و بدون هیچ مشکلى شروع به پرینت کردم، براى تنظیمات پیشرفته هم درایور مک رو مى تونید از سایت سازنده اون سخت افزار دانلود کنید. موس و کیبورد و ... هم به آسونى نصب و شناخته میشن.
آیا فایل هاى که ایجاد میکنم، مثل متون، پاورپوینت ها و... روى ویندوز اجرا میشن؟
قبلا در مک ممکن نبود، یعنى اگه در برنامه ادیتور متن مک( page ) فایلى رو ایجاد میکردید، اون فایل در ورد ویندوز قابل استفاده نبود، اما در نسخه هاى جدید، به سادگى میتونید فایلتون رو اکسپورت کنید براى نمایش در ویندوز.
دوستان در عصرى هستیم که کمپانى ها با هم تعامل دارن و اکوسیستم اونها داره شبیه و مشترک میشه، اگر احیانا در مک کمبودى حس کردید، مطمئن باشید راه حلى براى اون وجود داره.
آیا با مک بوک میشه بازى کرد؟
خیر، مک براى بازى نیست و بازى ها مهم دنیا معمولا نسخه مک ندارند، البته بازى در اپ استور مک وجود داره، اما ساده هستن. مک گرافیک جداگانه نداره و سخت افزار عظیم اون تمام توان خودش رو براى کارهاى شما در مک به اجرا میذاره، اگه قصد بازى دارید، مثل بقیه دوستان شما رو به خرید کنسول توصیه میکنم( خودم هم قصد خرید کنسول دارم).
آیا از اپ استور مک براحتى میشه دانلود کرد؟ ـیلترشکن ها چى؟!
براى دانلود از اپ استور فقط به اینترنت نیاز دارید، دنیایى از نرم افزارها منتظر شما هستند، ـیلترشکن هم فراوان در مدل هاى مختلف وجود داره! براى من که پیشفرض رو خودش هات اسپات شیلد رو داره که عالى کار میکنه.
سعى کردم به سوالات مهم که ممکنه شما رو مردد کنه واسه خرید مک پاسخ بدم، در پایان تجربه شخصیم رو در یک جمله به شما میگم: ""اگه وسیله اى رو خواستید بخرید، و خبردار شدید اپل اون محصول رو تولید کرده، در خریدش شک نکنید"".اپل شما رو نا امید نمیکنه. موفق باشید.",72,4,5,5,5,5,4,5
,,"شگفت انگیز دیجی...",10,0,4,4,4,4,4,4
"[""زيبت، سبک، قوي""]","[""ندارد""]","بسیار زیبا و قوی، لطفا موجودش کنید+پیشنهاد شگفت انگیز تا بخریمش",7,0,4,5,5,5,5,3
"زيبا و با کيفيت ساخت بالا
سيستم عامل ElCapitan که بي نظيره
تنوع بالاي برنامه ها و راحتي استفاده از مک","قيمت بالا نسبت به اکثر ديگر برندها","اگر می خواهید وارد دنیای مک شوید بهترین گزینه است و شمارو شیفته خودش می کنه. در ضمن گزینه مناسبی برای دانشجویان و مهندسین نیز می باشد.",12,2,4,5,5,5,4,5
,,"دیجی جان نفرات زیادی منتظر موجود شدن این محصول هستند. لطفا سریعتر موجودش کنید.",7,0,3,3,3,3,3,3
,,"ممنون از سایت خوب تون. لطفا موجودش کنید",5,1,5,4,4,5,4,5
,,"موجودش کنید",7,1,5,5,5,5,5,5
"[""همه چي""]","[""گرونه""]","ببینید دوستان من خودم اپلو دوس دارم ، با همه برند ها کار کردم . اخر سر به این نتیجه رسیدم که لپ تاپ و گوشیم اپل باشه .فقط اگه پول دارید",8,2,5,5,5,5,5,5
,,"لطفا موجود کنید",6,1,3,3,3,3,3,3
,,"من برای جلوگیری از پخش شدن اطلاعات غلط یا ناقص در این سایت برای خریداران احتمالی محصولات اپل لازم دیدم جسارت کرده و به نظر قبلی چند نکته تکمیلی اضافه کنم. مک بوک پرو پورت شبکه، فایروایر، VGA و ... ندارد ولی می‌توان با خرید یک آداپتور مناسب پورت همه کاره تاندر بولت را به این موارد تبدیل کرد. همه این آداپتورها در دیجیکالا موجود است. میزان رم مصرفی آخرین ورژن سیستم عامل مک( ال کپیتان) حداقل 2 گیگابایت است و بعد از بالا آمدن سیستم حدود 2.5 گیگابایت مصرف سیستم عامل می شود. توجه داشته باشید رم موجود بر روی مدل MF839 به 16 گیگ قابل ارتقا نیست. امکانات سری مک بوک پرو در حدی بالاست که کاربران حرفه ای و کسانی که بخواهد به مدت طولانی یک لپ تاپ مطمئن داشته باشند را به خود جذب می کند. مسلما کاربرانی که به دنبال گزینه های اقتصادی باشند خود بخود از گردونه حذف می شوند. سیستم عامل مک از لحاظ کمیت نرم افزار پایینتر از ویندوز است ولی از لحاظ کیفیت به هیچ وجه. اگر امکان نصب ویندوز را درنظر نگیریم عموما گیمرها و یک سری از برنامه های تخصصی مهندسی هستند که دچار کمبود می‌شوند. البته منظورم این نیست که مک گیم خوب ندارد یا امکان ران کردن گیم های ویندوزی با کراس اوور وجود ندارد. خیلی از برنامه های معروف هم برای مک موجود است مانند آفیس، برنامه های شرکت ادوبی، مایا، اتوکد، متلب و ... البته مک بین موسیقی دانها و تدوین کننده های فیلم بخاطر برنامه های منحصر بفردش جایگاه ویژه ای دارد. بهترین توصیه من به خریداران فهیم اینه که ببینید برای چه کاری به لپ تاپ اپل نیاز دارید و برنامه دلخواه شما چگونه قابل پشتیبانی است. متاسفانه اینجا امکان لینک گذاشتن وجود ندارد ولی اگر جستجو کنید می توانید لیست برنامه های کینگ 2016 حاوی 24 دی وی دی برنامه های کرک شده مخصوص مک را پیدا کنید.",11,2,3,3,3,3,3,3
"صداي واضح
Trackpad فوق العاده
سرعت بالا به واسطه هارد SSD
باس بالاي RAM
باتري قوي (استفاده مداوم با Backlight و WIFI و Bluetooth تا 11 ساعت)","کمبود پورت USB
نبود پورت Lan
نبود پورت 1394","این محصول کیفیت ساخت بسیار بالایی داره ولی باید توجه داشته باشید که در آپدیت های نهایی ElCapitan حد اقل میزان Ram مصرفی به 4GB میرسه علاوه بر این اگر قصد استفاده از برنامه هایی مثل Corel , 3D Max , و از این قبیل نرم افزار ها رو دارین فقط و فقط مجبورید ویندوز روی این لپتاپ نصب کنید که مشخصا با نصف این قیمت میتونین لپ تاپ هایی بسیار قوی تر از این مدل رو تهییه کنید . و یا اینکه نرم افزار VMWare Fusion رو نصب کنید و به صورت مجازی با این نرم افزار ها کار کنید .
اما به طور کلی و بدون تعصب این محصول رو بیشتر برای برنامه نویس ها و طراحان وب توصیه میکنم و به کاربر های معمولی و کاربر های خانگی اصلا توصیه نمیکنم .
لازم به ذکر هست که نرم افزار های کرک شده سیستم عامل OSX بسیار بسیار کمتر از Windows هست.",3,3,5,5,5,5,5,5
