"کاملا اون چيزي هست که يک گيمر نياز داره","عمر باتري متوسط","خیلی وقت نیست خریدمش ولی اگه دنبال یه دسته گیم خوب میگردید حتما این رو بخرید. خیلی در موردش تحقیق کرده بودم که در نهایت به این گزینه رسیدم. خیلی کامله بدون هیچ نقص و کمبودی. به راحتی با کامپیوتر و گوشی و تبلت کانکت میشه بدون سیم و هرگونه دانگل دیگه. اذیت هم نمیکنه. البته ناگفته نمونه که این دسته فقط اینطوری هست و مدل قدیمی دسته که Xbox one شناخته میشه اینطوری نیست و حتما دانگل میخواد. بنابراین حتما توجه کنید که مدل Xbox one s رو تهیه کنید. (همین مدل) اینم بگم که حتما باید ویندوز کامپیوترتون نسخه 10 باشه وگرنه کار نمیکنه. (تحقیقات من از سایتا اینو میگه خودم که کلا ویندوز 10 داشتم مشکلی هم باهاش نداشتم) من قبل از خریدن این دسته بین این و PS4 مونده بودم ولی دیدم اکثر گیمهای کامپیوتری با این دسته سازگاری دارند. مهم ترین این گیم ها Call of Duty و Need For Speed Rivals هستند که بدون هیچگونه تنظیم و دردسری راحت شناخته میشه و کار میکنه ولی PS4 اینطور نیست و شاید اذیت کنه. باتریش شاید یه خورده اذیت کنه که میتونید دو جفت باتریAA قابل شارژ بخرید و شارژ کنید و استفاده کنید. البته با کابل هم میتونید به کامپیوتر وصل کنید و بازی کنید و یا اگه نمیخواید باتری بخرید و با فاصله از کامپیوتر میخواید بشینید میتونید سیمش به شارژر گوشی وصل کنید و به فاصله 10 متری از کامپیوتر بشینید و ازش استفاده کنید. البته اینم بگم که تو مقایسه ها گفته شده که سه برابر PS4 باتری نگه میداره. نکنه دیگه که خیلی حال کردم باهاش اضافه شدن یه سوکت هدفون به دسته بود که حتی اگه به صورت بلوتوثی به کامپیوتر متصل باشید میتونید صدای کامپیوتر رو از طریق اون سوکت با وصل کردن یه هدفون گوشی بشنوید. صداش کیفیتش پایینه ولی برای نسخه های اول خیلی عالیه. از کیفیت ساختش هم بگم که کیفیت پلاستیکش واقعا عالیه وقتی توی دست میگیری میبینی که چقدر با اون دسته های ارزون 40 یا 50 تومنی فرق داره. خیلی قرص و محکم ساخته شده. دکمه هاشم خیلی نرم و کم صداست. وقتی دکمهشاش رو میزنی لذت میبری و احساس میکنی تا 10 سال دیگه هم کار میکنه. دو دکمه تریگر چلوش هم که اصلا صدا نداره خیلی نرمه و اصلا دست آدم رو اذیت نمیکنه. به نظرم یه عمر داشتم اشتباه میکردم که دسته های ارزون میخریدم و برای دو سه ماه بیشتر کار نمیکرد. یه بار بخرید خیال خودتون رو راحت کنید. با تشکر اگه سوالی هم داشتید بپرسید خوشحال میشم کمکتون کنم.",16,3,5,5,5,5
"جک 3.5 ميليمتري بهترين نکتشه","امکانات کمتر نسبت به پي اس 4","بسایر با کیفیته و برد بالایی داره فقط چیزایی مثل تاچ پد و اسپیکر نداره",3,2,4,5,3,4
"طراحي ارگونوميک
بازدهي بالا با 2 باطري قلمي (9 - 10 ساعت)","نيازمند به نيازمند به بلوتوث 4 و ويندوز 10 براي کارکرد بي سيم با کامپيوتر","از نظر ساخت و کیفیت خیلی خوبه، رنگ سفید دستگاه خیلی شیک هست
بازدهی باطری خیلی خوبی داره و شما می تونید هر وقت باطری دستگاه تموم شد راحت با دوتا باطری جدید به بازیتون ادامه بدید
نکته منفی که داره اینه که شما باید حتما ویندوز 10 داشته باشید تا بیسیم کار کنه و اون هم در صورتی که سیستمتون بلوتوث 4 داشته باشه",2,2,5,3,5,4
"استفاده بيسيم براي pc هماهنگ با بازي هاي روز","نقطه ضعفي نداره","اگه دیجی کالا دانگل بلوتوث ورژن 4 بیاره عالی میشه چون سیستمهای دسکتاپ بلوتوث ندارند و از این دسته بدون دانگل بلوتوث ورژن 4 نمیشه بصورت بیسیم استفاده کرد",4,1,5,5,5,3
"راحت بودن دسته",کيفيت,"من خودم ps4 دارم کیفیت بازیاش عالیه ولی ایکس باکس نه ولی چون ایکس باکس راحتر از ps4است ولی از نظر کیفیت ps4بهتره.",2,9,0,0,3,5
