positivePoints,negativePoints,commentText,like,dislike,"کيفيت و شفافيت عمومي تصوير","امکانات و قابليت ها","سهولت در کاربري","ارزش در برابر قيمت"
"کيفيت رنگ و تصوير بسيار عاليست علاوه بر ان گيرندگي انتن ان نيز بسيار خوب و بي ايراد است","فيلمهاي داخل فلش را نشون نميده دکمه رکورد هم کار نميکند","ولی در کل نسبت به سامسونگ و ال جی بهتر است",0,2,5,3,3,5
"کيفيت کانال هاي hd خوب و راضي کنندست کانال ها بعد تنظيم خودشون مرتب ميشن کيفيت ساخت و قطعات محاسبه کنترل خوبي داره","صداش ميتونست بيشتر باشه ولي همين هم بنظر کافي مياد کيفيت کانال هاي غير hd از تلويزيونهاي قديمي لامپ و تصوير پايين تره","با توجه به نیاز و قیمت راضیم ازش ولی اگه تلویزیون اصلیتون میخواد باشه حتما 32 بخرید و مارک های معتبر مثل ال جی- سامسونگ و ..",1,4,4,5,5,5
"تصوير واضح و روشن قابليت پخش اکثر فرمتهاي صوتي و تصويري درگاه هاي کامل گيرنده ديجيتال","کيفيت متوسط بدنه ظاهر نه چندان لوکس","کیفیت و وضوح تصویر و صدا قابل قبول است و تمامی فرمتهای صوتی و تصویری معمول را پخش میکند. درگاه های کاملی دارد و گیرنده دیجیتال آن امتیاز دیگر این محصول است.
اما کیفیت بدنه و ظاهر این محصول در مقایسه با برندهای نامدار کمی ضعیف است که البته به نسبت قیمت کاملا طبیعیست.",2,1,4,4,4,3
"تصوير شفاف و روشن امکان پخش اکثر فرمتهاي صوتي و تصويري دارا بودن کليه درگاه ها قابليت پخش کانالهاي ديجيتال و HD","کيفيت متوسط بدنه ظاهر ساده و نه چندان لوکس","با توجه به قیمت محصول و قابلیت پخش اکثر فرمتهای صوتی و تصویری و همچنین وضوح تصویر از خریدم راضی هستم.
دارا بودن گیرنده دیجیتال داخلی نیز از مزایای مهم این محصول است. البته کیفیت متوسط بدنه و ظاهر نه چندان لوکس نیز از معایب این محصول بوده که البته به نسبت قیمت پرداختی کاملا قابل چشم پوشیست.",2,0,4,4,4,3
"پشتيباني از انواع فرمت ها-امکان استفاده بعنوان مانيتور","خدمات پس از فروش ضعيف-صداي ضعيف-کيفيت تصوير پايين","به نظر من کسانی که قصد خرید این تلویزیون را دارند یه کم بیشتر خرج کنند و یک مارک بهتر مثل سونی یا سامسونگ بخرند که هم کیفیتشون ثابت شده و هم اگه خراب بشه قطعاتشون به راحتی پیدا میشه.",2,5,1,2,4,1
"کيفيت.گيرنده ديجيتال.سبک و قابل حمل","از نظر من ندارد","سلام من این تلویزیون را دو سال پیش خریدم واقعا خوبه تا حالا خراب نشده کیفیت خوبی داره و نسبتا سبک و قابل حمله . البته یکم قیمتش گران شده",6,4,3,3,3,3
