positivePoints,negativePoints,commentText,like,dislike,"ارزش خريد در برابر قيمت","کيفيت ساخت","طراحي و ظاهر","کارآيي و عملکرد"
"بسيار محکم و مقاوم
طراحي زيبا
فضاي مناسب",,"برای هارددیسک اکسترنال Silicon Power مدل آرمور A80 خیلی مناسب بود",0,0,5,5,5,5
,,"فراتر از حد انتظاره در خریدش تردید نکنید......",0,0,5,5,5,5
"سايز مناسب و جادار
طراحي داخلي بسيار زيبا
مقاومت فوق العاده در برابر ضربه
جنس رويه و دوخت و زيپ عالي
محفظه اي براي نگهداري حافظه هاي فلش","قيمت نسبتا زياد","محصولی بسیار عالی و با کیفیت
جای فلش داره که براحتی میتونید اونا رو هم در کیف قرار داده و همیشه همراه داشته باشید، فارغ از ترس گم شدن فلش هاتون.
طراحی داخلی بسیار شیک و نیز بدلیی لایه های ضد ضربه در داخل کیف، مقاومت بسیار عالی و بینظیری داره.
بنظرم اگر برای هاردتون ارزش زیادی قائلید، حتما این کیف رو تهیه کنید تا خیالتون بابت عدم ضربه خوردن هارد کاملا راحت باشه.
بنده از این کیف برای نگهداری هارد اکسترنال سیلیکون پاور Armor A85 با ظرفیت دو ترابایت استفاده میکنم و کاملا سایزش مناسبه.
حتما قبل از انتخاب، سایز هاردتون رو با سایز داخلی کیف مقایسه کنید تا خرید مناسبی داشته باشید.
البته اگر دیجی کالا، قیمت این هارد رو مقداری پایینتر بیاره مسلما یک خرید کاملا ایده آل برای همه خواهد بود.",2,0,4,5,5,5
