positivePoints,negativePoints,commentText,like,dislike,نوآوري,"ارزش خريد به نسبت قيمت","کيفيت ساخت","طراحي و ظاهر","کيفيت پخش صدا"
"طراحي و ظاهر بسيار زيبا
کيفيت پخش بسيار عالي","کابل معمولي","من هدستو خریدم واقعا برا گیم خوبه اما کیفیت ساختش پایینه. تو این رنج قیمیت بهترینه",0,0,3,5,2,5,5
"کيفيت صداي خوبي داره
در استفاده طولاني مدت گوشها اصلا اذيت نميشن","ولوم صدا خش خش ميکنه
سر رو خم کنين يکم جابجا ميشه و ممکنه بيوفته از روي سر","نمیدونم اینی که من گرفتم اینجوریه یا نه ولی وقتی ولوم صدا رو کم و زیاد میکنیم خش خش میکنه
اگه کسی کنارتون باشه صدای موزیک رو میشنوه
کیفیت صدای خوبی داره ولی در حد قیمتش نیست هدفون قبلیم که ارزون قیمت بود هم همین کیفیت رو داشت به نظرم بیشتر از اینکه بدرد موزیک گوش دادن بخوره بدرد فیلم تماشا کردن میخوره
بدنه مستحکم و سیم ضخیمی داره در کل کیفیت ساختش بالاست
گوش کامل داخلش قرار میگیره بنابراین اصلا فشاری به گوش وارد نمیشه
در مجموع نسبت به قیمتش بد نیست ولی میتونست بهتر از اینها باشه",0,0,3,3,4,4,4
