positivePoints,negativePoints,commentText,like,dislike,"طراحي ظاهري","کارايي و عملکرد","ارزش خريد در برابر قيمت","امکانات ارتباطي"
,,"از نظر من وقتی با همین پول شما میتونی یک سیستم‌ گیمینگ با گرافیک‌ 1080‌ ببندی اصلا ارزش‌ خرید نداره و این که همه قطعات رو یک شرکت یا کارخونه بسازه‌ مزیتی‌ محسوب نمی شه چون تمام قطعات کامپیوتر در دنیا از استاندارد های یکسان‌‌ در تولید محصولات بهره می برند و این که قطعات شرکت های مختلف در یک کیس‌ دور هم جمع بشن‌ مشکلی رو به وجود نمی یاره",2,2,3,3,3,3
"يکي از قدرتمند ترينCPU ها
RAM با ظرفيت بالا
حافظه SSD
سريال پورت
Display پورت","عدم وجود Ram Reader","من ریویوو کامل این محصول رو توی سایت HP خوندم، چون برای منم سوال بود که چرا کیس های آماده ی اسمبل شده قیمتشون کمی بالاتر از کیس های دستی توی بازاره
این کیس همه چیزش HP یه!!! از پاور و DVD درایو گرفته تا مادربوردش! در نتیجه هم خونی و کارایی این قطعات کنار هم توی کارخونه HP با بالا ترین حد ممکن استاندارد شده، تو کشور ما هم که شرکت گارانتی کننده ی هر قطعه از کامپیوتر یکیه، اینکه همه ی قطعات کیس یکجا یه گارانتی و پشتیبانی دارند عااالیه به نظرم
این کیس هم با توجه به فول پورت بودنش و داشتن سریال پورت از سری کیس های صنعتی HP محسوب میشه و چیپستش هم از آخرین نسله
دلیل کارت گرافیک نه چندان قویش هم همینه
به نظر من نسبت به این قیمت و کانفیگ عاااالیه
تازه اینقدز کانفیگ های متنوع روی دیجیکالا ترایع شده که همه نوع انتظاری رو پوشش میده
مرسی از دیجی",0,1,4,5,5,5
"پردازنده قوي","کارت گرافيک ضعيف","سی پی یوش خیلی قوی و مناسبه ولی پردازنده ی گرافیکیش خیلی ضعیفه نسبت به این قیمت.
با همین پول میشه سیستمی با دوبرابر امکانات این سرهم کرد.",6,2,4,2,2,3
,,"اخه چرا یه همچین کامپیوتری باید اینقد cpu ش قوی باشه
در حالی ک میشه این هزینه ی اضافی (که کم هم نیست)
خرج ارتقاع یه سری قطعات دیگه مثل هاردssd گرافیک بهتر
یا حتی یه مادر برد قوی تر که پورت های به روز تری مثل usb type c داشته باشه!
و به طبع با یه مادر بورد قوی تر کارت صدای بهتر نویز گیر پیشرفته تر و چیپست بهتر و ....
اینم در نظر داشته باشید ک کیس های اسمبل شده قیمت زیادی دارن!
وشما میتونید با یه همچین هزینه ای یه کیس چند برابر قوی تر ب معنای واقعی جمع کنید!",0,1,3,3,3,3
