positivePoints,negativePoints,commentText,like,dislike,"ارزش خرید به نسبت قیمت","طراحی و ظاهر","امکانات و قابلیت ها","سهولت استفاده","کیفیت ساخت",نوآوری
,,"من از اون موقعی که اینو گرفتم راضیم ازش واقعا بهتر از این تویه جهان موجود نیست...",3,0,5,5,5,5,5,5
,,"راضیم ازش واقعا عالیه",1,2,3,3,3,3,3,3
,,"ای کاش منم میتونستم یکی از اینا بخرم واقعا عالیه",14,3,5,5,5,5,3,3
"طراحي و ظاهر
امکانات و قابليت ها
کيفيت ساخت","ارزش خريد به نسبت قيمت","تبلت بسیار عالی هست من که ازش راضی ام",5,6,5,5,5,5,5,5
,,"سلام
بنده معمولا خریدهامو از دیجی کالا انجام میدم این مدل سرفیس پرو 4 رو، دیجی خیلی دیر موجودش کردو بنده به ناچار از خارج سفارش دادم واسم خریدن، تو این چند مدتی که ازش استفاده کردم میشه گفت که فوق العاده هست و تمامی قابلیت های گفته شده رو داراست به جز باطریش که در حالت وبگردی و wifi روشن بیشتر از 6 ساعت دوام نمیاره.
کار کردن با قلمش لذت بخشه، و در کل این تبلت جوری طراحی شده که همه ی توقعات منو به عنوان یک دانشجوی ارشد شیمی براورده میکنه و کاملا ازش راضیم فقط یه پیشنهاد دارم واسه کسایی که به رم بالا و حافظه داخلی بیشتر و cori7،نیاز مبرم ندارن، میتونن با هزینه کمتری ، مدل های پایین تر این تبلت رو خریداری کنن و قابلیت های سرفیس پرو 4 رو در اختیار داشته باشند.",10,4,3,5,5,5,5,5
