positivePoints,negativePoints,commentText,like,dislike,"ارزش خرید به نسبت قیمت","طراحی و ظاهر","امکانات و قابلیت ها","سهولت استفاده","کیفیت ساخت",نوآوری
,,"با توجه به اینکه دیجی توی پیشنهاد ویژه قرار داده توی این رنج قیمتی واقعا عالیه",0,0,5,5,4,4,4,3
"قيمت مناسب
صفحه نمايش 8 اژنچ
پشتيباني از 2 سيمکارت","حافظه داخلي کم","من این تبلت رو برای وبگردی و مطالعه انتخاب کردم و فکر کنم باتوجه به این هدف و بودجه انتخاب خوبیه.",5,0,5,5,4,3,3,3
"اندرويد 5.1
کيبورد سريع
پشتيباني از زبان فارسي
پشتيباني از otg
کيفيت مناسب صفحه","خط و خش بسيار راحت ميگيره
گير زدن بعضي اوقات
نگه داري شارژ کم","من واسه وب گردی و کتاب خریدم منو راه انداخت
اما واسه بازی و ... خوب نیس و واسه بچه ها حتما لنوو بخرید چون با دوامه",6,0,4,5,5,2,3,3
"قيمت به نسبت سايز صفحه","تاچ ضعيف
کيفيت ساخت
بد شارژ شدن","من این تبلت رو برای بچه ام خریدم و خیلی به خاطرش اذیت شدم. اولش که شارژ نمیگرفت و با دیجی کالا تماس گرفتم و گفتن بده بیرون اگر درست نشد بگو همکارامون بیان تحویل بگیرن که دادم بیرون به باطریش شوک وارد کردن و یه خط در میون برای شارژ کردنش این درد سر رو داشتم تا یاد گرفتم نذارم کاملا شارژ خالی کنه شارژ کنم. بعد از فاصله تقریبا 20 سانتی از دست بچه روی فرش افتاد که تاچش شکست بردم گارانتی( تک تیم فن) که با 85000 تومان تاچش رو عوض کردن و انصافا خیلی تمیز این کارو انجام دادن. کلا دلم رو زد و حتی بچه سه ساله هم فهمیده بود تاچش روان نیست و بعد که با ضرر فروختم.",8,1,4,3,2,3,0,2
"رم يگ گيگابايتي نسبت به قيمت
صفحه نمايش خوب نسبت به قيمت
سرعت پردازنده بالا
باتري خوب
صفحه نمايش 8 اينچي در مقابل قيمت کم","دوربين
ظاهر و شکل و شمايل
بد فورم بودن قاب پشتي
نبود لوازم جانبي","بررسی یک ماهه این تبلت",7,0,5,1,2,2,2,2
"قيمت عالي در مقابل کارايي
کيفيت صفحه نمايش خوب
اتصالات موبايل و اينترنت کامل
نگهداري شارژ متوسط
ظاهر خوب و طراحي مناسب در مقابل قيمت","دوربين خيلي ضعيف
برنامه ها قابل انتقال به رم نيستند","من این تبلت امروز از دی جی گرفتم و انتظار یک تبلت درست و حسابی و کار راه انداز را نداشتم ولی بعد از کارکردن با آن و بررسی تمام جوانب متوجه شدم که یک تبلت خوب و کار راه انداز و قابل اعتماد هست و تمام انتظارات را با توجه به پولی که بابتش دادم برآورده کرد
البته یک نکاتی هم هست
مثلا سرعت cpu 1.3 در سایت اعلام شده ولی در اصل 1000 هست که با توجه به این که اندروید تبلت از ابتدا روت شده بایستی بررسی بشه دلیلش چیه
در تست antutu تبلت امتیاز 15000 را بدست میاره که امتیاز خوبی نیست",6,2,5,5,4,4,4,3
"کيفيت صداي عالي
ظاهر شيک
اندرويد 5.1.1
فلش دوربين
قابليت اتصال فلش مموري","سرعت پايين گوگل کروم و اپرا در اين تبلت
کيفيت متوسط اما قابل قبول دوربين
حافظه نسبتا کم داخلي
خش افتادن سريع دوربين پشت","این تبلت رو از دیجی کالا خریدم و بعد از حدود 48 ساعت در مشهد دریافت کردم. بسته بندی شیک و با کلاسی داشت. دارای کارت گارانتی هم بود که سریالش رو با تبلت چک کردم و همخوانی داشت. اولین چیزی که من رو جذب کرد صدای بسیار بلند تبلت هم روی بلندگو و هم روی هدفونی که خودم از قبل داشتم بود، واقعا کیفیت صدا و بلندی صداش عالیه. ظاهرش هم بنظر من به نسبت قیمتش خیلی خوبه، از جلو براق و از پشت هم بدلیل زائده هایی که داره خوشم اومد و جنس پشتش طوری هست که رد انگشت معلوم نمیشه. مورد دومی که خیلی خوشم اومد کیفیت صفحه نمایش بود که هم خوش رنگ بود و هم معلومه رزولوشن بالایی داره چون همه چی به نسبت تبلت خودم کوچکتر هست. سومین موردی که خوشم اومد لمس خوبش موقع تایپ کردن بود که البته در موقع کار کردن در گوشه های صفحه و زدن روی بعضی قسمتا حس کردم بعضی موقع ها لمسش یک کم کند یا غیر دقیق میشه که به نسبت قیمتش خوبه. داشتن کابل otg که میشه فلش رو بهش وصل کرد برام جالب بود و همچنین نایلون روی صفحه نمایش هم برای چسباندن تو جعبه بود که من نتونستم خوب بچسبونم مجبور شدم برم بیرون بدم برام یک نایلون ضد خش برش بزنن و بچسبونن روی صفحه نمایش. باتریش هم بنظر من خوب هست چون من از صبح حدود 9 مدام در حال تست کردن بودم که حدود پنج باتری تموم شد. اینترنت سیم کارت ایرانسل هم با تنظیمات دستی که خودم دادم کار کرد هم H پلاس و هم E. ورژن اندرویدش هم چون 5.1.1 هست ظاهر خوب و شیکی داره. دوربینش با اینکه صورت رو تشخیص میده اما هم دوربین جلو و هم دوربین پشت کیفیت متوسطی داره اما به نسبت قیمت خوبه. حافظه داخلیش هم فقط حدود چهار گیگ در دسترسه که اذیت میکنه. با مرورگر خود اندروید سرعت باز کردن صفحات خوبه اما متاسفانه با گوگل کروم و اپرا صفحات رو از لحاظ اجرایی با تاخیر باز میکنه. ویدیوها رو چندتا آزمایشی پخش کردم با کیفیت خوب جواب میده. هنوز نتونستم راهی گیر بیارم که عکسا و فیلمایی که با دوربین میگیرم رو تو کارت حافظه ذخیره کنم اما احتمالا با نرم افزار دیگه دوربین مشکل حل میشه. چند تا کتاب پی دی اف هم باز ‌کردم جواب داد. هر دفعه که خاموش روشن میکنم کیبورد یک زبانه میشه که باید برم دو زبانش کنم که اونم احتمالا با آپدیت کیبورد مشکلش حل بشه. تبلت از لحاظ عرض شاید کوچکتر از تبلتای هشت اینچی باشه اما از لحاظ طول خیلی کشیده و HD هست. خوشبختانه حاشیه اضافی دور صفحش هم زیاد نیست. دوربینش فلش هم داره اما فلشش قوی نیست. نرم افزار پیش فرض زیاد روش نصب نیست که باید خودتون نصب کنین برای مثال گوگل کروم. برای گذاشتن کارت حافظه و سیم کارت باید در کنار دوربین رو که پشت دستگاه هست با فشار باز کنین که یک کم سفت باز میشه و موقع بستن باید چفت به چفت کنین و هم زمان که به پایین فشار میدین به داخل هم یک کم فشار بدین که بستنش هم سفته. کارت حافظه 16 سیلیکون پاور کلاس ده گذاشتم جواب داد، فلش هم با کابل otg وصل کردم کار کرد. مواظب دوربین پشتش هم باشین که برا من یک روزه خش افتاد. هنوز وقت نکردم بازی روش نصب کنم. روی هم رفته برای کسی که میخواد کارای روزمره مثل آهنگ گوش کردن، فیلم دیدن، کتاب الکترونیکی خوندن و گشت و گذار در اینترنت انجام بده تبلت خوب و مقرون به صرفه ای هست اما اگر کارای سنگین میخواین انجام بدین بنظر من بیشتر هزینه کنید. ممنون از دیجی کالا...",12,2,5,5,4,4,4,3
