positivePoints,negativePoints,commentText,like,dislike,"ارزش خرید به نسبت قیمت","طراحی و ظاهر","امکانات و قابلیت ها","سهولت استفاده","کیفیت ساخت",نوآوری
"خوش دست و نسبتا سبک/قيمت مناسب","رم پايين/ دوربين ضعيف/‌کيفيت صفحه متوسط","من حدود دو هفتست این تبلت رو خریدم و راضی هم هستم به نظر من تو این رنج قیمت بهتر از این تبلت پیدا نمیکنین اگه سامسونگ بخرین حداقل باید دو برابر این قیمت خرج کنین تا یه تبلت خوب بخرین...دوربینش اصلا خوب نیست و کیفیت عکس هاش پایینه...برا بازی های سنگین هم مناسب نیست ولی برا کار کردن عادی باهاش مثل چک کردن تلگرام و اینستاگرام خوبه...در کل اگر در حدود 700 هزار تومن میخواین خرج کنین من این تبلت رو بهتون پیشنهاد میکنم",1,0,5,4,3,3,4,3
"اندازه مناسب براي کتاب خواندن خوش دست","کيفيت کم دوربين","دراین حدود قیمتی خیلی خوب هست حتما پیشنهاد می کنم",0,0,4,4,4,4,4,3
"کيفيت صفحه نمايش خوب
دوربين متوسط (در حد 5 مگاپيکسل - واقعي)
باتري خوب
سخت افزار مناسب (رم 2 و حافظه 16 و پردازنده مناسب، اينترنت 4g)
تاچ قوي","من نديدم","بعد از دو ماه استفاده باید بگم تا بحال لگ و هنگی و از این جور چیزا نداشته و هر نرم افزاری رو به خوبی اجرا کرده (لازمه بگم که من اصلا از تبلت برای بازی استفاده نکردم و در مورد توانایی اجرای بازیها نمیتونم نظر بدم).
دوربینش هم در حد 5 مگاپیکسله، من از گل و گیاه و نوشته عکس گرفتم و راضی کننده بود و کیفیت فیلم برداریش هم FULL HD هست و از یه تبلت تو این رده نباید انتظار دوربین قویتری داشت.
برای وبگردی و خواندن کتاب و مقاله و ... خیلی خوبه. صفحه شفاف و مناسبی داره. قابلیت شخصی سازی رنگ صفحه نمایش بسته به نوع استفاده مثلا طولانی مدت مثل مطالعه و ... تحت عنوان (Splendid) هم داره.درضمن صفحه نمایش اون دارای محافظت از نوع Corning Gorilla Glass 1 هست که بدون گلس در برابر خط و خش مقاوم هست. تاچش با این حالی که یک گلس روش انداختم کاملا روونه و از نقاط قوت این تبلته. یکی از قابلیتاش اینه که با دوبار ضربه زدن رو صفحه روشن میشه و با تکرار این کار مجدد صفحه قفل میشه و نیازی به استفاده از دکمه های کناری برای باز کردن قفل صفحه نمایش نیست.
لوازم جانبیش تو بازار موجوده، من یه کیف مگنت خوب هم براش گرفتم که حملشو برای من که تو نگهداری از وسایلم حساس هستم راحت میکنه. ظاهر تبلت هم بسیار زیبا و خوش دسته.
به راحتی و با سرعتِ بالا، میتونید از اینترنت همراه 4g استفاده کنید. رابط کاربریش (ZenUI) هم خوبه و لذت بخشه. پخش صدای قوی و خوبی داره.
اگر تبلتی مشابه این رو از سامسونگ پیدا کنید حداقل باید حدود دو برابر این پول بدید. مثلا Tab A 8 LTE سامسونگ دوربینش 5، پردازندش و پردازنده گرافیکیش مشابه اینه و محافظت صفحه نمایش و برخی سنسورهای اینو نداره (مثل سنسور مجارورت یا proximity و قطب نما) و یک قلم اضافه داره و رزولوشن صفحش پایینتره (سامسونگ 160 هست و ایسوس 189) فیلمبرداریش ضعیف تره و HD هست و اندرویدش هم پاینتره (سامسونگ 5 و ایسوس 6) و قیمتش حدود 2 برابر اینه.
یه نکته جالب اینه که با راه اندازی تبلت و اتصال به اینترنت میتونید 100 گیگ فضای ابری از گوگل هدیه بگیرید.
من به چند نفر معرفی کردم و بعد از اینکه تبلت رو به خوبی دیدن اونها هم خریدن. در کنار همه اینها اندرویدش 6.0.1 هست و به محض راه اندازی کلی آپدیت سیستمی دانلود کرد. در کل اگر برای کاربری عمومی، مطالعه و وبگردی میخواید حتما پیشنهاد میکنم این تبلت رو یکی از گزینه هاتون قرار بدید.",1,1,5,5,5,5,5,5
"صفحه نمايش رم دو گيگ بسيار سريع پردازنده 410 اسنپ دراگون. آندرويد 6 رابط کاربري سريع و‌جذاب","دوربين نسبتا ضعيف","بسیار عالی هستش و تو این چند روزه که باهاش کار کردم از همه لحاظ عالیه مشابه Asus z170c که رمش یک گیگه.
با توجه به پولی که دارین میدین و امکاناتی که نوشته و تو عمل هم سریع هستش عالیه .توقع بجا باید داشت نه اینکه دوربین عالی و امکانات عالی با این قیمت انتظار داشته باشیم!
با خیالت راحت خرید کنید و راضی کننده هستش ...",0,0,5,5,5,5,4,3
"سنسور سنجش نور سنسور جي پي اس کيفيت بين خوب تا عالي","درب پلاستيکي باتري غير قابل تعويض","این تبلت با گلسش سفارش دادم از دیجی کالا.پلمپ کرده و تمیز بسته بندی شده بود که خیلی راضی بودم.خود تبلت هم در حد پولی که دادم
خوبه راضیم...میخواستم گلکسی تب آ 7 اینچ بگیرم که اصلا مدل اسنپدراگونش(بین المللی) تو ایران نیست خیلی از سامسونگ بدم اومدکه به ما ایرانیا
بی احترامی میکنه.
ایسوس گرفتم فقط از دی جی کالا چون کارش درسته.بازم میخوام از دیجی کالا خرید کنم.",0,1,4,4,4,2,3,3
"هيچي فقط اسمش ايسوزه!!
صداش خوبه","تا دلت بخواد","سلام..
قبل از خرید خیلی به چشم میاد ولی در واقعیت خیلیییی با اون چیزی که تو خیال و ذهنتون می سازید فرق داره..
دوربین خیلی بد( در حد VGA گوشی چینی های TV که در 10 سال پیش بودند) دوربین جلو رو که اوه اوه نگو-صفحه نمایش بی کیفیت طوری که یکم دقت کنید پیکسل های LCD رو مشاهده میکنید-کیفیت ساخت پایین- نور کم صفحه نمایش حاشیه زیاد کتار LCD-وزنش زیاد که واقعا دست خسته میشه و و و که انشالله تجربه نکنید..
در کل پیشنهاد میکنم این تبلت رو نخرید، یکم صبر کنید و با 100 تومان پول بیشتر برای تبلت سامسونگ خریداری کنید که لذت بخشه.",6,25,0,2,1,1,1,1
,,"تبلت خیلی خوبی. من واقعا از دیجی کالا بابت ارسال های خوبش تشکر میکنم",9,0,5,4,4,4,4,4
"انواع سنسورها صفحه نمايش LED اندرويد 6 تاچ خوب 4g","حافظه داخلي کم","تبلت بسیار خوش ساختیه که تو این رنج قیمت بهترین تبلت. تو خریدش شک نکنین
ایسوس کلا تبلت های خوبی میزنه",8,2,4,5,4,5,4,4
"قيمت مناسب","ندارد خيلي","تبت خوبیه با توجه به قیمتی که دارد انتظار چیز خارق العاده ای نمیشه داشت فقط یکمپیکسل صفحه بالاتر بود عالی میشد",3,2,5,5,5,5,5,5
"کيفيت صفحه خوب سرعت مناسب قابليت دابل تب براي خاموش روشن کردن صفحه طراحي زيبا بدون اضافه کاري اندرويد6 باتري فوق العاده","دوربين متوسط لگ هاي خيلي ريز حين اجراي بعضي برنامه ها و رابط کاربري زمان زياد شارژ شدن","سلام
از خوبی های این تبلت کیفیت صفحه تبلته که با تنظیمات شخصی میتونید اشباعیت رنگ هارو بالا ببرید و باعث چشم نوازتر شدن صفحه میشه و شدت نور بسیار مناسبی هم داره که حتما راضی نگهتون میداره فقط بدیش رزولیشن پایینشه که مخصوصا برای متون ریز شمارو مجبور میکنه که زوم کنید و قابلیت دابل تپ باعث میشه عمر دکمه پاور کنار دستگاه رو بیشتر کنه.
زمان شارژ شدن تبلت نزدیک 4 ساعته که خب خیلی زیاده و اگه کارتون عجله ای باشه و یک ساعت هم تو شارژ باشه نهایت 25درصد شارژ میکنه!! ولی بازدهی تبلت خیلی بالاست و باعث میشه اون 4 ساعت به چشم نیاد...طبق آخرین تست 10 ساعت به صورت مداوم و استفاده معمولی صفحه نمایش روشن بود (از100 تا 0) .
رابط کاربری روونی داره اما موقع اسکرول کردن صفحات وب و برنامه ها خیلی ریز لگ که در قیاس بقیه گوشی های اندرویدی با همین سخت افزار که کاملا روون اسکرول میشن یه مقدار تو ذوق میرنه که البته اگر زیاد حساس نیستید مشکلی در روند کارتون نمیزاره..
یکی دیگه از نکات مثبتش صفحه یه دست مشکیشه که موقع خاموش بودن صفحه باعث یکپارچگی و زیبایی جلوی تبلت میشه و در کل حس یه کالای لوکس رو به آدم منتقل میکنه.
دوربینش اونقدر ها هم که میگفتند بد نیست ، اگر در شرایط نوری مناسب باهاش عکس بگیرید راضیتون میکنه البته به شرط اینکه توقع زوم زیاد رو نداشته باشید!!
تاچ خوبی هم داره که مشکلی باهاش نخواهید داشت و مشکلاتی که از بعضی تبلت های دیگه میشنیدم مثل مشکل تاچ رو اصلا نداره
درکل مطمئن باشید از خریدتون پشیمون نخواهید شد خریدش رو بهتون پیشنهاد میکنم...
یه بررسی نسبتا کامل رو کردم که اون هایی که تو خریدش شک دارند شکشون برطرف شه.",6,1,4,5,5,5,4,2
"کلا خوبه","واقعا نداره","تبلت تازه به دستم رسید رنگ سفید رو سفارش دادم عالیه ؛بسیار شیک ،سبک و با کیفیت
سرعت خوبی داره با این قیمت بهترینه از دیجی کالا ممنونم و از خریدم عینه همیشه راضیم
در ضمن کیفیت صفحه نمایش بسیار خوبه و برای کار های روزمره و وب گردی بی نظیره
از دیجی میخوام که خش گیر جدیدی بیاره برای این تبلت اخه این که اوردی خیلی ضخیمه لطفا موجود شه با تشکر فراوان.",4,1,3,3,3,3,3,3
"کلا خوبي بيشترم ازش توقع نميره","جاي سيم کارتش","این که سیم کارتش از روی خودش جا نداره بیاد بیرون و این که هر دفعه باید درشو باز کنی یا ذره شاید مشکل ساز باشه
بقیه خوبه هم سیمش هم اس دی کارت
جاش بده",2,2,5,5,4,5,4,5
,,"تبلت بسیار خوبی است فقط بسیار سنگینه دست رو خسته میکنه.",0,3,3,3,3,3,3,3
,,"تو این رنج قیمت از نظر کیفیت ساخت و کارایی حرف نداره.",4,2,5,5,4,4,5,3
"همه چي","صفحه نمايش","با توجه به قیمتش واقعا عالیه حتی شاید هم فراتر از عالی",4,2,5,3,5,5,4,3
,"من نديدم","1سالی میشه خریدم ...دیدم دوباره آف خورده گفته بگم بهتون که واقعا تبلت خوش ساخت خوش دست و باکیفیتیه.
بهترین سایزو داره نه کوچیک نه خیلی بزرگ",4,3,5,5,4,4,4,4
,,"تبلت بسیار خوبیه برنامه ها رو راحت اجرا میکنه بازی ها یی که سنگین نیستن رو عالی و روان اجرا میکنه و همچنان داره از طرف ایسوس ساپورت میشه لمس و تاچ خوب کار میکنه باتری دوروز نگه میداره اینترنت نسل جدیدم ساپورت میکنه کل پیشنهاد میکنم الان که تخفیف ویژه هست از دست ندید",4,1,4,4,5,4,5,4
"زيبايي
کيفيت
مقرون به صرفه بودن","کيفيت دوربين که البته اصلا مهم نيست","سلام، از دیجی کالا خریدم و بسیار راضی هستم . برای وسایل جانبی هم تو تعطیلات طبقه سوم علاالدین کیف و گلسش رو پیدا کردم.
قابل توجه اون دوستی که گفته بود فایلهای آفیس رو باز نمیکنه:
برای باز کردن هر فایل با پسوندهای مختلف نیاز به نرم افزار مخصوص هست که مشکل شما با نصب نرم افزار Kingsoft Office حل میشه.",3,1,5,5,5,4,4,4
"سيم کارت 4g
رم بالا",ندارد,"قبل از عید گرفتم و تا الان راضیم و بی نقص بوده",7,2,5,5,5,5,5,3
,"دوربين اصلي عکس با کيفيت نداره","واقعا نسبت به قیمتش , عالی هست .من دو ماه که خریدم ازش کاملا راضی هستم",8,2,3,3,3,3,3,3
"همه جاش","هيچ جا","عالیییییییی حتما بخرید",9,4,5,5,5,5,5,5
همچي,نداره,"بی نظیره بی نقص بسیار عالی . حرف توش نیست . در خریدش شک نکنید",6,1,5,3,4,5,5,4
"همه چيزش عاليه.",ندارد,"در تاریخ 6/1/96 سفارش دادم 8/6/96 به دستم رسید. از همه نظرخوب است ولی ای کاش دیجی کالا مثل لپ تاپ هاش کیف و کاورش هم می داد.",5,4,4,4,5,5,4,4
"زيبا. سخت افزار بالا . ظريف. خوش دست
سبک",ندارد,"تبلت بسیار خوب.و به صرفه ایی هستش. حدود 1 ماهه از دیجی خریدم. هیچ نقطه ضعفی ندیدم. ایسوس برند خوبیه. دومین باریه که ایسوس میخرم و راضیم.",4,2,5,5,5,5,5,3
"سرعتش عاليه.","باطري زود تمام ميکند.","خیلی خوبه .
فوق العاده است.",5,3,5,5,5,5,5,5
"ارزش بالا درمقابل هزينه اي که کردم","عدم پشتيباني از move to sd card","تبلت خیلی خوبیه ازدی جی،کالا گرفتم فقط یه مشکلی دارم پاور پوینت و ورد و اکسل رو باز نمیکنه کسی میتونه راهنماییم کنه چع بزنامه ای دانلود کنم؟
از پلی استور وبازار چیزی نتونستم بدست بیازم
خواهشا اگرکسی میدونه راهنمایی کنه",5,1,3,3,3,3,3,3
"طراحي زيبا. سرعت پردازش وام بالا","لوازم جانبي. نوتيفيکيشن لايت ندارد.","سلام. من الان سه هفته ای هست که این تبلت رو خریدم. بیشتر برای کتابخونی استفاده کردم. ولی وقتی هوس بازی کردم بازیهایی که اجرا کردم کاملا بدون هنگ کردن اجرا کرد. کیفیت صفحه نمایش کاملا عالیه. دوربین و سلفی معمولی که البته برای تبلت کافیه. یک بدیش هشدار دایم برای آپدیت هست که البته من بهش توجه نمیکنم.دو بدی جزیی دیگه نداشتن چراغ نوتیفیکسشن و نبود لوازم جانبی در دسترس که بنظر من اصلا مهم نیست.هنگ و ری استارت نداره فقط یکبار توی این سه هفته ری استارت کرد. باتری کاملا عالیه و اگر فقط بهش سر بزنید راحت یک هفته دوام داره. اگرچه اندرویدش به نظر من به روشنی اندرو سامسونگ نیست. ولی من هیچ ضعف قابل ملاحظه ای براش نمیبینم اگر تصمیم به خریدش دارید یک لحظه هم شک نکنید. بابت نظرات دوستان عزیزم ممنون که منو متقاعد کرد این تبلت خوب رو بخرم.",6,2,5,5,5,5,5,5
"همه چي",هيچي,"تبلت عالیه قبل از عید خریدم تا حالا ک راضی بودم تبلت نرم و رونیه
عالیه شک نکنید بگیرید",3,1,5,5,5,5,5,5
,,"من تازه سفادش دادم هنوز نرسیده دستم اما خیلی ازش تعریف شنیدم امیدوارم همینطور باشه وقتی استفاده کررم حتما تجربمو میگم",3,2,3,3,3,3,3,3
"کارکرد روان و بدون لگ داره","دوربين,که البته ا ز تبلت و مخصوصا با اين قيمت انتظاري نبايد داشت.","اگه میخاید کارکرد تبلت خیلی روان بشه از قسمت quick setrings نرم افزار autostart manager رو باز کنید و هر چنتا که میتونید نرم افزار هارو انتخاب کرده و غیرفعال کنید, تا حدی که تبلت با حدود 40 برنامه نصب شده,حدودا 1.3 گیگ از دو گیگ رم را خالی نگه میداره",2,2,4,4,4,4,4,3
"زيبايي امکانات و قيمت","سخت پيدا شدن گلس و کيف بخاطر جديد بودن","بعد از کلی تحقیق و بررسی این تبلت رو از دیجی کالا خریدم و الان دارم باهاش نظرم رو می نویسم. از همه نظر ازش راضیم.",1,2,5,5,5,4,4,4
,,"سلام
چند روزه که این تبلت دستم رسیده، ممنون از دیجی کالا، به خاطر دقت و سرعت در ارسال
تبلت خوبی نیست، نخرید، سرعتش پایینه
اگه می‌تونید سیصد، چهارصد بذارید رو قیمتش مدل 4G ram بخرید. این تبلت سرعتش از گوشی با رم 1 هم پایین تره. دوربینش هم اصلأ خوب نیست.
باتریش بد نیست
در کل کار راه اندازه، ولی کند بودنش رو اعصابمه",6,7,1,3,2,2,3,3
,,"با سلام. نسبت به قیمت تبلت مناسبی می باشد.",3,2,4,4,3,4,3,3
"باطري با بازده مناسب در کارکرد هاي مختلف
صفحه نمايش باکيفيت
کيفيت مناسب صداي اسپيکر
سخت افزار قابل قبول
کيفيت ساخت","تا الان مشکلي در زمينه سخت افزار و نرم افزار نديدم
تنها نقد من مربوط به نبودن otgو هدفون همراه تبلته","من با تحقیق این تبلتو گرفتم به نسبت قیمت از هر نظر عالیه
به دوستان خرید این محصول رو پیشنهاد میکنم
این نقد رو هم دارم با تبلت مینویسم.
در پایان هم از دوستان دیجی کالا تشکر میکنم
سال نومبارک
پیروز باشید",2,0,5,5,5,5,5,3
"بد نيست",,"حتما بخرید",9,4,3,3,3,3,3,3
"خوش دست
سرعت خوب","دوربين ضعيف","تنها ایرادی که بهش برخوردم ولی مطمئن نیستم مشکل از تبلت باشه یا نرم افزار، این که موقعی که تو تلگرام ویس فرستاده میشه و میخام اجرا کنم تبلت هنگ میکنه",6,11,4,4,4,4,4,4
,,"این تبلت تبلت خوبی نیست",6,53,0,0,0,0,0,0
"کيفيت صفحه نمايش بالا صفحه نمايش هشت اينچي کيفيت صداي بالا داشتن اينترنت 4g با سرعت بالا","نبود لوازم جانبي","سلام ببخشید میخواستم یه سوال بپرسم ازتون من یه دو روزه این تبلتو خریدم هیچ مشکلی نداره ولی توی تنظیمات قسمت باتری میرم میزنه وای فای در حال اجرا ولی این درحالیه که وای فای تبلتم خاموشه و از باتریه تبلتم شارژ میره میخواستم ازتون بپرسم شما هم همچین مشکلی دارید",10,1,3,3,3,3,3,3
,,"این محصول سه روزه به دستم رسیده . هم طراحی زیبایی داره و هم امکانات . من دو سال قبل برای پسرم 7اینچ خریده بودم که تاچ ان شکست و تاچ اون با تعویض دیگه مثل قبل کار نکرد و برای اینکه ازش راضی بودم دوباره همین برند رو خریدم.",12,1,5,5,5,5,5,5
"سخت افزار مطمئن
رم مناسب به نسبت قيمت
وضح تصوير فوق العاده","نديدم تا الان","سلام
به نسبت قیمت در تبلتها این نوع مدل فوق العادست.
اگر قصد خرید این محصول رو دارید شک نکنید.
متاسفانه به دلایلی تبلت بدون نام و نشان خریده بودم با کلی تحقیق بلاخره به این نوع مدل رسیدم...
و از بازار خریدم.
همون طور که در بالا (نقاط قوت) نوشتم ... تبلت مناسبی برای مطالعه و حتی بازی کردن با کیفیت بالا هست.
امیدوارم با دقت تبلت یا هر جنس الکترونیکی بخرید و اشتباه اول من رو نکنید.",11,2,5,5,5,5,5,5
"صفحه مناسب
امکانات مناسب","تا کنون مورد خاصي مشاهده نکرده ام.","با سلام
بنده حدود 10 روزی است که 2 عدد از این تبلت از طریق دیجی کالا خریداری کردم.
در طول این مدت خیلی راضی بوده ام.
خیلی دنبال تبلت بودم و نهایتاً به این مدل و با این مشخصات رسیدم.
به نظرم چنانچه برای انجام کارهای روزمره میخواهید کارتان را راه میندازد.
با آرزوی موفقیت روزافزون برای دیجی کالایی های عزیز",12,1,5,5,5,5,5,5
"کيفيت صفحه نمايش با توجه به قيمت
عملکرد لمسي (تاچ) خوب
طراحي زيبا
پشتيباني به روز رساني
ارزش خريد بالا","مدت زمان شارژ","در این محدوده قیمت و با این امکانات از جمله 4G ، میشه گفت انتخاب مقرون به صرفه ایست برای وبگردی ، شبکه اجتماعی وحتی بازی های فکری!",7,1,4,3,3,3,3,3
"صفحه نمايش.کيفيت ساخت.سرعت.",نديدم,"تبلت خوبیه یعنی عالیه",8,1,5,5,5,5,5,5
"جنس بدن خوب
خوش دست","کيفيت پايين دوربين","سلام بهمه
به نسبت سایزش بسیار خوش دسته و برای انجام کارهای روزمره بسیار عالیه",10,1,3,4,4,4,4,3
,,"اول از دیجیکالا تشکر میکنم بخاطر خدمات بی نظیری که داره. واقعا دمت گرم. جزو قابل اعتمادترین شرکت های ایرانیه به نظر من. من این تبلتو 3 روزه گرفتم الانم دارم با خودش تایپ میکنم. تا الان که کاملا از خریدم راضیم.کمی نگران رزولیشن پایین صفحه بودم (البته تو این رنج قیمت همه همین رزولیشن رو دارن مگر این که تبلت خیلی قدیمی باشه) ولی خوب برای استفاده روزمره خوبه مخصوصا که رنگهارو خوب نشون میده و روشنایی خیلی خوبی داره. از لحاظ ظاهر هم عالیه. بزرگترین نکته مثبتش هم نرم افزاریه.اندروید 6 با رابطه کاربری خیلی خوب و کاربردی و روان. باترشم کاملا راضی کنندست. خلاصه از خریدم راضیم و لذت میبرم از این تبلت. توی این رنج قیمت حتما پیشنهاد میدم بهتون.",6,1,4,5,4,2,4,4
"کيفيت صفحه نمايش . باتري . خوشدست . زيبا . قوي . ...",نداره,"تو این رنج قیمت و کلا تبلت زیر 1 تومن بهترین گزینه اس.باتری عالی . صفحه نمایش حرف نداره.آسفالت 8 هم روش اجرا کردم بدون گیر کردن اجرا میشه. از هرنظر عالیه",15,2,5,4,4,5,4,5
