positivePoints,negativePoints,commentText,like,dislike,"ارزش خرید به نسبت قیمت","طراحی و ظاهر","امکانات و قابلیت ها","سهولت استفاده","کیفیت ساخت",نوآوری
,,"بدون استفاده مصرف باطری دارد.",0,0,1,2,2,2,1,0
"قيمت پايين
گارانتي يک ساله سازگار
3g","جنس بدنه پلاستيک نامرغوب مخصوصا پشت تبلت
سرعت پايين با توجه به سخت افزار تعبيه شده
داغ کردن سريع
باتري بسيار ضعيف","اگه یه مبلغ دیگه روش بزارید و تبلت های لنوو بخرید.،پولتون رو دور نریختید",1,0,2,2,3,3,1,2
"تو اين رنج قيمت مشخصات بالا","به نظر نمياد","عالیه و ارزشش را داره",2,1,5,5,5,5,5,3
قيمت,باطري,"چطور میتونم از نزدیک این تبلت رو ببینم؟",2,1,3,3,3,3,3,3
"سخت افزار متوسط وکارا وتمام فلزبودنش",دوربين,"تبلت عایی حتما پیشنهاد میکنم",0,1,5,5,5,5,5,5
"سخت افزار خيلي خوبه.نرم افزاري هم جوابگو","فقط دوربين","من این تبلت رو خریدم.از نظر سخت افزاری خیلی خوب و کارکن هستش. نرم افزار هم که تا تونستم ریختم ولی هنگ کردن درکار نیست. سرعت تاچ عالیه. کیفیت تصویرش خیلی خوبه. من از دیجی کالا خریدم.بیرون به چندتا فروشنده موبایل و تبلت نشون دادم که همشون گفتن این تبلت عالیه.مخصوصا برای بچه ها.در ضمن بیرون این تبلت قیمتش بالاتره.خلاصه شک نکنید تو خریدش.با این قیمت اسباب بازی هم نمیدن چه برسه به تبلت با این مشخصات خوب.",4,1,3,3,3,3,3,3
,,"در حد قیمت امکانات خوبی دارد",5,1,5,5,5,5,5,5
,"کمي داغ مي کند","نسبت به قیمت بدک نیست ولی با این مبلغ می توان گزینه ایی دیگر را انتخاب کرد",4,3,3,3,3,3,3,3
