positivePoints,negativePoints,commentText,like,dislike,"ارزش خرید به نسبت قیمت","طراحی و ظاهر","امکانات و قابلیت ها","سهولت استفاده","کیفیت ساخت",نوآوری
"طراحي زيبا
سبک
جمع و جور
مناسب براي نيازهاي معمولي
قيمت مناسب","نمايشگر کوچک و حاشيه صفحه زياد
ظرفيت هارد کم","از دیجی کالا بابت اینکه میخاد این محصول رو بیاره کمال تشکر رو دارم فقط امیدوارم دیجی کالا نسخه ویندوز این محصول رو هم بیاره که خیلی کاربردی تره و بیشتر مورد نیازه تا نسخه اندروید.
امیدوارم هر چه زودتر در دسترس قرار بدید این محصول رو.
باتشکر",7,0,5,5,5,5,3,5
"از هر نظر برتره",,"فقط ای کاش هر چه زود تر دیجی کالا اون رو بیاره چون مشتاقانه منتظره اومدنش در دیجی کالا هستم تا بلافاصله خریداری کنم",5,0,3,3,3,3,3,3
,,"این محصول واقعا خارق العاده است. با قیمتی مناسب نمیدونم چرا دیجی کالا نسخه اندرویدی اون رو تصمیم داره وارد کنه. شما یه دستگاه لمسی فوق العاده دارید که میشه روش نرم افزارهای گرافیکی ریخت و از قابلیت لمس اون حسن استفاده رو کرد. نسخه ویندوز بهترین انتخاب برای این محصول خواهد بود.",7,0,4,5,4,5,5,5
"صفحه کليد استثنايي
قلم بسيار پرسرعت و قوي
جمع و جور","صفحه نمايش کمي کوچيک","خیلی عالیه..واقعا نسخه ویندوز این دستگاه رو ک من کار کردم تمام انتظاراتی که از یه کامپیوتر یا لپتاپ میشه داشت رو براورده میکنه بدون کوچیکترین افت سرعتی",6,0,5,5,4,5,3,3
"خلاقيت و نوآوري",؟,"امیدوارم نسخه ی ویندوز این تبلت یا نوت بوک یا همون یوگابوک هم وارد بشه
واقعا دستگاه هیبریدی هیجان انگیزیه",10,1,3,4,5,4,4,5
,,"تتها عیبی که داره اینه که باید از صفحه 10.6 اینچی استفاده میکرد تا حاشیه صفحه رو هر چه کمتر کنه",4,4,5,5,5,5,5,5
"سبکي و باريک
وجود قلم بسيار عالي
داشتن کيبرد و صفحه نمايش دوم
وجود سه سيستم عامل(ويندوز_اندرويد_کوروميم)
داشتن دوريبين کار راه انداز","حافظه کم
پردازنده ي نچندان بالا","من یه دانشجو هستم و خیلی مشتاقم تا هرچه سریع تر این تبلتو بگیرم.البته سیستم عامل کرومیم این دستگاه رو میگرم چون سیستم عامل بی نقسیه برای این دستگاه که هم میتونی از هالت دکستاپ استفاده کرد هم میشه برنامه های اندروی وبرنامه های مخصوص این سیستم عامل رو روی اون نصب کرد.",6,3,5,5,5,3,4,5
"همه چي",هيچي,"فقط باید امتحان کنی مارک لنوو تو تبلت عالی کارمیکنه",10,2,3,3,3,3,3,3
,,"عجیب است که با وجود تبلتهای 4g و سبک 2016 صرفا تبلتهای بالای نیم کیلوی لنوو وارد می شوند !",2,11,0,0,0,0,1,1
