,,"سلام دوست عزیزی ک راهنمایی خاستی
پیامک نداره و نمی شه تماس گرقت. از طریق شبکه های اجتماعی میشه چت کرد و تماس گرفت
6 پلاس تلفنه و همه ی قابلیت ها رو داره ولی ایپد یه تبلته ک اندازه ی صفحش برای من مهم بود و بین اون و ایفون ایپد رو انتخاب کردم در ضمن از بین برنامه های اجتماعی ایپد با واتس اپ نیز مشکل داره در حالی ک ایفون هیچ محدودیتی در این زمینه نداره
در خصوص usb خوردن .... فقط از فلش های مخصوصی پشتیبانی میکنه ک میتونی جدا بخری ک بهش میگن iflash drive ک میتونی یه سرچ بزنی راج بش اطلاعات کسب کنی راج ب تبادل اطلاعات بین اندروید و ای او اس فقط بلوتوث نداره ولی میتونی از طریق نرم افزارهای جانبی مث zapya و share it خیلی راحت تر و سریع تر این کار رو انجام بدی
موفق باشید",1,0,4,5,3,5,5,2
,,"سلام من بین این و آیفون 6 پلاس موندم خوشحال میشم کسی راهنماییم کنه",2,0,0,0,0,0,0,0
,,"سلام دوستان.من تا حالا با ای او اس کار نکردم . و میخواستم ایر 2 رو بخرم ولی از بعضی ها شنیدم که محدودیت هایی داره مثل اتصال برقرار نکردن با usb (برام خیلی اتصال به usb مهمه )و این که نمیشه از گوشی یا تبلتای اندروید فایل گرفت و.. و یچیزایی هم راحع به جلبریک شنیدم . بدجور موندم سر دوراهی . میخواستم اگه واقعا کسی ایپد داشته یا اطلاعات دقیقی داره بگه دقیقا محدودیتای ایپد چی هستن و ایا میشه حلشون کرد یا نه ؟",0,0,0,0,0,0,0,0
,,"نقره ای و موجود کنید",0,0,5,5,5,5,5,5
,,"بابا GALAXY NOTE 10.1 EDITION 2014بدرد نمی خوره خیلی لگ داره و گیر می کنه . بعضی از بازی های سیستم عامل دیتای سنگین داره ولی باز آیپد بازی هاش دیتا نمیخواد .آیپد پردازنده ی قوی داره درسته پیامک نداره و نمی شه تماس گرقت. از طریق شبکه های اجتماعی میشه چت کرد و تماس گرفت.",1,0,5,5,5,5,5,5
,,"از نظر هنگ الان بنده آیپد 3 دارم asphalt 8لگ نمیزنه ولی شاید تو صفحه عوض کردن (بین دویست و خورده ای اپلیکیشن) یکم مکث کنه ولی مطمئن باش تا چهار سال هیچ لگی نخواهی دید",0,0,0,0,0,0,0,0
,,"سلام خدمت دوستان
بچه ها لطفا کمکم کنید من بین تب اس و ایر2 موندممن واسه بازی و سخت افزار میخوام که اصلا هنگ نکنه
موفق باشید",0,0,0,0,0,0,0,0
,,"دوست عزیز اقای مهدی رضایی قلعه تکی
بنده نیز همینو عرض کردم
بنده بعد از روزهای نخستین تولید ایپد 3 اونو تهیه کردم و ب تازگی هم همین محصول رو ک مشاهده میکنید خریداری کردم
منتهی دوستمون اقای احد شکری فرمودند ""در جواب بعضی از دوستان لازمه بگم که بعد از نصب سیم کارت قابلیت ارسال پیام کوتاه رو داره""
و من ازیشون سوال کردم تورو خدا اگر همچین قابلیتی داره ب بنده هم بگن چون بعد4 سال هنوز نتونستم پیداش کنم",1,0,4,5,3,5,5,2
,,"منتظر رنگ خاکستری هستم لطفا موجود کنید.... ممنون",2,0,0,0,0,0,0,0
,,"دوست عزیز علیرضا شایسته
همانطور که در مشخصات هم میبینید این تبلت sms ندارد
نرم افزار imassage تنها برای دادن مسیج بین افرادی است که اپل آیدی دارند و شماره تلفن نمیگیرد
شما تنها میتوانید با استفاده از سیمکارت به اینترنت وصل بشوید",1,0,0,0,0,0,0,0
,,"احد شکری
سلام ... بنده سیمکارتو فعال کردم وفقط ای مسیج داره ... من نمیتونم باهاش پیامک بدم باید چکار کنم ؟",2,0,4,5,3,5,5,2
,,"دوست عزیز امیر احمدی
وجود هاله در اطراف صفحه نمایش اصلا طبیعی نیست
کاش همون روز اول که خریدید با دیجیکالا تماس میگرفتید
با یک متخصص تماس بگیرید",1,0,0,0,0,0,0,0
,,"سلام دوستان ، من این تبلت رو به تازگی خریدم و باید بگم که اولین تجربه من در کار کردن با IOS هست که خیلی هم برام جذاب و دوست داشتنیه ، اما یک چیزی باعث نگرانی من شده که نمیدونم بجا هست یا نه ، وقتی که یکی از عکسهایی رو که زمینه سفید داره به عنوان تصویر زمینه میذارم احساس می کنم که از دو طرف صفحه نمایش دو هاله خیلی کمرنگ یکی سیز رنگ و دیگری صورتی مشخصه ، یعنی زمینه کاملا سفید نیست ، البته این مسئله در بقیه پنجره هایی که زمینه سفید دارن هم مشخصه ، خلاصه نمیدونم این یک ایراد مربوط به صفحه نمایشه یا نه ، لطفا اگر کسی میدونه راهنماییم کنه.",1,0,0,0,0,0,0,0
,,"فقط اگه پولشو داشتم...",2,0,4,4,4,5,5,4
,,"باسلام خدمت دوستان من اولین باری هست که میخوام با ای او اس اشنا شم راستش گوشی خودم گلکسی نوت3 هست ازش متنفرم فقط هنگیه ولی با این مطالبی که در دیجی کالا خودم ببخشید اینو میگم ولی فکم افتاد واقعا ایپد عالیه من تا الان میخواستم تب اس بخرم تا دیدم پسرخالم خرید والان پشیمونه داره میفروشه ازش نمیخرن نظرم عوض شد میخوام ایر 2 128 بخرم واگه روزی 1ملیاردم پول ایپد بشه هر نسلی بیاد میخرمش عالیهه",1,0,0,0,0,0,0,0
,,"تبلت ایپد ایر 2 تبلت بسیار خوش تیپ و با کلاسی هست الان با معرفی گلکسی تب اس 2 بعضی از افراد فکر میکنند تب اس 2 با ظرافت 5.6 میلی متر وایپد ایر 2 با6.1 میلی متر از ایر 2 بهتر هست ولی این از نظر من اشتباست چون ایر2 از لحاظ سخت افزاری نرم افزاری وکیفیت ساخت بهتر از گلکسی تب اس 2 هست هرکی موافقه + بکوبه",8,0,0,0,0,0,0,0
,,"پارت نامبر دستگاه من cl/a هست ک مال کاناداست
البته از دیجیکالا نخریدم ...باید عرض کنم اره اقای امیر مسعود زیبا شما درست میفرمایید اینم یه تفسیر خوبه ک همه ی مدل ها راضی کننده ان و با اومدن مدل جدیدتر کسی مدل قدیمیشو حاضر نیست کنار بزاره درحالی ک سامسونگ دارها با اومدن مدل جدیدتر از مدل قدیمی زده میشن ... من محدودیتاشو قبول دارم ولی ای کاش قابلیت پیامک و مکالمه هم بهش اضافه میشد",2,0,4,5,3,5,5,2
,,"ایپد ایر زرد یاgoldاصل امریکا و دارای شارژدهی بهتر و المینویم محکم و سبکتر خاکستری و مشکی است به نظر من gold بهترینه!!؟",0,1,5,5,5,5,5,5
,,"من که پول خریدشو ندارم وگرنه حتما می خریدم",4,0,5,4,5,5,5,3
,,"در مقابل، درآمد حاصل از فروش iPad همچنان با کاهش مواجه بوده و اپل تاکنون نتوانسته این نقطه ضعف را با چیز دیگری جبران کند. طبق گزارش منتشر‌ شده، در سه ماهه اخیر تنها 10.9 میلیون دستگاه iPad به فروش رفته که در مقایسه با iPadهای فروخته‌شده در مدت مشابه سال گذشته (13.3 میلیون دستگاه) با 18 درصد کاهش همراه بوده است. این ششمین فصل متوالی افت فروش iPad محسوب شده و به همین دلیل اپل از ادامه این روند ابراز نگرانی کرده است. حتی پس از شروع همکاری اپل با IBM در جهت ترغیب بیشتر کارمندان شرکت‌ها و ادارات به استفاده از تبلت‌ها، این امر هنوز محقق نشده است. شاید علت افت فروش iPad این باشد که کاربران ترجیح می‌دهند به جای خرید iPad جدیدتر، تبلت خود را نگه داشته و در عوض آیفون‌هایی با صفحه بزرگ‌تر را برای خرید انتخاب کنند. اپل امیدوار است عرضه iPad Pro، با صفحه بزرگ‌تر، در پاییز امسال راه خروج iPad از بحران را هموار کند.",2,0,4,5,3,5,5,2
,,"آقا این هدیه ای که گذاشتین عملا به هیچ دردی نمی خوره آخه اشتراک تلویزیون برای ما به چه دردی می خوره خواهشا سیمکارت 4G بذارید وسه هدیه که حداقل با خریدی که می کنیم ربطی داشته باشه و بشه ازش استفاده کرد",17,0,5,5,5,5,5,5
,,"مژده به کسانی که با تایپ فارسی مشکل دارند
بعد از بارها و بارها نامه نگاری هزاران نفر از جمله خودم، نرم افزار Microsoft office بالاخره تایپ فارسی و عربی را اصلاح کرد. البته اول باید یک صفحه کلید فارسی را با مبلغی اندک از سایت سیبچه دانلود و نصب کنید.",0,0,0,0,0,0,0,0
,,"سلام
میخواستم بگم دیجی جون هدیه ی سیم کارت 4G ایرانسل بهتر از هدیه ی فعلیه هر کس موافقه + بکوبه",27,1,0,0,0,0,0,0
,,"ببخشید شما آیپد را با چه نوع گارانتی تحویل میدهید؟",0,0,5,5,5,5,5,5
,,"آبان ماه میاد تو بازار امیر مسعود خان زیبا",1,0,5,5,5,5,5,5
,,"بسم الله الرحمن الرحیم
از نظر رزولوشن صفحه نمایش و تصویر و دوربین به گرد پای سامسونگ هم نمیرسه
آی او اس همیشه در اکثر جاها از اندروید عقب بوده
رم جانبی نمیخوره!
رادیو که هیچ مکالمه تلفنی هم نداره!
ولی از نظر پردازنده خیلی خوبه
حسگر انگشتش از سامسونگ دقیقتره
باتری و کارکرد باتری آیپد هم بهتر و بیشتره",4,4,4,5,4,4,5,5
,,"خرید این تبلت کاملا اشتباه شما میتونید با مقدار کمتری از این پول تبلت های قدرتمندتر و بهتری مانند:galaxy note 10.1 edition 2014 یا galaxy tab s 10.5 یا galaxy tab 8.4 بخرید من دوستم همین ایپد رو داره و من تب اس 8.4 روزی که این تبلتو دست من دید مجزوب کیفیت صفحش و قدرتش شد و روز بعدش رفت تب اس خرید با اینکه ترفدار اپل بود اعتراف کرد تب اس خیلی بهتر از ایپد ایر 2 هست",1,3,0,0,0,0,0,0
,,"سلام لطفا رنگ سفیدشو موجود کنید",1,0,0,0,0,0,0,0
,,"سلام
می خواستم بگم لطفا رنگ سفیدشو موجود کنید.باتشکر از سایت خوبتون.",1,0,0,0,0,0,0,0
,,"من دیروز نسخه 128 گیگ 4 جی رو گرفتم.. قبلش ایپد 4 داشتم . این تجربیات من بدون تعصبه
سرغت خیلی بیشتر شده و اضلا لگ و کندی حس نمیشه. تو ایپد 4 تو بازی های سنگین و اگر تو صفحه پوشه زیاد داشته باشید کاملا لگ میبینید
افکتا تو بازی خیلی بیشتر شده و کیفیت اجرای بازی واقعا بهتره و تو هیچ دیوایسی اینجوری ندیدم افکت هارو. هم جی 2 دارم هم نوت 4
باطری نسبت به ایپد 4 ضعیف تره ولی زودتر شارژ میشه . این تو 3 ساعت و ربع ایپد 4 تو 5 ساعت و ربع
خیلی سبک تره و خیلی خوشدست
صدای اسپیکر بم تره و بیس داره
دوربین خیلی بهتر شده
صفحه تو نور خورشید بهتر دیده میشه
تاچ ای دی عالیه
همون روز اول جیلبریک کرردم و الان هیچ محدودیتی ندارم
خلاصه حتما بخرید و بدونید این بهترین تبلت حال حاضر دنیاس",5,0,0,0,0,0,0,0
,,"دوست عزیز مهمان
بیشتر نرم افزارهای تخصصی مهندسی روی ویندوز نصب میشوند و نسخه iOS یا وجود ندارد یا تنها viewer است یا باید به دلار خریداری شود",0,0,0,0,0,0,0,0
,,"سلام این تبلت خیلی خوبه و رنگ لاییش از همه ی رنگ هایش زیبا تره در ضمن این تبلت 3 هسته ای هست.",1,0,0,0,0,0,0,0
,,"با سلام
این نظر من خطاب به کسانیست که به این تبلت علاقه دارند ولی به دلیل مشکلات مالی نتوانسته اند این تبلت را خریداری کنند لطفا تحمل و شکیبایی کنید چون قیمت این تبلت به طور چشم گیری کاهش میابد",2,0,0,0,0,0,0,0
,,"این تبلت چند هسته ای",1,0,5,5,5,5,5,5
,,"ممنون از همتون سلام من دانشجوی رشته الکترونیک هستم مدل گوشیم بالا نیست.ازطرفی دنبال یک وسیله ای هستم که هم نرم افزارهای تخصصی مرتبط با رشتم نصب بشه هم بتونم برنامه های اجتماعی رو نصب کنم اهل بازی نیستم. بین ایپد و لپ تاپ شک دارم چون حمل ایپد راحت تر از لپ تاپ و اینکه هزینش کمتره. بنظرشما ایپد ایر2 مدل 4G واسه من مناسب هس یا نه",2,0,0,0,0,0,0,0
,,"لطفا تا آخر تیر حتما ""طلایی""شو موجود کنید.
حتما میخوام از دیجیکالا بخرم. لطفا.
حتما طلاییشو بیارید و اگه ممکنه ""پیشنهاد شگفت انگیز"" یذارید
طـــلایـــی حتما",6,0,0,0,0,0,0,0
,,"به نظر من اگه کسی میخواد بگیره مدل wifi رو بگیره چون برای اینترنت زمانی که wifi نداریم میتونیم گوشی رو مودم کنیم و یا ipad بهش وصل شیم اگه مدل 4G باشه اولا دستگاه رو اذیت میکنه دوما احتمال داغ شدن دستگاه رو داره سوما پول باید بیشتر پرداخت بشه :) با تشکر",1,0,0,0,0,0,0,0
,,"لطفا هرچی سریع تر موجود کنین با رنگ خاکستری و قیمت مناسب ممنون",0,0,0,0,0,0,0,0
,,"سلام . لطفا رنگ طلایی رو موجود کنید",3,0,5,5,5,4,5,5
,,"بابا رنگ طلایی بذار دیگه",2,0,0,0,0,0,0,0
,,"سلام
آیپد من موقعی کهwifi خاموش است و روی airplane mode است بعد از 5 دقیقه بازی کردن(subway surf) داغ می کند .
آیا این طبیعی است؟
اخه می خواهم بدمش تعمیر کنند.",2,0,4,5,5,5,5,5
,,"دوستانی که خریدند مبارکشون باشه اما
دقت کنید که وقتی کابل شارژ لایتنینگ رو به آیپد میزنید جرقه کوچکی میزنه که به کابل و آیپد آسیب میزنه
پس حتما قبل از اینکه شارژر رو به پریز بزنید اول کابل رو به آیپد وصل کنید و سپس شارژر رو به برق وصل کنید تا جرقه ای بین کابل و آیپد بوجود نیاد",6,0,0,0,0,0,0,0
,,عالییییییی,1,0,5,5,5,5,5,5
,,"لطفا رنگ طلایی بیارید",3,0,0,0,0,0,0,0
,,"من میخوام بخرمش لطفا رنگ مشکیش رو موجود کنید",2,0,0,0,0,0,0,0
,,"نسبت به کسانی که در مورد نصب واتس اپ مشکل دارند اگر ایفون دارید بدون مشکل می تونید واتس اپ رو نصب کنید بدون جیلبریک به انجمن ایفون برید چون همه ی مطالب رو به طور کامل توضیح داده + فراموش نشه",1,0,0,0,0,0,0,0
,,"دوست عزیز مهرداد محمدحسین زاده
بدنه محکمی از جنس فلز و شیشه دارد که از انواع تبلت دیگر محکم تر است. اما با چکش می توان آن را شکست",1,0,0,0,0,0,0,0
,,"طلایش رو بیار دیگه منتظرم...",4,0,4,5,3,4,4,2
,,"به کسایی میگم که میگن این تبلت بدرد نمیخوره مایکرو سافت فقط افیسش کار امده اندروید هم معنایی جز لگ نداره نوت ادیشن هم دیگه عتیقه شده این وسط این تبلت همه رو با سخت افزارش شگفت زده کرده به بازیخور ها میگم که از این تبلت بی نظیر نگذرن",1,0,5,5,5,5,5,5
,,"طلایش رو بیارید هفته ی بعد امتحانات تموم میشه",3,0,4,5,3,4,4,2
,,"سلام میشه درباره بدنش یه توضیح بدین؟
مثل سامسونگه یا محکم تره؟",0,0,0,0,0,0,0,0
,,"سلام
به امید خدا من هفته‌ی بعد رنگ خاکستری‌ش رو می‌خرم. امیدوارم تا اون موقع موجود باشه و افزایش قیمت هم نداشته باشه.
البته از کاهش قیمت یا تخفیف‌های ویژه شدیداً استقبال میشه.
و امیدوارم تا اون موقع هدیه ویژه‌ش هم دوباره کنارش قرار بگیره.",1,0,0,0,0,0,0,0
,,"سلام ، من خودم از همون اولش هم از سامسونگ که فقط به خاطر ارزونیش توی جهان معروف شده بدم می اومد به هر حال من یه دو تا مورد باید بگم یکیش اینکه دی جی کالا چرا نسخه طلایی این مدل گرون تر از خاکستری و بقیه رنگ هاست؟
و مورد دیگر
اقای مهدی رضایی قلعه تکی 4g را یادتون رفت بگین",1,0,0,0,0,0,0,0
,,"دوست عزیز مهمان
با سیم کارت این آیپد نمی شود تماس گرفت فقط می شود با قابلیت 2G یا 3G به اینترنت وصل شد
بله هر تبلتی نیاز به یک محافظ صفحه نمایش دارد.من از همین دیجیکالا خریدم",1,0,0,0,0,0,0,0
,,"ببخشید اگه نمیشه پیامک یا تماس گرفت پس سیمکارت واسه چیه در ایپد دقیقا؟؟؟",0,0,0,0,0,0,0,0
,,"سلام
از دوستانی که این دستگاه رو یا اطلاعات کافی در این زمینه دارن یه سوال دارم.
این دستگاه یاز به محافظ صفحه نمایش داره واقعاً؟",0,0,0,0,0,0,0,0
,,"سلام من پیشنهاد میکنم حتما همین مدل رو بگیرید چون بعد حسرت میخورید که چرا مثلا من 64 یا 128 نگرفتم اصلا توی شک نیافتید و اصلا دیوایس های اندرویدی نگیرید من خودم الان یک نوت 10 دارم که خیلی هنگ میکنه که الان اون دست خواهرمه و بجاش ایر 32 گرفتم اصلا محصولات اپل حرف نداره سامسوتنگ کجا اپل کجا من دو روز پیش آیپدم رو فروختم و اومدم که این مدل رو بگیرم دیدم که رنگ طلایی موجود نیست وحالا منتظرم که دیجی کالا تا آخر این ماه رنگ طلایی رو موجود کنه .
ودر پاسخ بعضی از نظرات که میگفتن داغ میکنه یا هنگ میکنه و ....... یا محصول تقلبی از جایی خریدن و یا میخوان که محصولات اپل رو پایین بکشند
آیپدی که من داشتم اصلا نه هنگ میکرد و نه داغ میکرد و کاملا روان کار میکرد در محصولات اپل کلمه هنگ معنا نداره و پیشنهاد من اینه که این قیمت ارزون تر از جاهای دیگر است و حتما همین مدل رو بگیرید من خودم هم منتظرم که رنگ طلایی این مدل هم موجود بشه و بعد با یه چند چیز دیگر از دیجی کالا بگیرم
ممنون ااز دیجی جون وخدمات و محصولاتی که داره و ببخشید که یکم طولانی شد",7,0,4,5,5,5,5,5
,,"اقایون داشام من خودوم ipod air2 128g 4gدارم یعنی کلیش واس ماس واس اینکه چش همه سام سوسکی ها دراد بکوبین +++ تا کلید از جاش دراد بکوبین لایک تا شیش ستون بدن سام سوسکی ها به لرزه دراد",32,2,0,0,0,0,0,0
,,"تبلت خوبی است",2,0,0,0,0,0,0,0
,,"چرا این اینقدر ارزون شده از آیپد مینی هم ارزون تره !!؟",0,0,0,0,0,0,0,0
,,"باسلام خدمت دیجی کالای عزیز میخواستم لطف کنید که تا آخر این هفته یا آخر این ماه رنگ طلایی این مدل رو هم موجود کنید. باتشکر از دیجی جون.",6,0,4,5,5,5,5,5
,,"دوستان اپلی با افتخار اعلام میکنم اهمیت به این سامهنگ و... نزارید.مطمعن باشید اگر کاربران سامهنگ پول اپلو داشتن اصلا به پشت سرشون نگاه نمیکردن.از قدیم گفتن جیب خالی پز عالی.این که میگن نسخه128GBهنگ میکنه کاملا یه شایعه از طرف سامهنگی هاست و برای بد نام کردن خدای تلبت ها یعنی:ipad air 2می باشد.من خودم 64 گیگشو دارم وپدرم Samsung galaxy non 10.اصلااااا قابل مقایسه نیست.این کجا و اون کجا.تازه بابام میگه بیا با هم عوض کنیم هر چقدر خاستی سر میدم.تو فامیل هم وقتی مال منو دیدن اصلا براشون افت داره به تبلت دیگه ای نگاه کنن.تبلت نگو بلا بگو.در خریدش هیچ شکی نداشته باشید. واقعا عالللللللللییییییییههههه.ممنون دیجی جان به خاطر محصولات خوبت و لطفا نظرمو ثبت کن.البته من از دیجی کالا نخریدم",2,0,0,0,0,0,0,0
,,"دوست عزیز ر لاجوردی
همانگونه که در کامنت های پایین توضیح داده شده برنامه office در نسخه موبایل چه اندروید و چه ایپد قابلیت ""تایپ صحیح فارسی"" را ندارد. این مشکل نرم افزار است و ربطی به دستگاه ندارد و شما چه سامسونگ داشته باشید چه سونی چه آیپد همین مشکل را دارید و این وظیفه برنامه نویسان فارسی زبان است که راه حل آسانی برای آن بیابند (راه حل بسیار پیچیده ای برایش وجود دارد). اما اگر فایل های شما به زبان انگلیسی است هیچ مشکلی ندارد.
اتصال به پروژکتور از طریق ezCast و یا BravoCast ممکن است. ولی اگر مهارت قبلی برای استفاده از امکانات آیپد را ندارید یک تبلت ارزانقیمت با سیستم عامل ویندوز برای کنفرانس هایتان بخرید.

دوست عزیز مصطفی فرهنگی
آیپد برای شارژ به آمپر بالاتری نیاز دارد پس سعی نکنید با کامپیوتر آن را شارژ کنید و از شارژر اوریجینال خودش استفاده کنید. البته وقتی صفحه نمایش خاموش است با سرعت خیلی کم به درصد باتری اضافه میشود.

دوستانی که گمان میکنند با جیلبریک می تونند هر بازی رو روی این تبلت تصب کنند
برای رفع یکسری از باگ ها بخصوص باگ قطع و وصل شدن وای فای حتما باید به ورژن 8.3 آپدیت کنید اما متاسفانه جیلبریک کردن کامل این ورژن اصلا موجود نیست. پس مجبورید که یا نسخه پولی بازی ها رو از اپ استور بخرید و یا به نرم افزار هایی چون سیبچه و vshare و تانگ بو متوصل بشوید (یعنی کاری که خودم میکنم)

در پایان رنگ آیپد فقط خاکستری",0,0,0,0,0,0,0,0
,,"ساخته شده برای هر سلیقه ای و هرکاری.",1,0,0,0,0,0,0,0
