,,"این ایپد خیلی خوبه من خودم دارم خیلی هم راضیم پیشنهاد هم می کونم",0,0,0,0,0,0,0,0
,,"سلام. 2 سوال داشتم. برنامه ی office رو میشه در آیپد همونجوری که در لپ تاپ استفاده می شه، نصب و استفاده کرد؟ و اینکه با استفاده از مبدل HDMI، قابلیت نصب به ویدئو پروژکتور برای ارئه ی کنفرانس رو داره؟ راستش من برای ارائه ی کنفرانس به یک دستگاه سبک برای حمل و نقل احتیاج دارم. می خوام ببینم آیپد نیاز من رو برای این منظور رفع می کنه، یا بهتره لپ تاپ کوچک بخرم؟ با تشکر.",1,0,5,5,5,3,5,5
,,"من برای خرید گوشی، آیفون رو به همه ترجیح میدم و خودم هم 2 ساله آیفون دارم و واقعاً راضی ام ولی برای تبلت اپل رو انتخاب خوبی نمیدونم چون کمترین انتظارم از یه تبلت اینه که تمام امکانات آیفونم رو داشته باشه در حالی که آیپد در این مورد خیلی محدودیت داره... همه ی اینا رو وقتی کنار قابلیت های تبلت های حرفه ای سامسونگ مثل نوت 10.1 یا نوت پرو مثل قلم استایلوس و قابلیت اجرای همزمان چندین اپلیکیشن در صفحه نمایش و... میذارم، ترجیح میدم گوشیم ایل باشه و تبلتم سامسونگ... زوج خوبی میشن... مگه نه ؛-)",0,0,0,0,0,0,0,0
,,"سلام به دوستان دیجی کالایی
من نظرات متعددی رو خوندم و نقد و بررسی دیجی کالا رو هم شنیدم من خودم نمیدونم تبلت سامسونگ بگیرم یا آیپد ایر 2 ولی بین این دو خیلی چیز هارو فهمیدم 1- آیپد ایر 2 خیلی باکلاس شیک هست 2-آیپد ایر 2 سخت افزار بیشتری نست به سامسونگ داره 3- با آیپد بازی حرفه ای می تونید انجام دید . ولی با تبلت سامسونگ می تونید دانلود آسونتر داشته باشید وبگردی باهاش خیییییلی خوبه بازی هم راضی کننده است بلوتوث راحت تره و...
اما همه اینها رو میتونی با جلبریک کردن انجام بدی ولی از نظر من تبلت باید سامسونگ باشه و گوشی هم حتما آیفون باشه",0,0,0,0,0,0,0,0
,,"دیجی کالایه عزیز واقعا از پاسخگویی خوبت ممنونم فقط اگه امکان داره برای عاشقایه این تبلت قیمتو کمتر کن یا توی طرح بذارش. ممنون",5,0,3,5,5,5,5,5
,,"دوستانی که مرتب میپرسند
مقدار حافظه هیچ تاثیری تاکید میکنم هیچ تاثیری روی سرعت و داغ شدن و هنگ کردن ندارد. خودم 128 دارم نه داغ و نه هنگ میکند.
همین الان دارم با دوتا اکانت روی تبلت سونی و ایپدم کلش او کلنز بازی میکنم و نکست میزنم. با اینکه وضوح تصویر و روشنایی روی ایپد بیشتر است اما خنک تر است
دوستانی که درباره پارت نامبر نگران هستند. همین مدلی که دیجی کالا تحویل میدهد با سیمکارتها ایران کاملا کار میکند و هیچ نیازی به آنلاک کردن ندارد. هزاران نفر خریده اند و دارند حالش را می برند. همان سیمکارت هدیه را بیاندازید رویش کار میکند مثل بنز. اگر عرض بنده را باور نمیکنید زنگ بزنید پشتیبانی دیجیکالا شرط بکنید.
دوست عزیز سحرپاشایی
کی به شما گفته لاین و اینستاگرام نداره؟ آیپد بدون جیلبریک فقط و فقط و فقط واتزاپ ندارد. والسلام. همه چیز دارد. لاین اینستا اسکایپ تلگرام وایبر توییتر...وغیره. ضمنا چند برنامه هم دارد که مخصوص خود اپل است و نفر مقابل هم باید اپل داشته باشد مانند فیس و مسیج. برای انتقال فایل هم باید یک برنامه کم حجم به نام itools روی کامپیوترتان نصب کنید. نسخه پورتابل هم دارد که میتوانید روی تبلت کپی کنید و اگر از کامپیوتر دوستان خواستید فایل کپی کنید اول روی آن کامپیوتر اجرایش کنید. برنامه و بازی هم درست مثل اندروید باید دانلود کنید. معادل ""گوگل پلی استور"" سایت ""اپل استور"" است. معادل سایت ایرانی ""پلازا"" و ""کافه بازار"" سایت ایرانی ""سیبچه"" است. ضمنا خیلی از تبلت ها تماس ندارند. شما باید هندزفری به آیپد وصل کنید و با نرم افزاری مانند وایبر تماس بگیرید. حتی تمام بانک های ایرانی نسخه اپل نرم افزارشان را به سیبچه داده اند",3,0,0,0,0,0,0,0
,,"به نظر من آیپد بی نقصی است اگر آدم پول داشته باشه بی شک به سراغ همین آیپد میره من تا جایی که میتونم تلاش میکنم تا به دستش بیارم",2,0,4,5,4,5,5,5
,,"حجم زیاد نه تنها سرعت رو کم نمی کنه بلکه درصورت استفاده زیاد روان تر و سریع تر نیز هست.
دوستان توجه کنند که حدود 4-5 گیگ از حافظه به سیستم عامل اختصاص داده میشه و اگه از بازی ها و برنامه های دیتادار استفاده میکنید مراقب باشید حافظه کم نیارید که مجبور به حذف چند تا برنامه تون بشید",1,0,0,0,0,0,0,0
,,"سلام
دوستان به نظر من اصلا این تبلت قابل مقایسه نوت پرو 12اینچی سامسونگ نیست لطفا بی تعصب برید مقایسه کنید
درضمن یه نرم افزار جالبی برای آندروید اومده که ویندوز ایکس پی رو اجرا میکنه و تمام گجت های مختلف رو هم مث کامپیوتر پشتیبانی میکنه یعنی هم آندروید هم لپ تاپ هم تبلت دیگه چی میخایین دو بزرگتر بودنشش هم خیلی فرقی نداره در کل باز نرید اینو بخرین بعد یه نوت پرو دست کسی ببیند حسرت بخورید لااقل قبل خرید یه مقایسه بکنید خودتون حضوری نه تو سایت.
همینکه لپ تاپ میشه خودش کلی مزیته",1,0,0,0,0,0,0,0
,,"سلام ! بعد از ظهر امروز تحویل گرفتم !
به خاطر زیادی خوب بودنش هنگم!
ولی یه سوال :
آیا از طریق کابل یو اس پی خودش نمیشه به کامپیوتر وصل کرد و شارژش کرد!؟؟؟
من این کارو کردم و کنار باطری نوشت: Not sharj!
اگه امکان داره دوستانی که اطلاع دارن پاسخ بدن!
سپاس
از دیجی عزیز هم خیلی ممنونم",0,0,0,0,0,0,0,0
,,"میخواستم بگم شاید i pad air 2 باریک باشه ، سبک باشه ، ولی قدرت سخت افزاریش خیلی بهتر از not 10.1 edition 2014 نیست و هر کاری هم کنید نمیتونه بیشتر از بقیه تبلت های بازار قابلیت داشته باشه و بعد از یه مدتی ازش خسته خواهید شد ولی چیزی که note 10.1 edition 2014 یا surface pro 3 به شما میده چیزی فراتر از تبلت های کسل کننده و مثل هم بازار .
من خودم حدود هجده ماه که note 10.1 edition 2014 دارم و از همون موقع که i pad air تو دست خیلی از دوستام بود ، همشون اول احساس رضایت بیشتری میکردند ولی وقتی قابلیت های s pen Samsung رو میدیدن و اینکه رون تر از هر دستگاه دیگه ای در بازار عمل میکنه آرزوی داشتن یه تبلت مثل این رو داشتن .
حالا اگه میخواین تبلتی داشته باشید که همه حسرتش رو بخورن note 10.1 edition 2014 بهترین گزینه است و اگه هزینه بیشتر براتون مقدوره صد در صد Microsoft Surface Pro 3 بهترین انتخاب بازاره.",1,0,0,0,0,0,0,0
,,"این تبلت از همه ی تبلتا بهتره و میمونه تا وقتی که اپل ای پد بعدی خودشو معرفی کنه هیچ کم و کسری نداره قیمتش هم خیلی مناسبه",1,0,5,5,5,5,5,4
,,"دوستانی که این تبلت رو از دیجی کالا تحویل گرفتن میشه بگن که پارت نامبر دستگاهشون مال چه کشوریه؟
و همچنین بگن که دستگاهشون رو بدون iccid از دیجیکالا تحویل گرفتن یا نه؟
من الان چند وقته که میخوام سفارش بدم ولی از این بابت مطمئن نیستم که دستگاهی رو که دیجیکالا ارسال میکنه پارت نامبر کجاست؟
یا اصلا این موضوع در روند کارکرد دستگاه تاثیری داره یا نه",0,0,0,0,0,0,0,0
,,"دوستانی که اینقدر از شرکت اپل بد میگن انگار میلیون ها انسانی که دارن از محصولات اپل استفاده میکنن رو زیر سوال میبرن و خودشونو عقل کل میدونن!",6,0,0,0,0,0,0,0
,,"لطفا نسخه طلایی رو موجود کنید لطفاااااا i pad air2 128 4g gold",3,0,0,0,0,0,0,0
,,"دیجی کالا لطفا رنگ space gray موجود کن . مرسی",1,0,5,5,5,5,5,5
,,"سلام اونایی که این مدلو دارن جواب بدن
مدل 128 گیگ داغ یا هنگ میکنه",0,0,0,0,0,0,0,0
,,"دیگه تبلت بالاتر از این داریم. قسمت بشه می خرمش",1,0,0,0,0,0,0,0
,,"من ایپد مینی2 رو دارم عالیهههههههه",2,0,5,5,5,5,5,5
,,"اگه فلاش هم داشت عالی ترین تبلت دنیا می شد البته همین الان هم عالی ترین تبلت دنیاست",2,0,0,0,0,0,0,0
,,"بسیار عالی بیست....",3,0,5,5,5,5,5,5
,,"سلام
به نظرتون من 128 گیگ رو بخرم یا 64 گیگ ؟
بازی و نرم افزار زیاد دانلود میکنم بالای دویست تا عکس و بالای بیست تا فیلم و بیش از پنجاه تا آهنگ توش میریزم.
حالا میشه بگید کدوم برام مناسب تره دوستان ؟",0,0,0,0,0,0,0,0
,,"خدایش بد شانس تر از من وجود نداره بعد از این همه تحقیق و دانلود ویدئو هاش و نقد و بررسی همین الان اومدم تو سایت که بخرم عدل رنگ طلایش رو که میخوام تموم شده تو رو خدا زودتر رنگ طلایش رو بیارن که زودی میخوام بخرم و اگه امکانش هست پیشنهاد ویژه هم بزنید براش",5,0,5,5,5,5,5,5
,,"سلام
من میخوام 128 گیگ رو بخرم به نظرتون چنین حجمی در سرعت تبلت تاثیری داره؟
اگر حجم زیاد سرعت رو کم میکنه بگید من 64 گیگ رو بخرم",0,0,0,0,0,0,0,0
,,"من هنوز این تبلت رو نخریدم به نظرتون ممکنه من ازش دلزده بشم.",0,0,4,5,5,5,5,4
,,"امیر خوش نیت اگر واقعا قصد خرید داری همین مدل رو یعنی 128 گیگ رو همین الان بخر، کمترین قیمتی هست که تا الان ازش دیدم، من خودم قبل عید خریدم تازشم تخفیف خورده بود 128 رو. کلا هنگ نمی کنه چه 16 گیگ بگیری چه 64 چه 128 .اما اگه اونکه کمتره رو بگیری بعدا افسوس می خوری که چرا 128 رو نگرفتم",0,0,5,5,5,5,5,5
,,"سلام.دوستان من می خوام تبلت بخرم.انتخاب اولم آیپد بود
اما نظرات رو که خوندم 2دل شدم!تماس و اس ام اس که نداره
یو اس بی هم همین طور....برنامه های اجتماعی لاین...اینستا...و...
هم که نداره...انتقال فایل از/به کامپیوتر هم که گفتید روش خاص خودش رو داره
یا اگه لاین بره با کیفیت کم تر...خب پس من همه این کارا رو با گوشیم باید انجام بدم باز پس تبلت رو
نگاه کنم فقط؟؟؟برنامه هایی مثل بازار و پلی استور چی ؟داره؟
جای این که هی بگید عالیه عالیه یکم راجع به قابلیت ها و ترفندها
یا...صحبت کنید..",0,0,0,0,0,0,0,0
,,"فقط اپل هیچی جای اپل رو نمیتونه بگیره واقعاا بی نظیره اپل",8,0,0,0,0,0,0,0
,,"سلام ایپد ایر2 فارسی هم میشه؟",0,0,0,0,0,0,0,0
,,"باسلام من نوت 10 مدل p601 داشتم وشش ماهه که دارم باهاش کارمیکنم علی رغم اینکه از سامسونگ بدم میاد ولی این تبلت را خیلی دوست دارم متاسفانه خوشی زد زیر دلم واومدم همین ایر2رابا128گیگ طلایی راهمون اوایلش خریدم وتصورم این بود که یک شاهکار بتمام عیاره ،،ولی الحق که نقدوبررسی دیجی کالا ماهرانه است وواقعا در تک تک کلماتش کارشناسی هم فنی وهم اصول بازاریابی نهفته است یعنی هم حقایق رامیگه هم نمیذاره میل به خریدت کم بشه بهرحال درنقدشون گفته بودن..الغرض من وقتی شروع بکارکردم دیدم وای (گوشی خودم وخانمم هر دو 6پلاسه) اولا صفحه خیلی عالیه اما کیفیت عکسها درنوت10 واقعی وعالیتره،، دوما چون صفحه تماس نداره برنامه هایی مثل وات ساپ رانمیشه گرفت من بافوت وفن زیاد تونستم وایبر رانصب کنم ولی وات ساپ نمیشه،،،، بعنوان تبلت بنظرم نوت خیلی کاملتره (ازوقتی دارمش لپ تاپم گوشه نشین وبلااستفاده شده)وبرای جبران ظرفیت کمش شما یک هارداکسترنال 1ترابایت وای فای داربخر بذار کنارش دیگه ....انصافا جابجایی اطلاعات بانوت 10 که otgساپورت میکنه خیلی کارراحت کرده ،،غیراز ادیت فیلم در آیپدایر2 که دربرنامه imovieهست که محشره همه نرم افزارهای عکس وفیلم غیره رامیتونی ازplayبگیری. من بانوت 10 وگوشی 6پلاس انصافا یه تیم کامل برای هر فعالیت رایانه ای بودیم الان ایر2 رادرسایت ال دیجیتال گذاشتم برای فروش ...انتخاب خوبی نداشتم .... به نقدوبررسی های دیجی کالا عمیق توجه کنین چون همه حقایق رامیگن ولی چون خودمون باشوق یاتعصب نقدهارا بررسی میکنیم مثل من اشتباه درمیاد",3,0,0,0,0,0,0,0
,,"سلام دوستان ، یک درخواست داشتم لطفا منو راهنمایی کنید
من بین مدل 128 گیگی با 64 گیگی تردید دارم که کدوم رو بگیرم ، اگه کسی از دوستان این مدل رو خریده می خواستم بدونم که هنگ نمی کنه یا اصطلاحا لک نداره نسبت به 64 گیگی ، چون سرعت و روان بدون تبلت برای کار من خیلی مهمه و نباید گیر داشته باشه.
ممنون میشم راهنمایی کنید",3,0,0,0,0,0,0,0
,,"واقعا عالی میشه گفت بهترین تبلت تا الان همه چیزش عالیه و حرف نداره خیلی دلم میخواد این مدلو بگیرم حیف قیمتش خیلی زیاده انشاالله بتونم مدل 4G 16 یا 64 گیگشو بگیرم",1,0,0,0,0,0,0,0
,,"فوق العاده است. فقط حیف که قیمتش بالاست.",0,0,0,0,0,0,0,0
,,"دوست عزیز هانی دیلمی من دقیقا همین مدل را از همینجا خریدم
هرکسی بگوید هنگ نمی کند دروغ می گوید. اما من میگویم شما باید خیلی زحمت بکشید تا یک آیپد را هنگ کنید!!!
یک دوست دارم که می تواند آیپد را هنگ کند ولی من هروقت سعی کردم آیپد را هنگ کنم آیپد سریع آن برنامه را می بست.
هر وقت موفق شدم آیپد 128 را هنگ کنم همینجا خبرش را به شما می دهم
به نظرم نسل بعدی آیپد باید 256گیگ حافظه داشته باشد الان آیپدم را تا خرخره پر از موزیک ویدیو و گیم کرده ام",4,0,0,0,0,0,0,0
,,"دوستانى که از محدودیت هاى اپل صحبت میکنند قطع به یقین از OS هاى اپل چه Mac Os چه IOS هیچ چیز نمیدونند،اپل اگر دسترسى هاى پیش پا افتاده مثل بلوتوث که نه تنها امنیت پایین داره بلکه تکنولوژى متعلق بیش از یک دهه پیشه،عوضش تکنولوژى فوق تصور دیگه اى که انشالله شاید 10 سال دیگه دست دوستان غیر اپلى برسه(البته بعید میدونم چون پتنت اون به اسم اپله) مثل ایر پلى رو به کاربراش میده که با سرعت مافوق تصور فیلمهاى با حجم بالا که با بلوتوث امکان جابجایى اونها نیست رو میده!
بقیه اش رو هم خودتون بهتر میدونید همیشه میگن محبوبیتت رو از میزان دشمنات بسنج مهم اینه که ما لذتش رو میبریم شما هم خودتون رو خسته نکنید",10,0,0,0,0,0,0,0
,,"مزایا
شارژدهی در حد غیرقابل تصور و غیر قابل مقایسه حتی با روشن بودن مداوم وأی فأی بیشتر از هر تبلتی که تاکنون داشته اید
نور صفحه به شدت بالاتر إز هر تبلتی که تا حالا دیدم حتی در آفتاب ظهر
سرعت به وضوح از آیفون شیش بالاتر
کار کردن با اپل آیدی های ارزانقیمت موجود در إنترنت (و نه گران ها)
رابط کاربری ساده زیبا پرسرعت (ولی کم تنوع برای خانم های أهل تنوع)
خنک خنک خنکککک یخ دیگه از داغ کردن تبلت ها خسته شده بودم
وجود هزاران برنامه مجانی قابل دانلود
معایب
فارسی در حد یه تایپ ساده و نه بیشتر. بیخیال ادیت فایل فارسی
عدم وجود سایت های قوی ایرانی برای دانلود برنامه (فقط یک سایت بسیار ضعیف و با آپدیت دیر به دیر)
سرعت کم دانلود با سیمکارتهای ایرانسل تری جی و نیاز به سیمکارتهای فورجی (أین مشکل باید إز سمت ایرانسل رفع گردد چون با رایتل و همراه اول مشکلی ندارد)",1,0,0,0,0,0,0,0
,,"با سلام
من نزدیک یک ماه 16 گیگ وای فای ایپد ایر 2 رو داشتم خیلی دست پام رو بسته بود نرم افزار های که من نصب کرده بودم در صورتی که انلاین نمی بودم اجرا نمیشد ولی الان 64 4g گرفتم حرف نداره.اصلا داغ نمیکنه کیفیت صفه نمایشش خارق العاده اس ولی باطریش نصبت به مدل قبل یه کم ضعیف تره.من بازی نووا3 رو روش نصب کردم به هیچ وجه کندی در بازی ااحساس نکردم.و بعد از 2 ساعت بازی اصلا داغ نکرد تاچ ایدی در این مدل به اوج هوش مندی خودش رسیده..صدای اسپیکر ها حرف نداره واقعا. به صورتی که من دوس ندارم از هنسفری استفاده کنم
اگر محصولی میخواید که تا 7یا8سال تمام برنامه هارو به روانی اجرا کنه ای پد ایر 2 بگیرید و سمت اندروید نرید(قوی ترین محصول اندرویدی در حال حاضر گلکسی اس 6 هست که از ایفون 6 ضعیف تره در حالی که ایپد ایر 2 70درصد از ایفون 6 قوی تره ولی در حال حااضر این قدرت احساس نمیشود.)
هر کس موافقه لایک کنه :)
عذر میخوام از این که نظرم طولانی شد.
با تشکر از دیجی کالا",16,0,0,0,0,0,0,0
,,"مث ماس این روزا این تبلتو میخرن مخصوصا گولدشو دیجی کالا بهتر نیست بزنی در کل چنتا ازش داری",0,0,0,0,0,0,0,0
,,"سلام دوستان این آیپد واقعا عالیه.اگه قیمت براتون مهم نباشه این بهترین گزینه هست",2,0,0,0,0,0,0,0
,,"سلام دوستان من میخواستم بدونم که 128گیگ هنگ میکنه یا نه",0,0,0,0,0,0,0,0
,,"با سلام
آیپد ها همگی عالی هستن اما من توی نظرات خوندم بعضی ها آیپد روبا تبلت های اندروید مثل galaxy tab s و nexus 9و... مقایسه میکنند این کار فوقوالعاده کار مشکلی هست.کسانی این کار هارو میکنند که حداکثر چند سالی با تکنولوژی کار کرده باشند و با تبلت های مورد خطاب باید کار کرده باشد.من خودم هم آید دارم و هم تب اس.جفتشون بی نظیر هستن.من توی سخت ترین کارها ازشون کندی ندیدم.اپل و سامسونگ همیشه با هم رقابت داشتن و خواهند داشت.جفتشون هم جزو بهترین شرکت هاهستن.پس دیگه اینکه بیایم کیفیت کارای دو شرکت رو بیایم پایین کار اشتباهی.هر کسی هم نظری داره تمام.",5,0,0,0,0,0,0,0
,,"وقتی سیم کارت میخوره پس چرا نوشتین امکان برقراری تماس تلفنی نداره؟",0,0,0,0,0,0,0,0
,,"می تونم تو یک کلمه خلاصه کنمش

بی نظیر",5,0,0,0,0,0,0,0
,,"سلام
در پاسخ به آقای عمادی
اگه نداشتن بلوتوث بخاطر کپی رایته پس برندایی مثل سامسونگ و الجی و اچ تی سی که انقد هم تو آمریکا فروش دارن کپی رایتو رعایت نمیکنن؟یا داشتن کارت حافظه میکرو اس چه ربطی به گرفتن نرم افزار از منابع غیر معتبر داره؟نمیشه توش عکس یا فیلم ریخت؟
قصد جسارت ندارم ولی چون دارم درباره خرید آیپد تحقیق میکنم اینجور نظرا منو متعجب میکنه
با تشکر",4,0,0,0,0,0,0,0
