positivePoints,negativePoints,commentText,like,dislike,"ارزش خرید به نسبت قیمت","طراحی و ظاهر","امکانات و قابلیت ها","سهولت استفاده","کیفیت ساخت",نوآوری
"کيفيت ساخت_سخت افزار_دوربين_باتري ووو........",هيچي,"این تبلت خیلی خوبیه سخت افزار عالی دوربین عالی کیفیت عالی و...من میخوام رنگ speys grey رو بخرم جون میده توش بازی کنی.یک پیشنهاد دیگه هم به شما میدم که رنگ gold رو بخرین خیلی خوشگله با تشکر.",2,2,5,5,5,5,5,5
"کيفيت ساخت
همه چي",,"خیلی عالی است و حتما بخرید",3,0,5,5,5,5,5,5
,,"من این آیپد رو حدود 5 ماه هست که تهیه کردم آیپد به دلیل متفاوت بودن با اندروید یکم کار ها متفاوت تر و پیچیده تر خواهد بود تمامی امکانات و خدماتش مانند کیفیت آن عالی است تنها ممکن است با چند تا مشکل کوچک رو به رو شد که پس از مدتی با کار کردن فراوان رفع خواهد شد تنها می توانم بگویم بهترین کیفیت مال شرکت اپل بوده و دریغ از تمامی مشکلات اندروید و .... می باشد حاضر به پاسخگویی شما عزیزان خواهم بود با اشک از اطلاعات دیجی کالا واقعا گل کاشتن",3,1,3,5,5,5,5,5
"همه ي فاکتورها و امکانات !!","ندارد !!","در پاسخ به بعضی از دوستان عرض می کنم با توجه به این که اکثر ما از ابتدا با ویندوز آشنا شدیم بنابراین در اولین برخوردمان با اپل شاید یک سری محدودیت ها به نظرمون بیاد اما واقعیت این گونه نیست. شما هر کاری رو که بخواهید می تونید با اپل انجام بدید اما از مسیر و راه مشخض خودش. به عبارتی سبک و سیاق اپل با ویندوز و اندروید فرق می کنه. فقط کافیه کمی حوصله و زمان به خرج بدید و باهاش آشنا بشید.بعد خواهید دید که همه ی اون محدودیت هایی که فکر می کردید شاید به نوعی نقطه ی قوت هستند. مثلا شاید در نگاه اول نرم افزار آیتیونز رو دست و پاگیر و مایه ی دردسر بدونید اما من شخصا معتقدم که یک برنامه ی قدرتمند و فوق العاده برای مدیریت آیپد٬ آیفون و آیپاد هست. بزرگترین محدودیتی هم که به نظرتون میرسه شاید عدم امکان دانلود باشه که می تونید نرم افزار های مخصوصش رو از اپل استور بگیرید که نمونه ش رو دوستان در پست های قبلی معرفی کردن.در عوض شما وسیله ای دارید که هم از نظر سخت افزار و هم سیستم عامل و هم اپلیکیشن ها تکامل یافته و کاراست. من با آیفون 4 وارد دنیای اپل شدم و از اون موقع٬ ضمن احترام به همه ی سلایق و تولیدکنندگان٬ استفاده از اپل رو ترجیح میدم و اکثر وسایلی هم که استفاده می کنم از محصولات این کمپانی هستند.
به عنوان نکته ی آخر هم تآکید می کنم که اولا هیچ نیازی به جیلبریک کردن دستگاه نیست و ثانیا روی پارت نامبر هم حساسیتی به خرج ندید چون فقط یک بحث تبلیغاتی هست و تنها تفاوت در نوع دوشاخه ی برق آداپتورشون هست.",5,0,4,5,5,5,5,5
,,"لطفا موجودش کنید
با تشکر",3,0,5,5,4,3,5,4
,,"با سلام...از دوستان عزیز خواهش میکنم هر کسی اطلاعات داره در باره پارت نامبر و جیل بریک ایپد های اپل برام توضیح بده.من میخام ایر 2 بخرم ولی راجع به این موارد چیزی نمیدونم.",2,1,5,5,5,4,5,5
,,"لطفا رنگ خاکستری رو بیارید",2,1,4,4,5,4,5,4
,,"موجودش کنین",5,0,5,5,5,5,5,5
,,"سرکار خانم محدثه نوری
1- آیپد دارای یک صفحه کلید کاملا فارسی است. حرف گ پشت ک است و حرف پ پشت ب و حرف ژ پشت ز و حرف چ پشت ج
2- منوهای آیپد همگی به زبان انگلیسی هستند.
3- همانطور که در اندروید می توانید صفحه کلیدهای جانبی نصب کنید در آیپد هم می توانید.
4- بله سایت سیبچه مثل کافه بازار است که می توانید از آن برنامه دانلود کنید.
5- برنامه های مشهور مجانی هستند اما برنامه های پولی هم وجود دارد که زیاد به کار ما ایرانی ها نمی آیند.
6- بله درست است برای انتقال فایل باید از نرم افزار زاپیا یا شیرایت استفاده کنید چون با بلوتوث امکان ندارد.
7- برای اتصال به لپ تاپ و جابجا کردن فایل ها سه نرم افزار مشهور وجود دارد که در نظرات قبلی ام توضیح داده ام حتما مطالعه بفرمایید.
8- برای دانلود (فایل یا موسیقی) از سایت های ایرانی برنامه idownloader را باید نصب کنید که در نظرات قبلی روش کار با آن را توضیح داده ام.
9- کاربران ایرانی تقریبا هر سه ماه یکبار به مدت دو تا سه روز نمی توانند از اپ استور دانلود کنند. یعنی در هر فصل سه روز. یعنی تقریبا سالی ده روز. در این حالت خطای 1009 می دهد که یعنی باید دو سه روز صبر کنید.
10- نرم افزار itunes اجازه دسترسی به فولدر عکس ها و موزیک و نماهنگ و همچنین فولدرهایی که توسط برنامه هایی مانند اکسل یا آی دانلودر ساخته شده اند رو می دهد ولی اجازه دسترسی به بقیه حافظه را نمی دهدو اصلا شبیه اندروید نیست. روش کار با آن را در کامنت های قبلی داده ام.
11- برنامه ifile با قیمت دو دلار اجازه دسترسی به خیلی از فولدرها را به شما می دهد.
12- از آیپد می شود به عنوان فلش مموری استفاده کرد و روی آن با کامپیوتر فایل ریخت اما این فایل ها را نمی شود با خود آیپد باز کرد. تنها فایل هایی را می شود باز کرد که با همان سه برنامه مشهور روی آیپد بریزی.
13- اگر کامنت هایی را که قبلا دوستان نوشته اند بخوانی می بینی که قبلا به تمام سوال های شما پاسخ داده شده است.",14,0,0,0,0,0,0,0
,,"با سلام
میخواستم بپرسم آیا این تبلت ها با توجه به محدودیت هایی که در ایران هست jailbreak شده است یا خیر",0,0,0,0,0,0,0,0
,,"ضمنا برای بررسی نرم افزار های موجود در سایت اپل (که فکر کنم حدود 2 میلیون باشه) می تونید با لپ تاپ به سایت appstore مراجعه کنید و در بالای صفحه سمت راست روی chart کلیک کنید توی نیمه ی بالایی صفحه ی باز شده به صورت افقی لیست برنامه ها به شکل free apps ، paid apps ، books و ... رو ببینید
توقسمت free apps به عنوان مثال لیستی از نرم افزار های پر طرفدار میاد که 100 تا برنامه س
زیر تصویر و icon مربوط به هر برنامه اسم برنامه وزیرش دسته بندی مربوط به اون برنامه (مثلا game ، social networking، music و ... ) رو می تونید ببینید
اگر روی اون دسته بندی ( مثلا games یا ... ) کلیک کنین کل برنامه های اون دسته به ترتیب حروف الفبا میاد
البته کار کردن با appstore با خود ipad راحت تره",1,0,3,3,3,3,3,4
,,"خدمت خانم نوری عرض کنم که:
1. از سیم کارت نانو پشتیبانی می کنه ولی فقط برای اتصال به اینترنت ، قابلت مکالمه نداره ... برای همین سیم کارت تون 3G یا LTE باشه بهترع
2. به صورت پیش فرض تایپ فارسی نداره ... ولی یه سری نرم افزار از app store می تونین برای تایپ فارسی دانلود کنین
3. برای اتصال به لپ تاپ نرم افزار ITunes باید رو لپ تاپ تون داشته باشین تا اطلاعات بین کامپیوتر و iPad رد وبدل بشه. ضمنا باید Apple ID هم داشته باشین که هم می تونین خودتون بسازین ، هم با پرداخت 10 تا 15 تومن موبایل فروشی ها واستون می سازن
4. با یه سری نرم افزار که معروف ترین شون Zapya ست می تونین از طریق WiFi اطلاعات رو بین iPad و اندروید رد و بدل کنین
5. با داشتن apple ID به راحتی می تونین نرم افزار های free یا همون رایگان رو دانلود کنین ... برای نرم افزار های پولی باید Gift Card داشته باشین که تو اینترنت یه سری از سایت ها Gift Card های 50 و 100 دلاری اپل رو می فروشن
6. امکان دسترسی به فولدر ها رو راستش نمی دونم",2,0,3,3,3,3,3,4
,,"سلام به همه دست اندرکاران دیجی
دوستان من قصد خرید ایپد ایر2 رو دارم و میخوام از دیجی بخرم.اما بخاطر محدودیت هاش یکم دو دل هستم..
اول اینکه ایا ایپد از سیم کارتهای نانوسیم همراه اول یا ایرانسل (شبکه 2g) پشتیبانی میکنه یا نه؟
2. اینکه ایپد ایر 2 به اندروید بلوتوث نمیکنه.میشه از طریق دیگه ای اطلاعات رد و بدل کرد؟مثلا از طریق شرایت و ... از وای فای؟؟؟
3. اینکه ایپد ایر 2 امکان دسترسی به فولدرها رو به ما میده یا نه؟ مثلا پوشه تصاویر یا ...
4. ایا میشه ایپد رو به لپ تاپ وصل کرد با کابل؟ که بتونیم اطلاعات بریزیم در ایپد یا اینکه بعضی اطلاعاتش انتقال بدیم به لپ تاپ ...
و ایا هنگام وصل کردنش برای بازکردنش به نرم افزار خاصی نیاز داره؟ من خودم هر زمان گوشیم با کابل به سیستمم وصل میکنم ممثل یو اس بی میخونتش سیستم
5. از نظر دانلود برنامه ها و نصب نرم افزار در ایران ایپد ایر 2 محدودیتی داره یا نه؟
ممنون از سایت خییییییلی خوب دیجی
ممنون میشم زووود جوابمو بدید.
کسانیکه ایپدایر2 دارن خواهشا سریع جواب بدن.میخوام ایپد ایر 2 نقره ای بخرم.",1,0,0,0,0,0,0,0
,,"سلام دوباره
دوستان چندتا محدودیت دیگه خوندم از اپل از جمله اینکه نمیشه با اپل فارسی تایپ کرد،گوشی فارسی نمیشه،سرعت دانلود از اپ استور اپل پایینه،بلوتوث نداره،نمیتونی مثل گوشیای دیگه کابل بزنی به کامپیوتر و فایل رد و بدل کنی و اینجور چیزا یعنی اینا درسته؟
واقعا نمیشه با ایپد ایر2 فارسی تایپ کرد؟
منوی فارسی نداره؟؟!!!
یعنی اگربخواهیم تنظیماتش تغییر بدیم یا ... همش انگلیسیه؟
و اینکه میگن برای هر برنامه ای که بخوای دانلود کنی باید پول بدی درسته؟
من همشفکر میکنم وقتی از دیجی ایپد بخرم همش باید برای همه چیز پول بدم.
برای ایپد ایر 2 برنامه ای مثل بازار هست که بشه ازش نرم افزار دانلود کرد؟
لطفااا سرییع جواب بدین
دیجی نقره ایش موجود نگهدار لطفا ایپد ایر 2 نسخه 128 گیگ میخوام بخرم رنگ نقره ای
البته اول باید جواب نظراتم بگیرم بعد..",1,1,0,0,0,0,0,0
,,"سلام.بعد از مدتها انتظار بالاخره رنگ نقره ایش موجود شد و من از همین دیجی کالا گرفتمش.اولا تشکر می کنم از مسوولین سایت دیجی که به موقع و سریع اقدام به موجود کردن رنگهای متفاوتش می کنن.ثانیا باید عرض کنم که صفحه نمایشش واقعا عالیه.من قبلش note 2014 سامسونگ داشتم صفحه اش از این یکم درخشانتر بود ولی رنگها و تصاویر این ایپد زنده تر و اقعی ترن.باتریشم موقعی که گرفتم 69% در صد بود که هنوز به شارژ نزدمش.پارت نامبر استرالیاست و برای شارژش باید یک تبدیل جدا هم تهیه بشه.تنها عیبی که منو یکم دلخور کرده نداشتن فلش برای دوربینشه. عزیزان اگه سوال یا نکته دیگه ای بود من در خدمت هستم.ارادتمند.",4,0,5,5,5,5,5,5
,,"دیجی جان لطفا silver رو موجود کن",0,0,0,0,0,0,0,0
,,"با سلام
لطفا دوستانی که این iPad رو دارن بگن که کیفیت صفحه ی نمایشش در چه حدیه؟ مثلا از 10 بهش یه نمره ای بدن
و اگه با تبلت های سری S سامسونگ که AMOLED هست مقایسه ش کنن بگن که چقدر تفاوت دارن؟
مرسی",1,0,3,3,3,3,3,4
,,"لطفا شگفت انگیز بزنید من دو تا میخوام بخرم",4,0,0,0,0,0,0,0
,,"ای بابا همش ناموجوده که...؟!",1,0,0,0,0,0,0,0
,,"چرا خاکستری رو ندارید. رنگ پر طرفداریه. لطفا موجود کنید.",2,0,0,0,0,0,0,0
,,"اگه میشه گلدشو موجود کنید لطفا! من میخوام بخرم",2,0,5,5,4,3,5,4
,,"سلام. بچه های دیجی تصمیم ندارن رنگ نقره ای این مدلو موجود کنن؟ من از کی منتظرم.بابا کارم لنگ مونده نیاز شدید به تبلت با حجم رم بالا دارم. از مدل گری و گلدش خیلی خوشم نمیاد نقره ای شو می خوام که تو جلسات می برم سنگین باشه.خواهشا هر چه زودتر رنگ نقره ای این مدلم موجود کنین.",2,0,5,5,5,5,5,5
,,"اخه معایب ایپد رو زدید نبود حافظه خارجی",2,0,0,0,0,0,0,0
,,"لطفا پارت نامبری که موجود دارید و اعلام کنید",1,0,0,0,0,0,0,0
,,"با سلام این مدل ایپد ایر 2 که 128 سئم کارت خور است ایا پارت نامبر ان اخرش LL/A است و چه رنگی فعلا موجود است ؟ با تشکر از دیجی کالا",1,0,0,0,0,0,0,0
,,"در جواب خانم ساده باید عرض کنم که تبلتها کلا فاقد هندزفری هستن و هندز فری را باید جداگانه تهیه کنی.برای اپل هم همینطور.از برو بچه های دیجی هم خواهش می کنم که رنگ سیلورشو هم هر چه زودتر موجود کنین خواهشا که من خیلی وقته منتظرشم.مرسی ارادت.",1,0,5,5,5,5,5,5
,,"سلام.دیجی جون لطفا نقره ای اش را هم موجود کن.از کی منتظریم بابااا",1,0,5,5,5,5,5,5
,,"آقای سعید موسوی
شما واقعا فکر می کنی اصلی ترین قابلیت یک تبلت ده اینچی اینه که بگیری در گوشت باهاش مکالمه کنی؟ لپتاپ ها قرار است شما را از حمل pcها بی نیاز کنند و تبلت ها شما رو از حمل لپتاپ ها.
من ترجیح می دم سیم کارتی رو که باهاش مکالمه می کنم و شماره اش رو همه دوستا و فامیل هام دارند روی یک گوشی کوچولو باشه که راحت از جیبم دربیارم!!!! نه توی یک آیپد 10اینچی.",1,0,0,0,0,0,0,0
,,"من این تبلت رو سه شنبه 7مهر سفرش دادم و پنج شنبه 9 مهر دریافت کردم(شهرستان)هنوز برای نظر دادن راجع به کارایی ش که خیلی زوده ولی سرعت سفارش تا تحویل خیلی عالی بود از این بابت ممنون دیجی کالا هستم...ویه سوال از دوستان مطلع داشتم که روی این مدل تبلت هندزفری همراهش نیس؟البته برای موزیک وفیلم..میدونم که قابلیت مکالمه نداره",0,0,0,0,0,0,0,0
,,"اصلی ترین قابلیت یه تبلت از نظر شما مکالمه است ؟!!!!
من tab s داشتم . الان هم ipad air 2 .
بدون اغراق میتونم بگم اصلا قابل قیاس نیستن.
Apple خیلی سر تره. تنها ایرادش نداشتن قلم هست",3,0,0,0,0,0,0,0
,,"دیجی جون من نمی خوام پیشنهادویژه اش کنی فقط می خوام تاسال دیگرموجودنگهش داری.
فقـــــــــــط همـــــــــین،همــــــــــــــین.",3,0,5,5,5,5,5,5
,,"وقتی اصلی ترین قابلیت یعنی قابلیت مکالمه رونداره به چه دردی میخوره",1,4,0,0,0,0,0,0
,,"بابا رنگ طلایی اش رو موجود کنید مردیم از بس صبر کردیم",0,0,0,0,0,0,0,0
,,"رنگ مشکی رو موجود کنید لطفا",0,0,0,0,0,0,0,0
,,"لطفا موجودش کنید",0,0,0,0,0,0,0,0
,,"لطفا اگه میش موجودش کنید با پیشنهاد شگفت انگیز",3,0,0,0,0,0,0,0
,,"دیجی کالا چند ماه دیگه امکان داره ایپد پرو رو بیاری ؟ وقتی ایپد پرو رو اوردی قلم و کیبوردشم میاری؟",1,0,5,5,5,5,5,5
,,"دوست عزیز مهمان
تولدت مبارک
صفحه نمایش سامسونگ حالتی دارد که همه رنگ ها را کمی قرمز نشان می دهد. گویی یک شیشه قرمز رنگ روی آن قرار دارد. اما در ایپد رنگ ها کاملا طبیعی هستند.",0,0,0,0,0,0,0,0
,,"چرا داره دوباره هی گرونتر میشه؟",4,0,0,0,0,0,0,0
,,"واقعا تبلت عالیه
بابام قراره برای تولدم بگیره
میخواستم بدونم کیفیت صفحه نمایشش خوبه و به پای سامسونگ میرسه
ممنون میشم اگه پاسخ بدین",1,0,0,0,0,0,0,0
,,"من دارمش بی نظیره فقط تو انتخاب حافظه دقت کنید چون رم نمی خوره",1,0,5,5,5,5,5,5
,,"درود
به شگفت انگیز 64 ش که نرسیدم 128 رو شگفت انگیز کنید لطفا, ممنون.",6,0,0,0,0,0,0,0
,,"سلام. ببخشید لطفا راهنماییم کنید من الان یه نوت2 دارم ولی میخوام یه ایپد یا یه ایفون6 بخرم خیلی مرددم لطفا کمکم کنید",0,0,0,0,0,0,0,0
,,"آقا چرا این تبلت های اپل رو شگفت انگیز نمیکنید خرید کنیم؟؟؟",2,1,0,0,0,0,0,0
,,"iPad air 2 4g 128g 13اینچ کی میاد",1,0,0,0,0,0,0,0
,,"آقای علیرضا شایسته ممنونم از راهنماییتون",1,0,0,0,0,0,0,0
,,"دوستان این تبلت چیز محشریه، اما نقطه ضعف تمام تبلت های اپل لبه هاشه. لبه های تبلت در اثر ضربه به راحتی میپرن که به همین دلیل بهتون پیشنهاد میدم که اگر بیرون از خونه میبرینش قاب بزارین.
البته بقیه جاهاش خیلی قوین، مثلا یه بار از سمت صفحه نمایش از یه متری افتاد رو سرامیک آخ هم نگفت، ولی همونطور که گفتم لبه هاش یکم آسیب پذیر هستند. برای قاب هم یا اصل خود اپل رو بگیرید یا اگر مارک های دیگه میگیرید مطمین باشید که هم سبکه هم محکم. چون من یه دوستی داشتم که بار اول یه قاب belk گرفت(قاب های belk مزخرفن) که بعد سه ماه خورد شد کل گوشه هاش. بار دوم یه قاب ضد ضربه-ضد آب- ضد گرد و غبار- ضد برق و خلاصه ضد همه چیز گرفت که یه مشکل داشت: قاب چهار برابر خود آیپد وزن داشت که دست آدم خرد میشد وقتی میگرفتش. خلاصه یه قاب خوب بگیرید(قاب ها کلا گرونن). محافظ صفحه هم خوبه. خیلی توی محافظ صفحه پول ندید خیلیاشون پول مارک میگیرن، و در ضمن شفاف بگیرید چون خودش تا حدودی کدره نیازی به محافظ صفحه کدر نیست.",1,0,5,5,5,5,5,5
,,"خیالتون راحت کنم من خودم دارم استفاده میکنم بهترین بهترینهاست",1,0,0,0,0,0,0,0
,,"من تب اس واین را دارم. تب اس ارزونترو سبکتر و با قابلیت مکالمه.تب اس بسیار بهتره. من یک ماه پیش با همینقیمت از دی جی خریدم. در کل تب اس را برای دوستان مقیم ایران توصیه میکنم",1,0,0,0,0,0,0,0
,,"دوست عزیز
مطمئنا کسانی که تاکنون تنها از اندروید استفاده کرده اند وقتی با یک سیستم عامل جدید مواجه میشوند نیاز به تمرین و راهنمایی دارند. اگر قرار بود همه چیز دو سیستم عامل شبیه هم باشد چرا افرادی مثل من باید به سمت اپل میرفتند؟!؟!
اما همه محصولات اپل را میتوان به لپتاپ های ویندوزی از طریق کابل usb وصل کرد. شما هرگاه یک دستگاه جدید را به لپتاپ وصل میکنید نیاز به درایور مخصوص آن دارید. برای اتصال محصولات اپل برنامه های زیادی وجود دارد
برنامه استاندارد iTunes است. ولی برنامه هایی همچون iTools و برنامه فوق العاده mobile go نیز به شما کمک میکنند. برنامه تانگبو را نیز میتوانید نصب کنید.
برنامه iTunes دارای قابلیت های زیادی است که متاسفانه بسیاری از افرادی که اپل دارند با همه آن ها آشنا نیستند. مثلا iTunes میتواند فایل هایی را که در درون یک اپلیکیشن ذخیره شده اند به روی لپتاپ کپی کند.",0,0,0,0,0,0,0,0
,,"مژده به دوستانی که از آیپد برای کارهای اداری و تحصیلی استفاده میکنن
نرم افزارهای آشنای Microsoft word و excel قابلیت انتقال فایل از طریق outlook رو اضافه کرده اند که در آخرین ورژن قابل دانلود است
قبلا برای کار کردن مشترک روی یک فایل بر روی آیپد و لپتاپ به صورت مشترک تنها میشد از نرم افزار Polaris office و ساخت درایو مجازی بر روی لپ تاپ استفاده کرد",0,0,0,0,0,0,0,0
,,"دوستان عزیزی که سامسونگ رو به این تبلت ترجیح میدین، خوب برین سامسونگ بخرین، کسی مجبورتون نکرده که آیپد بخرید!...
من از خریدش خیلی راضیم و جیل برک هم کردم و دارم حالشو میبرم",2,0,5,5,5,5,5,5
