positivePoints,negativePoints,commentText,like,dislike,"ارزش خرید به نسبت قیمت","طراحی و ظاهر","امکانات و قابلیت ها","سهولت استفاده","کیفیت ساخت",نوآوری
"همه چيزش",ندارد,"من چهار ماهه از دیجی خریدم قبلا tab 2 سامسونگ داشتم اپل واقعا همه چیزش سره از سامسونگ
شک نکنید تو خریدش",14,5,4,5,5,5,5,5
[],[],"لطفا رنگ طلایی این محصول رو موجود کنید.",9,2,3,3,3,3,3,3
,,"لطفا رنگ گلد این تبلت رو موجود کنید.",9,1,3,3,3,3,3,3
"همه چيزش عاليه","حافظش کمه همين همه چيزش عاليه","همه چیزش عالیه بجز حافظه کمش البته اختلاف قیمت 16 و 32 یا 64 محصولات اپل خیلیه",7,2,5,5,5,5,5,5
,,"لطفا رنگ خاکستری هم موجود کنید",3,2,2,4,3,3,5,2
,,"توروخدا زودتر موجود کنید هر سه رنگش رو. خریدار زیاد داره! همین امروز که من می خواستم سفارش بدم ناموجود شد!!!",4,2,0,0,0,0,0,0
"همه چيز عاليه!",,"به نظر من همه چیز این تبلت عالیه! اما حافظه 16 گیگابایت برای همچین دیوایس قدرتمندی ظالمانست! به دوستانی که قصد خرید این تبلت دارن بیشنهاد میکنم 64 گیگابایت را خریداری کنید ...من خودم 16 دارم و راضی نیستم",6,2,4,5,3,4,4,4
,,"سلام لطفا طلاییش رو موجود کنید چند سریه فقط نقره ای و خاکستریش رو دارید من منتظرم طلاییش رو بیارید .",6,1,3,3,3,3,3,3
,,"دیجی جان لطفن هرچه زودتر قسمت مقایسه دوربین آیپد ها رو هم راه بنداز...
با تشکررررر",2,1,4,5,5,3,5,5
,,"آقای مصطفی همتیان
طبق تبلیغاتی که صورت گرفته صفحه آیپد دارای مقاومت بسیار بالایی است. گرچه من ترجیح می دهم که برای تبلتی با این قیمت حتما یک محافظ بخرم.",4,1,0,0,0,0,0,0
,,"یه سوال از آیپد دارها:
آیپد بخصوص این مدل نیاز به محافظ صفحه نمایش داره؟؟ واجبه؟",3,1,0,0,0,0,0,0
,,"دیجی کالا دوباره طلایی اش رو موجود کن اومدم بخرم تموم کردی این چه وضعشه??? خاکستری و نقره ای اصلا طرفدار نداره بیار دوبار ه طلایی",3,2,0,0,0,0,0,0
,,"آقای علی حقی رحیمی
مشکلی که استفاده از آیپد در ایران دارد اینست که تقریبا هیچکسی در اطراف شما نیست که تجربه کار کردن با اپل را داشته باشد. حداکثر یک آیفون خریده که با آن زنگ می زند. من وقتی آیپد خریدم خودم مجبور شدم توی سایت ها مختلف دنبال آموزش بگردم.
مثلا در گوگل سرچ می کردم ""ترفندهای آیفون"" یا به انگلیسی iphone tricks
همچنین یاد گرفتم که برنامه های زیادی برای اتصال آیپد به لپتاپ وجود دارد: itunes و mobilego و itools و tunesgo و tongbu که هرکدام قابلیت های خاصی دارند. جالب است که خود برنامه itunes که نرم افزار رسمی شرکت اپل است دارای ده ها قابلیت است که بسیاری از افرادی که دیدم با اپل کار می کردند متوجه آن نشده بودند.
ایپد دارای این محدودیت هاست:
1- شما نمی توانید از روی سی دی برنامه نصب کنید بلکه حتما باید هر برنامه ای را خودتان دانلود و نصب کنید. این برنامه به اپل آیدی شما وصل می شود می توانید از آن روی لپتاپ بکآپ بگیرید و بعد دوباره نصب کنید اما این برنامه را روی آیپد کسی دیگر نمی توانید نصب کنید.
2- با آیپد همیشه محتاج اینترنت هستید. بدون اینترنت لذت بردن از آیپد غیرممکن است. دست بالا اینکه چند فایل ویدیویی تماشا کنید و یا گیم های آفلاین بازی کنید.
3- هر برنامه ای (مثلا اکسل) برای خودش یک فولدر مجزا در آیپد درست می کند که فقط از طریق همان برنامه به آن دسترسی دارید. اگر بخواید آن فایل ها را به لپتاپ خود منتقل کنید باید با نرم افزار itunes و از قسمت شیرینگ به درون فولدر آن برنامه بروید.
4- هربار که آپدیت جدیدی برای سیستم عامل ایپد می آید مدتی طول می کشد تا برنامه نویسان فارسی نرم افزارهای خود را با آن هماهنگ کنند. مثلا گرچه مدتی است که سیستم عامل 9 برای آیپد آمده است اما بیشتر نرم افزارهای فارسی هنوز با سیستم عامل 8 کار می کنند. پس بهتر است که برای آپدیت کردن سیستم عامل آیپدی که می خرید عجله نکنید. (البته سیستم عامل 9 اصولا روی آیپد فرق زیادی با سیستم عامل 8 ندارد که بخواهید حسرت آن را بخورید!!!!)
5- OTG نداره و هربار که می خواهید یک فایل را از فلش مموری به آن منتقل کنید حتما نیاز به یک لپتاپ به عنوان واسطه دارید.
6- صفحه کلید فارسی ندارد و باید یک صفحه کلید فارسی از app store برای آن دانلود و نصب کنید.
در پایان باید بدانید آنچه من را ترغیب کرده است که سختی های انتقال فایل به آیپد را به جان بخرم اینست که اولا کیفیت ساخت و تصویر و باتری و سی پی یو آن بسیار بالاست دوما همیشه به اینترنت سیمکارت و وایفای دسترسی دارم و از همه مهمتر بیشتر همکارهام رو ترغیب کردم که آپل بخرند در نتیجه رسما مشکلی از لحاظ انتقال فایل نداریم!!!",10,1,0,0,0,0,0,0
,,"سلام دوستان من قصد خرید آیپد ایر2 رو دارم خیلی نگرانم چون بعد از مدت ها کار با اندروید می خوام وارد یک دنیای دیگه بشم از هرکی می پرسم میگه محدودیت داره یا مثلا پدره آدم در میاد تا دیتا منتقل بکنه توش(این برام یکم مهمه) من کارم با تبلت باز کردن فایل های تصویری و کتاب های الکترونیک هستش اصلا ساده تر بگم من یک تبلت دانشجویی لازم دارم بنظرتون آیپد نیاز های منو برآورده می کنه ؟؟؟
سوال دیگمم اینه که آیپد رو اگه به لپ تاپ وصل کنم می تونم تبادل اطلاعات داشته باشم؟؟؟حتما باید روی لپ تاپ نرم افزار خاصی بریزم؟؟؟
می بخشید اگه طولانی شد",2,2,5,5,5,5,5,5
,,"دوستان سلام
من قصد خرید یک تبلت در درجۀ اول برای استفاده از اینترنت و بعد از آن کتاب خواندن را دارم، دوربین هم تا اندازه ای برایم مهم است. به نظر شما بین آیپد ایر 2 و سامسونگ گلکسی تب s 2 کدام یک برای من مناسب تر است؟
در ضمن بنده به شدت نیاز به دریافت و انتقال اطلاعات دارم. آیا این که آیپد در زمینه انتقال اطلاعات خیلی محدودیت دارد، درست است؟
لطف بزرگی می کنید اگر راهنمایی بفرمایید.
متشکرم.",2,1,0,0,0,0,0,0
,,"اصلا تبلت خوبی نیست من که اصلا راضی نیستم بلاخره دارم قانع میشم که به سامسونگ مهاجرت کنم این تبلت واقعا مایوسم کرد",2,6,0,0,0,0,0,0
,,"یه سوال خیلی خیلیی مهم دارم اونم اینه که مدل وایفای بگیرم یا 4جی ؟؟؟
کدوم به دردم میخوره و میتونه برام بهتر باشه
یعنی این سیم خوردن و جی پی اس خیلی کاربردیه؟",0,1,0,0,0,0,0,0
,,"لطفا اگه میشه موجود کنیدش ممنون میشم",1,0,0,0,0,0,0,0
,,"سلام دوستان اگر ممکنه راهنمایی کنید!
من یه تبلت واسه نت برداری و نقاشی و خوندن فایلای پی دی اف میخوام، ازونجا که تعریف سرفیس و همه میکنن اول نظرم رو اون بود اما خودم اولترابوک لنوو core i7 دارم و دیدم شاید سرفیس خیلی به کارم نیاد چون استفادمم سنگین نیست، حالا بنظرتون ایر2 با یه قلم ادونیت بگیرم خوب هست واسه کارم؟ اگه گزینه دیگه ایم هست پیشهاد بدین (از سامسونگ خیلی خوشم نمیاد البته تجربه سری نتشو نداشتم). مرسییی",0,0,0,0,0,0,0,0
,,"خواهشا موجود کنید ... بدجور نیاز دارم... خربد از بازار هم به دلم‌نمیشینه... این مدل یا 64 رو",0,0,0,0,0,0,0,0
,,"دیجی لطفا رنگ طلایی رو موجود کن",4,0,0,0,0,0,0,0
,,"سلام خیلی عالیه و خوشگل تازه خریدم بهتر از 6و 6plus است هر کی موافقه بزن لایک رو.",8,2,5,5,5,5,5,5
,,"سلام
از دیجی کالا عزیز خواهش میکنم رنگ طلاییش رو موجود کنه.بذارین تو پیشنهاد شگفت انگیز .مرسی",4,1,0,0,0,0,0,0
,,"با سلام ، آقای دهقان شک نکن ایر 2حالا اگه بازی زیاد میکنی 64 گیگشو بخر وگرنه از لحاظ قدرت بی رقیبه ، دوربینش هم در روز عالیه امّا در شب به دلیل نبود فلش عکس ها نویز داره .با تشکر",1,0,5,5,5,5,5,5
,,"سلام می خوام یه تبلته درست و حسابی بخرم ولی بین دو انتخاب موندم:
گلکسی تب اس 10 اینچ
و ایپد ایر دو
برام خیلی مهمه که همه ی بازی هارو خوب اجرا کنه
سرعت به مرور زمان کم نشه(اخه من اولایی که تب 3 اومده بود گرفتم روز به روز سرعتش کمتر شد )
دوربینشم نسبتا خوب باشه
لطفا سریع جواب بدید چون می خوام بخرم",0,0,5,5,5,5,5,5
,,"دوستان ios 9 هم پاییز امسال واسه این تبلت میاد که قابلیت multi tasking هم اضافه شده همچین مصرف باتری بهینه شده ،امینی سرعت بهتر شده،و از همه مهمتر فضای که سیستم عامل ios 9 اشغال میکنه کمتر از نصف فضای ios 8 هستش.... برید حالشو ببرید",1,0,5,5,5,5,5,5
,,"من عاشق این تبلت فوق العاده هستم ولی بودجه خرید اون رو ندارم",5,0,5,5,5,4,5,5
,,"سلام اقای omid babizan
این تبلت قابلیت مکالمه و فرستادن پیامک نداره ب هیچ وجه
ب عبارتی سیمکارت خور بودنش تنها قابلیت اتصال ب اینترنتو فراهم میکنه و با برنامه های اجنماعی تنها میشه بادیگران ارتباط برقرارکرد درحالی ک این محدودیت درهیچ یک از تبلت های ساخت کمپانی های دیگر ندارد
تبلت بنده پارت نامبره کاناداست و از دیجیکالا تهیه نکردم وبایدعرض کنم فرقی در کیفیت نیست",3,1,0,2,0,1,4,0
,,"در پاسخ به آقا امید،یعنی این که شما نمیتونید با استفاده از سیمکارت تماس برقرار کنید و قابلیت شماره گیری نداره (البته با استفاده از نرم افزار های شبکه های اجتماعی مشکلی نداره).2.این تبلت طراحی وساخت آمریکاست و مونتاژ چین است.",2,0,5,5,5,5,5,5
,,"سلام دوستان یه سوالی دارم ممنون می شم اگه یک نفر جواب منو بده خدا خیرش بده 1می خواستم بدونم تبلت قابلت تماس نداره یعنی چی (لطف کنید جواب این سوال رو حنما بدید)2 این تبلت مال کجاست. مرسی اگه جواب منو بدید",0,0,0,0,0,0,0,0
,,"حاکستری موجود کنید من فوری میخرم",0,0,0,0,0,0,0,0
,,"لطفا خاکستری موجود کنین",0,0,0,0,0,0,0,0
,,"در پاسخ به دوستی که پرسیدن این تبلت مشکلی نداره؟. خیر دوست عزیز من حدوداً دو ماهه این تبلت رو دارم واقعاً فوق العادست،از لحاظ سخت افزاری عالی من خودم بازیهای gta san andrias,real racing 3,asphalt 8 رو روش امتحان کردم به خوبی اجرا کرد ،فقط به یه نکته ای که باید توجه بکنی اینه که یک کامپیوتر یا لب تاب یا...هرچیزی که بشه iTunes رو روش نصب کرد ،داشته باشی،باتشکّر از دیجی کالای عزیز.",2,0,5,5,5,5,5,5
,,"این تبلت کلا مشکی نداره؟",1,0,0,0,0,0,0,0
,,"در پاسخ به دوست عزیزی که مگه بیش تر از یک ماهه که iOS 8.4 اومده؟؟!!که شما میگی اپل الان یکساله داره میگه این مشکل رو حل میکنه،لطفاً وقتی اطلاعات ندارید مردم راگمراه نکنید(همچنین این تبلت در اواخر مهر ماه پارسال معرفی شده چطوری شما یکساله که این تبلت رو داری؟؟!!)",5,0,5,5,5,5,5,5
,,"سلام
پارت نامبر این تبلت واسه آمریکاست-LL/A",2,0,0,0,0,0,0,0
,,"این تبلت معرکست من چند ماهی میشه خریدم. واقعا عالیه من کم آوردم هر کار میکنم اصلا هنگ نکی کنه.حتما بخریدش از سامسونگ و سونی و اینا واقعا بهتره بی نظیر.",3,0,5,5,5,5,5,5
,,"به درد نمیخوره من یک ساله دارم ولی فروختمش وقتی به ios 8.4 به روزرسانی کردم تبلت دچار خرابی هایی شد و اصلا درست نشد پشتش زود داغ میکرد زود باتری تمام میکرد خود شرکت اپل گفته بود این مشکل را حل میکنه ولی دروغ میگه الان یک ساله که هنوز درست نشده منم فروختمش",2,2,5,5,5,5,5,5
,,"دوردبرشما:
آیا این محصول هنزفری داخل پگ دارا میباشد.گرامیان محبت فرماید پاسخ بگوید سپاس از مهرتان.پُرتوان باشید در پناه یزدان",1,0,0,0,0,0,0,0
,,"سلام، دوستانی که iPad air2 رو از دیجیتال کالا خریدن، تبلت پارت نامبر کجاست؟",1,0,5,5,5,5,5,5
,,"سلام من این ایپد از دیجی کالا سفارش دادم به محض این که این که فرصت پیام دادن پیدا کنم نظر خود ام را هم در مورد این کالا میفرستم ممنونم از دیجی کالا",1,0,0,0,0,0,0,0
,,"سلام دوست عزیز، با نرم أفزار share it شما میتونید کلیه اطلاعات شامل عکس فیلم، فایل pdf,office را به کامپیوتر یا گوشى اندرویدى منتقل کنید فقط باید نرم أفزار هم روى لبتاپ و هم روى گوشى نصب باشد و هردو به یک منبع wifi وصل باشند",3,0,0,0,0,0,0,0
,,"با سلام خدمت خانم روستایی
تنها راه برای انتقال هرگونه فایل نصب اخرین وژن ایتونز و بعد برای انتقال فایل میتونین از نرم افزار های iTools یا tongbu استفاده کنید ، البته حتما باید از قبل نرم فزار ایتونز روی کامپیوترتون نصب باشه ، بعدش مثلا با نرم افزار تانگبو به قسمت file system برین و روی app user کلید کنید و برنامه هاتون رو مشاهده کنید و با کلیک روی انها فایل هاتون رو مشاهده کنید و اگه بخواین فایلی رو اضافه کنید به راحتی import کنید.",1,0,0,0,0,0,0,0
,,"سلام دوستان
با آیپد به طریقی می توان داده هایی مانند ( فایل آفیس، پی دی اف و .... ) رو به لپ تاپ منتقل کرد و فضای آیپد رو آزاد کرد؟
دوستانی که آیپد دارند راهنمایی کنند
با نشکر",0,0,0,0,0,0,0,0
,,"با سلام.من ایپد ایر2 سلولار رنگ گلد خریدم.این تبلت واقعا زیبا و فوق العادست و در کنار ظرافت و طراحی مذوب کنندش از سخت افزار بسیار خوبی بهره مند هست که انصافا منو تا حد بسیار زیادی راضی نگه داشته.به دوستانی که قصد خرید مینی آیپد3 توصیه میکنم واقعا کمی بیشتر هزینه کنند و ایر2 بخرن چون واقعا باهم ازنظر سخت افزاری متفاوتن.اما اگر از نظر مالی براتون نمیصرفه میتونید ایپد مینی2 خرید کنید چون واقعا مینی2 با مینی3 هیچ فرق قابل ملاحظه ای ندارن.بازم میتونین خودتون مقایسه کنید.اما در آخر باید بهتون بگم ایر2 از هر نظر شما رو راضی میکنه.من به شخصه استفادم بسیار سنگین و زیاد هست که بخوبی منو راضی نگه داشته.",2,0,0,0,0,0,0,0
,,"طلایی رو موجود کنید!",3,1,0,0,0,0,0,0
,,"سلام
خسته نباشید
لطفا رنگ گلدشو موجود کنین
سپاس",3,1,0,0,0,0,0,0
,,"سلام و خسته نباشید
لطفا رنگ طلایی این تبلت رو نیز به فروشگاه اضافه کنید.
و موفق باشید",3,1,0,0,0,0,0,0
,,"خیلی خوبه عالیه",1,0,5,5,5,5,5,5
,,"طلایی رو موجود کنید لطفا",3,1,5,5,5,5,5,5
,,"دوستان من بین خرید این ای پد و نوت4 مردد هستم از نظر شما کدوم یکی میتونه برای من مفید تر باشه لطفا راهنماییم کنید",1,0,0,0,0,0,0,0
,,"سلام خسته نباشید، لطفا گلدش رو موجود کنید. ممنون",1,0,0,0,0,0,0,0
,,"اپل تو تبلت عالیه
همه ی ایپد ها خوب بودن ولی این یکی فراتر از خوبه
دیجی رنگ طلایی رو بیار
و بذارش تو پیشنهاد شگفت انگیز 100% میخرمش",4,0,0,0,0,0,0,0
,,"سلام دوستان . من نمی دو نم بین ipad air2 و nexus 9 و tab s چی بگیرم لطفا شما دوست خوب راهنمایی کنید. با تشکر از دی جی کالا",0,0,2,5,5,5,5,5
,,"وای چرا ناموجود شد تا من خواستم بخرم ناموجود شد که ..لطفا موجودش کنین مرسی",1,0,0,0,0,0,0,0
,,"مرسی از راهنمایی خوبتون",3,0,0,0,0,0,0,0
,,"سلام
لطفا سریع جواب بدید
پارت نامبرش چنده؟؟؟؟؟؟؟؟؟؟",0,0,0,0,0,0,0,0
,,"در جواب دوست عزیز :
شما اگه میخواین به فایلاتون دسترسی کامل داشته باشین تب اس بهترین گزینس، اما اگه دنبال ی تبلتی هستین که داغ نکنه ، شارژ خالی نکنه که روزی چند بار بزنیدش به شارژ یا شبا صفحه نمایشش اشکتو در نیاره،به راحتی ویروس نگیره،تاچش بی نظیر باشه،حسگر اثر انگشتش فوق العاده باشه،،سخت افزارش هیچ جوره کم نیاره و در عین حال زیبا و خوش دست باشه، من به شما air2 رو پیشنهاد میکنم",6,0,5,5,5,5,5,5
,,"فوق العادست",2,0,0,0,0,0,0,0
,,"من سه روزی میشه که این مدل ای پد رو از اینجا خریدم واقعا معرکه اس حرف نداره و از دیجی کالا هم بسیار تشکر میکنم واقعا بسته بندیش عالی بود بدون هیچ نقصی",1,1,0,0,0,0,0,0
,,"سلام من بین mini3وair2موندم کدومو بگیرم لطفا پیشنهاد دهید",2,0,0,0,0,0,0,0
