,,"با سلام بنده نیز به نوبه ی خودم وظیفه دیدم در این نظرات شرکت کنم
باید عرض کنم ک فرمایشات اقای اسدی درسته و من با ایشون کاملا موافقم به غیر از نظرشون در باره ی ظرفیت 16 گیگابایتی
همه چیز در دنیا نسبیه و مطلقی وجود نداره بنابراین نظر هیچ کسیو نمیشه رد کرد
از نظر بنده 16 گیگ خیلی کمه و از طرفی برای ارتقای 50 گیگ و رسیدن به 64 گیگ انقدر هزینه دادن هم خیلی زیاده
و راج به تماس باید عرض کنم منظور از مکالمه ای ک دوستان میگن این نیست ک یه تبلته با نمایشگر 9.7 اینچیو بگیرن در گوششون حرف بزنن،
ولی میشه با استفاده از هندزفری و با این قابلیت یه کاربر حرفه ای بود
این که یه وسیله ای همه ی قابلیت ها رو داشته باشه مزیت بزرگیه ...... مسخره کردن ادمایی ک این توقع رو دارن نه تنها کار درستی نیست بلکه مورد انتقاد شدیدم هست
اگر یادتون باشه ملت سال های 80 تا 83 یه گوشی تو دستشون بود و یه mp3 پلیر تو جیبشون .....تا نوکیا اومد این دوتا رو تلفیق کرد شاید قابلیت داشتن موزیک روی گوشی اون زمان مورد تمسخر عده ای قرار میگرفت و میگفتند تلفن همراه اسمش روشه و فقط باید باهاش تماس های ضروری گرفت
با گذشت زمان حالا شاهد اینیم ک کسایی ک اون زمان دیگران رو مورد تمسخر قرار میدادن حال خودشان مورد تمسخرند
پس باید به این فکر کنید ک حتی این قابلیت باید به لبتاب ها هم اضافه میشد ولی لبتاب ها دیگر در حال انقراضن چون تبلت ها در حال جایگرینی ان
یک زمان دیگر گوشی های دو سیم کارته نیز مورد انتقاد بودند حالا شاهد اینیم ک گوشی های دو سیم کارته طرفداران بیشتری نیز دارند ......
پس میشه یک فرمول کلی اراایه داد و اونم اینه ک هرچقد قابلیت های بیشتری روی یک وسیله باشه بهتره هرچند که این قابلیت مسخره باشه
گرچه من تا حالا سعی خودمو کردم ک غیر از اپل از هیچ برندی در خرید قطعات الکترونیکی استفاده نکنم و تا حدودی تونستم اما باید بگم محصولات اپل متاسفانه کلی محدودیت دارند
و این محدودیتایی ک گفته میشه به نفع مصرف کننده است کاملا اشتباهه و کاملا به نفع خود شرکته چون با این محدودیت ها بیشتر پول در میاره
بنده خودم همین محصولو دارم و همیشه ب لبتابم وصله به این فکر میکنم اگر لبتاب نداشتم چ خاکی بایست ب سرم میریختم
هیچکس حاضر نیست بگه ماست من ترشه .... ولی باید عرض کرد تبلتا اومدن که نیاز ب داشتن وسایلی مث لبتاب و .... نباشه ولی این دقیقا برعکسه کاملا نیاز به داشتن یه ویندوز یا یک مکینتاش برای مدیریتش هست
در اخر دوست دارم یک نکته ی اخلاقی برای هم وطنام یاد اوری کنم
برای خیلی ها مهمه وسیله ای ک دستشون میگیرن دست هرکسی نبینن ولی باید گفت این دیدگاهه خیلی زشت و غیر انسانیه و بخیلانه ایه
در جواب دوستانی ک میگن کلی کلاس داره بعد علامت :) میذارنم باید گفت مگه عقده داری
انسان های متواضعی میشناسم ک در اوج پولداری خیلی چیزها رو نمیخرن و میگن دوست نداریم کلاس بزاریم و خیلی ها رو میشناسم ک برای کلاس گذاشتن از هیچ کاری دریغ نمیکنن
شما جز کدوم دسته هستید
دوست دارید از کدوم دسته باشید؟
من فقط ب خاطر کیفیت ارش استفاده میکنم و ازش بیزارم چون میدونم این محصولات کمتر از براش هزینه برده ولی بالاتر ب مردم میفروشه
و از اینکه وقتی ایپدمو دارم استفاده میکنم بعضیا یه جوری نگاه میکنن بیزارم و میگم ای کاش همه میتونستن بخرن و تو دل کسی نباشه",14,0,0,2,0,1,4,0
,,"من یک ماهه این تبلتو خریدم،خودم کارشناس سخت افزارم،به جرات میتونم بگم تو سخت افزار خیلی واردم،
در جواب اونایی که میگن نخرین محدود میشیشن نمی ارزه قیمتش بالاس و .... باید بگم نخیر عزیزانم، این تبلت نه تنها نسبت به قیمتش ارزش خرید داره بلکه قویترین تبلت دنیاس،
بله ی سری محدودیت های جزیی داره ولی اگه وارد باشین مشکلتون حله، این تبلت در مقایسه با تب اس سامسونگ بسیار قدرتمند تره از لحاظ سخت افزاری، از لحاط شکل و زیبایی و جنس بدنه از تب اس پلاستیکی خیلی بهتره
شاید بگین لرزولوشن تب اس بهتره ولی همه چیز رزولوشن نیست،تب اس سامسونگ بزرگتره پس طبیعتا رزولوشن بیشتری داره،از طرفی کیفیت نمایشش رتینا از سوپر آلمو خیلی بهتره شاید در نگاه اول همه فکر کنن صفحه نمایشش سامسونگ بهتره اما بهتر نیست،پر رنگتره،پر رنگ بودن دلیل بر بهتر بودن نیس،رتینا تصاویرو با رنگ واقعی و استاندارد نشون میده، گذشته از اون مصرف باتری بسیار کمتری نسبت به سوپر آلمو داره و نکته بسیار مهمتر اینه که شبا چشمو کمتر خسته میکنه ،نمایشگر سامسونگ به جرات میشه گفت چشمو خیلی اذیت میکنه،من خودم نسخه ی 16 گیگ خریدم و کلی برنامه روش نصب کردم بسیار کافی هستش دو تا بازی اچ دی و 35 تا اپلیکیشن نصب کردم هنوز 5 گیگ آزاد داره،تنها محدودیتی که داره اینکه که مثلا نمیشه ی فایل pdf رو توی ی برنامه مثه تلگرام یا غیره واسه کسی فرستاد،این چیزو فقط کسایی میگن که کمییتو فدای کیفیت میکنن،نمیدون که اپل با اینکار چقد امنیت کاربراشو تامین میکنهو مثه گوگل از اطلاعات شخصی مردم کسب درامد نمیکنه،هر چند که شما میتونید با icould این مشکلو حل کنید و برای مدیریت فایلاتون از ifile استفاده کنید،یا محدودیت دیگش مکالمه که خیلی مسخرس شما تبلت میخرین نه گوشیه موبایل، خیلی خنده داره که بخوایین ی نمایشگر 9.7 اینچیو بگیرین در گوشتون حرف بزنین،",3,0,5,5,5,5,5,5
,,"سلام
من این تبلت رو 3 هفته هست که از خود دیجی کالا خرید که دستشون درد نکنه
در مورد خود دیجی کالا بگم که
قیمتش نسبت به بازار عالیه
اطمینان به دست نخورده بودن محصول
هدیه هایی که روی محصولاتش میده
دستشون درد نکنه
در مورد ایپد بگم
به نظر من 16 گیگش کار راه میندازه و کم میشه پر بشه
به نظرم صفحه نمایش سامسونگ و ایسوس بهتر از این هست طبیعی تر هست خودتون مقایسه کنین (( کسایی که با تبلت فیلم میبینن ))
اما توی دوربین و قابلیت هاش حرف اول رو میزنه البته اگه نور اطراف خوب باشه در غیر این صورت بیکیفیت میشه عکسا
طراحی فوق العاده خود تبلت و سبکی و نازکی
تیک و لگ که اصن توش نیست بازی های سنگین رو اجرا میکنه بدون یه ذره گیر یا تیک
در مورد داغ کردن بگم : توی بازی ها که هستم اگه خیلی بازی کنم داغ میکنهیا نمیدونم چرا وقتی یه فیلم دیدم باهاش هم داغ کرد یا وقتی تو شارژ زیاد کار کنم من قبلش فون پد 7 ایسوس رو داشتم ازش راضی بودم اما وقتی باهاش تو بازی میرفتم خیلی خیلی داغ میکرد دستمو خیلی گرم میکرد اما این اینجوری نیست تازه ایپد اگه داغ کنه فقط یه کم پشت سمت راستش داغ میکنه
سرعت کپی کردن با کابلش بیشتر از سرعت فلشمه (( اگه میخواین چیزی بریزین توش با itools راحت ترین ))
خوب شارژ میشه و خوب نگه میداره
کلاسش هم بالاس :)
در مورد بدی هاش بگم که اگه به اینترنت دسترسی ندارین اصن بهش فکر نکنین
آزادیه کار با اندروید رو نداره که همین باعث میشه ویروس نگیره
همیشه از شانس بد من اون app هایی که من دوست داشتم پولی بوده
خودم جلبریکش نکردم و دوست ندارم بکنم اما اگه بکنین میتونین app های پولی رو هم بریزین که همه میدونن
فیلم دیدن باهاش رو توصیه نمیکنم چون تبلت های دیگه بیشتر به درد این کار میخورن
برای کسایی مثل خودم که اولین باره از محصولات اپل استفاده میکنن شاید اوایل استفاده از اون کمی براشون سخت باشه اما به مرور زمان شیرین میشه :)",1,0,4,5,5,1,5,5
,,"در جواب بهنام دقیق ، دوست عزیز شما میتونی با نرم افزار itools براحتی فایلاتونو انتقال بدی کار باهاش بسیار سادس نیازی هم به آیتون ندارید با دو گزینه ی import و export",0,0,5,5,5,5,5,5
,,"دوستان نخرید به چند دلیل
16 گیگ واقعا خیلییییییی کمه چون اپلیکیشن هاش پرحجمن
قیمتش زیاده ......
برای فروشش مغازه دارها مفت برش میدارن
خیلی ها بعد خریدنش منصرف میشن چون نمیدونن از تبلت چی میخان و ایپدم سرشار از محدودیت و عدم شناخت کاربری توسط عمومه
اگر صد درصد قصدتونن استفاده از تبلت و اون هم ایپده و مطمن شدید اونوقت اقدام ب خرید کنید و توصیه اینه ک حداقل 64 بخرید
حتما سیم کارت خور بخرید چون بدون سیم کارت اذیت میشید
برای بالا بردن حافظه و استفاده از سیم کارت دو تا تکنیک هست یا اضافه تر پول میدید و روی دستگاهتون اینن قابلیتو دارید
یا میتونید از یه گوشیه دیگه ب عنوان سیم کارت و یک هارد اکسترنال وایرلس برای بالا بردن حجم استفاده کتید هیچ راه دیگه ای ام نیست",0,0,0,2,0,1,4,0
,,"سلام
حتما بخریدش
خیلی عالی صفحه نمایش توپ
قفط بإدهاش نمی شه اسمس داد و زنگ زِد همیشه بده وگرنه هیچ مشکلی نداره",0,0,0,0,0,0,0,0
,,"سلام به همه ی دوستان عزیز
یه سوال داشتماین ک تو مشخصاتش نوشته قابل مکالمه نیست یعنی اصلا نمیشه باهاش حرف زد؟
من میخواستم 4g بگیرم اما این قضیه داره اذیتم میکنه
کسایی ک خریدن بگن ک نمیشه باهاش تماس برقرار کرد؟
و سوال بعدیم اینه که همراه اول و ایرانسل و ...... بدون جیلبریک کردن ساپورت میکنه؟",1,0,5,5,5,5,5,5
,,"سلام،من میخوام این تبلت رو از دیجیکالا سفارش بدم و فقط میخوام چند تا سوال راجب این تبلت بپرسم و اگر کسی میتونه بطور شفاف جواب سوالم رو بده و راهنماییم کنه ممنون میشم.
من چطور میتونم از کامپیوتر و لپتاپ عکس و فیلم و آهنگ به تبلت منتقل کنم از طریق یو اس بی یا حتی شبکه؟راهی هست که نیاز به خریدن وسایل جانبی اضافی برای این کار نباشه یا حد اقل اگرم نیازه چیزی بخرم برای این کار کم هزینه باشه و زیاد خرج رو دستم نذاره...؟؟؟
و سوال دومم اینه که این تبلت قابلیت دی ال ان ای یا حالا چیز دیگه با یه اسم دیگه که همین کار رو انجام بده داره؟من خودم تبلت گلکسی تب اس دارم و قبل از این هم اکسپریا زد 2 داشتم اونا راحت این کار رو میکردن،من میخوام موزیک و عکس و فیلم رو از طریق مودم وای فای که به تمامی وسایل خونه وصله رو به اشتراک بذارم،من یه رسیور دیجیتال حرفه ای دارم که سیستم عامل لینوکس داره و قابلیت اتصال به شبکه از طریق کابل لن و وا فای رو داره و گزینه ای داره به اسم ریموت پلی که میشه از طریق هار اکسترنال وای فای یا شبکه و دی ال ان ای و امثال این ها روی دستگاه رسیور دیجیتال پخششون کرد،من یه مودم دی لینک دو آنتنه دارم قابلیت انتقال و دریافت تا 300 مگابایت در ثانیه رو داره که در حال حاضر با اتصال دستگاه رسیور به مورم از طریق وای فای و همچنین اتصال تبلتم به مورم به طور همزمان میتونم فایل های موزیک و عکس و ویدیو رو از تبلت روی شبکه به اشتراک بذارم و از طریق رسیور روی تلویزیون پخش کنم،میخوام بدونم همین کاری رو که گفتم چطور میتونم با آیپد ایر 2 انجام بدم؟؟؟
برنامه های پولی و با روز رو چطور میتونم به طور رایگان نصب کنم؟؟؟
ممنون میشم یکی از عزیزانی که جواب این سوالای منو بخوبی میدونه راهنماییم کنه...من به محض گرفتن جواب این تبلت رو از دیجیکالا سفارش میدم!",1,0,0,0,0,0,0,0
,,"سلام لطفا رنگ نقره ای را موجود کنید قصد خرید دارم چون تبلت عالیه و از گلگسی تب اس خیلی بهتره باتشکر.",2,0,5,5,3,5,5,4
