positivePoints,negativePoints,commentText,like,dislike,"کيفيت عمومي عکس و فيلم","کيفيت ساخت",ارگونومي,"امکانات و قابليت ها","ارزش در برابر قيمت"
"امکانات کيفيت مطلوب عکس در شب و روز سرعت بالاي شاتر صفحه ي لمسي طراحي مناسب براي افراد حرفه اي",,"من چند ماه این دوربین را دارم .
عکس های بسیار خوبی میگیرد .
رابط کاربری بسیار خوبی دارد.",1,0,5,5,5,4,5
"در يک کلام عالي","در حالت زوم زود باتري تموم ميکنه","عالی.من نزدیک به 2 ساله دارمش.عالیه",2,1,4,3,4,5,5
,,"از لحاظ زوم حرف نداره به نظرم، کیفیت عکساش در حالت های مختلفی که داره متفاوته،باید تنظیمات با توجه به شرایط محیطی انجام بشه. به شخصه راضی ام ازش.",4,3,0,0,0,0,0
,,"18 برابر زوم اپتیکال در حالت فیلم برداری داره و میتونه تا 20 دقیقه فیلم برداری کنه !",3,1,0,0,0,0,0
,,"خیلی خوبه",3,4,0,0,0,0,0
,,"دوستانی که دوربین رو دارن لطفا در مورد زوم اپتیکال در حین فیلمبرداری این دوربین توضیح بدن. ممنون",1,3,0,0,0,0,0
,,"یک سالی هست اینو گرفتم خیلی عالیه",7,4,0,0,0,0,0
