positivePoints,negativePoints,commentText,like,dislike,"کيفيت عمومي عکس و فيلم","کيفيت ساخت",ارگونومي,"امکانات و قابليت ها","ارزش در برابر قيمت"
"سنسور bsi comos لرزش کم در زوم بالا به دليل سنسور پيشرفته کيفيت بالاي فيلم برداري وصل شدن راحت به موبايل و انتقال عکس ها و گرفتن عکس عمر بالاي باتري به دليل سنسور به روز و کم مصرف برقي","نداشتن جاي فلش","من این دوربین رو یک ماه میشه که دارمش از همه لحاظ یه دوربین بی نقص هستش یعنی تو این رنج عمرا اگه مثل این دوربین پیدا کنین تو زوم بالا لرزش کمی داره اونم بخاطر سنسور پیشرفته اونه فیلم برداریش کیفیت خیلی بالایی داره تنها رقیبش canon sx60هستش که اونم به خاطر سنسورش که قدیمیه وو دوربینش که 16 مگاپیکسله و تو سال 2014معرفی شده در مقایسه با این دوربین که سال 2016 به بازار عرضه شده و بیست مگاپیکسله و سنسورش هم جدیدتره خود به خود می‌ره کنار
امیدوارم کمک کرده باشم تو انتخاب شما",1,1,5,5,5,5,5
"زوم فوقالعاده ... فکوس خودکار عالي","به نظر من هيچي","خوشحالم که دارمش",2,1,5,5,5,5,5
"کيفيت عکس فوق العاده",ندارد,"با سلام دوربین بسیار خوبیه برای مصارف خانگی و افراد مبتدی در خریدش شک نکنید",2,1,5,5,5,5,5
,,"سلام.
دوستان طبق تحقیقات بنده این دوربین از بهترین دوربین خانگی و حتی کمی بالتر هستش.قابلیت زومش واقعا قابله تحسین هست..امیدوارم دیجی کالا زوتر موجودش کنه تا همه بخریمش. شک نکنید.",5,3,5,5,5,5,4
"[""زوم 50 برابر .داراي واي فاي.داراي شارژر باتري\n""]",[],"بهترین دوربین با قیمت مناسب و با کیفیت .خیلی خیلی خوب با امکانات بالا",5,2,5,5,5,5,5
,,"بهترین دوربین خانگی وحتی سطح بالاتر تو این رنج قیمته",7,5,5,5,5,5,5
