positivePoints,negativePoints,commentText,like,dislike,"کيفيت عمومي عکس و فيلم","کيفيت ساخت",ارگونومي,"امکانات و قابليت ها","ارزش در برابر قيمت"
"قيمت پايين
وزن سبک","کيفيت پايين تصاوير مخصوصا در نور کم","اگر واقعا کیفیت تصویر براتون مهمه یا برید سمت دوربین های DSLR و بدون آینه یا دوربین های کامپکت سطح پیشرفته که قیمت بالایی دارن. کامپکت های سوپر زوم و معمولی در بهترین حالت کیفیتی برابر با گوشی های هوشمند پرچمدار کنونی دارن نه بیشتر",0,0,0,0,0,0,2
"[""نداره""]","[""يکي دوتا نيست""]","هرچی پول بدی اش میخوری یک سری از دوستان دوربینی ک میخوان بگیرن با مگاپیکسل عرض یابی میکنن که این کاملا اشتباه نظر من این نیست که هرچی گرون تر بخری اون جنس. فوق العادس ن .
شمایی ک داری انقدر خرج میکنی 100 تومن دیگه ک بزاری رو پولت ی چیز درست حسابی میخری ن ب خاطر قیمت کم و مگاپیکسل بالا جنس اشغال بخری اشتباه ی سری از دوستان این دوربینی ک میخوان بخرن رو با مگاپیکسل مقایسه میکننک اشتباهه",4,3,0,0,0,0,0
ارزونه,,"من قبلا یه دوربین 5 مگا پیکسل کانن Powershot 530 داشتم حدود 10 سال پیش خریده بودم عکسهایی که اون میگیره خیلی بهتر از اینه .عکسها بسیار بی کیفیت و دقت تصویر پایینی داره. در نقاط کم نور و تاریک عکسهای بسیار بد و تیره و تار میگیره. عمر باطری بسیار کم است. رنگ بدنه دوربین بسیار بی کیفیت است و هنگام در دست گرفتن احساس بی کیفیتی به شما منقل میشود. در کل بدرد عکس گرفتن و ثبت لحظات خانوادگی نمی خورد. اصلا جزئیات تو عکس مشخص نیست و با بزرگ کردن عکس احساس فوق العاده بدی به شما منتقل میشه. در کل ارزش خریدن نداره و دور ریختن پوله.",3,0,0,0,0,0,0
هيچ,"کيفيت عکس صفر کيفيت فيلم در حد زير صفر","به نظر من یه گوشی ارزون قیمت بهتر از این دوربین فیلم وعکس میگیره من که پولم رو دور ریختم شما همچین کاری رو نکنید",2,1,0,1,1,1,0
"[""ندارد""]","[""فراوان""]","خیلی بی کیفیته. پولمو حروم کردم. ارزون خری همینه دیگه",5,1,3,3,3,3,3
,"بدنه بسيار ضعيف
قيمت بالا
منوي بسيار ابتدايي و آماتور
زوم اتوماتيک بسيار کند و ضعيف","از ضعیفترین تولیدات کنن هستش",13,3,1,1,1,1,0
