positivePoints,negativePoints,commentText,like,dislike,"کيفيت عمومي عکس و فيلم","کيفيت ساخت",ارگونومي,"امکانات و قابليت ها","ارزش در برابر قيمت"
"کيفيت ساخت بالا
کوچک و قابل حمل بودن
ال سي دي قابل چرخش","نداشتن جک ميکروفون
نداشتن hot shoe","بهترین دوربین موجود در بازار برای vlogging",7,1,5,5,4,4,5
"کيفيت عکس خوب و نزديک به DSLR ها
کوچک و جمع و جور
قيمت مناسب در قياس با رقبا","باتري ضعيف","1- اگرچه کیفیت عکسهای G7X هم خیلی خوب بود، اما سطح عکسها حتی در آیسوهای پایین مثلاً 400 یا 800 از چیزی شبیه نویز یا گرین پوشیده بود که در Mark II برطرف شده‌است. 2- این دوربین بر خلاف جثه کوچکش خروجی بسیار خوبی دارد و در بسیاری از عکاسیها شما را تقریباً از DSLR بی‌نیاز می‌سازد. اندازه DSLR ها اغلب شما را از همراه بردن منصرف می‌کند. شما هر دوربینی را همراه نبردید، در واقع آن را ندارید اگرچه مثلاً 6D باشد! بهترین دوربین به نظر من آن است که با آن عکس بیشتری گرفته شود. 3- در مشخصاتدرج شده در بالا دو مورد باید اصلاح شود : یکی آن که حداکثر ISO 12800 است، نه 25600 و دوم آن که صفحه نمایش این دوربین هم مانند G7X لمسی است.",9,0,5,5,4,5,5
,"فاصله کانوني و زوم کم","سلام.
1- سرعت شاتر در مشخصات فنی 2000/1 خورده . این که کم هست
2- به نظرم فاصله کانونی خوبی نداره این دوربین. نه اینکه یک ضعف باشه . این یک مشخصه هست که شاید به درد بعضی ها بخوره . حداکثر 36 میلی متر هست. به نظر باید لنز نرمال تری داشت مثلا 24 تا 100 که بشه تقریبا کارهای روزمره ای باهاش انجام داد",3,14,3,3,3,3,3
"کيفيت عکس
کيفيت ساخت
تنظيمات عالي","تنها نقطه ظعف نداشتن فيلمبرداري 4k","بهترین دوربین کامپکت موجود در بازار ایران ، اگر 4k داشت بهترین کامپکت دنیا !",8,0,5,5,4,5,5
"همه چيز چه از لحاظ عکس و چه از لحاظ فيلم برداري عالي ميباشد","نسبت به قيمت آن هيچ نقطه ضعفي ندارد","همه چیز چه از لحاظ عکس و چه از لحاظ فیلم برداری عالی میباشد",4,0,5,5,4,5,5
"در متن ذکر شده","عدم پشتيباني از 4k","سلام
با توجه به تغییراتی که g7x mark ii نسبت به نسل قبل خود g7x داشته است به نظر می رسد ارزش هزینه اضافی رو داره. امکان چرخش 45 درجه به پایین علاوه بر چرخش 180 درجه به سمت بالا، استفاده از پردازنده digic7 که طبق ادعای شرکت سازنده باعث ایجاد وضوح بهتر و شارپ شدن بیشتر تصاویر میشه و همچنین باعث افزایش ایزو از 12800 تا 25600 شده البته در مورد ادعای دوم در بعضی سایت های تخصصی گفتن به صورت دستی ایزو 25600 رو پیدا نکردن و ممکنه اشتباه شده باشه. افزایش سرعت عکاسی متوالی 5.4fps با فرمت Raw نسبت به مدل قبل خود که تنها 1fps بوده است. امکان پردازش در فایل Raw و انجام برخی ویرایش ها در آن در خود دوربین، امکان شارژ باتری از طریق کابل usb، امکان انتخاب چرخش lens ring در دو حالت کلیکی و با صدا و چرخش روان و بی صدا که در مدل قبلی فقط امکان چرخش کلیکی صدادار وجود داشت، افزایش طول عمر باتری از 210 به 265 شات، افزوده شدن دستگیره در دوربین، کاهش نویز در ایزوهای بالاتر به خاطر پردازشگر digic 7 و...
من هنوز دوربین رو نخریدم و منتظرم تا دیجی کالا دوباره موجود کنه و در پیشنهاد ویژه بذاره تا با خیال راحتتر بخرم. از دوستان ارجمند که این دوربین رو خریدن یا تجربه کار با این دوربین رو داشتن درخواست دارم اگه نقدی به این دوربین دارن و یا نتیجه تحقیق من ناقص بوده لطف کنن به اشتراک بذارن.
با تشکر",4,0,5,5,5,5,5
"صفحه چرخان و لمسي
ارزش خوب در برابر قيمت
امکانات بسيار زياد و تنظيمات فوق العاده",,"از همه لحاظ راضی هستم. کارایی فوق‌العاده ای داره بخصوص برای من که همیشه دوربین خوبی میخواستم که در عین کیفیت جمع و جور هم باشه و بتونم در مسافرت راحت حمل کنم. ویژگی های بسیار،زیادی داره که تو این چند روزه هنوز،همشو کشف نکردم. یه راهنمای 225 صفحه ای به صورت pdf داره که توصیه میکنم دانلود کنید در ضمن صفحه نمایش هم لمسی است که در توضیحات دیجی کالا ذکر نشده.",4,0,5,5,4,5,5
