positivePoints,negativePoints,commentText,like,dislike,"کيفيت عمومي فيلم برداري","کيفيت ساخت",ارگونومي,"امکانات و قابليت ها","ارزش در برابر قيمت"
"پشتيباني از فرمتهاي مختلف تصويربرداري و عکاسي
تاچ بسيار عالي
کيفيت عکاسي و تصويربرداري فوق العاده
منوي کاملا آسان و خوب در نسخه انگليسي","حواستون باشه منو چيني نخريد
بدنه نه چندان قوي
لوازم جانبي کمتر از گوپرو
قيمت بالا در ايران","سلام من این دوربینو کمتر از یک ماهه که خریدم و اما چرا گوپرو نخریدم ؟به دلیل قیمت کمترش نسبت به گوپرو و اینکه از لحاظ امکانات سخت افزاری و کیفیت فیلمبرداری به مراتب بهتر از گوپرو هست این رو با یه سرچ ساده در یوتیوب و فیلمهای مقایسه دو دوربین متوجه میشید ازین رو به این دوربین لقب قاتل گوپرو دادند . البته قیمت تمام شده اش در ایران بالاست چون همه جا شیائومی به قیمت پایینش معروفه . اما بریم سراغ خود دوربین یکی از مزیت هاش اینه که صفحش لمسیه و خیلی هم از تاچ گوپرو بهتره و کمی بزرگتر ولی این مزیت معایبی هم داره مثل اینکه دیگه از تو قاب کار باهاش سخته و باید حواستون باشه تاچش ضربه نبینه اما تو گوپرو شما با دوتا دکمه میتونستید تمام تنظیماتو سریع انجام بدید ولی خوبیه تاچ اینه که شما میبینید دارید چی میگیرید و تنظیمات هم خیلی آسونه (کاربرای گوپرو همه دوست داشتن گوپرو 4 بلک بخرن که بهترین دوربین بود ولی به دلیل اینکه نسخه سیلور صفحه نمایش داشت اونو میخریدن که این دوربین کاملا اون معضل رو حل کرد ) . یه فرق دیگه که با گوپرو داره اینه که فقط یه دکمه داره که برای عکس گرفتن و خاموش روشن کردن هست . در ضمن باتری این وسیله خیلی از گوپرو قوی تره و فرمت های تصویربرداریش هم بیشتر و بهتره که خودش مهمترین مزیته به اعتقاد من . متاسفانه من در هنگام خرید حواسم به این نکته نبود که باید نسخه بین المللی رو بگیرم و نسخه چینی رو گرفتم که تمام منوهاش چینی و فاجعه بود اما با یه سرچ دقیق تو اینترنت فهمیدم چه جوری هک میشه و با یه عملیات ساده به زبان انگلیسی آپدیتش کردم . یه نکته دیگه اینه که تجهیزات جانبیش از گوپرو یک مقدار کمتره که فکر کنم با یه تبدیل کوچولو بتونید از لوازم گوپرو بر روی این دوربین استفاده کنید و در نهایت بین گوپرو و شیائومی قویا شیائومی رو توصیه میکنم البته یادتون نره نسخه international",0,0,5,4,1,5,4
"همه چيزش","نداره واقعاْ","کیفیت فیلمبرداری عالی عالی عالی و باورنکردنی - کیفیت عکس خوب - امکانات نرم افزاری بسیار و کاربردی - اندازه کوچک - کیفیت ساخت عالی - صفحه لایو ویو بی نظیر و کاربردی
نقاط قوت و ضعف و نوشتم. فقط یک نکته: با داشتن این گجت کمبود دو چیز بسیار مشهود می شه و نداشتن این دوچیز عملاْ استفاده از این دوربین رو بلااستفاده می کنه. اون دوچیز: 1 - سیستم کامپوتری قوی برای ادیت فیلمهای 4k
2 - تلوزیون اولتراچ دی و 4k که بتوان با آن فیلمهای با کیفیت ظبط شده با این دوربین را دید.",4,0,5,3,5,3,5
,,"یه موبایل پرچمدار که بخرید مثل جی 5 یا اس 7 کیفیت دوربین بالا تری نسبت به این داره تازه. قابلیت ظبط 4 کی و عکس برداری همه چی داره هم موبایله هم دوربین فضای کمتری میگیره و موبایلتون هم هست",0,16,3,3,3,3,3
"امکانات عالي",ندارد,"من یماهه دارمش ...باطریش عالیه...کیفیت فیلمبرداری و عکسبرداری حرف نداره ..فقط ایران گرونه",4,2,4,4,4,4,5
,,"من حدود 6 ماه هست که این دوربین دارم برای کوهنوردی گرفتم عکسای خیلی عالی میگیره مخصوصا از نور آفتاب، باتریش هم عالی هست فیلمهاشم کلی فرم مختلف داره فیلمای تایم لپس و اسلومیشنش هم عالیه من براش قاب ضد آب و چندتا قطعه دیگه هم براش گرفتم(داشتن تاچ لمسیش کار باهاش خیلی راحت کرده دیگه لازم نیست همش با گوشی کانکت بشیم)",8,0,5,4,4,4,4
"عمر باطري دو برابر گو پرو
اصلاح خطاي فيش آي
ويرايش لايو اسلو موشن
لرزشگير قدرتمند
نمايشگر","اونقدر از بقيه بهتره که باورکردني نيست","من توضیحی راجع بهش نمیدم.. فقط برید ویدیو های مقایسه این دوربین رو با بهترینهای گو پرو. از جمله نسخه پنجم بلک گوپرو، توی یوتیوب ببینید... اصلا قابل قیاس نیست... قیمت تصف گو پرو، قابلیت های بیشتر از گو پرو، لوازم جانبی بسیار بسیار ارزانتر از گوپرو....",9,2,5,5,5,5,5
"امکانات خوب و حرفه اي","عدم سازگاري لوازم جانبي با مدل قبلي","سلام
قبل از هر صحبتی باید یک گلایه از کسانی بکنم که بدون در نظرگرفتن مسایل نقد نویسی فقط یک چیزی می نویسند! که نه به کار شناخت محصول می آید نه به کاربر در خرید کمک میکند؛از خوش شانسی آنها کارشناس تایید محتوا هم آن را تایید میکند!
بنده ودر حال حاضر دارای شیاومی1 هستم که ازدیجی کالا خریدم در بازار به ورژن جدید شیاومی 2 میگویند بگذریم؛این دوربین جدید به جز ارتقای کیفیت تصویر برداری 4K که کار کوچکی نیست در تنظیمهای عکاسی نیز دست کاربر را باز گذاشته ومیتوان مانند دوربین های حرفه ای اقدام به تعیین سرعت شاتر و وایت بالانس و ...نمودکه این دوربین را برای افراد حرفه ای مناسب تر میکند.
این دوربین قابلیتهای زیادی برای کارهای خلاقانه به کاربر ارایه میکند که از حوصله این بحث خارج است و باید آن را تهیه کنی تا متوجه شوی چقدر قابلیت دارد
دامنه استفاده کنندگان این دوربین به جز مصرف کنندگان عادی میتوان به دانشجویان عکاسی وفیلمبرداری و تدوین؛استادان رشته هنر و علاقه مندان تصویربرداری هوایی به وسیله (کوادکوپترها)وغواصان وعلاقه مندان به طبیعت را میتوان نام برد در آخر باید از دیجی کالا پرسیداین ورژن ارایه شده(شیاومی 2) آیا مدل بین اللملی است یا مدل مورد استفاده در چین؛ زیرا تفاوت این دو مدل فقط در زبان منو ارایه شده انگلیسی در مدل بین المللی است. البته منوی ان زبانش چینی باشد شما دو راه برای استفاده از آن دارید راه اول که اسان تر است استفاده اپلیکیش اندروید آن در گوشی است که به زبان انگلیسی ارایه شده و راه دوم که کمی دشوارتر است یادگیری زبان چینی منو ی آن است!!!!",20,7,4,5,4,5,3
"4k
کوچيک",قيمت,"از شیاومی بعید بود روی این کالا قیمت زیادی بزاره . نمیگم زیاده ولی شیاومی به کیفیت بالا و قیمت پایین شهرت داشت.اگه راست میگم لایک یادتون نره",30,93,5,5,5,5,5
"همه چيز",ندارد,"خیلی وقت بود منتظر آوردنش به دیجی کالا بودم بسیار به صرفه تر از گوپرو هست",26,17,3,3,3,3,3
