positivePoints,negativePoints,commentText,like,dislike,"کيفيت عمومي عکس و فيلم","کيفيت ساخت",ارگونومي,"امکانات و قابليت ها","ارزش در برابر قيمت"
"لنز 75-300
داشتن wifi و NFC","پردازنده قديمي","این دوربین قابلیت فوکوس دستی رو داره و برای افراد مبتدی انتخاب خوبیه تو بقیه سایت ها فقط با لنز 18-55فروخته میشه",1,1,4,4,4,4,5
"کيفيت رنگ","لنزي که همراهشه بسيار ضعيفه","من پارسال این محصول رو از دی جی کالا تهیه کردم باتوجه به لنز ضعیفش ترجیح میدادم که از بازار تهیش کنم تا لنز قوی تری رو تهیه کنم.با تشکر از دی جی کالا",1,1,3,3,3,3,3
"قيمت معقول","نداشتن استبليلايزر روي هر دو لنز","حداقل لنز 18-55 رو باید با استبیلایزر ارائه میکردن
ممنون از دیجی کالا",13,2,1,1,3,1,3
