positivePoints,negativePoints,commentText,like,dislike,"کيفيت عمومي عکس و فيلم","کيفيت ساخت",ارگونومي,"امکانات و قابليت ها","ارزش در برابر قيمت"
,,"بسیار ضعیف .
هر اپشنی بخوای داره ولی خروجی بسیار ضعیف
برای خرید اول canon nikon
دوم سونی الیمپوس
بعدفوجی پاناسونیک
بقیه هیچ...",0,0,3,3,3,3,3
"[""کيفيتش خيلي بالاست و قابليت واي فايش خيلي کارو براي انتقال راحت مي کنه وحتي مي توني تبديل به دوربين مداربسته بشه ""]","[""يکم در بعضي اوقات نور سنجي خوب نمي کنه که خيلي مهم نيست""]","خیلی خوبه فقط نسبت به کانن sx710 یکم ضعیفه",4,1,5,5,5,5,5
,,"با این دوربین و چند مدل دیگه از دوربینهای سامسونگ در مغازه لوازم عکاسی یکی از دوستانم در شرایط نوری مختلف و تنظیمهای مختلف چند شات گرفتم. نسبت به کانن اس ایکس 700 یا نیکون p520 هیچ حرفی برای گفتن نداشت. عملکردش توی نور کم به شدت ضعیفه. سرعت فوکوس پایینه. رنگها حتی در بهترین حالت تنظیم و زیر نور کافی باز هم اختلاف زیادی با رنگهای اصلی دارن.",2,8,1,3,3,2,0
"[""قدرت زوم نسبت به هم رده ها"",""باطري مقاوم و با دوام"",""صفحه نمايشگر لمسي با قابليت چند لمس"",""لنز جمع شونده"",""تصوير برداري با بالاترين کيفيت زوم""]","[""قرار گرفتن لنز زير انگشت ""]","من دو سالی میشه گرفتم البته نه از دی جی کالا و زیر این قیمت خیلی خیلی هم راضی هستم هم از لحاظ زوم.کیفیت.باطری.صفحه نمایش ...........حتما توصیه میکنم بگیرید چون تو هم رده هاش بی نظیره من دوربین سونی.نایکون.فوجی فیلم و حتی کنوون هم داشتم ولی این از همشون بنظرم بهتره از همه لحاظ
ممنونم از دیجی جون بخاطر برنامه خوبشون.",6,2,5,4,5,4,5
,,"دامادمون یک هفته است خریده امکانات خوبی داره مثل وای فای و NFC
میشه به عنوان دوربین مدار بسته ازش استفاده کرد و تصویر رو به تبلت ارسال کرد (البته برای جاسوسی نساختن برای مراقبت از بچه های شیطون زیر دو سال)
زیاد وفت نشد باهاش ازش در مناظر مختلف عکاسی کنم حتی وقت نشد به لپ تاپ عکس منتقل کنم تا کیفیت رو بررسی کنم
اما امکانات ارتباط بی سیم خیلی برام جالب بود",8,3,0,0,0,0,0
,,"باحاله . . .",4,4,0,0,0,0,0
