positivePoints,negativePoints,commentText,like,dislike,"کيفيت عمومي عکس و فيلم","کيفيت ساخت",ارگونومي,"امکانات و قابليت ها","ارزش در برابر قيمت"
,,"نسبت به قیمتش خیلی خوبه
و کیفیت خیلی خوبی داره",1,0,5,5,3,3,5
"امکانات و قابليت هي بالا در مقابل قيمت پايين",,"راحت با یه canon یا nikon دو میلیونی رقابت می کنه",2,1,4,4,4,5,5
"وضوح و دقت سنسور
ارگونومي خوب
زوم بالا و حفظ کيفيت در حداکثر زوم
فيلم برداري فول اچ دي
فلش قوي","کم اوردن باطري در هنگام استفاده از زوم","این دوربین رو داشتم و واقعا ازش راضی بودم نسبت به قیمتش واقعا عکسها و فیلمهای عالی میگرفت . عکسهایی که از مناظر و ماه و .. در شرایط مختلف نوردهی گرفتم واقعا فوقالعاده بودند نسبت به قیمت دوربین",1,1,4,4,5,3,5
"قيمت واقعا خوب",باتري,"کیفت عکس برداری خوب
حداکثر سرعت فیلمبرداری360فریم بر ثانیه
ولی در هنگام فیلم برداری واستفاده از زوم دوربین باتری خیلی ضعیف میشه",4,2,5,5,5,5,5
"لنز قوي","شارژ کم","خوبه کسانی که نمیخوان زیاد هزینه کنن خوبه عالیه",0,2,3,3,3,3,3
,,"کسانی که نمیخوان هزینه زیاد بکنن و دنبال عکاسی حرفه ای نیستن و فقط ثبت لحظات براشون مهمه این دوربین بسیار خوبیه. البته من برای محل کارم خریدم که فک کنم مناسب هم باشه",7,1,3,4,3,4,5
"امکانات فراوان کيفيت خوب","باتري ضعيف","من همین امروز به دستم رسید و از دیجیکالا خریدم خیلی عالیه. حس یک دوربین حرفه ای رو به شما میده حتماً بخرید",14,2,5,5,5,5,5
,,"منم دارم و راضی هستم.همه چی تمومه..",19,4,5,5,5,5,5
,,"من این دوربین رو دارم نسبت به قیمتش عالیه منکه راضیم",19,2,0,0,0,0,0
