positivePoints,negativePoints,commentText,like,dislike,"کيفيت عمومي فيلم برداري","کيفيت ساخت",ارگونومي,"امکانات و قابليت ها","ارزش در برابر قيمت"
ندارد!,"نويز بسيار زياد در فيلم حتي با نور خوب محيط
کيفيت ساخت خيلي پايين","وقتی جعبه رو باز کردم، یک دوربین خیلی کوچیک دیدم با کیفیت ساخت پلاستیک خیلی پایین که اولین چیزی که به ذهنم رسید این بود که این واقعاً سونیه ؟! یا یه جنس متفرقه و بی نام و نشونه ؟!
بعدش شروع کردم به فیلم برداری. کیفیت فیلم بی نهایت پایین بود ! این پایین بودن کیفیت رو هم من با موبایل هایی که در اطرافم میبینم مقایسه کردم!
یک گوشی هوآوی 800 تومنی خریدیم که کیفیت فیلمی که میده واقعاً خیلی خیلی بالاتر از اینه
من انتظار داشتم که وقتی یک دوربین بالای 1 میلیون تومن میخرم، معادل دوربین یک گوشی 3 میلیون تومنی بهم کیفیت فیلم و تصویر بده ولی این نمیده !
مثلاً اگر شما به فیلم iPhone6 ، نمره 10 بدیم، این نمرهش میشه 5 !!!
شاید بگید که خب این قیاس، قیاس ِ درستی نیست! که خب به نظر من خیلی هم درسته !
یه گوشی ، 100 تا امکانات داره، در کنارش دوربین هم داره. ولی دوربین فیلم برداری که فقط کارش فیلمبرداریه، این کیفیت واقعاً پایین و نچسب بود براش!
علی الظاهر این دوربین هم کلاس با مدل های CX405 / CX440 / PJ410 / PJ440 هست و فرقشون توی امکانات جانبی مثل WIFI و پروژکتور و ایناست. یعنی به نظر میاد اگر این 4 مدل از لحاظ لنز دوربین مثل هم باشن، کلاً ارزش خرید ندارن!",6,5,1,1,3,3,1
"عالي خوب","بدنش صعيفه دربرابرصربه..بايدحسابي مواطبش باشين نيفته زمين وصربه نبينه","دوربین خوبیه به لحاط فیلم برداری حرف نداری..کیفیت عکسشم خوبه ولی یه ذره کوچیک میفته اخرش
من سه ماهه دارمش خوبه ماشاللا",1,4,5,4,4,4,3
,,"سلام این دوربین عالی وقیمت مناسبی داره.از دوربین فیلم برداری انتظار دوربین عکاسی نداشته باشید هر چی جای خودش",5,3,3,3,3,3,3
"زوم عالي
فيلم برداري قدرتمند
ضبط صداي عالي
باطري قوي","کيفيت عکس پايين","من چند ساله که این دوربین رو گرفتم جدا ازش راضی ام.اما کیفیت عکسش رو راضی نیستم نمیدونم چرا کیفیتش پایینه انگار عکس بزرگ نیست یکم که بزرگش میکنی تار میشه اما صدا و فیلمش عالیه. نسبت به قیمتش عالیه.توصیه میکنم اگر قصد خرید دارید درنگ نکنید.",7,4,5,5,5,5,5
