positivePoints,negativePoints,commentText,like,dislike,"کيفيت عمومي فيلم برداري","کيفيت ساخت",ارگونومي,"امکانات و قابليت ها","ارزش در برابر قيمت"
,,"توانایی دوربین فیملبرداری دیجیتال در فیملبرداری هست و توانایی دوربین عکس برداری دیحیتال در عکس برداری.
گرچه هر دو میتونن هم عکس بگیرن و هم فیلم. سوال اینه اگر هر دو نوع میتونن فیلم Full HD بگیرن پس چه نیازی به تولید این دو نوعه؟
سریعترین پاسخ اینه که دوربین فیلمبرداری قابلیت زوم بیشتر و مدت زمان تقریبا 3 برابر بیشتر فیملبرداری
دیگه اینکه بعضی دوربینهای فیملبرداری دارای هارد دیسک، پروژکتور، ورودی میکروفن، خروجی هدفون و قابلیت فیلمبرداری در شب هستند.
در دوربینهای فیلمبرداری دیجیتال میشه از یه صحنه ثابت دلخواه یه عکس تهیه کرد. به این صحنه ثابت دلخواه فریم میگن (تعریف عامه پسند فریم)
و وضوح (رزولوشن) هر فریم از فیلم در کلیه دوربینهای فیلمبرداری Full HD حاصلضرب دو عدد 1920*1080 که میشه 2 مگاپیکسل.",15,0,0,0,0,0,0
,,"فقط به درد دور انداختن میخوره آخه 2 مگاپیکسل هم شد کیفیت",1,35,1,2,2,3,0
