positivePoints,negativePoints,commentText,like,dislike,"ارزش خرید به نسبت قیمت",نوآوری,"کیفیت ساخت","امکانات و قابلیت ها","سهولت استفاده","طراحی و ظاهر"
,,"فوق العاده",1,0,5,5,5,5,5,5
"قيمت مناسب
صفحه بزرگ","ظرفيت پايين رم
عدم انتقال برنامه از رم به کارت حافظه","تو بلند مدت حافظ پایین خیلی شما رو اذیت میکنه روی هم رفته پیشنهاد می کنم نخرید",0,2,3,3,2,3,3,2
"اندازه صفحه نمايش
سبک (به دليل بدنه پلاستيک که خيلي مزيبت محسوب نمي‌شود)","مشکل بسيار حاد در هماهنگي سخت افزار و نرم افزار","با توجه به اینکه آشنایان این گوشی را داشتند و از کار با آن راضی بودند و تقریبا در این رنج قیمت گوشی مناسبی بود نزدیک به 10 روز پیش اقدام به خرید این محصول کردم و تجربه من از این گوشی بعد از تقریبا دو روز به شدت ناامید کننده بود. حاددترین مشکل این گوشی بستن خود به خود نرم افزارها و ریست شدن و گیرکردن بر روی لوگو ال جی است که چاره‌ای بجز درآوردن باتری ندارد و اگر این گوشی هم از مدل‌های با باطری غیرقابل تعویض بود نمی‌دانم دیگر باید چه کار می‌شد کرد!!! علاوه بر این مشکل خاموش شدن صفحه و روشن شدن به حالت ثابت چراغ ال ای دی گوشه سمت چپ (نشانگر شارژ و ...) که این هم به روش در آوردن و جایگذاری باتری حل می‍شود!!!
از طرفی چون این مشکل حدود یک روز در میان اتفاق می افتد وقتی از فرصت تست هفت روز تعویض هم استفاده می کنی چون کارشناسان ایرادی در آن نمی بییند از قبول خرابی آن سرباز می‌زنند!!!
از آنجایی که یکی از ابعاد کیفیت محصول قابلیت اطمینان است به دلیل این مشکل که از این لحاظ در حد بسیار پایین قرار دارد و به این دلیل اصلاً نمی‍شود روی این گوشی حساب باز کردچون احتمال دارد در موقع نیاز به یکباره هنگ نماید.
در کل تا موضعگیری رسمی ال جی یا نمایندگانش در مورد این مشکل رایج توصیه می‌کنم اقدام به خرید این مدل و با احتیاط بیشتر گوشی ال جی نکنید.",0,0,4,0,3,4,4,3
"دوربين خوب جلو وعقب .باتري نسبتا خوب .صفحه بزرگ و طراحي خوب نسبت به سامسونگ","بعضي وقتها هنگ ميکند","گوشی خوبیه اما نمیدانم چرا ال جی از ای پی اس برای ساخت صفحه هاش استفاده میکنه !!!چرا از تکنولوژی old led استفاده نمیکنه که در مقابل رقیبش سامسونگ کم نیاره. همینطور بنظرم میتونست از سی پی یو با سرعت بالاتری استفاده کنه",0,1,4,5,3,5,5,5
"شيک و خوش دست و باريک اندازه مناسب","سوزش چشم تا حدودي دارد","سلام من این گوشی رو یک ماه میشه خریدم خیلی باریک و سبک و خوش دسته واقعا ارزش خرید رو داشت برا من مشکل هنگ و غیره نداشت مورد پسند دوستانم هم بود خیلی شیک هست قیمتش و امکاناتش برای من که پول اضافی نمیخواستم هزینه کنم خوب بود کیفیت عکس هم عالی هست باتری هم خوب نگه میداره",2,0,3,3,3,3,3,3
"در تمام نکات","هيچ چيز","دقت کردید همه نظرات منفی رو کسانی گذاشتند که اصلاَ خریدار این گوشی نبودند؟!",3,0,5,5,5,5,5,5
"ميزان باتري بالاحتي هنگام اتصال ب اينترنت","لنز دور فاقد حفاظ","7 ماه خریدم ازش راضیم ولی توی جیبم گذاشتم لنزش خش دار شد و بردم گارانتی هیچی قبول نکرد ارزش خرید نداره اشباه کردم ب نظر من سامسونگ یا اپل بگیرین",0,1,2,3,1,3,4,2
"طراحي زيبا و وزن کم
امکانات دوربين مانند پنوراما و گرفتن عکس با حرکت دست و گفتن کلمات
امکانات قلم(با دراومدن قلم آپشن هاي مفيد ظاهر مي شوند)","تعبيه دکمه هاي پاور و کنترل صدا در پشت گوشي","سلام.من سه روزه که این گوشی رو از دیجی کالا خریدم.امکانات این گوشی نسبت به قیمتش واقعا بینظیره.گوشی زیبایی هست.فقط تنها چیزی که منو در مورد خریدنش ترسونده نظر برخی کاربران در مورد هنگ کردن بی دلیل گوشی هست که تنها راهش درآوردن باطری اونه.این اتفاق پریشب برای من افتاد و الان مردد هستم که از ضمانت 7 روزه برگشت کالا استفاده کنم و گوشی رو مرجوع کنم یا نه.چون خیلی مساله آزاردهنده ایه.",5,1,5,4,5,4,5,4
,,"نسبت به فیمت عالیه",3,0,5,3,4,4,5,4
,,"دوستانی که مشکل خاموش شدن رو دارن هر شی گوشی رو خاموش کنند بعد بخوابند بعد از یک هفته درست میشه",1,2,5,5,3,4,5,2
"دوربين با کيفيت نسبت به قيمت
قلم","صفحه نمايش بي کيفيت
انتقال صدا
عدم وجود نو آوري
مکان دکمه هاي صدا و خانوش و روشن بد
فاقد حسگر اثر انگشت","با استفاده ی دو ماهه ی من با کامل اطمینان به شما می گویم که اگر بخرید زود می فروشیدش.کیفیت عکس نسبت به قیمت خوبه.صفحه نمایش بزرگ اما دارای کیفیت پایین.از مزایاش دو سیمکارت بودن می تواند باشد . قلم هم برای دوستدارانش می تواند باعث خرید آن شود.اما بعضی مواقع مشکل انتقال صدا پیدا می کند. بعضی مواقع نیز هنگامی که از موبایلی به آن زنگ زده می شود می گوید مخاطب در دسترس نیست درحالی که در مکان کاملا خوب قرار داده شده بوده .اگر اونرو تهیه نمودید فقط بخاطر قلمش تهیه نمودید.",2,9,4,3,2,3,2,1
,,"اصلا به هیچ کدوم از نظرات منفی توجه نکنید شش ماهه خریدم نه هنگ کرده نه خاموش شده نه داغ کرده
واقعا ازش راضیم بسیار گوشیه معرکه ایه
البته اگر نظرات اینجا رو بخونید و از بازار تهیه کنید به شدت ضرر کردید
گوشیه خوبیه چون دیجی کالا جنس اصل بهتون تحویل میده نه مثل بازار که همه جوره کلاه سر ادم میذارن
بازم میگم از پولی که میدین رضایت خواهید داشت.",7,1,4,4,4,4,4,4
"زيبا و وزن پايين","سي پي يو پايين و نداشتن حسگر هاي هوشمند","من هفت ماه این گوشی رو خریدم خدا وکیلی ازش راضیم ولی قابلیت های زیادی نداره مثل فینگرس پرینت یا همون اثر انگشت یا قطب نما ولی بجای این دو قلم هوشمند گذاشتن ولی به نظر من قطب نما اثر انگشت حیاطی ترن تا قلم
سر بازی که میریم خوبه و عالی بازی هایی چونmodern kombet5 و asphalt8 رو اجرا میکنه در مدرن کمبت 5 مشکلی نداشت ولی تو اسفالت بعضی وقت ها رنگ گرافیکش یک ثانیه قاطی میشه و بعد درست میشه کسی که میخوای اینو بخری میتونی با این قیمت گوشی های بهتری بخری که استایلوس تو با این قیمت بالاش به گرد پاشم نمیرسه باتشکر از بچه های دیجی کالا",3,3,4,4,4,4,4,4
"طراحي عالي استفاده از مداد رابط کاربري اسان","هنگ در مواقع فشار بر روي گوشي با نرم افزار هاي سنگين کيفيت مداد خوب نيس","دوستان خوب و گرامی این گوشی ویژگی های خوبی داره ولی امکانات و حسگر اثر انگشت هواویHuawei honor 5x میتونه نظر شمارو ب خودش جلب کنه و تنها ویژگی خوب این ال جی استفاده از مداد هست ک همان طور در فیلم مشاهده میکنید خیلی کند است و راضی کننده نیست",0,4,3,4,5,5,5,3
,,"این گوشی خیلی هنگ میکنه
البته توی بسیاری از مدل های ال جی گیر کزدن روی لوگو طبیعیه
اما خب این گوشی خیلی بیش از حد این اتفاق براش میوفته",2,5,3,0,2,3,3,3
"خوش دست و با کيفيت البته شايد قديمش",,"با سلام من 6 ماه پیش خریدم فکرکنم اول سری ها بود واقعا ازش راضیم برام عجیب بود این مشکلات دوستان اما حتما سری جدید مشکل دار هستش",2,0,5,5,4,5,3,3
,,"من حدود 1سال میشه ک این گوشی رو دارم و مشکلاتی ک میگن رو نداشتم با اینکه خیلی ازش استفاده میکنم
سبک و خوش دسته
زود شارژ میشه
تاحالام خاموش نشده یا هنگی ای ک باعث شه بخوام باتری رو ازش خارج کنم نداشته",0,0,5,4,5,5,5,4
"ظريف
خوش دست
کيفيت ساخت بالا","مستوانست دوربين بهتري داشته باشد","سلام من این گوشی رو 6ماه هست که خریدم و مشکلی به جز دوربین بی کیفیت ندیدم و همه چیزش عالیه وکاملا راضی هستم و به شما هم پیشنهاد میکنم",0,1,5,5,5,5,5,5
,,"با سلام منم همین مشکل خاموش شدن گوشی را داشتم بعد از مدتی که این مشکل را داشتم به تنظیمات گوشی و نرم افزار گوشی رو آپدیت کردن چند روزی هست که گوشیم خاموش نمیشه شما هم امتحان کنید ببینید گوشیتون درست میشه.",0,1,3,4,5,5,5,4
"صفحه نمايش بزرگ . نرم افزارخوب","من که چيزي نديدم","یک هفته ای هست خریدمش ازش راضییم. اذیتم نکرده. ازدیجی کالا به خاطرارسال سریع تشکرمیکنم....",0,0,3,3,3,3,3,3
"دوربين13 و سلفي 8 اندرويد 6","رام پايين وجنس بدنه پلاستيک","در کل گوشی خوبیه گوشیو 6 ماهه خریدم هنوز ک هنوز هنگ نمیکنه بازی ها نسبتا سنگینو رو هم راحت اجرا میکنه و از همه مهم تر وزن کم و باریک ان است ک حس یک گوشی خوش دست ب شما میدهد",0,0,5,5,3,3,5,5
,,"الان یک ماه گوشی رو خریدم که بعد از یک هفته خود به خود خاموش میشه و باید باطری دربیاری و دوباره بزاری که روشن بشه.واقعا اعصابم رو خراب کرده ولی این دلیل نمیشه که امکانات و قابلیت های گوشی رو کتمان کرد. از نظر امکانات و طراحی عالیه حرف نداره اما یه نصیحت به دوستان :
سعی کنید وقتی میخواید گوشی بخرید گوشی بخرید که تازه وارد بازار شده چون با کیفیت بهتری در آغاز فروش عرضه میشه ولی بعد از مدتی که گذشت گوشی های معیوب در کشور های اروپایی رو بعد از تعمیر توسط نمایندگی اصلی شرکت وارد ایران میکنند و روی جعبش برچسب میخوره refresh و بعد ایران اون برچسب رو برمیداره و به اسم نو میفروشه . در نتیجه اون گوشی دیگه مثل روز اول نمیشه و آدم رو بیچاره میکنه.
فعلا دادم گارانتی تا ببینم چی میشه...",4,1,5,5,4,4,5,4
,"نقص طراحي سخت افزاري وخاموش شدن صفحه","این گوشی را بعد از سال ها که اولین گوشی هوشمندم بودخریدم. من اصولا فردی هستم که با تحقیق و مطالعه کامل خرید میکنم و عموما دوستان انتخاب من راقبول داشته و پس از من اقدام به خرید می کنند.پس ا ز مطالعه مشخصات فنی و مبلغ آن و پس از 2 تا 3 ماه بررسی سایت ها به خصوص بخش نظر خواهی دیجی کالا به عنوان رفرنس, نسبت به خرید آن در 23 اسفند از نمایندگی آن(مدیا پردازش) در بازار موبایل اقدام نمودم.نمایشگاه خود برنامه بر روی آن گذاشته و آنتی ویروسnod که همراi آن بود بر روی آن نصب نمودم.گلسی که برای آن فروخته می شود به دلیل انحنای صفحه کامل بر روی آن نمی چسبد و در زیر آن هوا می ماند.پس از حدود 10 روز همان مشکلی که دوستان اشاره کردند برای من نیز اتفاق افتاد .صفحه خاموش شده و مارک ال جی روی آن می ماندودستگاه غیر قابل استفاده می شود و آنقدر باطری مصرف می کند تا دستگاه خاموش شود. و برای روش نمودن آن مجددا باید باطری را خارج و وارد کنم.به مرکز تعمیرات ال جی در همان بازار مراجعه و گفتند دستگاه 7 روز از خریدش گذشته و شامل تعویض نمی شود .پس از چند بار مراجعه و توضیحات اینجانب دستگاه را از اینجانب تحویل گرفته و پس از 5 روز هنوز منتظر نتیجه می باشم.در آن موقع اعلام نمودند ممکن است تا وارد شدن دستگاه به کشور 2 تا 3 هفته طول بکشد.دستگاه گارانتی ماد ایران می باشد.توصیه اکید می کنم در انتخاب این دستگاه بی نهایت دقت فرمایید.این متن کاملا منطبق با واقعیت بوده و به دور از هر گونه تبلیغ سو می باشد.لازم به ذکر است که هیچگونه برنامه سنگین بازی و یا اپلیکیشن غیر مجاز نیز بر روی آن نصب ننمودم.",7,13,3,3,3,3,3,3
"طراحي زيبا","هنگ کردن مداوم","خیلی هنگ میکنه! باید یکسره باطریشو در بیارم تا درست بشه",6,11,3,3,3,3,3,3
,,"منم ماهاست خریدم باطریش که فوق العادست.کلا شک نکنین بخرین زود",7,5,5,5,4,5,5,3
,,"این گوشی نصبت به قیمتش حرف نداره
من که خیلی راضیم",11,2,3,3,3,3,3,3
,,"گوشی بسیار خوبی هستش
به نسبت قیمتش خیلی خیلی خوبه",10,2,5,4,5,5,5,4
"طراحي زيبا",باطري,"باطریش. تعریفی نداره ..... من یکساله خریدمش .... باطریش تا ظهر میشه 50 درصد .... اگه میخواین بخریدش حتما به فکره یه پاور بانک باشید",1,6,3,3,3,3,3,3
,,"سلام..من این گوشی روتقریبا دوماهی هست که خریدم ،از همون هفته اول بعد از خرید ،گوشی خود به خود بدون اینکه من کاری انجام بدم صفحه مربوط به آرم ال جی میاد(وخاموش نمیشه) و دکمه پاورش هم غیرفعال میشه و این آرم هست تا زمانی که باتری رو یه بار بیرون بیارم و سر جاش بذارم !تقریبا میشه گفت به طور میانگین هر دو روز چنین مشکلی پیش میاد،گاهی اوقات در یک روز دو بار این اتفاق افتاده! کارهای زیادی انجام دادم ولی فایده نداشتن(به تنظیمات کارخانه برگردوندم هم نرم افزاری هم سخت افزاری ریست کردم--مموری خارجی رو برداشتم،فقط از play storeنرم افزار نصب کردم،حتی نرم افزار های کم اهمیت رو حذف کردم)...نمیشه گفت مشکل همه گوشیای این مدله چون از فامیل هم دو نفر همین گوشی رو دارن ولی تا خالا چنین مشکلی نداشتن،شانسیه ممکنه از هر50 تا یکی اینجوری باشه!",3,5,1,3,3,3,3,1
"دوربين هاي با کيفيت قابل رقابت با j7 2016 که قيمش خيلي بيشتر از اينه خوش دسته با اينکه صفحه نمايش بزرگي داره رابط کاربري زيبا ( نظر شخصي )","يکم کند ميشه بعضي وقتا بعضي وقتا متاسفانه هنگ ميکنه و فقط ارم ال جي هست رو صفحه که بايد باتري رو در بياري دوباره بزاري درست ميشه چنس قاب پشت گوشي خوب نيس رنگ هاي صفحه نمايش هم بر رنگ هست تصاوير البته کنار سوپر امولد سامسونگ","در پایین اعلام کردم در کل گوشی خوبیه راضیم",2,1,5,3,4,4,4,4
"همه چي",نداره,"من نزدیک 7 ماهه این گوشی رو خریدم و ازش راضیم و پیشنهاد میکنم با این قیمت مناسب فرصت رو از دست ندید و سریع سفارش بدین",13,1,4,5,5,5,5,5
,,"دوستان عزیز. اندروید 7 یا نوقا برای این گوشی عرضه نشده. بلکه یه تلفن جدید با نام استایلوس 2 پلاس با اندروید 7 عرضه میشه. لطفا اشتباه نکنید.",8,4,5,5,5,3,4,3
"روان بودن
دوربين سلفي با کيفيت
باتري فوق العاده","نداشتن او تي جي","من نزدیک 6 ماهه این گوشی و دارم.عالیه فقط او تی جی ساپورت نمیکنه..
بازی فول اچ دی رو روون اجرا میکنه",5,1,5,5,3,4,5,3
"زيبايي و قيمت پايين
صفحه نمايش با تراکم پيکسلي پايين",,"گوشی خیلی خوب و خیلی خوشگلی مخصوصا رنگ قهوه ایش که که رنگ انتیکی هست",3,2,3,5,3,4,5,1
,,"من این گوشی رو یک ماهی هست که خریدم، بزرگترین مشکلی که داشتم که تو ذوقم زد این هست که وقتی شب تا صبح میذارمش بالای سرم، صبح حتما صفحه ش خاموش شده گوشی روشن اما صفحه ش روشن نمیشه، تا اینکه مجبور میشم باطری ش رو دربیارم، بعضی وقتها هم یهو ریست میشه و رو ی آرم ال جی میمونه و باید فقط باتریش رو در بیارم، و گویا مشکل رایجی هم هست! گویا باید ببری نمایندگی، تازه من اصلا به جز از گوگل پلی اپ روش نصب نمیکنم!!",9,11,5,5,5,3,5,4
"نک خيلي خوبي داره",هيچي,"عالی است چون هم قیمتش خوب است هم کارایی خوبی دارد",9,0,5,5,5,5,5,5
"دوربين خوب کيفيت صفحه نمايش قلمش خوبه در حد خودش","به نظرمن نداره","من این گوشی رو دو ماهه دارم
از هر نظر بگی راضیم
بادوربینش عکس فرستادم واسه جشنواره قبول شده
سلفیش که عالیه عالیه
رزولیشن صفحه عالیه
قلم یکم کنده خیلی کم
گوشی به روزیه
خوشدسته",6,0,3,5,4,5,5,4
,,"واقعا عالی بود . شبیه به گوشی سامسونگ هستش",5,2,5,5,5,5,5,5
,,"دیگه با این امکانات مفت محضه!!",8,0,5,5,5,5,5,5
"دوربين عالي","کند بودن در بعضي برنامه ها","بسیار عالیه خیلی دوستش دارم",3,1,5,5,5,5,5,5
"خيلي خوبه قلمش , صفحه نمايشش",,عالی,4,0,3,3,3,3,3,3
,,"من تو همون اولا که به بازار اومد خریدم تقریبا 1 ساله که دارمش خیلی عالیه تنها نقطه ضعفش نداشتن حسگر اثر انگشته در غیر اینصورت عالیه",4,0,5,5,5,5,5,5
عاليه,"دو سه تا چيز کوچيکه که اصلا مهم نيست","عالیه عالیه",2,0,5,5,4,5,5,4
"دوربين سلفي
باتري
صفحه نمايش بزرگ
قلم
سبک و خوش دست","واقعا نداره","تو این رنج قیمت نمیتونید مثلش پیدا کنید
گوشی روان و دوربین سلفی عالی",2,0,4,4,3,3,5,3
,,"گوشی خوبیه ولی وقتی چند دقیقه باهاش کار میکنم یا بعد روشن شدن وای فای مدام ریست میشه... یه جورایی خسته کننده س...",1,1,3,3,3,3,3,3
"کاراي بهتر کيفيت بيشتر
قلم ضعيف.قدرت پردازش ضعيف","صفحه ضعيف","من قبلا جی 7 سامسونگ داشتم متاسفانه با وصل کردن به اسپیکر زود سوخت آنقدر متنفر شدم که به سمت ال جی رفتم و استایلوس 2 رو خریدم.
بیشتر از هر گوشی دیگه ای بلا سرش آوردم ولی بسیار مقاومه.
سامسونگ بخاطر کیفیت صفحش لذت کار کردن داره. اما ال جی بخاطر صفه ips این حس رو نمیده ولی همین صفحه هم ارزونتره هم کسی که کنارت باشه نمیتونه گوشیتو چک کنه و هم بخاطر قطر بیشترش مقاومتر محسوب میشه. عیبهای این گوشی اینه که دوربینش منو نداره. تو کپی یا انتقال. کمی سختر از جی 7 هست. تقویمش ضعیفتره. باطریش نسبت به اینکه 2 هسته ایه مصرفش آنچنان تفاوتی با جی 7 که هشت هسته ای نداره.
در کل دیگه هیچ وقت سمت سامسونگ نمی رم نه بخاطر کیفیت بیخودش که از جای معتبری خریدم بخاطر کیفیت بسیار خوب ال جی و تعمیر راحترش و همون کارایش با قیمت ارزونتر",3,2,3,3,3,3,3,3
"طراحي خوب و شيک و ضخامت کم
باتري خوب و سخت افزار متوسط روبه بالا و صفحه نمايش با رنگ هاي طبيعي","برنامه ها تو کارت sd نميره","این گوشی رو من یه یه هفتهای هست که از بیرون خریدم و عالی هست صفجه نمایش بزرگ خوب و با کیفیتی داره و چراغ اعلان داره که بهش تو دیجی کالا اشاره نشده بود.قلمشم دقت خوبی داره و اونقدر اونقدر دقیق نیست ولی باز میگم خیلی خوبه. ایم گوشی طرحیش خیلی خوبه و خیلی نازک هست و قطرش به یک میلی متر نمیرسهو از نوت پنج سامسونگ بزرگتره .از لحاظ سخت اعزاری هم تا حد زیادی نیاز آدم رو برطرف میکنه وا میشه گفت اونقدر ها هم سخت افزارش ضعیف نیست با اینکه رمش دو هست و چهار هستتسس ولی خیلی خوبه بازی هایی مثل ریل ریسینگ و آسفالت هشت رو بدون لگ باز میکنه. به دوستانی که این گوشی رو دوست دارن و میخوان بخرن وشک دارن حتما پیشنهاد میکنم چون خودم همینطوری بودم و شک داشتم ولی تردید نکنید و بخرید خیلی خوبه . دوربینش هم خیلی رنگ ها رو طبیعی میندازه و کیفیتش هم دوربین جلو و عقب عالیه .",3,0,5,3,5,5,5,5
"دو سيم کارت4g صفحه نمايش بزرگ 100gحافظه گوگل","تخليه سريع باتري تو 4gحدود3ساعت بازگشت نور محيط از صفحه قلم جا ميمونه روsdبرنامه مثل تلگرام منتقل نميشه دوربين در حد13نيست otgنداره به تلوزيوناي قديمي وصل نم با پورت فقط10گيگ از حافظه خالي","سلام من 2ماه دارم باش حال نکردم شمارو نمیدونم
من سامسمنگj5وهاوایی y510 داشتم اونام برنامه میفرستادن مموری این نمیفرسته
هرچی دانلود میکنی میره حافظه داخلی حتی تو اپ تلگرام و واتس اپ
بقیش تو نقاط ضعف و قوت نوشتم",3,1,2,3,1,2,4,3
"همه چي",هيچي,"آقا من خریدم خیلی راضیم",2,0,5,5,5,5,5,5
