positivePoints,negativePoints,commentText,like,dislike,"ارزش خرید به نسبت قیمت",نوآوری,"کیفیت ساخت","امکانات و قابلیت ها","سهولت استفاده","طراحی و ظاهر"
,,"با سلام . ضمن تبریک بابت خرید این گوشی یعنی اچ تی سی 10 باید خدمت شما عرض کنم اکثریت خریداران این اسمارت فون از خرید خودشون بسیار راضی و خوشحالن و تجربه من بعد از حدود یک سال استفاده این موبایل هیچ کم و کاستی نسبت به موبایل های جدید تر از خودش نداره و کمبود جدی و خاصی تا بحال گزارش نشده نور صفحه این گوشی عالیه چه در شرایط زیر نور خورشید و چه در محیط‌ های بسته مانند خانه کاملا رضایت بخشه ، این گوشی در شرایط بسیار سنگین کاری مانند وبگردی فیلترشکن دانلود و بازی و شارژ شدن ( همه اینها باهم ) ممکنه کمی داغ کنه که کاملا طبیعیه اما پیشنهاد میشه موقع شارژ شدن از گوشی استفاده نکنید و در اخر کیفیت این موبایل و بقیه تولیدات اچ تی سی به قدری بالاست که معمولا با اپل برابری میکنه و سامسونگ هرگز نمیتونه در صدد رقابت با اچ تی سی و اپل بر بیاد . با ارزوی موفقیت برای همه دوستداران اچ تی سی",7,1,5,5,5,5,5,5
کامل,,"من z2 داشتم و بعد از کلی تحقیق این گوشیو گرفتم همه موبایلی ها میگفتن سامسونگ بگیر که واقعاً همه گوشی هاش شبیه هم هستند ولی اخر کار خودم کردم و htc گرفتم
داغ کردن گوشی وقتی اتفاق میفته که برنامه سنگین باز کنید که طبیعیه و تازه اونقدری نیست که اذیت کننده باشه
اینترنت خط قطع و وصل میشد که علتش تنظیمات apn بود و درست شد
اصدا سپیکرش تیز نیست هدفون حرفه ای دوربین عالی رم 4
تو نظر سنجی اشتباهی ارزش خرید کم زدم حتما پیشنهاد میکنم بخرید",5,0,3,5,4,5,5,4
"سيستم سخت افزاري قوي
طراحي زيبا مخصوصا رنگ مشکيش که فوق العادست
انتن دهي عالي
تو جاهايي که اميدي به 3g بودن ندارين . يهو ميبيند که نت دارين
دوربين جلوي با کيفيت","باطري ..","من الان یک ماهی میشه این گوشی رو دارم ... و کلا یک ادمی هستم که متاسفانه یا خوشبختانه رس گوشیو میکشم و کلا توقعم ازش بالاست :) و کلا تو خانواده اگه من از یه چیزی راضی باشم یا دستم دووم بیاره همه میرن اونو میخرن .. و تا الان ازش راضی بودم گفتنی هارو دوستان گفتن فقط لپ کلامو بهتون بگم ..از پولی که باباتش میدین پشیمون نمیشین ... و شاید گوشی با همین سیستم سخت افزاری تو یک برند دیگه گرون تر باشه ...
دوستان از ضعف های نرم افزاری گفتن که باید بگم مشکل از اندروید مارشمالو هستش نه گوشی و متاسفانه اپدیت هم چاره ساز نیستش ..مشکل کاهش عمر باطری هم از همین مارشمالو هستش که بشدت باطری میخوره ..و اندروید هفتم بدتر از اندروید 6 و واقعا نمیدونم دلیلش چیه جدیدا هر چی اپدیت میشه بد تر میشه البته اینم بگم اندروید هفت رو یکسری گوشی های محدودی جواب داده ...",2,0,5,4,4,4,5,4
"حسگر اثر انگشت فوق العاده قوي،صداي عالي و قوي","با استفاده زياد داغ مي کنه نور صفحه اش در بيشترين حالت ممکن مثل کم ترين حالت نور صفحه گوشي هاي سامسونگه...","کلا گوشیه خوبیه،به نسبت پولی که میدید ولی خب نور صفحه نمایشش آدم رو کلافه و نا امید می کنه... ای کاش صبر میکردم گلکسی اس 8 رو میخریدم...",5,31,4,4,3,4,2,2
عاليه,نداره,"از همه نظر خوب جواب میده فقط باطریش بیشتر 10ساعت پیاپی جواب نمیده
یعنی صبح ساعت 9 بزنی تو شارژ ساعت 9:45پر میشه بعد تا اخر شب 30درصد میمونه میخوابی باز صبح میزنی
ولی اگه کلا دستت باشه ساعت 8تموم میکنه
من منتظر htc 11هستم و هر پرچمداری میاد فقط بهش پوز خند میزنم
و متعهد به htc هستم از وقتی که دستم گرفتم",18,4,5,5,5,5,5,5
"کيفيت ساخت بالا","ميتونست پنل نمايشگر امولد باشه به جاي ال سي دي","گوشی فوق‌العاده ای هست من اول فکر میکردم اس7 بگیرم بهتر باشه ولی این و از نزدیک دیدم ترجیح htc بگیرم",19,0,5,5,4,5,5,4
"سخت افزار قوي
رابط کاربري ساده و روان
طراحي شيک و خاص","فعلا نديدم","از لحظه ای که بگیرید تو دستتون عاشقش میشید. اچ تی سی بازا فقط میفهن این گوشی چیه",22,0,5,5,4,5,4,4
,,"من دیروز بعد از مدت ها بررسی این گوشی رو خریدم و قبلش سونی z1 compact داشتم .
به اندروید 7 اپدیت کردم و هیچ گونه مشکلی هم نداشتم و ندارم .
کیفیت ساخت ، صفحه نمایش ، دوربین اصلی ، سرعت و هدفون عالی هستش .
کیفیت صدای اسپیکرها و دوربین سلفی خوب و کاملا راضی کننده .
از نظر اینترفیس و یوزر فرندلی بودن هم بسیار خوب هستش اما من سونی رو قوی تر میدونم در این زمینه ولی خیالتون راحت که اگر با سنس اچ تی سی کار نکردید به هیچ مشکل و پیچیدگی ایی بر نخواهید خورد ،بسیار طراحی خوب و نزدیک به اندروید خام رو داره .
فینگر پرینت سرعت خیلی خوبی داره ، گوشی به فرامین خیلی سریع و بدون لگ واکنش نشون میده و هرچی که از یه گوشی با کیفیت و پرچم دار انتظار دارید رو برآورده میکنه.
اگر برای خریدش شک دارید اصلا دو دل نباشید ، من این گوشی رو بین تمام رقبای خودش در نظر گرفتم و از نزدیک دیدمشون و خریدمش، مثل dtek 60 بلک بری ، سونی xz ، ال جی g5 , v20 و ....
سامسونگ های سری 7 هم دیدم به جز بخش سلیقه و ظاهر که شخصی هستش من برتری خیلی خاصی ندیدم به این گوشی که بخوام بابتش هزینه بیشتر بدم ، ارزش خرید این گوشی نسبت به محصولات مشابه خیلی بالاتر هست و من پیشنهادش میکنم .
موفق و شاد باشید همگی",22,1,5,5,5,5,5,5
"تاچ ايدي بسيار سريع دوربين خوب با امتياز بالا در dxo جنس بدنه عالي هدفون و صداي عالي کوييک شارژ 3","ضخامت زياد بازار عجيب که با تغيير software version گوشي رو به جاي 401 بت ميفروشن.","من هم تجربه ایفون دارم هم سامسونگ اس 6 و 7...
از سامسونگ راضی بودم ولی خسته کننده شده بود برام...دوربینش خوب بود ولی در حد ایفون نبود و بزرگترین ایرادش اینه که با گوشی ارزون سامسونگ وقتی تو دست یکی میبینیش تفاوت ظاهر انچنانی نمیبینی...
ایفون رو خیلی قبول دارم چون واقعا گوشی رو وقتی دستت میگیری لذت میبری ولی خب من با محدودیت ios مشکل دارم.
ولی حالا htc 10 ...همون حس جنس مرغوب فلز برس خورده ایفون رو بهت میده بدون محدودیت ios...دوربین خوب ولی بازم پایین تر ایفون و صفحه نمایش دلچسب پخش عالی هدفون عالی اندروید ناب 7 از همه مهمتر دست همه نمیبینیش...
در کل تجربه خوبیه اگه htc رو امتحان نکردین.",22,3,3,3,3,3,3,3
"دوربين
کيفيت صفحه نمايش
سخت افزار عالي
باتري بسيار عالي
کيفيت ساخت عالي","نور کم صفحه نمايش در حالت power saving","از خیلی از گوشی های پرچمدار که فقط تبلیغات دارند بهتره",21,0,5,5,5,5,5,4
,,"ترجیح دادم بجای گزینه ای کردن تقاط ضعف و قوت کلی راجع بهش نظر بدم...من اصولا هر وسیله ی دیجیتالی که میخوام بخرم دلو رودشو در میارم تا بخرمش ... در رابطه با نقاط قوت زیاده گویی نمیکنم چون دوستان همه ازش به اندازه کافی گفتن .. فقط در رابطه با نقاط ضعفش و نظر هایی که بعضی دوستان گفتن لازم دونستم توضیحاتی بدم .. اولین نقاط ضعفش رو میشه تو بخش نرم افزارییش میشه دید و این مربوط میشه به اندروید مارشمالو 6.01 و برین تو نت سرچ کنید راه کار هایی داره که میتونید به خداقل برسونید مشکلات رو ..حتما اپدیت اولیه شرکت رو که حدود 60 مگ هستش رو دانلود کنید...مشکل دیگم که البته نمیشه اسمش رو مشکل گذاشت ... کم بودن لوازم جانبی...که البته تو ایران کمه ...ولی کلا بخوام بگم ..من طردار سر سخت سونی هستم ولی این پرچم دار اچ تی سی کاری کرد که بیخیال سونی بشم",14,0,5,4,4,4,5,4
"سرعت بالا
شارژ سريع
کيفيت صفحه نمايش","داغ کردن هنگام شارژ
کيفيت پايين صداي اسپيکر
دوربين متوسط","من یک هفته است که اینو دارم با این قیمت گوشی های با کیفیت تری میشه خرید",1,55,2,4,4,3,2,2
"همه چي عالي","ضعفي نداره","اچ تی سی همه گوشیاش عالیه هیچ ضعفی توش وجود نداره ام ناین پلاس دارم خودم منتظر 11 هستم که بیاد فقط
اچ تی سی گوشیای میان ردش عالیه چه برسه پرچم داراش خودم البته فقط پرچم داراشو میخرم",23,3,3,3,3,3,3,3
"دوربين جلوي عالي
خروجي صدا و هدفون عالي
خوش دست بودن و زيباييش. نسبت به عکساش خيلي زيباتره از نزديک
باتري و سرعت فوق العاده گوشي
حسگر اثرانگشت سريع","حداکثر نور صفحه نمايش بايد بيشتر ميشد
دوربين اصلي ميتونست بهتر باشه ولي راضي کنندست","از لحاظ قیمت که از همه پرچمدارا ارزون تره با اینکه قیمتش با S7 خارج کشور برابره. کیفیت ساختش از S7 خیلی خیلی بیشتره شک نکنید. به هیچ وجه کندی و لگ توش نمیبینید. فقط کاش نور صفحه ش یه ذره بیشتر بود ولی بازم خوبه. تو خریدش شک نکنید",24,3,5,5,4,3,5,3
"همه چيز","نور صفحه يکم کمه ولي ازار دهنده نيست","من این گوشی رو 1هفته س که دارم گوشی خیلی خوب و جالبیه و کیفیت ساخت عالی داره و حسگر اثر انگشتش هم که عالیه. دوربینش خوبه ولی در نور کم تصاویر خیلی خوبی نمیگیره.باتری هم که خیلی سریع شارژ میشه.رابط کاربری هم خیلیییی قشنگه در کل من پیشنهاد می کنم. مطمئن باشید از خریدش پشیمون نمیشید.
من که ازش راضییم",14,0,5,5,5,5,5,4
"دوربين عاااااالي و باتري خوب
ظاهر جذابي داره
بدنه با کيفيت و لوکس
فينگر تاچش بي نظيره و تاچش سريعه
کيفيت صداش فوق العادس","ضد اب نيست
قطرش کمي زياد تر از بقيه پرچمداراس
حداکثر نور نمايشگر کمه
حجم صدا نسبت به قبل کمتر شده
کاش حاشيه نمايشگرش کمتر بود","نمایشگر:این گوشی نمایشگر بسیار با کیفیتی داره و وواقعا میشه حسش کرد. ولی حداکثر نورش نسبت به سایر گوشیها کمتره(360نیت)ک نمیدونم چرا بیشترش نکردن.اما زیر افتاب با اخرین لول نور میشه کاملا خوند متن اینارو.درکل جزو بهترین هاست.
طراحی و کیفیت ساختش بسیار عالیه.گوشی جذاب و خشکلیه خصوصا از نمای پشتی ک طراحی خاص گونه اچ تی سی را داره.من به شخصه جلوشو میپسندم ولی میتونس بهتر باش.کیفیت ساخت این گوشی واقعا عالیه و وقتی توی دست میگیری حس یه گوشی لوکس و گرون راحت القا میکنه ک پوینت مثبتیه براش
از لحاظ نرم افزاری و رابط کاربری هم بی شک یکی از بهترین هاس.سنس8 با اندروید7یا6 خیلی خوب مچ شده و یه حس روان بودن و سرعت به ادم دست میده ک من انصافا با s7e وایفون7کار کردم این حس نگرفتم.نزدیک به2.2گیگ از رم هم ازاده ک بخاطر سنس هست ک سبکه.تاچ گوشی هم عجیییب عالیه و من اکثرن اولین چیزی ک بهم میگن اطرافیان همین تاچشه بعد دوربینش.
از لحاظ سخت افزار و قدرت هم ک نیازی به گفتن من نداره ک عاااالیه و هیچگونه لگ.تاخیر یا افت فریم در بازی ها ی سنگین مشاهده نمیشه.
دوربین ک امسال پیشرفت فوق العاده ای نسبت به نسل های قبل داشته و وواقعا عکس های با کیفیتی ثبت میکنه .امتیاز88هم ازdxoدلیلی بر این ادعاست.من ک کیف میکنم وقتی باهاش عکاسی میکنم.کیفیت فیلمبرداری هم عالیه خصوصا4k.
دوربین سلفیش هم به نظر من بهترین سلفی بین پرچمداراس همراه ایفون7 پلاس.خیییلی تمیز و قشنگ سلفی میگیره.
باتری10 هم رضایت بخشه و با استفاده سنگین راحت1روز ج میده
کیفیت اسپیکرش هم خیلی بهتر از قبل شده و بین همه گوشیها بهتره.هدفونش هم بی نظیره و با اختلاف از سایرین جلوتره.ادم کیف میکنه وقتی موزیک با هدفونش گوش میده.بهترین گوشی در زمینه صداس بی شک.
فینگر تاچش هم بی تعصب سریعترینه.واقعا سریع و دقیقه خصوصا با اندروید7
ارزش خریدش هم با این قیمتی ک پیدا کرده خیلی خیلی زیاد شده و بهترین گزینه تو این رنج.
فست شارژش هم عالیه و توی100دقیقه از0تا100 پر میشه.درکل روزی نیم ساعت ک بزنین شارژ کافیه.
امسال داغ کردن انچنانی توی کار نیست.فقط موقع بازیهای سنگین یا فیلمبرداری 4kبیشتر داغ میشه ک همه گوشیا همینن و 10چون فلز خالص فقط بیشتر حس میشه نسبت به شیشه و فلزیا.البته خیلی هم سریع گرمارو انتقال میده و خنک میشه.
این گوشی بی شک یکی از بهترینای ساخته شده تا کنونه.با اینکه اکثر سایتای ایرانی بخاطر سود خوب سامسونگ ازش تعریف میکنن و اینو میکوبن گوش ندین.نمیگم بهترینه ولی جزو3گوشی برتر سال2016 بود به نظرم. بخرین حالشو ببرین.برای من ک 10 بهترین گوشی دنیاس.امیدوارم با11 بترکونه اچ تی سی.
ببخشید ک طولانی شد",18,0,5,5,5,5,4,2
"باتري فوق العاده و شارژ سريع از هر لحاظ عالي
دوربين عالي
پردازنده قوي
کيفيت صدا قابل قبول
هندزفري فوق العاده و باکيفيت","نبود تنوع گارد و قاب","سلام
6 ماهه دارمش و بدون تعصب میگم تا الان حتی یه هنگی جزئی هم ندیدم حتی تو بازی های گرافیک بالا و در یک کلام عالی
با تشکر",16,0,4,5,5,5,4,4
.,.,"سلام. من این گوشی رو نگرفتم. ولی میدونم از گوشی های گرون قیمت سامسونگ خیلی بهتره من الان 5 سال هست ک اچ تی سی استفاده میکنم تنها مشکل من فقط باطریشه. هر مدلی گرفتم شانسم فقط باطریش بد در اومده. روی دوربین هم یکم کم کار میکنه ولی بازم همه جوره اچ تی سی ماهه. واقعا از کارکردن باهاش خسته نمیشی. شما یه سامسونگ یا... استفاده کنی بعد مدتی ازش خسته میشی اما این مارک خستگی نداره ابدأ
اچ تی سی همیشه حرف اولو میزنه..",17,1,3,5,5,5,5,5
زيبا,"باتري نااميد کننده","واقعا ظاهرش از تموم گوشی های بازار قشنگتره همین هم منو وسوسه کرد بخرمش اما باتریش ناامید کنندس نسبت به گوشی های دیگه مثل سامسونگ که مال دوستم هست اچ تی سی هم دیرتر شارژ میشه وهم خیلی زود خالی میشه صفحه نمایشش هم هی روشن و یهو کم نور میشه خود بخود",0,12,3,3,3,3,3,3
"سيستم پردازشي بالا(820+4 گيگ رم)
باتري با شار ژ دهي مناسب همراه با شارژ سريع
اسپيکر هاي استريو با کيفيت صدا عالي
کيفيت بالاي دوربين اصلي و جلو","لوازم جانبي اين گوشي به راحتي گوشي هاي سامسونگ پيدا نميشه","ادامه نقاط قوت:
کیفیت ساخت گوشی عالی (بدنه به نسبت مستحکم تر در برابر خط و خش و ضربه)
امکان اضافه کردن حافظه جانبی(بصورت حافظه داخلی)
امکانات نرم افزاری ساده و سبک سنس اچ تی سی
کیفیت مکالمه خوب
اپدیت های نرم افزاری اچ تی سی با توجه به سنس 8 (که بسیار به اندروید خالص نزدیک شده و از وجودنرم افزار های اضافی اولیه پاک شده)سریع تر از سالهای قبل انجام میشود.اندروید 7 بعد از 98 روز برای این گوشی اومد
کیفیت صفحه نمایش و شدت روشنایی خوب
سنسور اثر انگشت با عملکرد عالی
هندزفری عالی",13,1,5,5,4,5,5,5
"همه چي",هيچي,"من دو سه روزه گرفتم عالیه مخصوصاً رنگ مشکیش خیلی با کلاسه ،فقط نمیدونم چرا بعضی وقتا صفحه نمایشش نورش زیادو کم میشه ولی درکل خیلی راضیم چونکه واقعا دوست داشتنیه",8,1,3,3,3,3,3,3
"حسگر اثر انگشت خيلي قوي کيفيت صدا","نور صفحه خيلي ضعيف...","من پیشنهاد نمیکنم خلاصه s7 سامسونگ خیلی سر تره",8,67,4,4,3,4,2,2
"پردازش گر قوي
زيبا
حسگر انگشت سريع
دوربيين محشر
اسپيکر عالي و بدنه فلز","يکم تو دست سر ميخوره و ليزه","عالی بازی ها رو خوب و بدون لگ و تیک زدن اجرا میکنه
:D رو خیلی راحت روش باز کردم و بازی کردم عالیه mkx",23,4,5,5,5,4,5,3
,,"فقط در یک کلام میشه گفت عالیه.
عالی بودنش رو هم فقط تو کار کردن باهاش میشه متوجه شد.
آپشنای جانبی واسه تبلیغ کردن و نشون دادن به دوست و اشنا زیاد نداره و تمرکزش رو گذاشته روی نیاز های اصلی مثل مدیریت رم و حافظه و پردازنده و سکیوریتی.
دوربین اصلی کیفیت خیلی خوب و عالی داره البته بهترین نیست.
ولی دوربین سلفیش بهترینه و کاملا عملکرد یه دوربین اصلی رو داره.
صداش و تکنولوژی Boomsound که نیازی به تعریف نداره.
شارژ سریع نسخه 3 هم فوق العاده س.
باتری 24 ساعت راحت برای کسی که خیلی از گوشی استفاده میکنه جواب میده.
سنسور اثر انگشت هم بسیار سریع هست و اصلا متوجه نمیشید که گوشیتون قفل بوده.
طراحی بدنه ش هم با رنگ carbon gray هم خیلییییی به دل من نشسته.
الان 3 ماه هست که گوشی رو دارم و نقطه ضعفی توش ندیدم.
امیدوارم مفید بوده باشه.",26,1,5,5,5,5,5,5
"حريف نداره",هيچ,"سلام دیجی کالا الان از اپل بالای 300نوع قاب و گلس داری ولی من از این فقط یه گلس دیدم که اونو هم همه مغازه ها دارن
یه چند تا قاب بیار بابا هر جا میرم یا هوشمند دارن یا یه نوع نیلیکین که اکثر هم سیاهه من به قابای رنگی احتیاج دارم حتی ژله ای از سایتای دیگم میترسم بخرم چون فقط به دیجی کالا اعتماد دارم گوشیمو هم از جای دیگه خریدم پشیمونم به خاطر پنجاه تومن بدون گارانتی خریدم
لطفا لوازم جانبیشو بیار قول میدم استقبال کنیم
انقد قاب اپل اعصابمو خورد میکنه",25,0,5,5,5,5,5,5
,,"یه ماهه دارمش عالیه",17,0,5,5,5,5,5,4
"طراحي عالي
دوربين عالي
نرم افزار عالي مخصوصا با رابط کاربري خود شرکت
اسپيکر و هندزفري بسيار با کيفيت
fast charge 3.0","ضد اب نبودن
برامدگي دوربين
کافي نبودن نور صفحه زير افتاب","این گوشی واقعا ارزش خریدن داره من که عاشقش شدم
به جز چند مورد خیلی ریز که شاید من حساس شدم بقیش حرف نداره
واقعا پیشنهاد میکنم",13,0,5,5,4,5,5,3
"همه چي","من که نديدم","عالییییه..... اپروز به دستم رسید و کاملا از همه نظر راضیم .... خیلی گوشیه قشنگیه مخصوصا در رنگ طلایی (هر کس با رنگ طلایی موافقه لایک کنه)",21,4,3,5,5,5,5,5
راحتي,,"خرید این گوشی رو توصیه میکنم
عالی و بدون ضعف",9,0,5,5,4,5,4,4
"همه چيش","داغ کردن گوشي هنگام شارژ","همه چیش واقعا عالیه از نرم افزار بگیر تا سخت افزار
تنها مشکلاتی که میتونم ازش بگیرم اینه که باتریش یکم ضعیفه که میگن با اندروید 7 درست میشه اون یکیشم اینه که گوشی خیلی از مواقع موقع شارژ شدن داغ میکنه که زیاد اذیت کننده نیست
به این زودی هم آپدیت نکنین اندرویدش رو چون تازه یکی دو ماهه که اومده باگم زیاد خواهد داشت. یه 1 ماه دیگه هم صبر کنید",8,0,3,4,5,4,5,4
