باطري،دوربين،صدا,"نداره ،کامل ترين پک 2016","سلام،فقط چند روزه گوشیو خریدم و هنوز نمیتونم بررسی کامل گوشیو بذارم ولی در نگاه اولیه میتونم بگم فوق العاده س این گوشی.
،باطری و شارژر عاااالی،صدا چه اسپیکر چه هندزفیری عاااالی
فقط چن تا نکته:اول اینکه قیافه گوشی ظریف تر از عکس هاست و تو ظاهر ضخامتش کمتر از اس7 دیده میشه.در حالی که تو عدد ضخامتش بیشتره.
دوم اینکه رنگ طلایی با اونی که تو عکسای دیجی هست فرق میکنه ،به سمت مسی میل کرده یکم ،من بیشتر میپسندم،شیک تره ،اما از نزدیک ببینین تا بپسندین.یه عکس هست که خیلی شبیه به رنگ واقعیشه و اخر نظرم میذارم.
سوم فوکوس لیزری دوربینه که باید سنسورش کامل تمیز باشه وگرنه گوشی پیام میده که تمیز کنین و با دستمال کاغذی این کارو بکنین و این پیغام چیزیه که شرکتای دیگه هم باید در مورد فوکوس لیزری به گوشیاشون اضافه کنن.
بازم چیزی ببینم بهتون میگم.",16,3,4,5,5,4,5,3
"[""کدومو بگم""]","[""ندارد""]","سلام نظرات قبل منو خوندید حتما ،الان بعد از خرید این گوشی میخوام نظر بدم چون نظرات قبلیم بیشتر به خاطر پنج گوشی اچ تی سی که قبلا داشتم بود.
همونطور ک فکر میکردم عالی سرعت و روانی بالا. صفحه نمایش عالی نه به اندازه گلکسی.کیفیت اسپیکر نسبت به ام8 کمتر ولی هدفون های رز بسیار بسیار بسیار بالا و دیونه کننده که میتونی با توجه به شنوایی و محیط با نوع و زمان اهنگ گوش کردن شخصی سازیش کنی .شارژ با سرعت.دوربین که جای حرف و حدیث نداره بهترین سلفی بازار و دوربین اصلی ک عالیه سه برابر بهتر از ام8 ک داشتم .زیبایی هم که اچ تی سی داراش میدونن خاص و باکلاس ..سرعت و دقت حسگر اثر انگشت هم حساب عالیه من هنوز موندم چرا ملت بخاطر یه سیب گاز زده پول به ایفون میدن خوشحالم که بازم نرفتم سراغ ایفون. امیدوارم که کمکتون کرده باشم واسه من که از قبل معلوم بود. عاشقای اچ تی سی بلایکن بخرید لذت ببرید دوستان",31,3,5,5,5,5,5,5
"کيفيت ساخت بسيار بالا و رابط سريع مثل نکسوس ها
منتقل کردن حس کالاي لوکس و شارژ سريع و با دوام
صداي عالي هم در هدفون هم اسپيکر ها
صفحه نمايش خيلي خيلي خوب و چشم نواز و تاچ سريع
اثر انگشت پر سرعت و دوربين عالي هم در پشت و هم در سلفي","نبود لوازم جانبي
ديگر هيچ","سلام من خیلی نظرات رو میخونم تا بتونم خرید خوبی داشته باشم اینجا هم نظر میدم تا بقیه راحت بتونن بفهمن که چجوریاس این گوشی
کیفیت ساخت بسیار عالی هستش طوری که دست میگیرین واقعا امکان نداره نگید بالاترین کیفیت رو داره
صفحه نمایشش خیلی خوبه من قبلش نوت5 داشتم ولی این از اون هم بهتره تاچش هم عالیه
سرعت گوشی واقعا زیاده مثل نکسوس ها روون و رابط کاربری دلچسب تری نسبت به اون ها داره امکان نداره ذره ای تاخیر بی جا ببینید
دوربین ها واقعا عالی هستن و کاملا راضیتون میکنن اختلاف ها تو مقایسه ها واسه این به چشم میان چون دارن مقایسه میشن وگرنه به قدری خوب هست که نشه ایرادی گرفت
صداش معرکه س.من قبل نوت5 هم ام9 داشتم از اون صداش بلند تره و کیفیتش هم عالیه مخصوصا تو هدفون که این هدفون های های-رز خودش واقعا غولیه.یه هدفون پایونییر از همین دیجی گرفتم در مقابل اون هدفون هاش واقعا بهترن بیس و تفکیک عالی صداش به قدری بلنده نمیشه گذاشت تا اخر
باطریش هم تقریبا 6.30 ساعت صفحه روشن میده که با توجه به استفاده من دو روز جوابمو میده
از 20 درصد تا 100 تقریبا 70 دقیقه طول میکشه شارژش
خیلی خوش دست هم هست و با کلاس.با اعتماد به نفسه کامل از جیبتون در میارید
من مشکی گرفتم از علاالدین قیمتش از اینجا پایین تر بود ولی خب این گارانتی پرشین سلو هست گوشی من اینتره همون همراه سرویس
تنها ایرادش نبود لوازم جانبیه که مهم نیس چون گلس نمیزنم
حسگر اثر انگشتش عالیه یعنی اصلا خطا نداره حتی یه بار.یادمه نوت5 رو با ایفون دوستم مقایسه میکردم انگشتشو از بالا میزاشت یعنی برعکس باز هم باز میکرد خیلی جالب بود واسم اینم دقیقا همونجوریه از همه جهات باز میکنه حتی اگه فقط رو به بالا انگشتو ست کرده باشین با این تفاوت که سرعتش از ایفون 6اس بیشتره.
من بسیار راضی هستم شاید یکی با ملاک هاش جور نباشه خیلی راضی نباشه
ولی نکته منفی به چشمم نخورد و کاملا عالیه پیشنهاد میکنم حتما بخرید",45,4,5,5,5,5,5,5
"از نظر مني که 3 ساله m7 دارم وبا htc کار کردم .يايک گوشي تمام عيار روبرو هستيم","عدم وجود نمايندگي هاي فعال زيادي همچون سامسونگ .اگه htc هم عين سانسونگ خوب تبليغات ميکرد الان فروشي نجومي داشت","اول از همه از دیجی کالای عزیز تقاضا دارم که دوباره این گوشی خوب رو پیشنهاد شگفت انگیزش کنه.
ای کاش ای کا اااااای کاش .htc هم یه نمایندگی فعال و خوب تو ایران داشت
اینجوری خیال ما طرفداداشم راحت میشد",19,1,5,5,5,5,5,5
"رابط کاربري روان. حسگر اثر انگشت بسيار سريع. خوش دستي و زيبايي. صداي فوق العاده با کيفيت. تک بودن و آس بردن گوشي","از نظر من ميتونست دوربين بهتري باشه البته دوربين سلفي عاليه","من این گوشیو دیروز تهیه کردم. باید بگم بسیار روان و خوش دسته و علاوه بر اون احساس تک بودن به ادم میده و نظر مردمو جلب میکنه. من باید بین z5primum/htc10/lg g5/samsngs7/phone6/یکی رو انتخاب میکردم که اول از همه g5رو به خاطر ظاهر نه چندان دلچسبش رد کردم و بعد اپل رو به دلیل همه گیر بودنش ولی گوشیه خوبیه و بعد سونی که از همون اول به دلم نشست و بعد بین اس 7واین گوشی 10گیر کردم و علی رغم تشویق تمام فروشنده ها به سامسونگ. اچ تی سی گرفتم و از تصمیمم راضی هستم ولی دوربین جای بهتر شدن داشت ولی در کل گوشی با کیفیت و بی نهایت آس و تک است. در خریدش تردید نکنید. امیدوارم کمک کرده باشم",23,5,4,5,4,5,5,4
"[""طراحي زيبا و ارگونوميک"",""کيفيت بالا"",""اندرويد خالص "",""کيفيت صدا عالي""]",[],"من در خرید این گوشی تردید داشتم. راستش به s7 و 6s هم فکر کردم.چون قبلا هم one x داشتم و راضی بودم دوباره به HTCاعتماد کردم و 10 رو خریدم. الان کاملا راضی هستم. شاید رو کاغذ HTC یه جاهایی ضعف داشته باشه ولی وقتی گوشی رو تو دستتون میگیرین اینقدر با کیفیت و متفاوت هست که کاملاً راضی میشین. راستی ضخامت گوشی اذیت کننده نیست اصلا چون طراحی گوشی عالی هست.",24,1,4,5,5,5,3,3
[],[],"باتری رو واقعا 10 بهتر عمل کرده ولی نمی دونم چرا منکرش میشید اختلافش هم خیلی فاحش هست",19,2,5,5,5,5,3,5
,,"دوستی که فرمودید نمره دوربینش زیاده ولی کیفیت خوب نیس اگر خوب نبود قطعا این نمره رو نداشت و تقریبا همه میدونن که مشکل دوربین مال قبل از اپدیت بود و الان کارایی عالی شده و قطعا بهتر هم خواهد شد اون یکی دوستمون که میگفت نیاید بگید از اپل بهتره اخه برادر شما وقتی هیچکدوم از گوشیای سری one htc رو دستت نگرفتی برا چی میای نظر کاشناسانه میدی و بقیه رو گمراه میکنی بنده بعد از 2 سال استفاده از m8 با اینکه حافظه 32 گیگش پر شده ولی بسیار سریعه مثل روز اول و هنوز هنگی ازش ندیدم گوشی من داخل اب هم افتاده و هنوز عالی کار میکنه اون یکی دوستمون که برندا رو مقایسه کردن اچ تی سی برندی بود که اندروید رو اورد برندی بود که گوشی لمسی رو مود کرد آیمیت گوشی های نسل قبل اچ تی سی بود ک با قلم کار میکرد و همه میدونن که خدای کیفیت ساخت وعمر گوشی هست و اگر تبلیغات شدید سامسونگ علیهش نبود الان جز 3 برند پر فروش دنیا بود در اخر عرض کنم دوستانی که میخواید گوشی بخرید من فقط و فقط htc 10 رو توصیه میکنم چون ارگونومی s7 بدترین ارگونومی هست که در تلفن های هوشمند دیدم و جی 5 زیر نور افتاب اصن قابل دیدن نیست و اپل هم نصف اندرویدی های امسال بهتون امکانات میده",23,3,5,5,5,5,5,5
---,---,"دوستان لطفا"" وقتی نقد و نظری می نویسند بدون هیچ گونه جانبداری نسبت به برند خاصی باشه تا دوستانی که می خواهند از نظرات شما ها به عنوان راهنما برای خرید استفاده کنند دچار سردرگمی و انتخاب اشتباه نشوند و اگر من عاشق برند خاصی هستم ( به همین دلیل نقص ها و کاستی هاش برام مهم نیست ) نباید این مورد در نوشتن نظر های من تاثیر بگذارد و بایستی اگر بررسی و مقایسه خاصی انجام داده ام واقعیات را بنویسم حتی اگر مخالف میل و علایق خودم باشه باتشکر از همگی دوستان",28,2,3,4,3,3,4,2
,,"تا حدودی با نظر شما موافقم ولی من خودم lg g5 دارم اصلا هم زشت نیست و تا حالا ندیدم کسی بگه گوشیت زشته.
در ضمن HTC10 هم به سرعت از پس همه کاری بر میاد و زیبایی خاصی داره...",17,1,4,4,4,4,5,4
"[""عاااالي""]","[""چيزي نديدم واقعا ""]","آقا این گوشی فوق العاده است ، حسی که به آدم دست میده موقع کار کردن باهاش رو با هیچ گوشی تجربه نمیکنید ، اینو مطمئن باشید",17,2,5,5,5,5,3,5
,,"سلام من قبلا اچ تی سی داشتم گوشی خوبیه فقط مشکل خدمات پس از فروش داره یعنی قطعاتش به سختی گیر میاد و لوازم جانبی هم همینطور واگر گوشی باز باشید برای عوض کردنش مشکل دارید یعنی گوشی دست دوم و خیلی به سختی وارزون میخرند",10,22,3,3,3,3,3,3
"[""شارژرسريع دوربين فوقالعاده سيستم عامل روان و....""]","[""مگه ميشه مگه دازيم""]","من گوشی باز هستم و همه گوشی های پرچمدار تست زذم واقعا این گوشی همه چیز تمامه از هر لحاظ",14,2,2,5,5,5,5,2
,"تک سيم کارت","البته تک سیم کارت بودن ذاتاً عیب نیست. ولی وقتی قرار است این قدر هزینه نماییم، و از طرفی با توجه به اینکه افراد ممکن است دو سیم کارت داشته باشند و یا برای دیتا از سیم کارت دیگری استفاده کنند، برای خیلی از کاربران خرید گوشی تک سیم کارته توجیهی ندارد.",5,5,1,4,2,3,4,3
"[""دوربين.کيفيت ساخت .صداي شفاف.سرعت و رابط کاربري عالي.شارژ سريع ""]","[""نداره""]","من واقعا نمیفهمم اون دوستی که میگه شارژ وایرلس نداره اصلا چیزی درمورد این تکنولوژی میدونه؟؟داداش گوشی فلزه .مگه میخوای اتیش بگیره؟شبیه این میمونه که 2تا فلز رو بزاری تو مایکروویو جرقه بزنه خونه بره هوا.عجب .اگه سامسونگ وایرلس داره واس اینه که شیشه هستش.پس دلیل منطقی بیار.من خودم این گوشی رو دارم بهترینه هیچ گوشی رو دستش نیست باید ی ساعت باهاش کار کنی تا بفهمی.از سر تعصب نیست حرفام اگه از هرکی ک این برند رو داشته سوال کنی میفهمی که چی میگم.ادم اصلا دلش نمیاد گوشی رو عوض کنه.اگه الان همه میگن اچ تی سی دیگه تموم شده فلانه واسه اینه که اچ تی سی تبلیغات رو دست کم گرفت و خیلیا تا حالا گوشی های این شرکت رو دست نگرفتن میگن بدرد نمیخوره فلانه.شماها رفتین چهار جا خوندین که اچ تی سی بده فلانه چنانه داغ میکنه و ....همش حرفه من ی 816هم دارم اونم الان 2ساله دارم خدا شاهده یک بارم هنگ نکرده.کلی هم از دستم افتاده فقط ی ترک ریز رو اسپیکر بالاش افتاده.",5,2,5,5,5,5,3,5
"[""گفتن دوستان""]","[""گفتن دوستان""]","من فقط این رو میخام بگم,از نزدیک دستتون بگیرید گوشیو حس خوبی بهتون دست میده.و شیک و زیبا هست.اما برای کسایی ک روی برند تعصب ندارن میخام بگم,ک نوت5 رو هم ب جد درنظر داشته باشید.اون هم واقعا از لحاظ زیبایی چیزی کم نداره ازین گوشی.من به شخصه بعد از کلی بررسی, نوت 5 رو انتخاب کردم.اما این گوشی هم گوشی خوبیه اگه تعصب دارید روی اچ تی سی,بخریدش و حالشو ببرید.",7,3,3,5,4,3,4,3
"همه چي","گرون تر بودن نسبت به همرده ها
نداشتن قابليتي خاص","دوستان من خودم یکی از طرفداران اچ تی سی و سونی ام و واقعا از وضعیت فعلی این دو شرکت ناراحتم چرا که هردو در بخش موبایل دارن ضرر میکنن اما یکی از بزرگترین سیاست های غلط این دو شرکت قیمت بسیار بالای محصولات اون هاست و من مشتری به عنوان یه طرفدار دوست دارم چیزی که دارم میخرم ارزش خرید داشته باشه اگر موضوع قیمت نبود این گوشی رو حتما میخریدم اما به عنوان مثال رقیبانی مثل سامسونگ و الجی و هوآوی واقعا قیمت های مناسب رو در کنار امکانت مشابه در اختیار کاربر قرار میدن قیمت در اصل برای من مهم نیست مثلا آیفون 6 اس پلاس 128 گیگ هم جزو گزینه هام بود اما به دلایلی از بین گزینه هام حذف کردم اگر میخواید یه گوشی فوق العاده با حس کیفیت میخواید این گوشی بهترین گزینس اما اگه چندان به اینکه کیفیت رو احساس کنین اهمیت نمیدین رقبای زیادی برای این گوشی وجود دارن در نهایت برتری های این گوشی در مقایسه با همرده ها:
قاب پشتی فلزی با ارگونومی بسیار بالا
حسگر اثر انگشت خیلی سریع
رابط کاربری سبک و نزدیک به اندروید خام
دوربین جلو
فیلم برداری کیفیت صدا ی بلنگو و هدفون",3,0,3,5,5,5,5,3
"[""رابط کاربري ساده\nدوربين با کيفيت\nجنس بدنه خوب\nو...""]","[""طراحي ضعيف و قطر بسيار زياد!""]","این گوشی از همه لحاظ عالی هست اما از نظر طراحی بسیار ضعیف عملکرده مخصوصا قطر آن زیاده 9میلی متر در مقایسه با بقیه پرچمداران زیاده در حالی که بقیه کمپانی ها دارند قطر گوشی خود را کاهش میدهند این برعکس عمل میکنه!!!",2,12,3,4,4,3,1,4
,,"از همه لحاظ عالی",21,3,5,5,5,5,5,5
,,"سلام.خیلیا میخوان بدونن که این بهتره یا اس 7.اگر میخواین بدونین اینو کامل بخونین.
طراحی:اول از همه باید بگم که سلیقه ها متفاوته.و همچنین کاربری ها.اگر براتون ضد آب بودن مهمه اس 7 رو بردارین.اما اگر بدنه با کیفیت فلزی و ظاهر پریمیوم براتون مهمه اچ تی سی 10 بهتره.در دست واقعا اچ تی سی حس بهتری رو میده.همچنین مقاومتش در برابر ضربه بالاتره.(اینو طبق گفته ی سایتا میگم و اصلا پیشنهاد نمیکنم هیچ کدومو بندازین ولی در کل من اچ تی سیو بیشتر تو طراحی قبول دارم.
ا صفحه نمایش: در یک کلام.اس 7 بهتره.هر جور حساب کنین بهتره.اچ تی سی 10 هم عالیه و اصلا بد نیست ولی صفحه نمایش سامسونگ یه چیز دیگس.
بلند گو:اگر بلندگو براتون مهمه قطعا اچ تی سی 10 بهتره.خیلیم بهتره. اس 7 از لحاظ صدا به خاطر ضد آب بودن بلندگو هاش ضعیف شده.اما اچ تی سی همیشه تو بلندگو ها حرف اولو میزنه.
دوربین:بخشی که خیلی سرش دعواس همین بخشه.طرفداری هر کدوم میگن مال ما بهتره.من کلی از عکساشونو با هم مقایسه کردم و چیزی که میگم کاملا عادلانس.در بخش کیفیت دوربین اصلی اس 7 کمی بهتره.نه خیلی زیاد فقط یکم.و دوربین اچ تی سی 10 کاملا راضیتون میکنه.ولی به هر حال اس 7 بهتره.اما دوبین سلفی اچ تی سی 10 بهتره و جزئیات زیادتری نمایش میده.و اگر اشتباه نکنمois هم داره.
سخت افزار:این بخش به نظرم زیاد روش حساس نشین بهتره.هر دو عالین و بازی هایی که تا چند سال بعد میاد رو پشتیبانی میکنن.مفهوم هنگ تقریباً توشون نیست و حتی میشه گفت لگ هم نمیزنن.کاملا هر دو روانن و به نظرم برتری خاصی نسبت به هم ندارن.تو بنچ مارکا هم مثل همن.
نرم افزار:اچ تی سی تو پرچمدار جدیدش سعی کرده تا به اندروید خام گوگل نزدیک بشه.در حالی که سامسونگ رابط کاربریش رو سبک کرده اما هنوز پر از قابلیته.در کل اچ نی سی خیلی باکلاس و مجلسیه و اس 7 رابط کاربری جذاب تری داره.در کل من اس 7 رو بیشتر میپسندم اما از نظر خیلیا اچ تی سی بهتره و نظر اونا کاملاً محترمه.در کل اینم سلیقه ایه.
سنسور ها:این بخش بخش خیلی مهمی نیست ولی بازم خالی از لطف نیست گفتنش.فینگر پرینت هر دو واقعا عالیه.اما اچ تی سی به نظر میاد یکم بهتره.در عوض سامسونگ سنسور برای کنترل سلامتی داره.و بقیه ی سنسور هارو هردو دارن و همه خیلی خوب کار میکنن.ولی در کل اس 7 کامل تره.
باتری:این بخش تقریباً مهم ترین بخشه.و باید بگم که اس 7 بهتره تو این بخش.علاوه بر این که زودتر شارژ میشه ماندگاری شارژش هم بیشتره.اچ تی سی 10 بد نیست ولی اس 7 بهتره.
سعی کردم تو این مقایسه کاملاً راستگو باشم و چیزیو از قلم نندازم.امیدارم کمکتون کنه",27,15,1,5,3,5,3,1
[],[],"سلام دوستان اگه اچ تی سی دوست داری خوب استفاده کن لزومی نداره بحث کنین. htc درسال 1997 تاسیس شد واولین گوشی هوشمند خودش رو سال 2008 تولیدکرد سودخالصش 4میلیارد ولی روبه نزول. اپل درسال1976 تاسیس شد وسود خالصش 37 میلیارد بود اولین گوشی هوشمندش رو سال 2007 تولیدکرد. اولین گوشی هوشمند دنیا توسط شرکت ال جی وسامسونگ ساخته شده. سامسونگ یک شرکت خوشه ای وچندملیتی که سال 1938 تاسیس شده وسودخالصش 30میلیارد درسال 2013 بوده.اولین گوشی باقابلیت ضبط اچ دی درجهان رو ساخته. سامسونگ الکترونیک بزرگترین شرکت فناوری اطلاعات دردنیاس وصفحه نمایش خیلی از برندها وهمینطور اپل روقراره تولیدکنه گوشی نوت 5 سامسونگ به عنوان محبوب ترین گوشی درامریکاشناخته شده است وهمچنان سامسونگ واپل تاپ ترین برندها دردنیا هستن هم ازنظر فروش اعتبار قدمت ومحبوبیت برای اثبات حرفام برین سوابق شرکت هارو بررسی کنین.ممنون ذوستای گلم",11,26,3,3,3,3,3,3
,,"اچ تی سی 10 گوشی کامل و بدون نقص هستش.خیلی ها میگن اس 7 بهتره.ولی حواسشون نیست که اگه گوشی اس7 از دستشون بیفته پشت گوشی چه اتفاقی واسش میفته.این یکی از نقص های اس7 بود......",5,2,5,5,5,5,5,5
"[""کيفيت بالا و رابط کاربري فوق‌العاده""]","[""دوربين بيرون زده با وجود ضخامت زياد""]","سلام HTC10 بااینکه ضخامتش زیاده دوربینش بیرون زده و این یکم تو ذوق میزنه غیر از این مشکلی نداره رابط کاربریشم بهترینه",3,5,4,5,3,5,4,0
[],[],"قبل از خرید ال جی جی 5 رو هم بررسی کنید اگه باز هم خواستید این گوشیو بخرید اس 7 سامسونگو بررسی کنید بازم اگه خواستی اینو بخری یه بار با اس 6 ایفون کار کن بعد ببین واسه این پول میدی یا نه!",11,17,3,3,3,3,3,3
"[""همچي ""]","[""دوربين""]","سلام خدمت دوستان اگر راستشو بخواهید این گوشی برخلاف نمره dexo markعملکرد خیلی بالایی در کیفیت ندارد ولی منظورم اینه تو یه همه ی شرایط عملکردش فرق میکند اگر برای کیفیت دوربین گوشی میخرید به سمت اس6 و جی5بروید البته بنظرمن این گوشی بهترینه تو2016حدا عاشقشم و دوربینش واسم مهم نیست ولی مطمعن باشین دوربین سلفیش تکه ببخشید سرتونو در اوردم.",4,30,3,5,5,5,4,3
