"کيفيت ساخت بدنه تکه تک کيفيت صدا تکه تک باتري تکه تک دوربين عالي کيفيت صفحه نمايش عالي خوش دست بودن تکه تک سنسور اثر انگشت تکه تک","صفحه نمايش عاليه اما ميتونست خيلي بهتر باشه","سلام.طولانیه ولی ارزششو داره بخونی چون میخای انقد هزینه کنی (نمره هایی ک تو هر بخش دادم از 100 میباشد)
سال 2016 سال سقوط سامسونگ بوده.اکثر گوشی های 2016 سامسونگ مشکل شارژ و باتری داشتن و سری note هم ک داستان خودشو داشت من بین s7 و g5 و htc10 مونده بودم و بعد از تحقیق فراوان و مشورت و سرچ این رو خریدم بررسی فقط htc10 و در بعضی جاها مقایسه با سامسونگ s7 و lg g5
الان دیگه سخت افزار گوشی های پرچمدار ب قدری قویه ک تفاوت چندانی با هم ندارن و توی کار کردن کم نمیارن بنابر این تو این بررسی کاری با سخت افزار ندارم و ب مسایل کلیدی پرداختم از نظر من ی گوشی باید تمامیه مسائل رو با همدیگه در سطح قابل قبول رو ب بالا داشته باشه و اینکه ی گوشی مثل lg g5 دوربین عالی داشته باشه اما ازون طرف کیفیت ساخت بدنش راضی کننده نباشه بدرد نمیخوره یا مثلا سامسونگ s7 کیفیت صفحه عالی داره اما از نظر عمری بودن گوشی ضعیفه
یسری امکانات هم مثل سنسور ضربان قلب جنبه تجاری دارن و فاقد ارزش برای مصرف کننده هست و یسری امکانات مثل ماژول در جی5 از نقاط ضعف و کانون خرابی گوشی در استفاده مداوم محسوب میشن
برای من قبل از امکانات گوشی کیفیت ساخت بدنه اهمیت داره چرا ک میخام وقتی اینقد هزینه میکنم حدود دوسال داشته باشمش بدون استرس خرابی و ترس افتادن گوشی و شکستن صفحه یا پشت آن بنابراین بدون تردید بدنه یکپارچه آلومینیوم htc10 هم استرس رو از شما میگیره هم حس برتری میده ب شما
کیفیت صفحه نمره. htc10=75. samsung s7=85)
در حد قابل قبول است و مسلمأ شمارو راضی نگه میداره و زیر آفتاب هم راحت قابل استفاده است.درسته ک صفحه s7 از این سرتره اما در نظر داشته باشید ک مقاومت این در برابر ضربه خیلی بالاتره در نتیجه عمری تره (درسته دوتاشون گوریلا گلس4 دارن اما خودمونیما حتما ی فرقایی دارن ک این بعد 32 بار سقوط از ارتفاع میشکنه اما s7 بعد 2 بار)
تاچ:(نمره. htc10=100)
بسیار روان و ب اصطلاح لیز بوده و با کوچکترین اشاره عمل میکنه
نکته مهم اگه مثل من دستتون زیاد عرق میکنه بدون هیچ مشکلی گوشی رو استفاده کنید چون تاچش هنگ تو کارش نیس اینو واسه این گفتم چون گوشی قبلیم ک 10روز فقط داشتمش تا یکم دستم خیس یا عرقی بود قاط میزد و رو اعصاب بود
باتری:(نمره. htc10:90)
بدون تردید از نقاط قوت این گوشیه و با استفاده بسیار سنگین راحت 24ساعت جوابگو میباشد
اسپیکر و هنزفری:(نمره. htc10=95)
ما ی بلندی صدا داریم ی شفافیت و وضوح صدا
کسانی ک بلندی صدا میخان برن glx بگیرن چون فک میکنم از همه گوشی ها بلندتره اما اگر کیفیت صدا در کنار بلندی و وضوح و شفافیت میخاین بدون شک htc10 هنزفری هاشو ک اصلا حرفی برای گفتن ندارم دوربین:(نمره. lg g5=100. htc10=90) کیفیت دوربین حدی دارد ک امروزه اکثر پرچمداران اون حد معقول رو دارند و این گوشی انتظارات مارو براورده میکنه حالا دوربین lg g5 یا s7 بهتر هم باشه اما سایر نقاط قوت گوشی هم مطرحه لرزشگیر اپتیکال دوربین پشت و سلفی دارد ک عالی است سنسور اثر انگشت:(نمره. htc10=95) دکمه لمسی و هم سطح با بدنه گوشی ب زیبایی و عملکرد بهتر سنسور کمک کرده و خیلی از s7 ک اولا دکمه فشاریه و ثانیأ توی طراحی سطحش از بدنه بالاتره و بسیار زشت شده ,بهتره یا از lg g5 ک پشت گوشی بوده و استفاده سخته
بدون تردید سریع ترین عملکرد رو htc10 داره(0.2 ثانیه)
ی نکته درباره سنسور این گوشی ک جایی ازش صحبت نشده اینه ک ب مرور زمان هرچی بیشتر استفاده میکنید انگشت شمارو بهتر شناسایی میکنه
شارژر:(نمره. htc10=95)
در عرض حدود یساعت از 0 ب 100 درصد میرسونه
آنتن دهی:(نمره. htc10=100)
کاملا بدون مشکل و همیشه در دسترس هستید
در نهایت پیشنهاد من ب شما:
گوشی htc10 همه امکانات رو در کنار هم داره و بدون تردیداز همه لحاظ از s7 برتره بجز کیفیت صفحه و از همه لحاظ از g5 سرتره ب جز دوربین
اگر اونقدری پول دارید ک هر 6 ماه یا یکسال گوشیتون رو ب دلیل افت قدرت سخت افزار یا خرابی های ناشی از باتری و ... نو کنید یا اگه افتاد و شکست جدید بخرید برید سامسونگ s7 بگیرید چون کیفیت صفحش فوق العادس اما کیفیت** ساخت صفحش پایینه(در مقابل ضربه)
اما اگه مثل من میخاهید ی گوشی رو 2تا3 سال نگه دارید طبیعتا باید یچیزی بخرید ک در کنار امکانات خوب و بالا ،کیفیت ساخت بدنه بالا و سخت افزار خر کار (در استفاده طولانی مدت چند ساله)داشته باشه ک بدون تردید htc10 حرفهایی برای گفتن داره",37,3,4,5,4,5,5,4
,,"در مورد دوربین این گوشی که برخی گفتن در شب خوب نمیگیره باید عرض کنم که با تنظیمات دستی (نه اتوماتیک) و به حسن لرزشگیر، بهترین تصاویر رو میشه گرفت. با کاهش سرعت شاتر و سایر تنظیمات تصاویر باور نکردنی میشه گرفت.",29,2,4,5,5,5,5,4
"طراحي زيبا و کيفيت ساخت بالا
دوربين با کيفيت
باطري
کيفيت صدا
رواني و نداشتن لق و سنسور اثر انگشت بسيار سريع","من چيزي نديدم","بعد کلی تحقیق یک ماهی میشه که این گوشی رو خریدم، خوشبختانه همونطوری که فکر می کردم از آب دراومد و همه چیزش عالیه، برای من دوربین خیلی مهم بود و از بین گزینه های موجود و هم رده دوربین این گوشی با رقبا برابری می کنه و بعضی جاها هم بهتره، برای من مهم بود که گوشی که دستم میگرم پلاستیک یا شیشه نباشه و بدنه فلزی این گوشی کاملا این مهم رو برآورده کرده، همچنین باطری خیلی خوبی داره و در اکثر مواقع بیشتر از 24 ساعت(یک روز تمام ) دوام میاره، توی یک ساعت هم از 15 درصد به 100 میرسه، کیفیت هندزفری عالی داره و همچنین قابلیت شخصی سازی رابط کاربریش خیلی عالی هستش و دستتون تو اکثر مواقع آزاده، تنها نقطه ای که وجود داره و اون هم مربوط به خود گوشی نمیشه محافظ صفحه های موجود در بازاره، چون بالای صفحه نمایش گوشی قوس داره و محافظ های صفحه اون رو پوشش نمی دن، البته این مورد برای اکثر گوشی ها صدق می کنه ، lg g5 هم این مشکل رو داره. به طور کلی از خریدم راضی هستم و به شما پیشنهاد میکنم اگر قصد خرید گوشی انرویدی پرچمدار دارین این گزینه بهترین گزینه هستش.",36,0,4,5,5,5,5,4
"رابط کاربري بسيار جذاب با قابليت شخصي سازي فوق العاده
رنگهاي واقعي صفحه نمايش
صداي فوق العاده Boom Sound
کيفيت ساخت عالي
دوربين عالي جلو و عقب هر دو با لرزش گير Optical",,"این گوشی تو سایت EISA اروپا بهترین گوشی هوشمند 2016-2017 شد و دیگه هیچ حرفی برای گفتن نیست. اگه باهاش کار کنید شیفتش میشید.",29,5,4,5,5,5,5,4
"دوربين پشتي عالي وسلفي فوق العاده
رابط کاربري جذاب
کيفيت صدا عالي و هدفون بي نظير
تاچ فوق العاده سريع و اسکنر اثر انگشت دقيق
استحکام و کيفيت عالي بدنه","نور کم نمايشگر نسبت به رقبا
کمتر شدن صدا نسبت به قبل
عملکرد متوسط دوربين در تاريکيه شب","نمایشگردر کل عالیه ولی میتونست حداکثر نور صفحش بیشتر باش.حتی از خیلی میان رده هاهم حداکثر نورش کمتره ک واقعا نمیدونم چرا بهش توجهی نشده.ولی کنتراست ،کیفیت و همه چیش عالیه.تاچش هم بی نهایت سریعه و فقط کافیه انگشت نزدیکش بش تا عمل کنه
کیفیت ساخت و طراحی ک سلیقه ایه ولی استحکام و کیفیتش فوق العادس و توی دست ک میگیری حس یه پرچمدار روکاملا به کاربر القا میکنه.من به شخصه از ظاهر گوشی خوشم اومد و میگم سلیقه ایه ولی واقعا خوشکله.
رابط کاربری سنس هم ک به عالی ترین شکل پیاده شده و واقعا اگ طرفدار سنس باشین بی نهایت لذت میبرین.
از لحاظ عملکرد هم قویترین بازیها و برنامه هارا به راحتی اجرا میکنه و هیچ .هیچ لگ و هنگی نمیبینید.
باتریش هم ک بسیار عالی خصوصا بعد چندتا اپدیت دوربین و باتری بهتر میشه.اگ استفاده معمولی دارین دو تا سه روز جواب میده ولی اگ سنگین یک روز پرکاررو به راحتی ساپورت میکنه.از صفز تا صد هم 90دقیقه شارز میشه .
دوربین 10هم ک امسال کولاک کرد.به نظر من ک سلفیش عالیه و بهترینه توی بازار.دوربین عقب هم خوبه و در حدs7eوالجی هست ولی بهتر نیست.در شرایط نوری خوب دوربینش فوق العادس و واقعا بی نظیره ولی در نور کم خصوصا شب عملکردش فقط در حد یه پرچمداره و چیز خاصی نداره.در کل نور محیط خیلی مهمه براش.در نور خوب عملکردش فوقالعاده بهتره
صدای اسپیکرهاش نسبت به نسل های قبلی یه کم کمتر شده ولی کیفیتش خیلی بهتر شده.هدفونش هم فوق العاده با کیفیته .و با اختلاف نسبت به بقیه بهترین هدفون و کیفیت صدا را امسال بدون شک10 داره .اک عاشق موسیقی هستید بهترین گزینه هست
اسکنر انگشتش فوق العاده دقیق و سریع.تاچش بی نهایت حساس وسریع.و کلا یه گوشی فوق العاده روان و کم نقصه
کسایی ک قصد خرید دارن مطمئن باشن دارن یه گوشی تمام وکمال و یکی از سه گوشی برتر امسال رو میخرن.ببخشید ک طولانی شد",20,3,5,5,5,5,5,3
"کيفيت ساخت بسيار بالا
حسگر اثر انگشت سريع - فست شارژ 3 - داشتن USB type - C
کيفيت صداي عالي مخصوصا به هدفون هاي high res
دوربين
رابط کاربري سبک و محشر سنس",هيچي,"اگر مثل من از طراحی گوشیهای شیشه ای که با دو دقیقه استفاده غرق اثر انگشت کیشن و باید روزی 50 دفعه تمیزشون کنید خسته شدید، اگر موسیقی با هدفونهای فوق العاده high res واستون مهمه، و از همه مهمتر کیفیت ساخت محشر براتون اهمیت داره، شک نکنید.... Htc 10 خودشه",21,2,4,5,4,5,5,4
"زيلد داره . مخصوصا باطريش","تا جايي که من ميدونم فعلا نداشته","واقعا گوشیه خوبی هستش . من خودم فقط طرفدار اپل هستم . بعضی ها شاید از این گوشی یا ایفون خوششون نیاد هرکی سلیقه و انتظارات خودشو داره
ولی اگه نظر منو بخواید هر گوشی ای میخواید بگیرید غیر از سونی",9,8,5,5,4,5,5,4
"کيفيت صداي خوب
رابط کاربري عالي
مستحکم بودن
صفحه ال سي دي شفاف و عالي","قيمت نسبتا زياد
صداي ضعيف تر نسبت به مدل هاي گذشته","من این گوشی رو 4ماه دارم و تا حالا هیچ عیب و نقص ی ازش ندیدم واقعا تمام توقعات منو از یک گوشی پرچمدار برآورده کرده",17,2,3,5,4,5,3,2
"همه چيش","فقط زد اب نبودن","سلام خدای چطور این گوشی و این برند رو با سامسونگ مقایسه میکنید بعداز اپل قاطعا htc بهترین برند هست این گوشیم عالیه من یه کلیپ دیدم ازش که تو اب گذاشتنش خیلی خوب دوام اورد چیزیشم نشد یعنی اگه اتفاقی بیفته تو اب خیالتون راحت حداقل تا 10دقیقه چیزیش نمیشه من خودم ایفن6 دارم میخوام بفروشم الان این گوشی رو بخرم واسه تنوع و همیشه عاشق htc بودم چون گوشیاش واقعا با کیفیته این یه چیزه کاملا مشخصه گوشی فقط اپل و htc .البته گوگل هم گوشیا خوبی زده خدای بقیه برند ها روبا اینا مقایسه نکنید من یه گوشی باز قدیمی هستم الکی حرف نمیزنم و هیچ تعصبی هم ندارم اگه گوشی میخواید بگیرید از این 3 برند حتما بخرید .یا علی",32,6,4,5,5,5,5,4
,,"من خیلی از مشخصات این گوشی خوشم اومد و اینکه با این اندازه صفحه نمایشگر حجم باتریش خیلی فوق‌العاده ست ولی وقتی نظر بعضی از کاربران خریدار محصول رو خوندم که نوشته بودن باتری سریع خالی میکنه تعجب کردم و اینکه خیلی ها گفته بودن تو همه سایت ها از باتری این گوشی تعریف شده پس مشکلی نداره ، به نظر من هر سایت معروفی و بنچمارک هر چی که بگن نظرشون اررش نظر یک نفر که گوشی رو خریده و استفاده کرده رو نداره اونا در عمل دیدن که اینطوریه باطری پس حتماً یه چیزی هست که میگن",1,17,3,3,3,3,3,3
,,"سلام.دیدم دوستان در مورد باطری بحث میکنن چون این گوشی رو دارم خواستم بگم که من چند ماه این گوشی رو دارم یکی از نقاط قوت این گوشی باطریش هست واقعا عالی. همین قدر بگم ک یکبار که یادم هست از 7 صبح 2 درصد شارژ داشت ساعت 2 بعد از ظهر خاموش شد البته زنگ خور نداشتم ولی چند بار گوشیو چک کردم..امید وارم کمک کنه بهتون. البته یک وان ام 9 پلاس هم دارم ولی اون عکس این روزی 4 بار تو شارژ هست دو سه روز ابدیت اندروید 6 اومده براش ظاهرا یه کوچولو بهترشده",25,0,5,5,5,5,5,5
"همه چيز",,"شاید در مقایسه با گوشی های دیگه مثل اس7 یا آیفون 7 یه ذره احساس کنید عقب باشه ولی ارزش پولی رو که میدید داره.من htc one x داشتم با اینکه داغ میکرد و دوربین خوبی نداشت و باتریش ضعیف بود بازم نسبت به گلکسی اس3 که رقیبش بود بیشتر دوسش داشتم.کافیه یه هفته با سنس کار کنید تا همه گوشی های دیگه از چشمتون بیفتن",22,8,5,5,5,5,5,4
"بدنه مستحکم .هدفون هاي عالي.سخت افزار.باطري","کمي دوربين ازپرچمدارهايG5وs7ضعيفتره","اونایی که میگن باطری ضعیفه دوستان عزیزخیلی ازسایت های معتبرایرانی وخارجی به اچ تی سی تبریک گفتن چون باطری این گوشی ازهمه برترشدبریدتحقیق کنیداگه باطریتون ضعیفه شایداصلی نیس وشایدازجای معتبرنگرفتین وشاید6ساعت شارژاولیه نکردین وپیشنهادمن اینکه داخل شارژباگوشی ورنرین چون به مرورزمان پیرمیشه من الان این گوشی رودارم روی3Gتنظیم کردم 24ساعت دوام میاره فرداییش هم35درصدداره البته اینم بگم زیاداهل شبکه های مجازی نیستم",22,21,5,4,4,5,5,5
"همه چيش","تبليغات کم نسبت به ديگر برندها","سلام لطفا اونایی که باطری گوشیشون خرابه یا از گوشی بیش از اندازه کار می کشند بی جهت نظر رو باطری اچ تی سی10 ندهند چون این گوشی از نظر باطری هیچ ضعفی نداره",38,9,3,3,3,3,3,3
"بدنه بسيار مقاوم و با کيفيت
کيفيت تصوير بسيار عالي
کيفيت دوربين بسيار عالي
کيفيت صداي بسيار عالي
امکانات بسيار عالي",,"من مدل One M8 این گوشی رو دارم و مدل 10 رو هم چند روز بررسی کردم به نظرم بهترین گوشی هست.
فقط در تعریف گوشی اینو بگم که m8 روزی 3 بار از دستم میافته و هنوز مثل روز اوله (البته با قاب ژله ای بسیار نازکی که خریدم که فکر میکنم فقط مانع خش افتادن میشه و حتی روی صفحه محافظ ننداختم چون با وجود Gorila Glass 3 کار عبث و احمقانه ای است و تا به حال با وجود ضربه ها و اشیائ تیزه که با آن برخورد داشته حتی 1 خط ندارد!) من اهل بازی نیستم و از گوشی برای تلگرام و اینترنت استفاده میکنم و این گوشی همه انتظارات من را براورده میکند.
قابلیت شارژ سریع خیلی خوب است اما هنوز هم جای کار دارد . من شنیده ام از نظر تئوری تکنولوزی در حدی پیش رفته است که بتوان در 30 ثانیه همچین باطری را شارژ کرد نمیدانم چرا سازندگان گوشیها تعلل میکنند.
دوربین این گوشی هم همانطور که خیلیها اشاره کردند کیفیت بسیار بالایی دارد و از نظر من از آیفون 6s بهتر است.
در کل نیازهای من از گوشی استفاده آسان، کیفیت دوربین خوب و هنگ نکردن و بدنه است که همه در این گوشی بسیار عالی میباشد (صدا هم در این گوشی معرکه است برای کسانی که به کیفیت صدا اهمیت میدهند)
از نظر امکانات تقریبا همه گوشیها امکانات مشابهی دارند به جز هواوی که اکانات بینظیری دارد ولی کیفیت بدنه و مقاومت این گوشی مساله بسیار مهمی است که شاید من را از خرید 6و7 گوشی بی نیاز کرده است و فیمت بالای این گوشی به ایم مقاومت می ارزد.",16,7,5,5,5,5,5,5
,,"دوست عزیز تو تست باتری این گوشی ایفون 7،گلکسی اس 7،و ال جی جی 5 رو پشت سر گذاشت و اول شد. حتما گوشی شما مشکل داره به گارانتی مراجعه کنید.",27,5,4,5,5,5,3,4
,,"برخی از دوستان از عملکرد باطری اچ تی سی 10 انتقاد کردن در حالی که 10 بین تمامی پرچمداران امسال بهترین عملکرد باطری رو داشته!
درسته شارژدهی باطری گوشی های هوشمند به خصوص در رده ی پرچمداران نسبت به سال های پیش ضعیف تر شده که اون هم به خاطر پیشرفت سریع صفحه نمایش (ابعاد صفحه، رزولیشن و تعداد پیکسل) و سخت افزار قدرتمند این سری گوشی هاست...
ولی شما برای بررسی عملکرد باطری این گوشی باید اون رو با پرچمداران امسال مقایسه کنی ن گوشی های میان رده و بالا رده ی سال های پیش و گوشی هایی که قبلا خود شما داشتی!
اچ تی سی 10 در مقابل جی 5 اس 7 پی 9 و آیفون 7 بهترین عملکرد رو در زمینه باطری داشته (به استنداد بررسی سایت های معتبر موبایل جهان)
لطفا با نظرات و تجربیات اشتباه خودتون دیگران رو گمراه نکنید...
ممنون.",37,6,5,5,5,5,3,5
"سي پي يو فوقلعاده .. رم بالا .. تاچ ايدي خيلي سريع","باتري تو 30 دقيقه وب گردي صدا ته سانديس ميده","من 3 هفته ای میشه خریدم یه پاور بانک خریدم که واقعا ازش راضیم چون باطری خود گوشی که اصلا چنگی به دل نمیزنه ... ولی دوربینش معرکس واقعا تا هالا چنین چیزی ندیده بودم ... تو اجرای بازی ها حرف واسه گفتن زیاد داره ... بازم رسیدم سر باتری . با اینکه خیلی زود خالی میشه ولی از حق نگزریم واقعا ام خیلی سریع شارژ میشه 100 درصد زیر 1 ساعته. که البته زیر 1 ساعتم خای میشه ..این به اون در.. تم هاش خیلی جذاب و خیلی متنوعه.. کیفیت صداش چه تو هدفون چه خود گوشی حرف نداره وقتی از هدفون استفاده میکنم تو موزیک قرق میشم خیلی خوبه هدفونش... محل اسپیکرا یکی بالا برای صدای زیر. یکی کف برای صدای بم .. جفت دوربیناش لرزش گیر اپتیکال داره که این خیلی خوبه ... سفیدش سفید نیست یزره زرده که میشه تو تنظیمات رنگشو سرد کرد ...
دیگه چیزی نداره که بگم ... همین",17,65,5,3,5,5,5,2
,,"سلام دوستان. من اوایل خرداد که تازه این گوشی وارد شده بود یکی خریدم. در کمال تعجب بدنه زیاد داغ میشد. بعدش پرفرمنس گوشی تو بازی حسابی میامد پایین. تو رابط کاربری هم بعضی اوقات لگ داشت.
خلاصه بدجوری حالمو گرفت. با اینکه سالها htc داشتم گفتم دیگه باید بیخیال اون بشم. گالکسی s7 خریدم. ولی اشتباه محض بود. نه اینکه گوشی بدی باشه. کسی که سالها htc داشته واقعا نمیتونه چیز دیگه ای تحمل کنه. اختلاف صدای توی هدفون بسیار دور از هم!! رابط کاربری زود خسته کننده!! همین دوتا عامل باعث شد دوباره برم سراغ htc .
این دفعه خیلی ترس داشتم که نکنه دوباره تجربه دفعه پیش بشه. اما این بار اصلا مشکلاتی که گفتم رو نداشت. گوشی بسیار روان و خیلی کمتر از قبلی داغ میکنه.
همیشه شنیده بودم که سری اول هر گوشی که میاد نباید رفت سراغش. یکبار اینکارو کردم تجربه بدی شد. ولی الان واقعا خوشحالم که گوشی مورد علاقه ام رو دارم. هرکسی این گوشی رو بخره بی بروبرگرد عاشقش میشه",30,10,4,5,5,5,5,4
