positive_points,negative_points,text,like,dislike,"ارزش خرید به نسبت قیمت",نوآوری,"کیفیت ساخت","امکانات و قابلیت ها","سهولت استفاده","طراحی و ظاهر"
هيچي,"همه چي","این اندروید 6 پس کی قراره برا این بیاد
من دوماهی هست خریدمش
رم 64 گیگ فول شده
بدون هیچ محتوایی هی هم ارور میده
واقعا حیف پولی",0,0,3,2,2,3,3,2
,,"گوشی خوبی نیست...من خریدم زود خراب شد...سخت افزلر مزخرفی داره...اینو جدی میگم",2,5,3,3,3,3,3,3
"سهولت استفاده -سرعت خوب-حافظه و رم بالا-","پايين بودن کيفيت دوربين نسبت به قيمت","من 1 ماه خریدم و هیچ گونه مشکل نرم افزاری و سخت افزاری نداشته است و لوازمی که رویش است نیازی به خرید لوازم جانبی ندارد",3,0,4,5,5,5,4,3
"حافظه داخلي و رم",,"نسبت ب قیمتش خیلی خوب و خوش دسته",3,0,5,3,5,4,3,3
"شارژ واقعا سريع قفل صفحه منحصر به فرد فلاش پور نور سادگي و زيبايي بدنه(جنس بدنه هيچ موقع مهم نيست به نظرم) هندس فري حرفه اي اقلام همراه","نداشتن نور پس زمينه 3کليک نويز در اسپيکر که با يه فوم صداگير ساده مشکلش حل ميشه کمبود لوازم جانبي که به زودي حل ميشه.البته طرفاي جمهوري فراوونه","دوستان من قبلا یه نظر داده بودم که بیشترش منفی بود.راستش چونکه شارژش خیلی زود خالی میشد،حسابی حالم رو گرفته بود و منم چشمامو بستم و هر چی ایراد بنی اسرائیلی بود گرفتم ازش.حالا که مشکل باتری رو حل کردم،خیلی گوشیه خوبی هم به نظر میاد.توی مدیریت باتریش،یه حالت داره به اسم super saving که اونو انتخاب کنید.باورتون نمیشه چقدر تاثیر مثبت داره توی حفظ شارژ.البته یه سری کارا رو وقتی بخواید انجام بدین،به طور خودکار از اون حالت خارج میشه.خلاصه من صبح با شارژ100% میرفتم سره کار،با 14% میومدم خونه.خداییش هم خیلی استفاده نمیکردم.اما الان قشنگ دو روز نگه میداره،با همون مقدار استفاده (کمی بازی،کمی چرخش تو اینترنت،تماس،...)
دوربیناشم قابل قبولند.خصوصا دوربین سلفی.سرعتش هم توی بازیا حرف نداره.اون روز آبدیت اشتباه کرده بودم که کمی لگ داشت بازی.خداییش هم حافظه 64گیگ بزرگترین امتیازه این گوشیه.الان هیچ ایرادی نداره.تنها ایراد این گوشی که واقعا نمیشه کاریش کرد،نداشتن نور پس زمینه سه کلیک پایین.همین.من خیلی حساسم توی کارکرد گوشی.مطمئن باشید اگر ایراد بده دیگه ای داشت میگفتم.راستی از صفحه بزرگش من یکی خیلی لذت میبرم.",10,1,3,3,4,4,5,2
هيچي,"همه چي","تا حالا بعد یه ماه و خورده ای هنوز اندروید 6 براش نیومده درحالی که اندروید 7 هم داره میاد خیلی گوشی بدیه خیلی پشیمونم اشتباه منو نکنید",1,9,3,2,2,3,3,2
"ايسوز بودن","ايسوز بودن","قبل از خرید یه نگاهی به مشخصات و قیمت گوشی LG G3 بندازید . . .
بنظرم فقط کسانی این گوشی رو میخرن که عاشق برند ایسوز هستن . اگر برندش ایسوز نبود خیلی قیمتش پایین تر بود!
ضمن اینکه نباید یادمون بره تخصص ایسوز ساخت گوشی نیست این گوشی نسبت به LG G3 که قیمتی پایین تر هم داره، هیچ برتری خاصی نداره و مطمئن باشید برخلاف الجی قطعات و لوازمش بسختی گیر میاد!",3,20,1,2,3,2,2,1
"همه چيزش عاليه",نداره,عالیه,4,1,5,5,5,5,5,5
"همه چيز","نداشتن حسگر اثر انگشت","ای کاش حسگر اثر انگشت داشت من حاضر بودم حتی پول بیشتری بدم",3,6,5,4,4,5,5,5
"سي پي يو قدرتمند رم بالا","اندازه بزرگ اشغال زياد رم","نسبت به قیمت گوشی خوبیه کاش با اندازه پنج اینچ بود من از بازار خریدم ولی قیمت دیجی پایینتر بود",5,1,2,2,4,2,3,3
"اشتباه در انتخاب","گوشي بسيار بديه","سلام
یکی خریدم خراب بود
بردم نمایندگی
عوض کردن
دومیه رو هم عوض کردن اونم خراب بود بردم شرکت با اینکه دو هفته هم نشده بود گفتن ما فقط یک باز عوض میکنیم اینو تعمیر کردن ...الانم مشکلاتش اینه...
باتری دو ساعت تمام طول میکشه پر شه و فست شارژ نیست
بعد پر شدن بعد چند دقیقه برم سراغش بدون کارکرد چند درصدی باتری خالی میکنه
خیلی داغ میکنه چه در هنگام کار کردن باهاش چه شارژ
وقتی نور صفحشو کم میکنم هی پرت نور میندازه و صفحه هی سفید میشه انگار فلاش میزنه
هنگ هم میکنه و هر یه هفته باید خاموش روشنش کنم تا درست شه
واقعا گوشی بدیه
نمایندگی که میرفتم هی یکی میومد همین مشکلات رو داشت....",7,12,3,2,2,3,3,2
,,"من یک ماه گرفتم از دیجی کالا کاملا راضیم
ولی دو سیم 4g نیس فقط سیم یک
روی 3Gسرعت بالاتر از1 مگ است روی 4Gسرعت افت دلرد روی همراه اول
ایرانسل سرعت بالاست",6,1,3,3,3,3,3,3
"سهولت کار با گوشي (خوش دست بودن )
شيک بودن","دوربين خيلي ضعيف در حد گوشي هاي ارزان قيمت
باز نکردن فايلهاي با پسوند avi با هيچيک از جديد ترين مديا ها(kmplayer)
گوشي با سخت افزار قوي ولي نسبتا نا کارآمد
داغ شدن خيلي زياد گوشي و شارژر هنگام شارژ شدن .","بنده به تازگی این گوشی رو دریافت کردم اما تصور اینچنین گوشی نداشتم .به هیچ عنوان توصیه نمیکنم ...",8,18,2,3,2,3,3,3
"پردازنده قوي
امکانات جالب","باطري ضعيف","با سلام خدمت دوستان عزیز من چون خودم قبل از خرید همیشه نظر کابران رو می خونم وظیفه خودم میدونم هر چند کوتاه گوشش ایسوس رو از نظر خودم توصیف کنم
در نگاه اول به نظرم خودم من یک برنده بودم چون با مبلغ یک میلیون تومان یک گوشی با مارکی خریده بودم کهتوی سیستمهای کامچیوتری حرف برای گفتن داره درضمن همراع گوشی ی پک از طرف دیجی کلا اومد که اونم کلی لوازم داخلش بود
اما بیاید واقعیت رو ببینیم ایسوس گوشی ساز نیست سازنده مادر برد هست اما تو گوشی نه
باطری این گوشی اون انتظاری که داشتم رو براورده نکرد فقط کارهای روزمره در یک روز و نه بازی باطری خیلی سریع خالی میشه
اینترنت 4G اصلا روش کار نمکنه
میدونید چرا با یک پک کامل براتون میاد چ.ن هیچ جا لوازمش پیدا نمیشه
انصافا اتن دهیش خوب
ی قابلیت کار با تک دست داره که اونم خیلی خوب
به هر حال من چون هم هواوی داشتم هم سامسونگ می تونم به جرعت بگم از هواویی بهتر ولی به پای سامسونگ نمیرسه البته ممکنه از سامسونگ هم قیمتش بهتر باشه من نمی دونم چون سامونگ من A8 بود
خیلی متشکرم از دیجی کالا",13,11,2,1,3,2,2,3
"دوربين سلفي قفل صفحه با دبل کليلک سايز خوب به عنوان قبلت شارژ سريع فلش پر نور","داشتن لگ در بعضي از بازي هاي کم گرافيک مثل 8ballpool دوربين نه چندان جالب جلو به نظر سرعت رم واقعي نيست(يعني 4 نيست) هنگ کردن در بعضي از موارد که با اين رم اصلا نبايد باشه نداشتن نورپس زمينه 3کليک اصلي گوشي(بک،هوم،...)","جونم بگه براتون که پشیمونم آقا،پشیمون.کاشکی سونی میگرفتم با رم 2 که حتی ارزونتر بود.اما هیچ کدوم از این مشکلات رو نداره.من یه سونی xperia m dual داشتم که تا 1سال،به جز دوربین،عالی بود از همه نظر تا اینکه پر شد تا خرخره و هنگ بازار شروع شد.من میگم هزینه کنید و فلان مدل بگیرید،فقط میگم گول گوشی های تازه وارد رو نخورید.یا حق",9,20,3,3,4,4,5,2
"سرعت خوب، و روان بودن در تمام برنامه ها و نيز مولتي تسکينگ عالي (ميتونيد تحقيق بيشتر کنيد)
خوانايي خوب صفحه در محيط هاي پر نور
پردازش عالي صدا و هدفون بسيار با کيفيت
تاچ دقيق و سريع و وجود کليد هاي فيزيکي (البته فاقد نور پس زمينه)
GPS بسيار سريع و حالت شارژ سريع","داغ شدن
فيلمبرداري ضعيف (در به کار بردن اين کلمه اغراق نکردم)
مشکل اسپيکر (هنگام پخش بعضي فرکانسهاي صوتي به شدت شاهد نويز و خش هستيم)
پشتيباني نه چندان جالب ايسوس از لحاظ بروز رساني ها (توضيحات رو مطالعه کنيد)","در این بررسی من مشخصات فنی را دوباره ذکر نخواهم کرد، مشخصات همان است که قبلا خوانده اید.
Performance:
هنگام کار با Zenfone 2 در تمام نرم افزار ها سرعت عالی خواهد بود، اما این فکر که در گوشی های اندرویدی هیچ زمان شاهد لگ نباشیم تفکر باطلی است و در عمل حتی در گرانترین اندرویدی ها هم گاها شاهد لگ هستیم؛ زنفون هم از این قاعده مستثنی نیست و شاید گاهی اوقات لگ های ریز و درشتی به چشمتان بیاید. اما مولتی تسکینگ Zenfone 2 اصلا در سطح گوشی های محدوده ی یک میلیون تومانی نیست و به راحتی با گرانترین های بازار در این حوزه رقابت می کند.
اگر شما قدیم از کاربران Windows Mobile (نه Windows Phone) بوده باشید درک جالب تری از مولتی تسکینگ دارید، در ویندوز موبایل دقیقا مولتی تسکینگ مشابه ویندوز دسکتاپ بود و برنامه ها در پس زمینه هم به پردازش ادامه می دادند، البته در اندروید مدیریت RAM و CPU با آنچه که در ویندوز موبایل بود تفاوت داردبا این وجود مقوله ی مولتی تسکینگ در Zenfone 2 آن است که به طور ایده آلی نرم افزار های اجرا شده را تا زمانی که خودتان آن را نبندید در پس زمینه آماده به کار و باز نگه میدارد و این موضوع مطمعنا باعث خوشنودی شما خواهد بود.
نمایشگر:
بهتره از اعداد تراکم پیکسل و رزولوشن بگذریم؛ نمایشگر زنفون خوب است اما نه زمانی که با گوشی های High-End سامسونگ یا اپل مقایسه شود، نمایشگر این گوشی در فضای باز و محیط های پر نور خوانا است و مشکلی از این بابت وجود ندارد اما رنگ ها آنچنان نیست که در Galaxy S6 و iphone 6 دیده اید.
نکته ی دیگر کلید روشن-خاموش دستگاه است که در نگاه اول جای بسیار بدی قرار گرفته و از این بابت ایرادهایی به آن وارد شده، اما باید توجه داشت که بجز برای Restart و Shut down هیچ نیازی به این دکمه نخواهید داشت و نمایشگر همانطور که با دوبار لمس روشن می شود، با دوبار لمس هم قفل و خاموش می شود.
صدا و هدفون:
باز هم کاری به اعداد و ارقام و نمودار ها نداریم، در یک کلام پردازش صوتی زنفون عالی است؛ نرم افزار پخش موزیک ایسوس با نام ""Music"" خود دارای 5 باند اکولایزر قابل تنطیم به همراه Surround و Base Boost است که این نکته ی چشم گیری نیست و در بسیاری از گوشی ها دیده می شود اما استفاده از AudioWizard ایسوس به کاربر تجربه ی خوبی خواهد داد. همچنین هدفون-هندزفری موجود در جعبه بر خلاف خیلی از گوشی های بازار خیلی با کیفیت و خوش ساخت است و صدای بسیار لذت بخش با Base گیرا و عمیقی را به گوش شما می رساند.
صدا (اسپیکر):
حجم صدای اسپیکر خوب است، کیفت صدای آن هم دلنشین و خوب است، محل قرار گیری اسپیکر هم میتوان گفت خوب است و هنگام استفاده از دستگاه به صورت Landscape انگشت ها جلوی اسپیکر را نمی گیرد و اگر گوشی روی میز باشد با توجه به قوس دستگاه، مسیر اسپیکر مسدود نمی شود و صدای زنگ به گوش خواهد رسید. اما در بعضی از فرکانس ها هرچند ولوم کم باشد یا زیاد، نویز به گوش می رسد که گاهی آزار دهنده است.
تاچ و کلید:
دقت تاچ زنفون هیچ ایرادی ندارد و سریع است؛ همچنین نکته ی مثبت وجود کلید های دستوری اندروید به صورت فیزیکی است که دیگر قسمتی از نمایشگر را برای این منظور از دست نمی دهید.

شارژ و امکانات ارتباطی:
کم و کسری در ارتباطات دیده نمی شود، WiFi در دو باند 2 و 5 گیگاهرتز کار می کند همچنین امکانات لازم برای DLNA و Wirless Screen بطور پیش فرض در تنظیمات گنجانده شده. تکنولوژیNFC هم که در کل تکلیفش برای اکثر کاربران ایرانی مشخص نیست و هنوز اینجا کارایی چندانی براش تعریف نشده و وارد تشریحش نمی شیم.
باتری در حالت شارژ سریع ظرف حدود 40-45 دقیقه %70 شارژ می شود و 30-35 دقیقه دیگر هم برای رسیدن به %100 نیاز است.
داغ شدن:
Zenfone 2 داغ می شود. مادامی که در حال کار با گوشی هستید گرما را کم و بیش حس خواهید کرد اما هنگام بازی و پردازش های سنگینتر گوشی از حالت گرم تبدیل به داغ می شود! این داغ شدن هرچند خیلی آزار دهنده هست اما شاهد هیچ تاثیر محسوسی بر راندمان دستگاه نخواهید بود.
دوربین (عکس):
عکس های مقبولی ثبت می کند و تنظیمات کاملی دارد، همچنین در صورت استفاده از حالت Super Resolution عکسهایی با سایز 50 مگاپیکسل! (8192x6144) ثبت می شود. حالت های ویژه ی نور کم دارد اما فاقد نویز نیز نیست.
نکته ی عجیب گاها پر پر زدن های پارازیت مانند است که گاهی شاهد هستیم و البته با قابلیت Anti-Flicker چه 60Hz و چه 50Hz حل نمی شود. در مجموع عملکرد عکاسی با این گوشی معمولی است.
دوربین (فیلم):
اما فیلم برداری واقعا افتضاح است.سخن را زیاد طولانی نمی کنم، کیفیت فیلم برداری در حد یک گوشی 250 هزار تومانی است با این تفاوت که گوشی 250 هزار تومانی حداقل باگ های فیلم برداری Zenfone 2 را ندارد!
فیلم برداری با مشکل ""زوم"" همراه است به این صورت که بلافاصله بعد از زدن دکمه ی Record ، آنچه را که در قاب دوربین تدارک دیده بودید از بین می رود و دوربین زوم می شود، آنگاه شما قصد بر کم کردن زوم می کنید اما خواهید دید که زوم در حالت Minimum است و توفیق رفیقتان نخواهد بود و با کیفیت حاصل از زوم دیجیتال هم که آشنایی دارید!
لازم به ذکر است که این مورد با هیچ تنظیمی هم اصلاح شدنی نیست و باعث می شود هیچ وقت هوای فیلمبرداری به سرتان نزند، کاربران زیادی از جمله بنده این مشکل را گزارش داده اند و متاسفانه آپدیت هایی که تا این لحظه منتشر شده هم این مشکل را مرتفع نکرده.ضمنا frame rate هم به هیچ عنوان راضی کننده نیست.
شما راحت ترید اگر فکر کنید زنفون 2 اصلا قابلیت فیلم برداری ندارد.
دوربین سلفی:
دوربین 5 مگاپیکسل، مانند همه ی گوشی ها است؛ بد نیست.
پشتیبانی نرم افزاری ایسوس:
افرادی که از سایر محصولات ASUS استفاده می کنند می دانند که ایسوس پشتیبانی بدی از نظر نرم افزاری ندارد و آپدیت ها و رام ها و برنامه ها و دیگر فایل های مورد نیاز در وبسایت شرکت ایسوس به راحتی در دسترس است اما گویا اندروید M با وجود اینکه رسما برای زنفون 2 منتشر شده،آنطور که باید رضایت کاربران را جلب نکرده وتا این لحظه امکان آپدیت به اندروید M توسط قسمت به روز رسانی گوشی میسر نیست و تنها راه پیش رو دانلود رام از سایت Asus و نصب دستی آن است.
جمع بندی:
سوای تبلیغات و حرف های عامیانه و برند پرستانه ای که راجع به اینتل و ایسوس و ... اینها می شود، این گوشی پرفورمنس بسیار خوبی دارد و در عمل شاهد آن خواهید بود و با این دستگاه میتوانید گران قیمت های بازار را گاها به چالش بکشید و بلکه پیروز از میدان درآیید و البته ضعف هایی مثل دوربین و آنها که به آن اشاره شد هم بسیار بسیار مهم هستند و باید دید کاربر حاضر است چه چیزی را فدای چیز دیگری کند.
نظر شخصی بنده:
من این گوشی رو از دیجی کالای عزیز نخریدم چون در آخرین خریدم در ارسال یک لپ تاپ بد قولی کردند و کلا از خرید اینترنتی دلزده شدم اما قیمت این گوشی در دیجی کالا از بازار ارزونتره (در این تاریخ). اینه که اگه به فکر دوربین نیستید گوشی بدی نیست.",24,3,3,3,4,4,4,3
"پردازشگر، رم و گرافيک قدرتمند: به هيچ برنامه اي نه نميگه
صفحه نمايش با کيفيت و تاچ قوي
شارژ سريع و قاب هاي اضافه بدرد بخور همراه
رابط کاربري عالي و قابليت شخصي سازي فوق العاده
امکانات نرم افزاري کاربردي فراوان به خصوص براي دوربين","کيفيت متوسط دوربين در نور کم
کيفيت پايين لوازم جانبي مانند منوپاد و فلش همراه","من در خرید این گوشی بسیار مردد و دودل بودم طوری که حتی از خریدش منصرف شده بودم تا این که دل رو به دریا زدم و خریدمش و الان خیلی از خرید خودم خوشحال و راضی ام. دوستان فراموش نکنین شما با این پولی که میدید یه گوشی با امکانات عالی میگیرید که هیچ برند دیگه ای با این پول نصف این امکانات رو هم در اختیارتون قرار نمیده. خلاصه اگه دنبال لذت بردن از ظاهر گوشی و کار کردن با اون هستین حتی یه لحظه هم شک نکنید و بخرید و لذت کار با یک گوشی غول رو ببرید.",10,3,5,4,5,5,3,4
"همه. چيز",هيچي,"راحت .دوربین عالی. پردازش بالا",3,6,5,5,5,5,5,5
"حافظه 64 گيگ CPUاينتل 2/3قدرت پردازش هر هسته دوسيمکارت واقعي همزمان فعال که يکيش فور جي هست.","دوربين متوسط","اگر دنبال عکس گرفتن نیستین بهترین گزینه برای خریدموبایل در این رنج قیمته.
درکل گوشیه قدرتمندیه.",7,2,5,5,5,5,5,5
,,"ی سریا ایرادای الکی میگیرن آدم می مونه چی بگه . مثل اینکه اینستاگرام یا تلگرام نصب نمیشه یا از این مدل ایرادا , برادر من , رو گوشی 100 هزار تومانی بابا بزرگ من هم این برنامه ها نصب میشه , اگه نصب کردن رو بلد نیستی یا فایلی که دانلود کردی ناقص بوده تقصیر گوشی ننداز , مورد دوم سینه چاکان سامسونگ و ایفون وقتی یکبار این گوشی رو دستشون نگرفتن رو چه حسابی میاین میگن بدرد نمیخوره ؟ مورد سوم این دورببن گوشی موبایله , دوربین کنونی که تو مستندای حیاط وحش استفاده میکنن که نیست میاین میگن دوربینش فلانه بدرد نمیخوره , کیفیت نداره , مورد چهارم بابا اینقدر سخت نگیرین بخرین",18,5,3,3,3,3,3,3
"خوش دست بودن
سيستم پر سرعت براي اجراي برنامه ها ونصب برنامه ها","باتري باتوجه به 3000ميلي آمپر بودن زودتر خالي ميشه
وضوح دوربين هم اوني نبود که تصورش رو ميکردم به نسبت 13 مگاي هوايي
حافظه اصلي قابل دسترس 54 گيگه نه 64","در کل یه گوشی خاصی میباشد",5,3,3,4,4,4,5,4
"سي پي يو بسيار قوي
بدنه محکم
مقرون به صرفه بودن","نداشتن حسگر اثر انگشت
نبودن قابليت شارژ بي سيم","من یه ماهه که این گوشی رو خریدم و اصلا از نظر سی پی کم میاره به پلاستیک بودن بدنش توجهی نکنید خیلی محکمه و در تو این سطح از قیمت گوشی ها و بالاتر از اونا گوشی رو پیدا نمیکنی که مثل این همچین قابلیت های رو داشته باشه به هر حال انتخاب با خودتونه اگه میخوایینش معطل نشین زود سفارشش بدین",2,0,5,4,3,4,3,3
,,"بخرید حرف نداره همه چیزش خوبه
شش ماه بیشتر خریدمش حرف نداره از خیلی از گوشیها با برند های عالی بهتره",4,1,5,5,5,5,3,5
"رم بالا
حافظه داخلي بالا
دو شيار سيم کارت جدا
شيار کارت جانبي جدا
صفحه نمايش خوب","نبود حسگر اثر انگشت
کيفيت پايين بدنه
داغ کردن گوشي هنگام شارژ
دوربين ضعيف","گوشی و خوبی است من دو ماهه دارمش و راضی بودم فقط اگه زیاد گوشی از دستتون میوفته نخرید چون کیفیت بدنه فوق العاده پایینه",4,3,5,5,5,5,5,5
