[],[],"در جواب دوستی که LG k10 رو پیشنهاد کرده بود باید بگم که k10 اگرچه تز امکانات بالایی برخورداره و دوسال گرانتی بسیار معتبری داره اما در نمونه های بررسی شده و دیده شده این گوشی اکثر کاربران از میزان بازدهی باطری آن ناراضی هستند
این گوشی دارای مشخصات بالایی هست که نیاز به باطری بالای سه هزار داشته و این از ضعف های گوشیه
پس من توصیه نمی کنم lg k10 را به جای این گوشی بخرید",12,35,3,3,3,3,3,3
"2 گيگابايت رم
پردازشگر گرافيکي قدرتمند
دوربين جلوي 5 مگاپيکسل
پشيباني از شبکه 4G
صفحه نمايش hd""1280x720""","کيفيت پايين دوربين اصلي","به جز دوربین اصلی نقص دیگه ای نداره ،همون کاری یه گوشی با دو برابر قیمت انجام میده این گوشی از عهده ش بر میاد...(البته هنوز امتحان نکردم usb otg هم پشتیبانی میکنه یا نه)....",3,9,5,5,4,5,5,3
"ظاهر زيبا","برند معروفي نيست","سلام دوستان من چند روزی میشه که گوشیه ال جی k10 رو خریدم درسته صد هزار تومن گرون تر از اینه ولی امکاناتی مثل طراحیه زیبا و خوش دست اندروید شش دوربین سیزده و مقدار نگهداری شارژ مناسب داره که نسبت به قیمتش خیلی عالیه و مقرون به صرفست دیگه انتخاب با خودتون تازه دوسال گارانتی طلایی هم داره...",22,13,3,3,3,3,3,3
,,"دوستان این گوشی از نظر قیمت و امکانات خوبه
ولی قطعاتش گیر نمیاد و اصلا گوشیه نام آشنایی نیست
اگر میخواین با همین قیمت و امکانات کمی بالاتر داشته باشید
خرید GLX MAD بهتره
هم دوربین هم طراحیش از این بهتره
از تولید ملی هم حمایت میکنین
البته اینم مثل GLX
ولی جی ال ایکس یکم بهتره",23,26,5,2,3,3,3,1
,,"یه موردی که توی نظر قبلیم یادم رفت بگم اینه که به نظرم که ضد خش صفحه اضافه هم براش از دیجی کالا بخرید که بعدا لنگ نمونید.",8,2,5,3,3,4,4,2
"طراحي زيبا
قيمت مناسب
قابليت اتصال به تلويزيون هاي هوشمند
قابليت انقال فيلم در حال پخش به صفحه اصلي","نداشتن otg
نداشتن قابليت انتقال برنامه ها به کارت sd
قرار گرفتن بلندگو پشت صفحه
دوربين متوسط","سلام. دیروز گوشی به دستم رسید که البته دو روز کار کردن نمیتونه خیلی اطلاعات در مورد یه گوشی به فرد بده ولی مواردی که تا الان دیدم رو عرض میکنم.
همون اول که گوشی به دستم رسید از طراحیش خوشم اومد. هرچند لبه های پایینی و بالایی کمی زیاده. هندزفری داخل بسته زیبا و نسبتا با کیفیته.
ضدخش صفحه رو خودم انداختم و با سختی. چون تا حالا این کارو نکرده بودم ولی خوب انجام شد.
قاب ژله ای با رنگ آبی کمرنگ و قشنگه. بعد از روشن کردن یه ءپدیت حدودا یک گیگ براش اومد که تو توضیحاتش نوشته بود برای بهبود سیستم بود که بعد از نصب آپدیت معمولا توصیه میکنن گوشی رو ریست فکتوری کنید.
باتریش به نظرم خوبه. هم زود شارژ میشه هم با استفاده معمولی مثلا بازی کلش و تلگرام و اینا، خوب شارژ نگه میداره.
کیفیت صدای بلندگو خوبه ولی چون بلندگو پشت گوشیه، کمی اذیت کننده ست.
با استفاده از قابلیت های دسترسی تست کردم، گوشی پنج لمس همزمان ساپورت میکنه .
دوربین جلو کیفیت مناسب و کیفیت دوربین پشت معمولیه همراه با آپشن های کم. نمیتونید به خاطر دوربین روی این گوشی حساب باز کنید.
این گوشی otg یا قابلیت اتصال فلش بصورت مستقیم بهش رو نداره که گوشی های این قیمتی کلا ندارن.
ولی نقصی که واقعا متعجبم کرد نداشتن قابلیت انتقال برنامه ها به کارت حافظه بود که الان گوشی های خیلی ارزون قیمت هم دارن و امیدوارم با یه آپدیت این مشکل هم حل بشه.
یه امکان جالبی که داره انتقال فیلم در حال پخش از گالری، به روی صفحه اصلیه. طوری که هم میشه فیلم رو دیدم و هم روی صفحه کار انجام داد.
این گوشی یه بازار تم و فونت و عکس والپیپر جالب هم داره که آنلاینه و تم ها و عکس های جالبی داره.
چون هنوز سیمکارت ننداختم کیفیت صدای مکالمه و اینترنت رو هنوز نمیتونم تست کنم .
در کل باید بگم این گوشی نسبت به قیمتش می ارزه و نه شگفت زده تون میکنه و نه ناامیدتون میکنه.
من بین این گوشی و هواوی y5 II 4g مونده بودم. هرچند این رو تزجیح دادم ولی اون گوشی امکانات و قابلیت های جالبی داره که بخاطرش حسرت میخورم ولی ریسک کردم و این گوشی رو خریدم. باید بدونید که این گوشی صاحب اول و آخرش خودتونید. چون نه لوازم جانبیش پیدا میشه و نه اگه خراب بشه قطعاتش پیدا میشه. من البته از گارانتیش خبر ندارم که آیا واقعا به درد میخوره یا نه.
در کل من از خریدم راضیم.
امیدوارم این صحبت ها به دردتون خورده باشه.",22,4,5,3,3,4,4,2
,,"من شاید نتونستم توی نظر قبلی منظورم رو کامل برسونم
دوستی هم نظر گذاشتن عملکرد رم یک گیگ برند خوب باز هم پایینتر از رم دو گیگ این محصوله،حرف شما کاملا درسته اما این رو مد نظر داشته باشین که شما فقط رم رو ندارید قطعات بسیار حساس تری هم هست،به طور مثال سی پی یو اسنپ دراگون تولید گرمای کمتری داره و در نتیجه عمر نگهداری باتری هم بالاتر میره،من نمیگم سامسونگ خوبه یا هواوی یا .... منظورم اینه که شما موقع خرید به برند های سازنده ی سی پی یو و چیپست گرافیکی هم خیلی توجه کنید و فقط اعداد و ارقام نیستن که مشخص میکنن یه جنسی به صرفه تره،دوستانی که دارن دنبال یه گوشی میگردن تو این رنج قیمت حتما این رو مد نظر داشته باشن،در ضمن نظر قبلی هم گفتم فروش یه شرکت فقط تبلیغ نیست رضایت مشتری حرف اول رو میزنه،بنده به شخصه اگر بخوام توی این رنج گوشی خریداری کنم j5 رو میگیرم به چند دلیل:صفحه نمایش با تکنولوژی super amoled که انحصاری سامسونگه ى کیفیت رنگ بسیار بالاتره از ips معمولیه
باتری سامسونگ بین تمام گوشی ها بهترین و نشونه ی اونم اینه که اکثر پاور بانک هایی که شرکت های معتبر تولید میکنن از باتری samsung استفاده میکنن که خود دیجیکالا هم تو توضیحات نوشته
سی پی یو اسنپدراگون مصرف کم، بازده بالا
پردازنده گرافیکی adreno 306 که به راحتی از پس تمام بازی های ساخته شده برای اندروید بر میاد
گوشی های سامسونگ در بین گوشی ها اندروید بهترین پشتیبانی رو از لحاظ آپدیت سیستم عامل دارن
به شخصه طراحی سامسونگ رو خیلی میپسندم به خصوص رنگ طلایی گوشی که بالاتر گفتم
امیدوارم مفید بوده باشه",3,6,3,3,3,3,3,3
"حافظه و رم مناسب
کيفيت صفحه نمايش در حد قابل قبول
کيفيت بدنه در حد قابل قبول
دوربين در حد قيمت
داشتن لوازم جاتبي اشانتيون","باطري چنگي به دل نميزنه
شرت کات منو نداره","به نسبت قیمت خوبه .از لحاظ خافظه داخلی و رم از هم ردهای خودش هم ارزوتتره هم دو برابر رم و حافظه داره",4,1,4,4,2,3,4,2
"قيمت ، نسبت به امکانات
خوش نام ، البته در ساير توليدات برند تي پي لينک","ابهام در مورد شرکت گارانتي کننده و نحوه ي سرويس دهي","با سلام . با تو جه به قیمت ، واقعا امکانات مناسبی داره و تقریبا هر شخصی رو مشتاق به خرید می کنه ، تنها و تنها موردی که از خرید این گوشی ادم و به شک می ندازه ، نحوه ی گارانتی و خدمات پس از فروشش هست ‌ . چون نادر و کمیاب هست ، فقط قطعاتش و خود نمایندگیش داره .",1,1,4,3,5,5,3,3
"رم 2
حافظه 16 گيگي","با اين قيمت ندارد","دوستان لطفا منصفانه نظر بدید.
این یک گوشی ارزان قیمت هست نه یک پرچم دار.
در رابطه با cpu و رم که اون دوستمون توی نظرات قبلی گفتن از قطعات بی کیفیت در این گوشی استفاده شده باید بگم که دوست عزیز درسته که تراشه این گوشی مثلا با گوشی سامسونگ تفاوت داره ولی اگر هم از رم با کیفبت پایین تر در ساخت این گوشی ها استفاده شده باشه باز هم یک رم 2 گیگی با کیفیت پایین تر عملکرد بهتری داره تا یک رم 1 گیگی روی گوشی سامسونگ و این رو هم عرض کنم که دیگه اون دوران گذشت که همه نوکیا میخریدن و میگفتن گوشی فقط نوکیا الان بسته به مشخصات گوشی و مقدار پولی که داری گوشی مورد نظرتو حالا با هر برندی میخری.یه مقدار ذهنتونو باز کنید و نگید فقط سامسونگ یا هواوی یا...
بعضی از دوستان هم نوشتن حافظه 32 گیگی ندارد خب دوست عزیز شما همینو با یه سامسونگ و الجی همرده مقایسه کنی متوجه میشی که همه گوشی ها توی این رنج دارای حافظه 8 هستن در صورتی که حافظه این گوشی 16 گیگه و باز هم میگم این یک گوشی ارزان قیمته نه پرچم دار",11,4,5,4,5,4,4,4
,,"برای افراد کم توقع که بیشتر با زنگ و اس کار دارن ولی از گوشی هوشمند داشتن هم میخوان لذت مختصری هم ببرن عالیه",3,4,5,3,4,4,5,4
,,"دوست عزیزی اومدن نظر گذاشتن گفتن اونایی که طرفدار سامسونگ هستن میان میگن این گوشی رو نخرید
واضح بهتون میگم این گوشی سی پی یو اون ساخت شرکت مدیاتک هست که سی پی یو های ارزون تر و دارای کیفیت پایین تر رو ارائه میده نسبت به سی پی یو های شرکت کوالکوم(اسنپ دراگون)،وارد رم و پردازش گر گرافیکی هم نمیشیم،بعضی از شرکت ها میان مشخصات بالایی رو با هزینه کم ارائه میدن در صورتی که کیفیت و بازده این قطعات پایین تره به طور مثال،شما قصد دارید یه کامپیوتر رو جمع کنین میتونین از دو سی پی یو اینتل و یا ای ام دی استفاده کنین،در قطعه رم شما چندین انتخاب دارین میتونین کینگستون بگیرین میتونین پاتریوت بگیرین و ... ،قیمت پاتریوت دو برابر کینگستون در میاد در نتیجه قیمت کیس شما بالاتر میره،این موضوع در بقیه قطعات هم صدق میکنه و همچنین در مورد گوشی های هوشمند،دقت نکنین این گوشی مشخصاتش دو برابر سامسونگ هم رده هست اما در واقع قطعاتی که شرکت سامسونگ توی گوشی هاش استفاده میکنه قطعات به مراتب با کیفیت تریه
اگر یک گوشی از زمانی که نوکیا و سونی اریکسون بازار رو به طور کامل در اختیار داشتن،داشته باشید و اون رو باز کنید میبیند که روی اکثر قطعات الکتریکی اون نام سامسونگ هک شده،درست زمانی که سامسونگ جلوی نوکیا حرفی برای گفتن نداشت،پس چی شد که سامسونگ یه بخش اعظمی از فروش توی بازار های جهانی به خودش اختصاص داده،این مسئله صرفا تبلیغ کردن نیست،رضایت مشتری هم هست که به مراتب تاثیر بیشتری نسبت به تبلیغ داره",13,15,3,3,3,3,3,3
,,"دوستانی ک دنبال بررسی تخصصی این گوشی هستند بخونن:
تمام این نظرات نسبت ب قیمت این گوشی هست وگرنه گوشی هایی با امکانات بالاتری با قیمت های بیشتری هم هستند ک اون دیگه بسته به بودجتون داره...
باید گفت این گوشی از اون دسته از گوشی هاییه ک ظاهره خوبی داره و بیننده رو ب خودش جلب میکنه و کمی شبیه LG G3 هست .
محیط کاربریش چنگی ب دل نمیزنه ولی میتوانید از لانچرهایی مثل apuse استفاده کنید ک خیلی شیکترش میکنه.
از نظر صدا و بلندگوهاشم که کیفیتش عالیه .
دوربین جلوش هم از کیفیت خوبی برخوردار و افکت هایی هم ک براش گذاشتن زیبایی عکس گرفته شده رو دوچندان میکنه ولی کیفیت دوربین پشت یکم ضعیفه علی الخصوص در شب...
ی امکان دیگه ای هم ک برخورداره ٬گرفتن عکس در هنگام فیلمبرداریه ک ب نظر جالب میاد.
از نظر سخت افزاری رم خوبی داره و حافظه داخلی ک دردسترستون میذاره حدود ده گیگه که با اپدیت 990مگیی ک براش میاد کمتر میشه .بعد از اپدیت کردن باطری بهتر کار میکنه
یه عیبی ک تو این گوشی ب چشم میخوره نداشتن چراغ نوتیفیکیشنه ک اگه داش عالی میشد در کل گوشیه خوبیه نسبت ب قیمت...",7,3,4,4,4,4,4,3
"رم 2 . حافظه داخلي 16 . زيبايي که بيشتر از قيمتش ميخوره . صداي خوب . 4جي . غير تکراري بودن","باطري متوسط . نداشتن چراغ اعلان . نخوردن otg.","معمولا تمام کسایی که فقط برندهای معروف رو میشناسن و قبول دارن ایراد میگیرند که چرا سامسونگ و هواوی نخریدی. اون هم بخاطر نشناختن قدرت این گوشی در بین هم رده های خوده. تی پی لینک در زمینه فن آوری ارتباطاته و ساخت گوشی خوب ازش انتظار میره
تکرار رو کنار بذارید",4,2,3,3,3,3,3,3
,,"دوستان کابل otg ساپورت میکنه",1,4,3,3,3,3,3,3
"4g
مناسب براي افراد مسن","طراحي بد
کيفيت صحفه ي پايين
حافظه ي داخلي زير 32
کيفيت پايين دوربين
تاچ ضعيف","این گوشی رو فقط برای کسایی که تا به حال با گوشی های کلاسیک کار میکردن پیشنهاد میکنم",0,17,2,0,2,0,2,0
,,"یه پیشنهاد بهتون میدم برید GLxmad یا پارت. بگیرید. هم به جیب خود کمک کرده اید و هم پیشتیبانی بهتری دارد. امکاناتش هم روی کاغذ از این گوشی بیشتر است.
من خودم ماد دارم راضی ام. اما اگه اپدیت کنید خیلی بهتر میشه",2,13,3,3,3,3,3,3
,,"عالیه هم گوشیه شیکیه هم کاراییش خوبه",8,3,5,5,5,5,5,5
,باتري,"با سلام بعد چند وقت استفاده حالا میشه بهتر نظر داد
اول از همه بگم که باتری با استفاده معمولی یه روز نگه می داره
کیفیت دوربین هم مثل اینکه عکس گرفتن باهاش قلق داره که کمکم داره دستم میاد
صداش نسبتا خوبه
از نظر ظاهری هم خیلی قشنگه فقط یه مشکلی باهاش دارم اینه که درب پشتش خیلی ضعیفه همش احساس میکنم میخواد بشکنه
لگ و تاخیری هم ندیدم باهاش تا حالا حدود 50 تا نرم افزار روش نصبه
من فقط با باتری مشکل دارم البته واسه 4g مصرفش زیاد نیست ولی نمی دونم چرا بعضی وقتها یهویی خالی میشه در کل فک کنم یه پاور بانک لازمه",11,5,5,4,4,5,4,3
,,"با مشخصات فوق گوشی خوبی بنظر میاد",8,3,3,3,3,3,3,3
"مقرون به صرفه و کاربردي","مشکلاتي در باز کردن در پشتي","من این گوشی رو برای پدرم خریداری کردم که تا به حال با گوشی های کلاسیک فقط کار کرده بود و با تلفن های همراه هوشمند آشنایی نداشت،این تلفن با توجه به امکاناتی که ارایه میده،قیمت مطلوبی داره، عملکردش روانه، کیفیت صفحه نمایش مناسبه و خیلی سریع میشه باهاش کار کردن رو یاد گرفت، حتی برای مبتدی ها. از جمله نکاتی که باید توجه کنید اول اینکه جای خیلی کوچکی برای باز کردن در پشتی تعبیه شده. و باید دقت کنید تا با برای باز کردن در به قاب پشتی آسیبی وارد نکنید، دوم اینکه موقع نصب محافظ صفحه نمایش نهایت دقت رو به کار ببرید و مطابق دستور العمل مراحل رو انجام بدید. این تلفن همراه برای اقایون بسیار مناسبه، هم توی جیب کت یا جیب شلوار جا میشه، هم صفحه نمایش مناسبی داره که برای انگشت های بزرگ هم مشکلی ایجاد نمی کنه. همچنین برای افرادی که میخوان با پرداخت هزینه ی متوسطی متفاوت باشند. از جمله نقاط قوت دیگه این گوشی امکان استفاده همزمان از دو سیمکارت هست.",8,4,5,4,4,4,4,3
,,"من حدود 1 ماهه دارمش. واقعا تو این رنج قیمت عالیه.",8,6,5,4,4,3,5,3
"زيبا.مقرون به صرفه. امکانات خوب
ضعيف بودن باطري",,"حدود یک ماهه أین گوشی فوق العاده رو دارم. واقعا سرعت اینترنت 4g عالیه. ضمن اینکه سرعت خود گوشی هم عالیه و هیچ نقصی نداره. واقعا تو خریدش شک نکنید. هیچ فرق خاصی با گوشی g3 ال جی نداره.",4,14,3,3,3,3,3,3
"سرعت خوب
دو سيم کارته
سرعت اتصالات سيم کارت ها و آنتن دهي","انتقال نيافتن برنامه ها به sd کارت!!","سلام. تنها مشکلی که من تو این گوشی میبینم نداشتن امکان انتقال برنامه به اس دی کارت هست نمیدونم دوستان دیگه هم خریدن امتحان کنن ببینن براشون این جور هست یا نه. تازه نرم افزار هایی مثل ضبط صدا که حجمشون زیاد میشه میره رو حافظه داخلی گوشی... یا مثلا پوشه تلگرام که عکس ها توش ذخیره میشه هم میره به حافظه داخلی. اینستاگرام و.... هم همین طور فقط نرم افزار های دیفالت خود گوشی میره تو حافظه خارجی... که اون هم باید تو قسمت storage تنظیم کنی. خواهشا اگه راهی هست که بشه این نقطه ضعف رو بر طرف کرد دوستان بگن. در ضمن مشکل کیفیت دوربین رو میشه با یه نرم افزار درست کرد از دوربین خود گوشی خیلی بهتر هست. اسمش dslr هست.",12,0,4,4,3,4,5,3
"قيمت مناسب","ضعف باتري
سرعت گوشي","این گوشی برای این قیمت مناسب هست، ولی یه مقداری کند هست. باضافه اینک همیزان عمر باتریش خیلی پایینه.
مثلا من صبح گوشی رو 100 درصد از شارژ در میارم، عصر تموم میشه شارژش.
ضمن این که خیلی شارژ شدنش طول میکشه.",12,7,4,1,3,3,3,2
"دوربين ولرزشگير مخصوص
طراحي
رم مناسب",نداره,"سلام
دوربین این گوشی بخصوص بهمراه این لرزشگیرش واقعا عالی و کارآمده
از نظر سخت افزاری شاید به عدد فرکانسش کم باشه ولی در عوض از نوع 64بیتی ،که بسیار خوب جوابگوی بازی ها و برنامه های نیمه سنگین تا حدودی سنگین هم هست و میشه گفت بهترین گزینه برای خرید تو این رنج قیمتیه
که معمولا خیلیا میتونن با هزینه کم امکانات زیادی رو از این گوشی دریافت کنن.نمایشگر 5اینچ اچ دی و چیپست کوآد کور 64 بیتی و دوربین بهمراه لرزشگیر 4محور و 2گیگ حافظه رم و حافظه داخلی16 گیگ خدایی با این قیمت عااااالیه.",9,2,5,5,4,5,3,4
"ظاهر خوب،سبک،خوش دست
قدرت پردازنده رم و سي پي يو و چي پي يو قابل قبول مخصوصا رمش
دوربين سلفي قابل قبول
آنتن دهي خوب
4G","باطري نه چندان خوب
دوربين پشت ضعيف در حد پنجم نيست
سوکت شارژر در قسمت پايين
سوييچ بين خطوط براي اينترنت خوب نيست حتما بايد تو تنظيمات اول انتخاب بشه","در کل بعد چند جست جوی تخصصی و. با اطلاعاتی که من از گوشی و این چیزا دارم به این گوشی رسیدم در این رنج قیمت و با این مشخصات بهترین گوشی بازاره اگر دنبال برند نیستید و مشکلی با لوازم جانبی ندارید این گوشی رو حتما توصیه میکنم همه جوره خوبه البته نه از لحاظ دوربین و باطری در کل بهرید ضرر نخواهی کرد شارژر و هندزفری خوبی داره فقط کیفیت خروجی صدای گوشی ضعیفه هندزفری عالیه این خلاصه تجربه 20 روزه استفاده من از این گوشی بود",7,2,4,3,3,4,4,3
"دوربين خوب
قيمت مناسب
سخت افزار مناسب",,"برای این قیمت گوشی بسیار مناسبی هست
انواع بازی ها رو روش اجرا کردم
بدون هیچ مشکلی اجرا شدند
و درضمن در جعبه گوشی هندزفری هم موجود میباشد!!! البته زیاد رو هندزفری گوشی حساب نکنید چون یه هندزفری سطح پایین هست",7,2,5,4,3,4,3,3
,,"برای. اونایی که نمیخوان پول الکی به برند بدن عالیه کیفیتش قابل قبوله و امکاناتش هم خوبه ... بر خلاف انتظارم و شناختی که از برچسب های معمولی داشتم که موقع نسب همش هوا. میگرفت این برچسب همراه گوشی نصبش مثل گلس راحت بود و اصلا هوا نگرفت در ضمن از مراحل نصبش یک کلیپ تهیه کردم و گذاشتم تو ی یوتوپ....دوستانی که تمایل دارن ببینن میتونن این جمله رو سرچ کنن و تماشا کنن ( TP-LINK C5 opening boxes and labeling
جعبه گشایی گوشی تی پی لینک س 5 و نصب برچسب )
موفق باشید",5,3,5,5,5,5,3,5
