"الحمدلله گوشي خوبيه مشکلي باهاش نداشتم","اگه بيشتر توي بازار جا بيفته بهتره-نبود گلس،قاب و کيف در بازار","الحمدلله گوشی خوبیه مشکلی باهاش نداشتم
اگه بیشتر توی بازار جا بیفته بهتره چون آرامش خاطر بیشتری برای خریدار فراهم می کنه-نبود گلس،قاب و کیف در بازار
بنده از هر دو مدلش خرید کردم یکی برا خودم و یکی برا خانومم الحمدلله تا بحال مشکل خاصی نداشتیم
بارها در موقع خرید به این فکر کردم که مبادا از خریدم متضرر بشم و اینکه چرا اینترنتی خرید کنم چرا نرم بازار گردی کنم-ولی الحمدلله بعد از حدود دوسال خرید از دیجیکالا راضی بودم امیدوارم دیجیکالا رویه های مثبت خودش رو تقویت کنه و رویه های منفی احتمالی رو هم صفرش کنه-امیدوارم دیجیکالا بتونه موفق باشه و کالاهای با کیفیت عالی و قیمت پایین تحویل مشتریان عزیزش بده",7,4,5,4,5,5,5,4
"تاچ روان و قوي
باطري با ماندگاري طولاني
گارانتي براي گوشي، باطري ،شارژر حتي قاب ژله اي گوشي","عدم چراغ نوتيفيکيشن
دوربين در حد 5 مگاپيکسل
کيفيت بدنه ميتوانست بهتر باشد","من این گوشی رو برای مادرم تهیه کردم
در کل تو 48 ساعتی که تست اش کردم خیلی روان کار کرد
پردازنده این گوشی از نوع 64 بیت -4 هسته ای است با 2 گیگابایت حافظه برای نصب نرم افزار ها
دارای حافظه داخلی 16 گیگابایت و ساپورت micro SD
دو سیمکارته از نوع میکرو
پشتیبانی از شبکه 4G-LTE
صفحه نمایش HD از نوع IPS که رزولیشن مناسبی داره
متاسفانه دوربین اش برای عکاسی کیفیت اش در حد 5 مگاپیکسل هست ولی فیلمبرداری اش FULL HD هست و دوربین سلفی کیفیت اش قابله قبوله و برای دوربین پشت از دو فلاش LED استفاده شده که نور خوبی داره
در کل در مقایسه با شرکت های رقیب از نظر امکانات و هم طراحی که کپی برداری از LG G2 هست به خوبی عمل کرده و هیچ برندی رو رو با این امکانات تو این رنج قیمت پیدا نمی کنید.",4,4,5,4,5,5,5,3
"صفحه نمايش
4g
دوربين
رابط کاربري سبک","فعلا هيچي","یه روزی هست که دارم ازش استفاده میکنم. در همون ابتدا اپدیت 950 مگابایتی براش اومد که نصب کردم.در کل سه تا نرم افزار اپدیت شد. دوربین سلفیش عالیه.رنگ خاکستری زیباتره.در کل ارزش خرید داره.",3,2,5,3,5,3,5,5
"زيبا و خوش دست.4g.اقلامي که هنگام خريد همراه گوشي بود و ...","تا حالا مشکلي نديدم.","گوشی شیکی هست و اشانتیونهای خوبی هم همراهش بود که البته الان دیگه نیست.روز بعد یک گیگ براش آپدیت اومد! هیچ نقطه ضعفی تا حالا ندیدم.نسبت به قیمتش واقعا میارزه.",5,2,4,4,3,4,4,4
,,"واقعا گوشی خیلی خوبی هست نسبت به قیمتش",5,2,5,5,5,5,5,5
,,"در کل میگم خوبه ولی دوتا مشکل باهاش داشتم تا الان یکی اینکه عکس با فلش خیلی تاریک میشه بجا روشن شدن و یکی دیگه حالت ذخیره نیرو کار خاصی انجام نمیده ضمنا بعد از آپدیت احساس میکنم بیشتر باطری نگه می داره.",3,2,5,4,4,5,4,3
,,"دوازدهم از سخت افزار دستگاه بنچمارک antutu گرفتم نمره 32912 گرفت الان بنچمارک گرفتم نمره 33200 گرفت باریکلا tp",5,2,5,3,4,5,4,2
"طراحي مناسب
شبکه نسل4 -داراي 4سنسور- هندزفري و کابل يواس بي باکيفيت
کيفيت ساخت - تو انتن دهي کم نمياره چون شرکتش خودش استاد شبکه است
دوربين مناسب باتوجه به قيمت
صفحه نمايش خوب -دابل فلش بودنش","نقطه ضعفي نديدم تا به اينجا اگه بود مينويسم","با درود فکر کنم چون این شرکت برای با اول وارد این عرصه شده چیزی کم نذاشته و سعی کرده با تمام قدرتش باتوجه به قیمت عمل کنه. بنظرم خوش دسته سبکه ساخت شرکت معتبریه شاید تازه تو کار گوشی اومده ولی شرکت بزرگ و اسم ورسم داریه تو این بازه قیمت فکر نکنم گوشی با این امکا نات پیدا بشه سنسور ها برام مهم بودن چون از نرم افزارای ویژه ای استفاده میکنم
گوشی خوبی نمیگم عالی و ... ولی با این قیمت کسی با این امکانات و مارک صد البته معروف کسی دیده به ما هم معرفی کنید توضیحات : گوشی جنسش اکلیریه که باکیفیته محافظ صفحه نمایشش برعکس بود یعنی سوراخی که برای دوربین سلفی روش تعبیه شده بود میافته سمت دیگش دوستان برعکس نصب نکنید دیگه چاره چیه هدیس و جنسش خوب نیس هرچه سعی کردم حباب نیفته نشد !!! گارد ژله ایش برا من روشن با رنگ ابی بود جنسش معمولیه ولی نسبتا خوبه مخصوصا چهار کنجش که بر امدگی داره و یه جورایی سپر خوبیه باطریش جدا میشه و قابل تعویضه بسته بندی بسیار شیکه و رنگش بنفشه کارت گارانتیش18 ماهه است این جالیه هندزفری 3ماه طبق شرایط گارانتی . گارانتی داره. باطری و شارژر 6 ماه نمی دونم چی بگم کدوم شرکت این کارو میکنه",10,4,4,4,4,4,4,3
"دوربين تو نور خوب و کافي
رابط کاربري نزديک اندرويد خالص
کيفيت صفحه نمايش و نور ش نسبتا خوبه
يه زيبايي خاصي داره با اينکه شبيه g3 lg هست و البته حاشيه هاش زياده نسبتا","دوربين تو نور کم
چراغ ال اي دي نداره يکم بده
صداي بلندگو مکالمه کمه
حالت تنظيم اتوماتيک نور روي %10 تنظيم ميکنه و کم و زياد نميشه تو شرايط نوري مختلف","مثل اینکه یه آپدیت هم براش اومده که نمیدونم چیه ولی فردا دانلودش میکنم ببینم چیکار میکنه فعلا نرم افزار خاصی روش نصب نکردم ببینم چجوریه ولی هر چی تم و عکس داشت دانلود کردم چیزای جالبی بودن با اینکه تعدادشون کمه در کل به نظرم با این قیمت و امکانات ارزش خرید رو داره",4,2,5,4,4,5,4,3
"سرعت بالا و تاچ روان، نور خوب، داشتن قطب نما
کيفيت صداي بالا در مکالمه! مجبور ميشيد کمش کنيد!
خلاقيت در نرم افزارهاي پيش فرض و کاربردي
باتري مناسب و واقعي بودن ظرفيت
طراحي شيک و خوش دست، مخصوصا خاکستري :)","نداشتن قابليت شارژ سريع
نداشتن چراغ اعلان","سلام، از افرادی که گوشیو نخریدن و طبق سلیقه و برنددوستیشون نظرات غیر منصفانه و اشتباه میدن واقعا میخام اینکارو نکنن! پرایدو با پرادو مقایسه نباید کرد که اول خوبیاشو میگم بعد معایبش
این گوشی بهترین تجربه خریدم بوده توی گوشی های میان رده. کیفیت صفحه و نور که زیر آفتاب هم کم نمیاره و تاچ روون واقعا خوبه، یه دونه لگ و تاخیر ندیدم توش!
نکته بعدی داشتن نرم افزارای مدیریت سیستم و باتریه که خیلی خوب عمل می کنه و از نرم افزارای مختلف مثل کلین مستر و فایل منیجرها بی نیاز میشید.
یه نرم افزار فوق العاده برای اسکرین شات داره که تقلید از سامسونگ نوته و واقعا کم نظیره؛ از هر چیزی توی گوشی با هر مدلی که دلتون بخواد میتونید اسکرین شات بگیرید!
یه نرم افزار فوق العاده داره که میتونید دسترسی برنامه ها رو به هرچیزی محدود کنید! یعنی میتونید تعیین کنید این بازی اجازه اتصال به اینترنت نداره! یا مثلاً این برنامه اجازه دسترسی به پیامک ها و گالری رو نداره! واین همون چیزیه که در بدر دنبالش میگشتم که بدون روت کردن، امکان پذیر نبود...
کیفیت صدا کلا خیلی خوبه و توی مکالمه مجبورم صدا رو کم کنم تا صدا ازش درز نکنه به بیرون، البته یه نرم افزار مدیریت صدا داره که میتونید تقویت صدا رو خاموش کنید.
باتریش 2200 واقعیه و با استفاده تمام وقت از اینترنت 4G و تلگرام یه روز و نیم دووم اورد! تازه وقتی رسید به 20، پیشنهاد فعال شدن حالت کم مصرفو داد که خیلی بهترش کرد. سعی کنید باتریو تا 100 نشده درنیارید حتی 99 هم شارژ کامل حساب نمیشه. باتریش قابل تعویضه.
طراحی گوشی هم بنظرم خیلی شیک و زیباست. رنگ خاکستریشو گرفتم که البته نزدیک مشکیه و یه قاب سیلیکونی بی رنگ مایل به آبی داره که وقتی فلاش گوشیو روشن میکنید، واقعا دیدنی میشه
ضد خشی که همراشه توش دستمال مرطوب و چسبهای ضد ریزگرد داره و من که دفعه اولم بود خیلی راحت بدون یه حباب نصبش کردم.
معایب:
چراغ اعلان نداره و اگر صدای گوشیو نشنیده باشید مجبورید صفحه رو روشن کنید و چک کنید که کسی زنگ یا پیام زده یا نه. البته نرم افزارایی هست که فلاش گوشیو چشمک زن میکنه موقع پیام اومدن که خب باتریو میخوره.
توی سه ساعت شارژ کامل میشه با اینکه ظرفیت باتری زیر 3000 میلی آمپره، توقع داشتم دوساعته شارژ بشه.
در مجموع نسبت به این قیمت، دو تا عیبی که داره انصافاً قابل چشم پوشیه، با این رنج قیمت بقیه هم این قابلیتا رو ندارن، قیمتش عالیه، بنظرم تنوع و جایگزین خوبی برای گوشیهای میان رده تکراری هواوی و سامسونگه. اگه برگردم به ده روز پیش باز هم همینو سفارش میدم.
یاعلی",7,3,5,4,4,4,4,4
"صفحه . دوربين سلفي عالي .فورجي عالي.گارد ژله اي ضربه گير همراهش هم عاليه","يه کم باطريش کمه که با نور صفحه اتومات يا دستي تنظيم کنيد در طول روز اونم حل ميشه","گوشی نسبت به قیمت عالیه و چیزی با این کیفیت امکانات تو بازار وجود نداره خیالتون راحت من همه ی گوشیها رو داشتم تقریبا
در ضمن یه گلایه از دیجی کالا دارم بابت قرعه کشی این گوشی که گفته بود عید قربان انجام میشه ولی هنوز خبری نشده",10,3,3,3,3,3,3,3
,,"در زمان زنگ خوردن گوشی صفحه گوشی روشن نمیشه و دوم اینکه بعضی مواقع صفحه نمایش اگر خاموش نکنم تا موقعی که شارژش صفر بشه و گوشی کلا خاموش بشه روشن میمونه، امیدوارم آپدیتی برای رفع این نواقص بیاد. (البته با روشن خاموش کردن گوشی تا مدتی این مشکل حل میشه ولی بعد از مدتی دوباره این مشکلات وجود داره)",10,4,3,2,3,3,3,2
"4g قيمت هدايا و ساير امکانات در مقايسه با گوشي هاي هم رده...","دوربين ميتونست کمي بهتر باشه ولي بازم نسبت به قيمت قابل قبوله عدم وجود چراغ اعلان که واقعا نميدونم چرا نداره!","من در مقایسه با هانر 3 هواوی میگم که کاملا این گوشی قابل قبوله با توجه به قیمت و هدایاش؛ و نقاط قوت و ضعف نیز گفته شده...",2,1,5,4,4,4,4,3
"دوربين خوب و سلفي خوب
سخت افزار خوب
صفحه نمايش خوب
ارگونومي خوب
فلش بسيار قدرتمند","صداي ضعيف
هندزفري ضعيف
شارژدهي متوسط باتري","راضیم ولی تو هیچ زمینه ای شگفت زده نمیکنه شما رو.
مثلا zte nubia 5s من رو در زمینه صفحه نمایش و صدا شگفت زده کرد با قیمت 300 هزار تومان!
ولی در کل نسبت به قیمتش می ارزه من خودم تو کار گوشی های ارزون قیمت با مشخصات فوق العاده ام. پیشنهاد میکنم منتظر zte z max pro بمونین. یه سرچ کنید میفهمید چرا.",2,2,5,4,3,4,3,1
,"نداشتن چراغ نوتيفيکيشن يا همون اعلان","تا الان ضعف اصلیش نداشتن همون چراغ اعلانه که با وجود کاربردی بودن رو بعضی گوشیا مث این گوشی نیست",2,4,3,3,3,3,3,3
ندارد,"همه چي","با این قیمت برید سامسونگ جی تو بخرید که واقعا خیلی سرتر از این هست.گول چند تا سنسور نخورید.دوربینش ضعیف.شارژ نگه نمیداره.پردازنده که اصلا نگو....
البته اینم ثبت نمیشه .یاعلی",4,12,3,3,3,3,3,3
"تراحي زيبا
سبک و خوش دست
روون و بدون گير
4g
بسيار زيبا و تکرار نشدني","نقطه ضعفي نديدم","در حد خودش خیلی عالیه،میشه گفت بهتر از این گوشی در این رنج قیمت پیدا نمیکنید از دیجی جون هم نهایت تشکر رو میکنم که با سرعت بالا این محصول رو برام اورد.",9,3,5,4,4,4,4,3
"رام 2 گيگ
اندرويد 5","عدم پشتيباني otg
نبود چراغ هشدار نوتيفيکيشن
دوربين نچندان قوي","بنظرم با یک مقدار هزینه بیشتر گوشی شیائومی بگیرید بسیار بیشتر از خریدتون لذت میبرید من توی این گوشی نو آوری یا قابلیتی ندیدم تازه عدم پشتیبانی otg برای گوشی های جدید یه فاجعس گوشی قبلیم اسمارت clio 4700 بود اینو انداختم کنار دوباره اسمارت گرفتم دستم",6,3,2,3,2,3,2,2
"3G.4G
RAM&ROM
زيبايي","باطري
دوربين","گوشی نسبت ب قیمت درحد براورده کردن انتظارات طرف مقابل هست ولی اگه کیفیت دوربین یکم بیشتر بود عالی میشد نقد دوستان هم که سایر گوشی هارو به این گوشی ترجیح دادن به نظر درست نمیاد و خودتون هم با جستجو کردن و تحقیق کردن ب این نتیجه می رسید ک این گوشی نسبت ب قیمت امکانات بالایی داره گوشیی با این امکانات و این رنج قیمت تا الان که ندیدم ولی این خارج از انتظارم بود که دیجی کالا همزمان با مسابقه حدس بزن و برنده شو قیمت این ایم گوشی رو بالا ببره و جایزه هاشو هم کم کنه یعنی اینجا دیجی کالا داره یه جا جایزه میده و یجا دیگه هم قیمتارو میبره بالا و هم جایزه های دیگه رو یا قطع می کمه یا کم ...",5,2,4,4,4,4,4,3
,,"لطفا قابلیت otg رو به مشخصات فنی اضافه کنید",4,2,3,3,3,3,3,3
,,"دومین خریدم هم به دستم رسید. بی صبرانه منتظر اعلام نتیجه قرعه کشی هستم، خواهشی که از دیجی کالا دارم اینه که نتیجه قرعه کشی رو اعلام کنه",4,2,4,3,4,4,4,3
"امکانات به نسبت قيمت خوب","لوازم جانبي. باطري. ژله اي قاب به سختي گير مياد","لوازم جانبی. باطری. ژله ای قاب به سختی گیر میاد",4,7,3,3,3,3,3,3
"دوربين صدا خوشدست خاکستري خوشگل و....","نسبت به پولي که دادم مي تونم بگه هيچي جدا هيچي اين تجربه کارکرن من تو چهار روز","من که همه رقمه تست کردم در ضمن فکر لوازم جانبی رو نکنید توجعبه هر آنچه که مورد نیاز است را دارد .اسپیکر مونو ولی قوی وبا صداب بلند نسبت به رقبا. دوربین در حد قابل قبول .خوشدست مانند ال جی جی3 کیفیت ساخت خوب و ارزش خرید بالا با توجه به هدایا ولوازمی که دیجی در کنارش گذاشته من چند روزی هست دارم ازش استفاده می کنم ولی خداوکیلی باز هم میگم با توجه به هدایا وقیمت عالی حتی قابل مقایسه با رقبای همسطح خودش در برند های معتبر",9,2,5,2,5,4,5,4
,,"اولا که از تراکم پیکسل ها همه چی معلومه که چه نوع صفحه نمایش داره اونم lcd که مدتهاست دیگه کاربردی نداره با این قیمت هم میشه یه اولترا زد سونی خرید که خیلی سر تره
فقط سوالم اینه که این قیمتشو از کجا اوردن گوشی خوش فرم و جالبی هم ک نیست بقیه قابلیت هاش هم تعریفی نداره الان در حد لومیا 520 نوکیا هم نیست در ضمن ماکروسافت یه نمونه جدید زده لومیا 550 هم ارزونتره هم خشکلتره و باکلاستر دیجی کالا کم کم داری بنجل فروشی میزنیا",5,29,3,3,3,3,3,3
"نمايشگر 5 اينچي با کيفيت مناسب
پردازنده خوب و رام بالا نسبت به قيمت
دوربين هاي با کيفيت
اينترنت پرسرعت 4G
باتري با بازدهي مناسب","فعلا هيچکدوم از لوازمش موجود نيس","اول از همه باید بگم وقتی مشخصات گوشی رو تو دیجیکالا میدیدم زده بود منوی فارسی نداره تو اقلام همراه هم هندزفری نزده بود که یکم دو دل شدم ولی سفارش دادم و اومد دیدم هم منوی فارسی داره هم هندزفری لطفا تصحیحشون کنید من رنگ سفید این گوشی رو خریدم و واقعا زیبا و خوش دست هستش طراحیش بسیار شبیه گوشی های پرچمدار LG هستش کیفیت تصویر خوبی داره و در نور افتاب به خوبی میتونید استفاده کنید از سخت افزارش خیلی کار نکشیدم ولی با همین استفاده عادی کوچیکترین هنگی نداشت و رام مناسبی داره و چنتا برنامه با هم باز باشه مشکلی ایجاد نمیکنه از حافظه داخلی کمتر از 10 گیگ در دسترس هستش باتریش فوق العادس و بازدهی خیلی خوبی داره و اون دوستمون گفته 100 نمیشه مشکل از گوشیشون هست منوی زیبا و روونی داره و تنها مشکلش اینه منوی برنامه نداره دوربین های خوب و قابل قبولی داره و نباید با این قیمت انتظار بالایی از گوشی داشته باشید و دارای فلاش 2 تایی هست که نور بسیار خوبی داره از دو سیمکارت به خوبی پشتیبانی میکنه و اینترنت 4G خیلی خوب کار میکنه فقط لوازم جانبی تو بازار تقریبا هیچی نداره که امیدواریم با بیشتر شدن این گوشی اون هم موجود بشه درکل با این رده قیمتی یکی از بهترین گزینه هاس",3,1,5,3,3,5,4,3
,,"بنظر من در عصر فعلی با توجه به اینکه اکثر گوشی ها و بطور کلی گجت های نسل جدید به سمت استفاده ی حداکثری از فضاهای در دسترس خود پیش میرن
این گوشی دچار ضعف شدید در طراحی هستش
طوریکه حاشیه ی اطراف صفحه نمایش ادمو به یاد گوشی های لمسی نسل اول میندازه.",7,18,3,3,3,3,3,3
"کيفيت بالاي صفحه نمايش.خوش ساخت بودن.
باطري نسبتا ضعيف",,"گوشی خوبیه البته نسبت به قیمتش.صفحه نمایش خوب.خوش ساخت.حافظه خوب.بدون هنگ.دوربین نسبتا خوب.فقط یه کم من باباطریش مشکل دارم وگرنه به جز باطریش همه چیش خوبه",19,3,5,5,3,5,4,4
"همه چيز ظاهر-امکانات-شرکت سازنده -دسترسي و...","فقط شايد منوي فارسي نداشتن که اونم با برنامه فارسي ساز حل ميشه","دوستان با این امکان نات و این قیمت محال همچین سیستمی توی مارک های دیگه گیرتون بیاد
وتی پی لینک هم شرکت معتبری در عرصه فنا وری شبکه و
ای تی است
و ازاین گوشی انتظار دوربین گوشی هفتصد هزار تومانی به بالا
رو نداشته باشید
یاعلی مدد. موفق باشید",15,7,5,5,5,4,5,5
,,"با سلام بعد چند روز کار کردن با گوشی هنگام زنگ خوردن صفحه روشن نمشود که باید دستی باز کنی وجواب بدهی گوشی را خاموش و روشن کردم خوب شد بعد مدتی دوباره تکرار شد",10,15,3,3,3,3,3,3
"شارژ و نت خوبي داره","فقط نميدونم چرا بيشتر از 94 شارژ نميشه","گوشی خوبی هست و به قیمت میارزه و من که راضی هستم فقط کاش یکم تصویر شفاف تر و دوربین با کیفیتی داشت باقیش عالیه.",4,4,4,5,3,3,5,4
,,"س این نقد دوم من هست درباره این گوشی سیستم امنیتی عالی داره تو حالت کم مصرف صفحه ساه سفید میشه و در ضمن این گوشی باتریش قابل تعویضه تو مشخصات ضربدر زدن کارشنا سا حواسشون کجاست و هندزفری و کابل یو اس بی با هاش هست گوشیه خوبیه اگر ابدیتش کنین مصرف باتریش خوب میشه روز اول بعد از 8 ساعت شارزه اوله بعد 1 ساعت گوشی استندبای بود 12 درصد کم کرد ولی بعد از ابیدت خوب شد و اخرین حرفمم من یه رم 64 گیگ روش گزاشتم راهت ساپورت کرد گوشی نسبت به قیمت عالیه",10,6,5,4,3,3,4,1
,,"عالیه نسبت به قیمت و هدایا همراه",6,1,4,3,4,4,3,3
"همه چيز",فيلمبرداري,"قبلا نظرم رو در مورد این گوشی نوشته بودم ولی الان بعد 1 هفته به سخت ترین شکل ممکن آزمایشش کردم و بازی های سنگین مثل آسفالت 8 و مدرن کامبت 5، گنگستار 4 رو باهاش بازی میکنم بدون هیچ لگ و هنگ جواب میده، در صورتی که گوشی قبلیم هوآوی جی 700 بود و با دوگیگ رم (که قعطا الکی بود) بازی مثل اسفالت رو جواب نمیداد و کلا لگ و آهسته بود. خلاصه اینکه من ازش راضی ام خدا هم ازش راضی باشه با این قیمت...",16,5,4,3,4,4,4,3
