positivePoints,negativePoints,commentText,like,dislike,"ارزش خرید به نسبت قیمت",نوآوری,"کیفیت ساخت","امکانات و قابلیت ها","سهولت استفاده","طراحی و ظاهر"
"دوربين
اجراي راحت برنامه ها با داشتن 2 گيگ رم","دکمه هاي کناري، کم و زياد کردن صدا، قفل شدن صفحه","تجربه بعد از 5 ماه استفاده
اوایل خرید این قدر حساس بود که من تا حالا ندیده بودم
این قدر دکمه های کناریش حساس بود که فقط افی بود یه کوچولو لمس بشه تا واکنش بده، انگار لمسی بود
اما
الان باید جون بکنی تا صدا کم و زیاد بشه یا صفحه قفل بشه
منطقی هست با داشتن 2گیگ رم، میتونه برنامه های روزمره رو بدون اذیت کردن باز کنه.
دوربینشم به نظر من با توجه به قیمتش خوبه
الان هم می خوام برم گارانتی ، نتیجه رو بعدا میگم.",0,0,3,2,3,3,3,3
"دوربين سلفي","ذخيره شارژ باطري","من خیلی وقته این گوشی رو دارم چون نمیخواستم زیاد هزینه کنم و به دلیل اینکه مودم این شرکت رو هم داشتم و اینکه اوایل ورود این برند به عرصه ی تلفن همراه بود اطمینان کردم و به هیچ وجه پشیمان نیستم،دوست عزیز اگه رویایی فکر نمیکنی این گوشی انتخاب مناسبیه ولی اگر به نظر بنده میتونی تا هشتصد هزار تومان هزینه کنی این گوشی رو نخر ولی اگر زیر این مبلغه حتما همین گوشی رو بگیر،من با گوشی بازی نمیکنم ولی در حالت عادی تا حالا هنگ نکرده و یک نکته مطمئنا چون اول راهه قطعاتش کمه فعلا پس اگر انسان منظمی هستی این گوشی رو بگیر.تمام",0,1,5,2,3,4,3,2
"دوربين
باطري
تاچ عالي",هيچي,"سلام.من این رو از بیرون خریدم.عالیه عالین",0,1,3,4,4,5,3,4
"همه چي","پيدا نشدن لوازم جانبي","سلام.واقعا گوشی خوبی هستش از هر لحاظ تو این قیمت نصبت به برندایه دیگه شک نکنید",0,1,3,3,3,3,3,3
"اينترنت 4gبراي هر دو سيم ،اصلا هنگ نداشته،حافظه داخلي مورد قبول،اجراي اکثر برنامه هايش قابل نصب،قطب نماو....","اسپيکر ضعيف،دوربين نسبت به گوشي سوني کمي ضعيفه ولي نسبت به سامسونگ خوبه","تجربه 6ماهه استفاده از گوشی نقاط قوت:اصلا هنگ نداره ،اجرای برنامه هایش قابل نصب وسی پی یو قوی،صفحه نمایش مورد قبول با سایز مناسب وخوش دست،باطری با شارژ مناسب،4gاینترنت بسیار قوی ،داشتن قطب نما و...نقاط ضعف: اسپیکر ضعیف با صدای کم",1,2,3,3,3,3,3,3
"رم مناسب.باطري با ظرفيت مناسب.دو سيم 4g","ساپورت لوازم جانبي","با توجه به قیمتش سخت افزاره خوبی داره.مشکلاتی هم که بعضی از دوستان فرمودند هیچ کدوم رو من باهاش نداشتم.در مجموع خوبه",0,1,3,5,3,3,3,3
"قيمت سخت افزار دوربين با کيفيت صفحه تاچ عالي طراحي زيباي گوشي","هيچ مشکلي نداره","سلام
دوستان من الان نزدیک به یک ماه میشه که این گوشی رو خریدم و تا اینجا خیلی راضی بودم از این گوشی...این گوشی با توجه به قیمتی که داره خیلی امکانات زیادی هم داره.اول می خواستم بخرم شک داشتم ولی الان کاملا نظرم عوض شده...به کسایی که شک دارن هم می خوام اطمینان بدم که عالیه این گوشی.
امید وارم که دیجی کالا تایید کنه پ بزاره نظرمو تا شما هم متوجه بشید.",0,2,5,5,4,5,5,5
,"همه چي","خیلی گوشی خشک و هنگی. پیشنهاد نمی کنم",1,1,3,3,3,3,3,3
ارزون,"باگ نرم افزاري
کيفيت ساخت پايين
نبود لوازم جانبي
هر چي که فک کنين","سلام
این چندمین باره که میام اینجا و نظر میزارم .
من که گول تبلیغات قرعه کشی این گوشی رو خوردم و خریدمش.
ولی اگه کسی خواست گوشی بخره حتما و حتما و حتما به برندش اهمیت زیادی بده .
چون با وجود این همه مشکلات که واسه من پیش اومده کاری نمیتونم بکنم.
ولی اگه گوشی رو از برند معروفی میخریدم با وجود اینکه قیمتش بیشتره ولی ارزش بالایی هم داره.
چون اگه چیزیشون خراب بشه اعم از مشکل نرم افزاری و سخت افزاری هم فایل های گوشی به راحتی پیدا میشه و هم سخت افزار شون تو بازار هست و تعمیرکارا هم میتونن کاری کنن.
امیدوارم که این نظرو دیگه تأیید کنن . خدا شاهده توش دروغی نگفتم.",39,3,5,4,4,5,4,3
,,"شک دارم گوشی خوبی باشه",5,2,3,2,3,3,3,3
,,"دوستان اصلا نمیشه از نظرات فهمید این گوشی خوبه یا نه ، باید خودتون باهاش کار کنین",6,4,3,2,3,3,3,3
"من نقطه قوتي نديدم","تماما ضعف","با سلام من دوباره تاکید میکنم دوستان قول قیمت این گوشی رو نخورن.
من یه 2ماهی این گوشی رو داشتم. اصلا خوب نبود. بعضی وقتا هم ریستارت میکرد خود به خود.
بهتره یه گوشی شناخته شده بخرید تو رنج این قیمت واقعا گوشی های خوبی تو بازار هست. ال جی و سامسونگ و هوآوی",14,2,5,4,3,1,3,3
"نسبت به قيمت ارزش خريد داره","موقع زنگ خوردن بعصي مواقع صفحه نمايش روشن نميشه که بتوني پاسخ بدي","چند روزه که برچسب صفحه نمایش که توکارتنش بود استفاده کرده بودم خراب شده وکنده شده هرجاهم میرم پیدا نمیکنم وتو بازار نیست از این بابت خیلی بد
اگه لوازم هم بزارین عالیه",6,5,3,3,3,3,3,3
"سرعت قدرت سخت افزاري باتري خوب","فعلا نقطه ضعفي توش نديدم","من این گوشیو خریدم کیفیت بالایی داره ram2gسرعت بالایی بهش داده مطمئنم گرون میشه چون می‍‍‌ارزه",3,6,5,5,4,5,5,2
,,"این گوشی باگ نرم افزاری زیادی به صورت پیش فرض داره درست،اما مشکل تغییر 4جی به شبکه های دیگه نداره از نظر آنتن دهی عالیه(مگه اینکه تو پوشش نباشی)،دوستان عزیز کسایی ک مشکل دارن میتونن فایل اپدیت شو(ترجین آخریش) از سایت نفوس بگیرن و اپدیت کنن(ترجیحن با قند شکن ک نسخه اروپا رو بگیره،زبان فارسی پشتیبانی میکنه)روشش هم تو سایتش هست.تنها مشکل من با اپ های پیشفرض تلفن و پیام رسان اونه ک من خودم جدا نصب کردم",5,9,3,3,3,3,3,3
"سخت افزار قوي و به صرفه","نرم افزار ضعيف
ثابت نموندن روي يک شبکه 3g يا 4g","با سلام من 2 ماهه این گوشی رو دارم، از لحاظ سخت افزار واقعا گوشی خوبیه، از لحاظ نرم افزار اما کمبود داره، از روز اول سنسور مجاورت(primixy) کار نمیکنه، از لحاظ شبکه حتی اگر زیر دکل هم وایسید بعد یه مدت از 4G به E پرش داره، باید دوباره شبکه رو دستی بهش بشناشی،حتی من اپلیکیشن 4G only هم نصب کردم، اون وقت هم هر کی زنگ میزنه میگه اشغاله
خلاصه tp-link این گوشی رو از روی LG کپی کرده پیشنهاد میکنم یه گوشی برند مثل LG یا samsung بخربد، من میخوام یک LG k10 بخرم، یکی داریم اصلا پرش انتن شبکه نداره اون خیلی بهتره. پیشنهاد میدم رو پولتون بذارید یه برند بخرید.",14,4,5,4,3,1,3,3
"عالي با اين قيمت","اندرويد نسبتا قديمي با باگ فراوون","سلام و عرض ادب،دو هفته ی این گوشی و سفارش دادم،نسبت ب قیمتش عالیه،مخصوصن آخرین بیاد اندروید شو روش فلش زدم(اپدیت کردم اول دیدم چنگی ب دل نزد)،پشتیبانی خوبی داره،تنها مشکلش اینه دیجی لوازم جانبی سونی موجود نمیکنه.دوستان گلم،این گوشی از برندی ب نام ولی واقعا عالیه و پشتیبانی خوبی داره.فقط ا تی جی نمی‌خوره و اندروید ش با اس دی تو بعضی اپ ها مشکل داشت(من با روت حلش کردم).در آخر تنها چیزی ک می‌تونم بگم دوستان انتظار نداشته باشین با این قیمت اس 7 دستتون بگیرین،فوق العاده برای استفاده روزانه",6,12,3,3,3,3,3,3
"سي پي يو و چيپ گرافيک برد الکترونيکي با کيفيت کيت آبي","تاچ ضعيف دوربين ضعيف قطعات بدنه ضعيف باتري ضعيف","آقا انصافا نسبت به قیمتش منصفانه است ولی اگر نخریدین هنوز یه گوشی بهتر از این بخرین چون سیستم عاملش اپدیت نداره یه بار اپدیت میشه دیگه تمام. نسخه اندروید 5/1 هست و به درد نمیخوره ادم عصبی میکنه راحت و خلاصه نیست هزار بار باید تایید کنی تا میخوایی یه اس ام اس بدی . دوربین تعطیل . تاچ پد شماره گیر ضعیف شماره ها اشتباه تاچ میشن اگه سریع بزنی.ریسنت پاک نمیشه باید با انگشت بکشی تا پاک شه .روی شبکه فورجی قطی داری یعنی اگه زیر انتن موبایلم وایسی یهو قط میشه دو باره باید اینترنت موبایل قط و وصل کنی .باتری کلا ضعیفه زود تموم میشه نور صفحه رو باید همیشه پایین باشه.آپدیت نمیاد تو سایتش کلا.دکمه ولوم کنارش وقتی کم کنی کل صدای گوشی کم میش",18,6,1,2,3,1,3,3
"4G
Ram 16 G","دوربين متوسط","این گوشی با امکاناتش با این مبلغ عالیه . گارانتی پارس ارتباط هم که عالیه . من کارم فروش مودم های تی پی لینکه . کامل با این شرکت گارانتی دهنده آشنا هستم . تو این چهار ماه یکبارم هنگ و لگ نداشتم .
در ضمن این گوشی خز نیست دست کسی نمیتونی ببینی .
از قدیم گفتن هر چی پول بدی آش میخوری",9,10,5,4,5,4,4,4
"سرعت بالا در پردازش و اجرا
4G با سرعت بالا و واقعي
امکانات بسيارخوب نسبت به قيمت","عدم پشتيباني از OTG
باتري متوسط","قبلاً هم نظرمو ثبت کرده بودم راجع به مزایا و معایبش، اما الان بعد از 5ماه چیزایی که بنظرم رسید رو مینویسم، بیشترشو توی نقاط قوت و ضعف گفتم.
اگر حس می کنید به انتقال فایل از فلش مموری به گوشی یا برعکس نیاز پیدا میکنید،متاسفانه این گوشی مناسب شما نیست، خودم خیلی حرص خوردم سر این قضیه
و باتری بعد از 5 ماه استفاده یه مقداری نسبت به اولش ضعیف شده و نهایتا از صبح ساعت 8 صبح تا 8 شب شارژش به 20 میرسه در حالت استفاده عادی (تمام وقت 4G روشن).
در مجموع گوشی خیلی خوبیه نسبت به قیمتش؛ اگر دنبال باتری قوی می گردید، سری به گوشی GLX مدل پارس بزنید، 5000 میلی آمپر آخه؟!",5,9,5,4,4,4,4,4
,,"الان چند ماهه که دارم و راضیم،نسبت به قیمتش خیلی خوبه،گوشیه که دست هر کسی نمیبینیش ،خوشگله،نرم افزارش هم خوب و روونه،کلا نسبت به پولی که دادم خیلی بیشتر ارزششو داره...",5,5,3,3,3,3,3,3
,,"سلام من این گوشی رو‌ پنج ماهی هست گرفتم.میتونم بگم عالیه.
فقط مشکلش اینه که لوازم جانبیش وجود نداره.
از سایت دیجیکالا خاهش میکنم لوازم جانبی رو موجود کنه.",10,3,3,3,3,3,3,3
,,"عالییه بخرید",5,4,3,0,3,3,3,3
,,"من گوشی چند ماه قبل گرفتم اول خوب بود بعد 4 ماه کلید زیاد کردن صدا خراب شد فقط میشه صدا کم کرد طراحی خوبه ولی وقتی گلاس انداختم انعکاس نورش زیاد شده امروز که دیگه قفل لمسی که با انگشت میکشیدی پایین قفل میشد دیگه کار نمیکنه شماره های که تو سیم کارت ذخیره کردم نمیاد که باید گوشی خاموش روشن کنم چند بار این مشکل از اول بود ولی قاب پشتش خیلی خوبه مقاوم در برابر جذب اثر انگشت. دوربین که اصلا خوب نیست",5,5,2,2,3,4,5,3
"cpu
design",camera,"در کل باید بگم نسبت ب قیمتش معمولیه",2,6,1,2,2,3,3,0
"cpu قوي
ram کارد خوبي دارد","دوربين خراب شده","سلام
3 ماه هست که خریدم
نسبت به قیمتش امکانتش خوبه
قدرت پردازشش و هنگ نکردنش خیلی خوبه ---- رم و سرعتش عالیه --- اما دوربینش الان خراب فیلم میگیرد و کسی پاسخگو نیست یکبار میگند اندروید را ارتقاء نمیدادید و دفعه دیگه میگند ارتقاء بدهی خوب خواهد شد...از دوربینش ناراضی",4,3,3,3,3,3,3,2
"باطري.سرعت cpu.","دوربين متوسط","قابل توجه کسانی که این گوشی رو خریدن و از نرم افزار دستگاه ناراضین. باید بگم که 950 مگابایت اپدیت اومده برای گوشی که تموم مشکلات نرم افزاری دستگاه رو حل کرده . رو هم رفته گوشی خوبیه با قیمت مناسب",4,5,3,3,3,3,3,3
,,"واقعا عالیهه من 2سال هس دارم از این گوشی ها تا حالا یکبار هنگ نکرده سیستم بدنی واقعا قویهه",3,6,5,5,5,5,5,5
"ايرادات زياد نرم افزار","سخت افزار قوي","این نقد و بررسی دوم منه. حالا کاملا با گوشی آشنا شدم.
شرکت tplink یک شرکت تولید سخت افزاره. و اگر مثل من کاملا با این گوشی آشنا شده باشید متوجه میشید که از لحاظ سخت افزاری تو این قیمت عااالیه. ولی هرچی سخت افزارش قویه، بخش نرم افزاریش واقعا لنگ میزنه.
اول باید در پاسخ اون دوستمون که برنامه ها رو بعد مخفی کردن گم کرده باید بگم که کافیه روی صفحه اصلی با دو انگشت به سمت پایین بکشید تا برنامه های مخفی شده رو نشون بده.
و اما لگ ها یا ایرادات نرم افزاری :
یک ـ وقتی داده های گوشی روشنه ، و با سرعت بالایی توی برنامه ها کار میکنه، بعضی برنامه اصلا با داده ها اینترنت ندارن. مثل مرورگرها (سه نوع مرورگر رو امتحان کردم)، برنامه بازار و اینستاگرام. اولش فکر کردم شاید من تنظیماتی رو دست زدم که داده ها رو برای این برنامه ها محدود کرده ولی ریست فکتوری هم کردم و اوضاع همونه. در قسمت تنظیمات هم چیزی پیدا نکردم.
دو ـ وقتی گوشی در حال پخش آهنگه، اگر صفحه قفل رو باز کنید و وارد گوشی بشید، در کمال تعجب نوار ابزار بالای گوشی محو میشه و به جاش تصویر صفحه قفل رو نشون میده.
سه ـ وقتی اتصال داده رو خاموش میکنم و وایفای رو روشن، چند دقیقه طول میکشه تا به وایفای وصل شه. بیشتر مواقع مجبور میشم دستی و از تنظیمات به وایفای متصل بشم.
چهار ـ بیشتر وقتایی که تو بازی کلش هستم و بعضی مواقع در برنامه های دیگر، اندروید گوشی تحمل نداره و از برنامه بیرون میپره و مینویسه صفحه اصلی خوب متوقف شده.
پنج ـ واقعا عجیبه که قابلیت انتقال برنامه ها به اس دی کارتو نداره
شش ـ از نظر من نداشتن قابلیت تغییر برنامه های نوار ابزار بالا هم مشکله
گزینه اولی که گفتم بیشتر از تمام این اشکالات من رو اذیت کرده و پشیمون از خرید این گوشی.
مزایای این گوشی رو هم در نظر قبلیم میتونید ببینید و دوباره تکرار نمیکنم.",25,9,5,3,3,4,4,2
,,"عالی من راضیم",3,5,5,4,3,4,3,3
,,"گوشی خوبیه من 2ماهه دارم و ازش راضی هستم ولی تهیه لوازم جانبی سخته",1,4,4,4,4,5,4,3
,,"این نظر دوم منه درمورد این گوشی، یه قابلیت داره واسه مخفی کردن نرم افزارها که اگه مخفی کنی بعضی از نرم افزارا کلا دیگه پیدانمیشن بایداز تنظیمات بازکنید، دوربین گوشی درحالت فیلم برداری نمیدونم چرا زومه اصن عجیبه شاید واسه من اینطوری بود.یه چیز دیگه که هندزفری وصل میکنی بعداز یکی دوماه واسه من کیفیت صداش پایین اومده، باگ های دیگشم بماند",11,1,3,3,3,3,3,3
"ظاهر زيبا
امکانات مانند ساير پايين رده ها","دوربين
خروجي صداي هندزفري
باگ نرم افزاري
نبود لوازم جانبي","سلام
بعد دو ماه استفاده سبک دچار هنگ و لگ شده فقط تلگرام و اینستا و چند تا نرم افزار مورد نیاز دیگه رو نصب دارم
دوربینش هم جدیدا شده نویز خالی
خروجی صدای هندزفری کیفیت بالایی داره ولی حجم صداش خیلی کمه
برچسب صفحه هم یه خش روش افتاده ولی برچسبش پیدا نمیشد که یدو برچسب تبلت گرفتم و دورشو زدم
به هیچ نرم افزاری هم اجازه تغییر داده نمیشه مثلا نرم افزار های مدیریت فایل اجازه انتقال فایل رو ندارن . zarchive هم اجازه نداره فایل زیپ رو اکسترک کنه و تو قسمتی که اجازه میده هیچ چیزی وجود نداره کلا سرکاریه
و اجازه انتقال به کارت اس دی رو هم نمیده
ذخیره نیرو هم که الکیه چون فقط رنگ سیاه تبدیل به نارنجی میشه ولی هیچ انیمیشن یاافکتی رو غیر فعال نمیکنه
واستحکام هم کمه هر دفعه که قاب پشتشو میخوام باز کنم فک میکنم الانه که بشکنه و در کل بدون گارد احساس خوبی ندارم
نمیدونم شانس منه یا اینکه کلا اینا اینجورین اما پشیمونم از انتخابم .",10,3,5,4,4,5,4,3
"سخت افزار قدرتمن
رم 2 گيگ بدون هنگ و روشن شدن ظرف 10 ثانيه
نمايشگر خوب
قابليت تصوير برداري full hd &hdr
دوربين سلفي خيلي خوب","رابط کاربري که من از من هايي که مثل هواوي باشه اصلا خوشم نمياد","دوستان دقت کنید این جنس درجه 1 چین هست و قابلیت رقابت با خیلی از برند ها رو داره از نظر گارانتی و پشتیبانی من اینو از شهر خریدم گارانتی تعویض داره در صورت خرابی تعویض میشه که خیلی خوبه
صفحه نمایشش زمان روشن شدن مجذوبت میکنه و خیلی راضی
از نظر سرعت پردازش عالی هست دو سیمکارت همزان 4g هم که خیلی عالی هست
باتریش اصلا بد نیست و دلیل از بین رفتن باتری اون 8 ساعت شارز اولیه هست که نباید انجام بشه چون باتریرو نابود میکنه من الان با این باتری به صورت مداوم 8 ساعت فیلم می بینم و حدود 8 ساعت اینترنت 3g استفاده میکنم
از خریدم به شدت راضی هستم و یادتون نره
لطفا برند های دیگه رو که فقط به خاطر اسم گرون هستند رو با برندی که به فکر مشتری های کم درامد هستن مقایسه نکنید",4,10,5,4,5,4,5,4
,,"واقعا با این قیمت بهتر از این گیر نمیاد",7,5,5,4,5,5,3,3
"خيلي ممنون کيفيت صفحه بسيااار عالي",,"بسیار عالی",5,4,3,3,3,3,3,3
,,"راضیم ازش ممنون از دیجی کالا یک هفته دارمش خوب بوده",1,2,5,4,3,4,3,3
"سخت افزار مناسب
صفحه نمايش بسيار با کيفيت
قيمت مناسب","اسپيکرش بسيار ضعيفه هم از نظر کيفيت هم از نظر بلندي صدا
باتريش در عرض 1ساعت تخليه ميشه
دوربين اصليش در صورت لرزش دست تصاويري بي کيفيت ميگيرد","با وجود نقاط ضعفی که داره بازم از خریدم راضیم",4,5,5,3,4,3,4,3
"-صداي مکالمه بسيار عالي
دوربين سلفي خوب باطري خوب
سرعت پردازش عالي-پشتيباني از4G
حافظه16 و رم2گيگ
داشتن هديه","فاقد شرکت خدمات پس از فروش در ايران
دوربين اصلي درحد8نيست
عدم ارايه در فروشگاههاي موبايل
برچسب بي کيفيت هديه
اندرويد5.1 عدم پشتيباني ازOTG","در کل گوشی خوبی است بنده از دو رنگ آن گرفتم هر دو رنگ زیباست .نسبت به قیمت آن عالی است .باطری آن هم خوب است.با توجه به استفاده زیاد از گوشی طبیعی است باطری آن زود خالی شود .یکی از دوستان نظر داده بودند که گوشی های چینی بنجل هستند باید خدمتشون عرض کنم اکثر برندهای معروف در چین تولید میشود .کالاباید باکیفیت باشد برند و کشور تولید کننده مهم نیست.",11,3,5,4,4,5,5,4
"رم و حافظه داخلي بالا و ساپورت حسگرها مانند قطب نما","نسبتا کم","همه چیزش نسبتا خوبه ،من دراین یک ماهی که دارم کاملا راضیم",11,8,3,3,3,3,3,3
,,"دوستان لطفا فقط گوشی سونی بخرید از این جنس های بونجول چینی نخرید",19,68,0,0,0,0,0,0
ندارد,"همش متاسفانه","متاسفانه امروز وای فای گوشی از کار افتاده وروشن نمیشه ،این مشکل درکنار باگ نرم افزاری خیلی زیاد کلا پشیمون شدم از خریدش",27,28,3,3,3,3,3,3
"طراحي زيبا
قيمت مناسب
سخت افزار خوب و قابل قبول با توجه به قيمت","باطري ضعيف","من این گوشی رو برای مادرم خریدم زیباست و با توجه به قیمتش و برچسب و گاردی که دی جی کالا میده واقعا عالیه حتما توی این رنج قیمت این گوشی رو خریداری کنید درسته نام اشنا نیست ولی نا امیدتون نمیکنه",9,13,4,4,4,3,4,4
,,"این عجیبه که otg اسپورت نمی کنه.",8,21,5,3,3,3,4,2
"نسبت به قيمتش عالي( زماني که شگفت انگيز بود )","مشکلات و باگ ها نرم افزاري فراوان
دوربين افتضاح
کيفيت سخت افزاري خييلي بد","با توجه به نقاط قوت و ضعفش که ذکر کردم، پشیمونم.",17,20,1,4,3,2,5,0
