positive_points,negative_points,text,like,dislike,"ارزش خرید به نسبت قیمت",نوآوری,"کیفیت ساخت","امکانات و قابلیت ها","سهولت استفاده","طراحی و ظاهر"
,,"من از قدیم از طرفدارای htc بوده ام اما بین خرید این گوشی و سامسونگ s7 edge مردد بودم ولی بین قابلیت ضد آب بودن سامسونگ و ضد ضربه بودن htc، امتیاز رو به htc دادم با اینکه Samsung از Gorilla Glass 5 استفاده کرده وHTC از Gorilla Glass3 ولی در تست ضربه htc مقاومت بالایی نشون داده که این ماجرا طراحی دقیقتر و حساب شده تر htc رو نشون میده. البته htc در برخورد با آب مقاومت خوبی نشون داده و من M9 داشتم که 1 ساعت در آبشار در برابر رطوبت زیاد و پودر آب فیلم و عکس گرفتم و جان سالم در برد.
کیفیت صدای htc ظاهرا بهتر هست که من استفاده زیادی از آن نمیکنم .
دیگر قابلیت هایی که ترجیح میدادم در htc وجود داشت شارژ بیسیم و 2 سیم کارته بودن است ولی نکته این که سامسونگ در حال حاظر حداکثر با رم 32 موجود است که به ناچار اسلات سیم کارت دوم را رم خارحی اشغال خواهد کرد و عملا یا با حافظه کم باید بسازید یا تک سیم کارت باید استفاده کنید.
ولی استفاده از Gorilla Glass 3 در HTC کمی عجیب بود و در دیجی کالا هم ورژن 4 درج شده و عده ای هم به اشتباه فکر میکنند 5 هست.",0,0,4,5,4,5,5,4
"کيفيت و ظاهر عالي در کنار سخت افزار و امکانات کافي","حيف که تک سيمکارته هستش. ولي نقطه ضعفي من نميبينم.","بنظر من این گوشی عالیه البته این نظر فقط از روی مشخصات اعلام شده میدم. ولی از انجایی که کیفیت دو مدل گوشی قبلی از این برند داشتم کاملا راضیم و عالی بودند. بنظرم از انتخاب این گوشی نسبت به پرچمداران سایر برندها راضی تر خواهم بود.البته بنده منتظر نسخه دو سیم کارت این گوشی دقیقا با همین مشخصات هستم.امیدوارم این شرکت برای مشتریانی مثل بنده هم اقدامی صورت بدهد.و از دیجی کالا میخوام در صورت تولید نسخه دو سیمکارت این مدل اطلاع رسانی بکند و موجود باشه تا بتونیم خریداری کنیم.با تشکر از زحمات دیجی کالای عزیز.",3,1,3,3,3,3,3,3
,,"دوستی که میگه سامسونگ برتریش سیستم خنک کننده و باتری بیشتره،،اولا اس7 چون شیشه هس مجبوره با یه سیستم خنک کننده گرمارو دفع کنه،بدنه فلزی خود فلز نقش دفع کننده گرمارو داره. باتری 3600 داره،،چون صفحه نمایشش بزرگتره اگه 3000 میزاشت که واویلا بود. و 1.7 با 1.8 تفاوت انچنانی نداره... در کل حنی الجی هم بخرین ضرر نکردین،،، گوشیا الان توی یه سطح هستن",4,3,3,5,4,5,5,3
[],[],"باید عرض کنم بین تمام گوشی های بازار من پرچمداران رو تست کردم البته در حد عکس گرفتن و سرعت عمل عکس گرفتن و اینجور چیزها . باید بگم ایفون همیشه سریعتر بود اما محدودیت هاش اونو جزو گزینه های من هیچ وقت قرار نداده
اما s7 edge بنظرم توی پرچمدارا بهترین گزینس .
سیستم خنک کننده مایع دو سیمکارت باتری 3600 میلی امپر و صفحه edge برتری های این گوشی نسبت به اچ تی سی 10 هست در مقابل 64 گیگ رم و دیگر هیچ
راستی دوربین سامسونگ s7 edge به مراتب بهتر از اچ تی سی هست 240 فریم در برابر 120 فریم و دهانه دیافراگم 1.8 اچ تی سی که در سامسونگ 1.7 هست و به مراتب در کم نوری خودشو مشون میده .
البته فعلا بین خرید s7 و صبر کردن برای گوشی های جدید کمی مردد هستم",2,7,3,3,3,3,3,3
"CPU عالي
من به شخصه ال سي دي رو به امولد ترجيح ميدم
دوربين با کيفيت عالي /لرزشگير سلفي
شارژ سريع
HTC SENSE که من با اون کار کردم از همه ي لانچرها بهتر بود","داخل کشور خدماتش زياد خوب نيست","گوشی خوش دستیه با کیفیت بدنه و سخت افزار عالی
در کل از سامسونگ گلکسی اس 7 اج و عادی بهتره البته این نظر شخصی منه ها بگم",10,2,4,5,5,5,5,4
"استفاده از سري جديد CPU هاي (Snap Dragon (820
استفاده از 4 GB حافظه RAM جهت بهبود اجراي برنامه و بازي هاي سنگين بدون لگ
استفاده از دوربين 12 Ultra Mega Pixel براي دوربين اصلي و دوربين 5 Mega Pixel براي دوربين سلفي با وضوح تصوير بالا
استفاده از محافظ صفحه Gorilla Glass 5 با مقاومت بسيار بالا که مانع آسيب ديدن LCD ميگردد
استفاده از حسگر Finger Print با حساسيت بالا","محدود شدن رابط کاربري فوق العاده hTC Sense و حذف hTc Gallery , htc Mucis و hTc Sense Input و جايگزيني آنها با عناوين Google و Keyboard جديد
کاهش قدرت اسپيکرها نسبت به مدل هاي قبلي مانند M9","به صورت کلی در درجه اول hTc 10 یک اسمارت فون بسیار سریع با طراحی فوق العاده زیبا و شکیل است که برای جذب کاربران وارد بازار رقابت با برند های دیگر شده و به جرات میتوان از آن به عنوان قدرتمندترین پرچمدار شرکت hTc یاد کرد که تنها ایرادی که میتوان از این مدل گرفت محدود کردن رابط کاری محبوب و فوق العاده hTC Sense است که امکاناتی کاربردی با محیطی بسیار زیبا همراه با سهولت استفاده را در اختیار طرفداران این برند میگذاشت که با سیاست جدید شرکت از این پس محیط کاربری بر پایه سیستم عامل Android تغییر کرده و رابط کاربری hTc Sense محدود به خدماتی ظاهری نظیر Theme میگردد و برنامه های کاربردی Google نظیر Google Play Music , Google Photos و ... جایگزین برنامه های اختصاصی hTc Sense نظیر hTc Music و hTc Gallery میگردد.",3,2,5,5,4,4,5,4
,,"عاشقشم ...",6,1,5,5,5,5,5,5
,,"دوستان توجه داشته باشید که مدل 2 سیم کارت اصلا نیست و اچ تی سی نمیزنه",7,2,5,5,5,5,5,5
"همه چي",هيچي,"خیلی گوشی خوبیه و کیفیت ساخت اچ تی سی همیشه عالیه
دوستان میخواستم بدونم رنگ نقره ای مدل 64 گیگ پنل جلوش مشکیه یا سفید.؟",5,1,3,3,3,3,3,3
"همه چي",هيچي,"دیجی کالا موجود کنین رنگ نقره ای پنل جلو مشکیشو چند روز دیگه میخوام بخرم ممنون.",3,0,4,5,5,5,5,5
"بدنه بي نظير
برترين دوربين سلفي 5 مگا پيکسلي
حسگري جذاب و سريع","هنوز اسمارت فوني بدون نقطه ضعف توليد نشده","10 گوشی هوشمندی است که با در دست گرفتن می توانید تفاوت را در دستان حس کنید و دوست خواهید داشت تا از دیگر اسمارت فون ها استفاده نکنید و به HTC روی آورید .",8,2,5,5,4,5,5,5
[],[],"دوستان توی کلیپ اچ دی تست مقاومت بین این مدل از اچ تی سی و آیفون 6 و سامسونگ اس 7 با کمال ناباوری اچ تی سی پس از 32بار پایین افتادن از فاصله یک متری از سمت صفحه نمایش تونست مقاومت خودش رو نشون بده،سامسونگ بعد از 5بار و اپل بعد از 7بار،دلیل مقاومت بالای صفحه نمایش اچ تی سی استفاده از تکنولوژی گلوریاگلس نامبر 5هستش،،پس شاید قیمت بالا این گوشی یکس از دلایلش این باشه،،،،درضمن بنده ام 8 استفاده میکنم",10,5,5,5,5,5,5,5
"[""دوربين با کيفيت ""]","[""شارژ وايرلس ""]","سلام دیجی موجود میکنی بازم",10,1,3,3,3,3,3,3
[],[],"کسی که یکم تو اینترنت بگرده البته تو سایت های خارجی میفهمه این قیمت براش خیلی زیاده
الکی گرون بهترین اسمیه که براش میشه گذاشت",16,28,0,1,1,1,1,0
"محشره ب مولا","قيمت ي کم بالا","دیجی کالا لطفا رنگ مشکی رو هم موجود کنید ضمنا اگه ممکنه گارانتی رو حذف کنید قیمتشو بیاریید پایین تر . ممنون",14,6,5,5,5,5,5,5
"کيفيت ساختش که زبانزد همه س، صدا، usb type c، دوربين هاي رضايت بخش","قيمت يکم زياده (اما باز هم ارزش داره)","از دیجی کالا خواهشمندم که دوتا رنگ دیگه رو هم موجود کنه برای این مدل (64 GB)
مخصوصا رنگ خاکستری رو.
منتظریم.
ممنون.",19,2,4,5,4,5,5,4
"[""htc berand""]","[""android""]","سلام اچ تی سی برند خیلی خوبییه و فوق العادست ولی این قیمت یکم غیر طبیعی برای این گوشی در این رنج قیمت به iPhone 6 هم نگاه کنید",10,20,3,5,4,5,4,3
[],[],"چه اچ تی سی چه سامسونگ چه ال جی چه سونی چه اپل همشون به درد نمیخورن فقط و فقط ایسوس اونم زنفون 3 دلوکس عالیه از همه ی اینا بهتره والا",8,55,0,0,0,0,0,0
,,"دیجی جان خواهشا رنگ طلایی رو موجود کن اکثر ملت طلایی میخوان",12,8,5,5,5,5,5,5
[],[],"دوست عزیز کی گفته کنترل تی وی نداره
من این گوشی رو دارم امتحان کردم داره خیلی هم خوب کار میکنه",11,8,5,5,5,5,5,5
[],[],"سلام
دی جی کالا خواهشن دوسیم کارت شو موجود کن
ممنون",9,9,5,5,5,5,3,5
"[""بدنه عالي"",""کيفت دروبين"",""خوش دست بودن""]",,"بی نظیره واقعا حرف نداره بهتون توصیه میکنم بخرید",15,1,5,5,5,5,5,5
,,"به نظرم مدل دو سیم‌کارته این گوشی کارایی بهتره داره، لطفا اگه این مدل وجود داره، برای خرید موجودش کنید
دوستان عزیز اگه کسی در مورد ارایه یا عدم ارایه‌ی مدل دو سیم‌کارته‌ی این گوشی اطلاعاتی داره، به اشتراک بگذاره",8,8,2,5,5,5,5,4
,,"من m8دارم یه لگ ازش ندیدم این دیگه چی میخواد بشه با رم 4.فقط اونایی میفهمن چی میگم که پرچمدار HTC داشتن.",40,12,5,5,5,5,5,5
"[""تقزيبا هم قسمت ها""]",,"تمام پرچمداران برندهای دیگه تمام امکانات رو دارند ولی اینقدر گرون نیستند",21,18,3,3,3,3,3,3
,,"همین مونده بود که با جی 3 مقایسه بشه !!!
همین ال جی تو جی 5 پلاستیک رو رنگ کرده و یه لایه آلومینویم روش گذاشته به عنوان بدنه فلزی به مردم قالب می کنه . کیفیت صفحه نمایشش هم که تو نور خورشید اصلا پیدا نیست .
البته ناگفته نماند که سرعت شارژش عالی هست و کیفیت عکس برداریش . اما موبایلی که صفحه نمایشش ضعیف باشه با اون 800 نیت تقلبیش به درد نمی خوره . حالا بهترین دوربین و بهترین امکانات هم داشته باشه.تو نور خورشید به زور باید صفحه نمایش رو ببینی.",28,14,5,5,5,5,5,5
"بدنه‌ي تمام فلزي زيبا و خوش‌ساخت
بالاترين سخت افزار و دوربين باکيفيت با امکانات زياد
شارژدهي بالا در مقايسه با گوشي‌هاي هم‌رده
صفحه نمايش با دقت 565 dpi و رنگ هاي طبيعي
تاچ و حسگر اثرانگشت دقيق و سريع","نبود infrared blaster براي کنترل TV","نقد و بررسی اچ تی سی 10 :
طراحی و ساخت :
کمپانی تایوانی اچ تی سی در پرچم دار امسال خود اقدام به تمام فلزی کردن گوشی حتی در قسمت بالایی آن نموده و با ایجاد یک لبه ی خم شده در بدنه ی پشتی حس در دست گرفتن گوشی را بهبود بخشیده اسپیکر بوم ساوند پایین گوشی رو به لبه ی زیرین گوشی انتقال داده و اسپیکر اصلی بالایی گوشی رو باریک و زیباتر کرده از جمله تغییرات دیگر دو طرف صفحه ی نمایش است که به دو رنگ مشکی و سفید در آمده وتاثیر زیادی در زیبایی گوشی از چشم کاربر دارد اچ تی سی علاوه بر این تغییرات اقدام به اضافه کردن سنسور اثر انگشت به صورت دکمه ی لمسی ضد خش نموده که تمایز خود را با دیگر پرچمداران دارای دکمه فیزیکی حفظ کند و برای محافظت از دوربین های عقب و جلو شیشه مخصوص زد خط و خش استفاده کرده که برای کاربرانی که در مورد محافظ لنز دوربین حساسیت دارند امنیت خاطر ایجاد کند همچنین پس از تست پرتاب گوشی به سمت زمین بیشترین مقاومت ممکن را از جانب پرچم دار اچ تی سی با 32 بار پرتاب برای از کار افتادن مشهده کردیم در صورتی که این رقم برای پرچمداران الجی و سامسونگ 1 بار بود و در تست خراشیده شدن پشت در خراش هایی با قدرت 1تا6 هیچ خشی بر بدنه ی گوشی باقی نماند و شروع اسیب از خراش با قدرت 7 تا 10 بود.
صفحه نمایش:
در پرچمدار امسال اچ تی سی شاهد صفحه ی نمایش Super LCD 5 با اندازه 5.2 اینچ و دقت 565 ppi است که به صورت بسیار دقیق واضح و با نور بالا جزییات را با طیف 16 ملیون رنگ و به طبیعی ترین صورت ممکن نمایش میگذارد و دارای محافظ corning glass 4 میباشد این صفحه از بهترین تاچ اندرویدی بهره میبرد که سریعترین و دقیق ترین تاچ اندرویدی تا به امروز است که در صورت خیس بودن صفحه و یا دست نیز دقیق میباشد.
دوربین:
این پرچمدار از دوربین 12 مگاپیکسل با فناوری اولترا پیکسل با پیکسل هایی به ابعاد 1.55µm بهره میبرد که باعث جذب نور بالاتر از دوربین هایی با پیکسل های معمولی میشود این دوربین از فوکوس لیزری با سرعت قابل قبول استفاده میکند و دارای حالات ,geo-tagging, touch focus, face detection, HDR, panorama ,manual میباشد که در قسمت دستی یا manual امکان تنظیم دیافراگم نور دهی مصنوعی گرمی و سردی تصویر فاصله کانونی لنز را به شما میدهد.
بیشترین سرعت اجرای برنامه دوربین به شما در ثبت لحظه های ناگهانی یاری میرساندهمانظور که در بحث صفحه ی نمایش گفته شد اچ تی سی در استفاده از رنگهای طبیعی و ثبت طبیعی لحظات بسیار دقیق عمل کرده و در دوربین نیز این امر به وضوح قابل مشاهده است لرزشگیر هر دو دوربین تصاویری دقیق را برای شما ثبت کرده و فناوری اولترا پیکسل در دوربین سلفی نیز باعث ثبت سلفی هایی با نور بسیار مناسب در محیط تاریک میگردد.اچ تی سی در اخرین اقدام خود دقت دوربین گوشی را به وسیله ی تقویت نرم افزار و اپدیت جدید ارتقاع بخشیده که تجربه ای لذتبخش برای شما ایجاد میکند.
باتری:
htc 10 از نظر باتری کارایی بالایی از خود به نمایش میگذارد به عنوان یک کاربر معمولی شما با گوش دادن به موزیک تماس تلفنی و وبگردی2 روز باطری خواهید داشت در حالی که با بازی کردن وبگردی فیلم دیدن و گوش دادن به موزیک و فعالیت هتای سنگین دیگر از این گوشی استفاده نمایید شما 1 روز کامل با کاربری بالا میتوانید از این گوشی استفاده کنید و در اخر شب هنوز 10% شارژ داشته باشید فناوری شارژ سریع 10 امکان شارژ 50% گوشی در نیم ساعت را به شما میدهد و با استفاده از نرم افزار اچ تی سی باتری با فعالیت های روزانه شما تنظیم میشود و به شارژدهی بیشتر گوشی کمک میکند.
صدا:
صدای این پرچمدار از نظر تفکیک پیشرفت زیادی نسبت به نسل های قبل داشته و تکنولوژی BoomSound را ارتقاع داده و به تکنولوژی جدیدی به نام BoomSound™ Hi-Fi edition رسیده و با پخش بیس از اسپیکر پایینی و صدای تفکیک شده با طول موج بالاتر از اسپیکر بالایی تجربه ای بی نظیر برای شنونده در هنگام گوش دادن به موسیقی فیلم و بازی کردن ایجاد میکند همچنین تکنولوژی hi-res 24 لذت فراوانی در تفکیک صدا توسط هندزفری برای شما ایجاد میکند و با افزایش شخصی سازی های هندزفری نسبت به تمامی انواع شنیدار ها شما از بهترین تجربه هایی موسیقیایی ممکن بهره مند خواهید شد.
سخت‌افزار و سیستم‌عامل:
تراشه‌ی اسنپدراگون 820 و رم چهار گیگابایتی، عملکرد بسیار سریعی برای 10 به همراه داشته است.این گوشی در بنچمارک معتبر انتوتو عدد 156000 را بدست آورد که این عدد برای پرچمداران اس7 و ایفون 6اس به ترتیب 134000و 133000 بود که با تفاوت 22000 نسبت به پرچمداران دیگر به شدت باعث حیرت زدگی من شد. این گوشی دارای 32-64 گیگابایت حافظه‌ی داخلی است و امکان پشتیبانی از کارت حافظه‌ی microSD تا 2 ترابایت در آن وجود دارد.
10 واقعا عملکرد سریع و قابل‌ستایشی دارد و ما هر کاری کریم تا لگ و کندی را در این گوشی ببینیم، به در بسته خوردیم. یکی از برگ برنده‌های این پرچم‌دار اچ‌تی‌سی نسبت به سایر گوشی‌های اندرویدی، رابط‌کاربری ساده و جذاب آن است. خوشبختانه رابط‌کاربری Sense 8 در اچ‌تی‌سی 10 تغییرات زیادی نسبت به نسخه‌ی استوک اندروید مارشملو ایجاد نکرده است. اگر از علاقه‌مندان سرعت بالا و تنظیمات شخصی سازی بسیار زیاد تم های مختلف هستید، قطعا از کار با این گوشی اچ‌تی‌سی لذت خواهید برد. سنسور اثر انگشت استفاده شده در این گوشی نسبت به سایر پرچمداران ایفون سامسونگ و الجی سریعترین و دقیقترین سنسور میباشد.
نوآوری: شارژ بسیار سریع توسط Usb c , تکنولوژی اولتراپیکسل نسل 2 , تکنولوژی BoomSound™ Hi-Fi edition , لرزشگیر دوربین دوم و تکنولوژی کالیبره کردن باتری نسبت به نوع کاربری
جمع بندی:
اچ تی سی در حال حاضر قویترین گوشی هوشمند دنیا را به بازار عرضه کرده و در حال حاضر جایگاه خود را به عنوان برترین برند اندرویدی تا به امروز تثبیت نموده این در حالیست که در تست های متنوع استحکام سرعت و اثر انگشت علاوه بر برند های اندرویدی از ایفون 6اس نیز پیشی گرفته. اچ تی سی نسبت به امکانات کاربردی اقدام نموده و از زیاده روی ها و امکانات فانتزی کم مصرف گوشی های این روز ها فاصله گرفته تا بهترین پرچمدار تاریخ اندروید را معرفی کند.

امتیازات:
ارزش خرید به نسبت قیمت 4.2
نوآوری 4.6
کیفیت ساخت 5
امکانات و قابلیت ها 4.7
سهولت استفاده 5
طراحی و ظاهر 4.9",22,5,5,5,5,5,5,5
"[""سخت افزار خوب""]","[""طراحي به سبک سامسونگ""]","من خودم همیشه HTC. میگرفتیم اما از وقتی سامسونگ با سری s بازار و قبضه کرد و رقیب ها رو بیرون دیگه جز سامسونگ چیزی دستم نمیگیرم فقطم سری S. یا Note اگه توجه کنید شرکت اچ تی سی در حالت سردرگمی به سر میبره و چند ساله ضعیف عمل میکنه و همونطوری که خودتون مشاهده میکنید طرح واسه سامسونگه..در کل آینده اش نامعلومه و با این قیمتی که داره فک نکنم ارزش خرید داشته باشه نسبت به مدل های مثل S6.S7. و NOTE5",7,36,3,3,3,3,3,3
