,,"دوستان امسال htc تو گوشی 10 تقریبا تو همه زمینه ها کامل کار کرده. پردازنده و گرافیک و رزولوشنش و نسخه اندرویدش و... مثل باقی پرچم دارای اندرویده. برندی با سابقست که فراز و فرود های بسیاری داشته و تونسته مشکلات و معایب چند پرچم دار گذشتشو اصلاح کنه و به تکامل برسونه اما نقایصی هم هنوز مونده که گاها سلیقه ایه. یکیش طراحی فیس جلو گوشیه که بر خلاف طراحیه پشتش اصلا جذاب نیس و یه جورایی حس سامسونگ گونه داره. و مساله مهمتر اینه که درسته که تو تمام ریز دسته بندی های مختلف حس تکامل رو بصورت یکپارچه تدایی میکنه اما صرفا به تکامل رسیده و چیزی فراتر از اون بهتون نمیده.. خلاقیتی که این گوشی رو متمایز کنه توش نیست. ریسکی نکرده که بخاطرش شما تجربه ای متفاوت از گوشی های دیگه داشته باشین. همه چیز صرفا خوبه. نه دوربین دوتایی واید 135 درجه ای که بتونه یه پانورامارو تو یه شات بگیره و باعث حیرت بقیه بشه نه خاصیت مقاومت در برابر آب که خاصش کنه نه حالت ماژولار. دوربینشم شاید برای خریداری که فقط این گوشی رو بخره صرفا خوب باشه اما صرفا برای اون طرف خوبه. درسته رو کاغذ، اعداد دوربین جذابن اما کماکان در مقایسه شهودی با G5 ال جی و s7 سامسونگ حرفی برای گفتن ندارند. طراحی پشتش فوق العادست اما مگه چقدر این طراحی پشت رو شما به عنوان مصرف کننده میبینید اونم وقتی میره زیر قاب؟ طراحی جلو که بسیار کلاسیک و تکراری و مشابه سامسونگه و این برای یه برند با قدمت جذاب نیست. شاید به خاطر به خطر افتادن ادامه حیات کمپانی و ضرر های ممتد مالی htc نخواسته ریسک کنه و محتاطانه پرچمدارشو صرفا بروز نگه داشته. من این برند با قدمت رو دوست دارم اما از اون بیشتر هیجان تجربه تکنولوژیک جدیدو خلاقیت رو دوست دارم که رو به پیشرفته. حالا قیمت هم قطعا یکی از پارامتر هاست که هرکی نادیدش میگیره آدم منطقی نیست چون شما ارزش کالارو نسبت به قیمتش میسنجید. و این قیمت فعلا دور از منطق هست. عذر خواهی میکنم اما با این تفسیر طرفدار های اپل کسایی هستند که نسبت به قیمتشون کالا دریافت نمیکنند. درواقع پول زیادی میدند فقط به سیستم عاملی مثل ios که روونه ام با محدودیتهایی رو اعصاب. درواقع ررونی گوشی واسه سیستم عامل به شدت بسته ای که روون عمل میکنه و خب باید هم امن باشه. چون فقط اپ استور داره و بس. چون باید پی اچ دی داشته باشی فایلاتو رو لپ تاپ بریزی. چون کارت حافظه ساپورت نمیکنه. وسط ناکجا آباد اگه دسترسی به نت نداشته باشی باید بجای بلوتوث طرفتو نگاه کنی و آهنگ دانلود شده در تلگرامتو تو همون گروه یا کانال دوباره گوش بدی چیزی به عنوان فایل منیجر وجود نداره.دوربین 6s. با این قیمت یه لرزشگیر اپتیکال نداره و فقتی ورودی و خروجیتون اینقدر محدوده معلومه خبری از ویروس و بد افزار و هنگ نیست همونطور که تو 1100 نوکیا نبود! تو پرچم دارای گوشیای اندرویدی هم میشه گفت همه تو یه سطحند تقریبا و اونچه اونارو متمایز میکنه خلاقیت و کیفیت در مقابل ارزش خرید اونهاست. یا علی موفق و پیروز باشید",11,14,2,5,3,3,3,1
"[""دوربين خوب"",""کيفيت صفحه بسيار عالي""]","[""باتري"",""پيسکل هاي بيش از اندازه و بي استفاده""]","خب فناوری صفحه این گوشی رو دقیقا جی3 داره ک خیلی بهش ایراد گرفتن و این که چشم انسان حداثر 430 پیکسل و میتونی درک کنه و 550 پیکسل بی استفاده و نه خوبی داره بدتر مصرف باتری رو بالا میبره. دقیقا مثل جی 3 کیفیت بالا ولی حجم باتری بسیار پایین درمقابل این حجم از پیکسل و چیپست. هواوی میت 7 حس گر اثر انگشت داره پس نواوری جدیدی نیس. سرعت پردارنده 2.15 ولی برای جی3 سرعتش 2.5. فست شارژش خوبه ولی یه کاربرد معمولی و وب گردی. بیشتر از 4 ساعت دوووم نمیاره و کلافتون میکنه. میتونید بایکم دقت بیشتر گوشب مناسب تری خریداری کنید",4,22,1,4,4,5,3,1
,,"الان قیمتش بالاس فک کنم گرونترین پرچمدار اندروید",12,3,2,4,4,3,3,3
,,"گوشی خیلی خوبیه و امانات و سخت افزار خوبی توش بکار رفته. فقط صفحه نمایش ال سی دی مصرف باطری رو بالا میبره",8,10,5,3,5,5,5,5
"[""همه چيز""]","[""هيچ""]","htc
بهترین برند در بین گوشی های آندرویدی هست من الان نسخه. m9 plus supreme camera رو استفاده میکنم واقعا راضیم.رابط کاربری. sense 7 خیلی روان و خوبه بهترین جنس بدنه و طراحی ظاهری رو داره برترین اسپیکرها رو داره البته کیفیت صدا فوق العاده ست ولی به نظرم شدت صدا یکم پایینه نمیگم دوربین بهترینه ولی جزو بهترین هاست.با کیفیت تریت صفحه نمایش رو داره و از مشخصات فنی قدرتمندی بهره میبره در کل عالی وخوب.حسگر اثر انگشتشم بیسته بیسته",20,8,5,5,5,5,3,5
"همه چي","نقاط ضعف؟مگه داريم؟","ایول,64 گیگ هم اومد,عالی,بزودی میخرمش از دیجی.
لطفا اگه دو سیمش هم هست,بیارین خواهشا,دیگه کامل کامل میشه,ممنون.",7,8,3,5,5,5,5,4
,,"خدایی htc از نظر امکانات و قابلیتها کم نداره بلکه خیلی بهترم هست نسبت به سایر برندها. کیفیت ساخت که از بس عالیه که قابل مقایسه نیست. htc هر سال بعضی طرفداراشو از دست میداد سر نقد بعضی سایتها و دوستانی که ازش بد میگفتن و ایراد میگیرفتن. اما بدونین htc واقعا حقش بالای همه هستش. با کلی مشکل تو شرکتشون هرسال یه پرچمدار روانی کننده میدن بیرون و دل کسایی مثل من که طرفدار شماره یکش هستم رو میبره. هرچی خطا کرده بود بخاطر ریسک تو فناوریهاش تو این چند سال، برطرف کرده و حالا htc10 رو داده بیرون. بنده متخصص نیستم ولی خواهشن هرکی میخواد گوشی بخره، رو htc و این گوشی حساب ویژه باز کنه.",20,4,4,5,5,4,5,4
"[""پردازنده سادگي خوش دست بودن""]","[""دوربين""]","سلام خدمت دیجی کالا های عزیز من میخواستم بگم حتما نباید گوشی مثل گوشی های سامسونگ رنگ و لعاب و اج و نوت باشن تا آدم واسه خریدش مشتاق باشه الان این گوشی از نظر دوربین پردازنده کیفیت ساخت چیزی کم نداره به نظر من اصلا بعضی ها پرچمدار ساده دوست دارن بگیرن دستشون",16,6,5,5,5,4,4,4
,,"وااااااای کاش زودتر موجودش میکردین که من 32 گیگشو نخرم, تازه یه مموری 64 هم براش خریدم",9,2,5,5,5,5,5,5
,,"بخرید عالیه.
بدون لگ بدون گیر
سرعت قدرت
همه بازیا و برنامه ها هر کاری ازش بهوای با سرعت بی نهایت انجام میده.
همه چی براش آب خوردن.",9,1,5,5,5,5,3,5
"[""همه چي""]","[""ندارد""]","چیزه بسیار خوبیست ولی گرونه ! کی میاد این همه پول برا این گوشی بده من که میخوام lg g5 بخرم همه ازش تعریف میکنن من الجیو نسبت به اچ تی سی بیشتر دوس دارم نظره شمارو نمیدونم",11,11,3,3,3,3,3,3
,,"عجب چیز خفنیه!!!",12,5,3,5,5,5,5,4
"صفحه نمايش با کيفيت
حسگر اثر انگشت سريع
جنس بدنه خوب
دوربين اصلي خوب","قيمت گران
ظاهري نه چندان زيبا
بلند گو ضعيف
دوربين سلفي در مقايسه با رقبا ضعيف","تمام نقاط ضعف و قوت گفتم در بالا. یکمی پول بزارید ایفون 6 اس با حافظه 64 بگیرید . یا علی",6,18,3,3,3,3,3,3
"بهترين گوشي تا به امروز","قيمتش! يا خود خدا...","یه تخفیف خفن بزنید بتونیم بخریم من اینو میخوام دیجی",12,2,5,5,5,5,5,5
[],"[""بسيار گران""]","با همین هزینه میتوان محصولات بهتری خریداری کرد.",4,14,1,4,4,2,3,3
,,"با ارزش تر از 100 تا گوشی اپل.....زیبا ...قوی .",17,7,5,5,5,5,5,5
"از بس زياده نميشه نوشت","ديدي سلامشو برسون","به به مدل 64......حیف گرونه.. اخر ماه میخام 32 گیگ رو بخرم",13,2,5,5,5,5,5,5
,,"چقد شبیه سامسونگه",4,20,3,3,3,3,3,3
,,"سلام
دیجی کالا خواهشن دوسیم کارته Htc 10 رو بیارید",8,4,5,5,5,5,3,5
"بسيار زياد که بيشترشو خودتون هم ميدونيد","يک سري ضعف هاي خيلي جزعي که تو هر گوشي ديگه اي پيدا ميشه و نميشه اون رو يک نقطه ضعف دونست","بالاخره دیجی موجودش کرد . این گوشی واقعا شاهکاره . در هر زمینه ای نسبت به قبل پیشرفته و تعامل رو رعایت کرده و همه رو با هم جلو برده . مثلا مثل ال جی نیومده بخاطر بخاطر دوربین هاش طراحیش رو خراب کنه........ ( حداقل به نظر من طراحی پشت g5 اصلا قشنگ نیست ) یا مثل سامسونگ زیبایی رو فدای مقاومت و کیفیت کنه( به هیچ عنوان نمیشه مقاومت فلز رو با شیشه مقایسه کرد ) قیمت این گوشی هم مناسبه و مطمعنا قیمتش تا مدتی بعد کم میشه ( باتوجه به این که این گوشی تازه وارد بازار ایران شده ) از هر نظر گوشی عالی هست . در خریدش شک نکنید به هیچ عنوان پشیمون نمیشید .",7,2,4,5,5,5,5,4
