positivePoints,negativePoints,commentText,like,dislike,"ارزش خرید به نسبت قیمت",نوآوری,"کیفیت ساخت","امکانات و قابلیت ها","سهولت استفاده","طراحی و ظاهر"
"صفحه نمايش سخت افزار طراحي خوش دستي تاچ روون","باطري لوازم جانبي","نسبت به پولی که میدی تجزبه عالی داره همه چیش خوبه دوربینشم بد نیست ولی تو نور کم تعریفی نداره باطریش میتونست بهتر بشه در کل واقعا می ارزه خدا پدر اقای شیاومی رو بیامرزه",3,0,3,4,4,4,3,3
"اشاره شد","اونم همين طور","سلام
من خودم چند وقته این گوشی رو خریدم. دوستانی که می خوان این گوشی رو بخرن، بدونن اندروید قابل ارتقای به خدااااا... بعضیا مدام میان اندرویدش 4 . اندرویدش و رابط کاربریش قابل ارتقاس. صفحه نمایشش به نسبت گوشی های هم رده واقعا بهتره. 4k رو مث آب خوردن پخش می کنه کدوم یک از گوشی های هم رده چنین کاری انجام میدن؟؟ من خودم امتحان کردم دوربین اش چیزی کمتر از j7 سامسونگ نداره که البته قیمتش دو برابره . cpu اش 4 هسته ای نه 8 هسته ای که خودش یه نقطه ی قوت حساب میشه. اونم با پردازش 2.5 گیگاهرتزی بر ثانیه!!! که خیلی از اون 8 هسته ای های دهن پر کن بهتره (تو هم رده هاش). باتری هم رضایت بخش. فقط تنها نقطه ضعفی رو که میشه بهش نسبت داد موقع انجام بازی های سنگین البته نه همشون یه کم داغ می کنه که فک کنم تو گوشی های بالای یه میلیون هم عادی باشه چه برسه به این بدبخت!!!
خلاصه انتخاب خوبیه، من پیشنهاد می کنم",16,5,5,3,4,3,3,3
,,"این گوشی اندرویدش به شیش آپدیت میشه هفتم قراره بیاد",4,0,4,4,4,5,4,4
,"عدم ساپورت از نسل چهارم مخابرات يا همان 4G
تک سيم کارته بودن
ضخامت زياد گوشي
عدم پشتيباني از کارت حافظه جانبي
اندرويد قديمي کيت کت","این گوشی با این قیمت زیاد رقبای زیادی مثل جی 5 سامسونگ کا 10 ال جی و 5 ایکس هواوی دارد . نداشتن 4G دو سیمکارته نبودن نداشتن درگاه کارت حافظه جانبی با توجه به کم بودن حافظه خود گوشی باید از ملزومات این گوشی بود اندروید قدیمی و ضخامت زیاد گوشی تنها بخشی از نقاط ضعف این گوشی است . اگر حافظه داخلی این گوشی 32 گیگ بود و از 4G پشتیبانی میکرد با این قیمت ارزش خرید داشت ولی با مشخصات این گوشی در این رنج قیمت مناسب این گوشیست.",73,28,1,3,0,2,1,1
"خوبه همه چيز",نديدم,"این گوشی رو از دیجیکالا خریدم اندروید 4 بود اپدیت کردم 6 شد گوشیه خوبیه همچیش تقریبا عالیه خوش دسته مناسب من برای مادرم گرفتم و 4g لازم نداشت و حافظشم خوبه در کل هنگی ندیدم ازش خیلی برنامه و بازی نصب کردم دوربینشم خوبه صفحه نمایش عالی هم نداره خوشم اومد از این گوشی و شاید یکی برای پدر هم بخرم هم قیمتش خوبه هم امکانات و گارانتیش خوبه و راضی هستم از خریدش خیلی بهتر از هواوی و سامسونگ و ال جی که سالی یه بار اپدیت میدن بیرون و بعد از دو سال اصن اون گوشی به درد نمیخوره هم رم هاشون کمه همم اندرویدشون قدیمیه البته اینایی که گفتم گوشی هایی در یک رده قیمت",11,28,3,3,3,3,3,3
,,"من یکماهه که این گوشی رو تو فروش ویژه خریدم...واقعا عالیه و ارزش خرید داره...دوربینش تو روز عالیه ...صفحه نمایش بیست...سخت افزار خوب...در مورد خدمات بعد فروشش باید بگم نمایندگیش برخلاف اونچیزی که دوستان میگفتند فعال هست و سرویس دهی خوبی داره...علاوه بر اون قاب و گلس گوشی تو سایتهای اینترنتی زیادی وحود داره و اتفاقا راحتتر از بعضی مدلای گوشیای دیگه مثل الجی گیر میاد.درسته که کارت حافظه نداره اما با قابلیت اوتی جی واقعا جای خالی کارت حس نمیشه...اگه با اینترنت گوشی اونم با سرعت فور جى کار ندارید..باید بگم واقعا گوشی خوبیه",13,18,3,4,3,4,3,3
,,"این گوشی حرف نداره.رابط کاربریذسریع و زیبا و روان با آپدیت های سریع که تو یه سایت خوندم اندروید هفت هم براش میاد‌.دوربین عالی باتری با دوام که به سرعت شارژ میشه یه قابلیت جالبش اینه که می تونی از هر نرم افزار دو تا داشته باشی مثلا دو تا تلگرام
سخت افزار خیلی قوی که همه چی رو میشه و تو آنتوتو شصت و یک هزار و خورده ای آورد
تو پیشنهاد ویژه فوق العاده است فک کنید با این قیمت چنین امکاناتی
اگه واقعا یه گوشی خوب و قوی می خواست که همه چی رو جواب بده و از هر لحاظ از همراه های خودش سر تر باشه این گوشی رو بگیرین",8,16,5,5,5,5,5,3
"طراحي زيبا و خوش دست","عدم پشتيباني از سيم کارت 4G","نقد و بررسی خودمو پس از استفاده از گوشی mi4مینویسم شاید تا حدودی به دوستان در انتخاب کمک کند... گوشی mi4در سه مدل به بازار عرضه شده مدل 16گیگ حافظه داخلی و 2گیگ رم مدل 64گیگ حافظه داخلی و 3 گیگ رم و البته یک مدل خاص با نام mi 4LTE با 16گیگ حافظه داخلی و 3گیگ رم که دقیقا همین مدل عرضه شده توسط دیجی کالاست اما بدون شبکه LTE گوشی دارای سخت افزار قدرتمند اما تا حدودی قدیمیست که به لطف پرچمدار بودن از اندروید نسخه 6.0.1برخوردار شده بعد از آپدیت به اندروید 6و کمی کار کردن و اجرای چند برنامه متوجه شدم نسخه اندروید 6 چندان با سخت افزار دستگاه هماهنگ نیست مثل مصرف زیاد باتری و یا عدم اجرای صحیح برنامه dual app بعد از بیان نقاط ضعف باید سراغ نقاط قوت دستگاه رفت مثل کیفیت عالی صفحه نمایش قابلیت عکاسی خوب، فیلمبرداری با کیفیت 4kو بنظر من از همه مهمتر خوش دست بودن در حین انجام کار در هر صورت من بعد از یک روز استفاده گوشی رو به همان قیمت خرید فروختم و الان تجربه یک روز استفاده رو براتون نوشتم",14,1,3,4,2,5,4,1
"تراکم پيکسلي مناسب صفحه نمايش
رم 3 گيگابايت","پردازنده قديمي
سيستم عامل قديمي
نداشتن 4G
عدم پشتيباني از کارت حافظه","درود
این گوشی از گوشی هایی هست که تولیدش باید سه سال قبل متوقف میشد پردازنده این گوشی هم تراشه اسنپ دراگون 801 هست که متعلق به چهار سال قبل می باشد.
اندروید کیت کت 4.4 هم به کنار که حرفی برا گفتن باقی نمیذاره.
حافظه داخلی ذکر شده براش 16 گیگ هست که قطعا همش قابل استفاده نیست و حافظه آزاد چیزی حدود 11 گیگابایت باید باشه و کارت حافظه هم نمیخوره که این مقدار اصلا جوابگو نیست.
صفحه نمایش این گوشی از تراکم پیکسلی مناسبی برخوردار هست و تنها عیبش نداشتن محافظ مثلا گوریلا گلس هست.
نداشتن شبکه ارتباطی نسل چهارم هم عیب بزرگ دیگه ای هست که این شبکه تقریبا فراگیر شده و عدم پشتیبانی نقطه ضعف به حساب میاد.
عملکرد هر دو دوربین و امکانات روی کاغذ مناسب هست.
رابط کاربری خوشایندی و تعداد مناسبی هم حسگر داره و ظرفیت باتری هم برای این گوشی با این سخت افزار مناسب و خوب هست.
در کل خرید این گوشی در سال 1396 با وجود گوشی های دیگه اصلا توصیه نمیشه.",14,10,1,3,2,3,3,3
"صفحه نمايش فول اچ دي
کيفيت ساخت بالا محصولات شياومي
دوربين خوب
رم بالا سه گيگ
باتري قوي 3000","نداشتن 4G","همه چی این گوشی عالیه اما نداشتن 4G ضعف بالایی محصوب میشه",9,2,4,4,3,4,4,4
,,"من نمیدونم واقعا چه دشمنی با این گوشی فوق العاده داشتن که شیار کارت حافظه نذاشتن براش.
واقعا که حیف...",5,5,5,3,4,3,4,3
,,"در کل عالی و بسیار زیبا ولی اگه میخواهید بخرید 16نخرید که دردسره زود پر میشع",12,1,5,5,5,5,5,5
"طراحي زيباوشيک
صفحه نمايش باکيفيت
سخت افزار قوي",,"ضمن تشکر از ارسال سریع لازم میدونم احساسم را پس از بازکردن جعبه گوشی برایتان توصیف کنم .بسته بندی بسیار متفاوت جعبه گوشی،وقتی گوشی رابرای اولین بار دیدم احساس تک بودن بهم دست .چون شاید به تعداد انکشتان دستتان در اطراف خودتان افرادی باشند که این گوشی رادردستشان باشد.رابط کاربری خاص،دوربین با کیفیت،صفحه نمایش با کیفیت و...اکر به دنبال یک گوشی خاص ومنحصر به فرد با سخت افزار بالا وقیمت مناسب میگردید،این گوشی پیشنهاد خوبی است.",8,6,3,5,5,5,3,5
"خوش دستي طراحي خوب قيمت مناسب سخت افزار قوي","کمبود وسايل جانبي","گوشی خیلی خوبیه و واقعا از خریدش راضی هستم
یک که نه دو سر و گردن از هم قیمتهاش بالاتره
و از گوشی هابی که دو برابرش قیمت دارن تقریبا هم سطحه
اگر فورجی و دو سیم کارت براتون مهم نیست لذت داشتنش رو سریعتر تجربه کنید",7,4,3,4,4,5,5,3
"سخت افزار قدرت مند
رزوليشن عالي
کيفيت عالي دوربين سلفي","حافظه کم
باطري بسياار ضعيف","اقعا باطری بدرد نخوری داره خیلی ضعیفه من تازه گوشیو خریدم بعد از یک هفته حتی با استفاده درست باطریش خیلی ضیف شد",13,5,3,0,2,0,5,3
,,"من از دیجی تو پیشنهاد ویژه گرفتم واقعا خوبه قیمتش عالیه",6,3,5,4,5,4,4,4
,,"یک ماهی هست که گوشی رو خریدم، وقتی برای اولین بار ظاهرش رو دیدم، خیلی بهتر از تصورم بود، با اینکه یک گوشی میان رده است، حس یک گوشی درجه یک رو میده. به لحاظ سخت افزاری قوی هست . جزئیات خیلی خوبی داره و کاملا راضی هستم",10,1,5,5,5,5,5,5
"همه چيز خوبه",ندارد,"ممنونم از دیحی
در کل به قیمتش می ارزه
واقعا پیشنهتد میکنم",11,4,3,5,5,5,5,5
"قابليت ارتقا به اندرويد6.خوب شدن دوربين هادراندرويد6وهمچنين سريع شدن.سخت افزارعالي",هيچ,"عالی بوده واسه من بقیه رونمی دونم در جواب خانوم مریم میناوند.برای ارتقابه قسمت ستینگ بریدبعدروی درباره گوشی بعدقسمت به روزرسانی بریدخیلی راحت دانلود کنید منم اینطوری ارتقادادم به6.اگرم نشدبریدگوگل دنبال رام گوشیتون.",9,2,3,3,3,3,3,3
"کيفيت صحفه نمايش
قابليتotg","عدم پشتيباني از sdکارت
3g بودن","باسلام ارز ادب
بنده یک هفته ای هست که گوشی از دیجی کالا خریداری کردم باید اول از همه بگم این چنین گوشی هارو فقط میشه از فروشگاه های معتبر خریداری کرد مخصوصا در شهرستان ها چون نسخه فیک این محصول زیاده ...
دوم اینکه این گوشی که به دست ام رسید اول ابدیتش کردم وبعد ارتقا اندروید دادم..از لحاظ کیفیت صحفه نمایش باید بگم ایوال داری شیاومی واقعا معرکه س از لحاظ سخت افزاری طبق
نرم افزار بنچمارک تست نزدیک52000هزار امتیاز داد که کاملا با الجی جی 3 برابری می کرد ...
درکل گوشی خوبیه تواین رنج قیمت تواین رنج قیمت سامسونگ جی 1 نمیدن چه برسه شیاومی ...
خواستم بگم اگه می خواین این گوشی بخرین تو خریدش شک نکنید..
همه تونو به خداوند متعال می سپارم....",13,2,5,4,4,4,5,3
"طراحي عالي
تاچ عالي
باطري خوب
MIUI بسيار خوش دست و عالي","رم نخوردن
دوربين تو نور کم يه ذره نويز داره","سلام
اول MIUI یه ارتقا پیدا میکنه بعدش بار دوم اندروید به همراه MIUI ارتقا پیدا میکنه.
مال من تا حالا 4 بار فکر کنم آپدیت شده و الانم MIUI 8.2.1.0 هست.
وقتی میبینید 50 نفر میگن اندروید ما 6 شده یه کم بیشتر وقت بزارید و تحقیق کنید.",9,0,5,4,4,5,4,4
,,"سلام
گوشی چند روزی میشه که به دستم رسیده و جا داره از ارسال به موقع و قیمت مناسب دیجی کالا نسبت به سایر فروشگاه ها تشکر و قدر دانی کنم.
با تجربه ای که تو این چند روز از گوشی بدست آوردم سعی می کنم نقد و بررسی جزئی داشته باشم تا خریداران بعدی این مدل از مزایا و معایب گوشی مطلع بشن.
اول از همه باید به کیفیت ساخت گوشی اشاره کنم طوری که با اولین بار دست گرفتن Mi4 متوجه استحکام بدنه و کیفیت بالای ساخت گوشی میشید. تنها ایرادی که به بدنه گوشی وارده جا موندن اثر انگشت بر روی بدنه و صفحه نمایش هست و همین امر خصوصا در قسمت پشت گوشی پتانسیل خوبی برای سر خوردن از دست میتونه ایجاد کنه، اما با این حال از کیفیت ساخت گوشی واقعا کم نمی کنه.
بعد از تحویل گرفتن گوشی دو بار پیغام اپدیت برام ارسال شد که بار نخست مربوط به آپدیت به نسخه(رابط کاربری miui7) بود و با حجم تقریبی 750 مگابایت، بعد از آپدیت به miui7 پیغام آپدیت به miui8 ظاهر میشه که حجمی در حدود 850 مگابایت داره، آپدیت miui8 که تموم بشه نسخه اندروید هم از 4 به 6 ارتقاء پیدا می کنه.
اولین باری هست که از رابط کاربری miui استفاده می کنم و خلاقیت تیم طراح رو تحسین می کنم، هم در بحث طراحی گرافیکی رابط و هم در خلاقیت خرج شده در خصوص ریز ترین مسائل مربوط به هر بخش از نرم افزار
دوربین گوشی رو به صورت محدود تست کردم و نتایجی که بدست آوردم نشون میده که دوربین پشت تو محیط های باز عملکرد خیلی بهتری نسبت به محیط بسته داره. دوربین جلو (سلفی) هم کیفیت مناسبی داشت.
سیستم صوتی گوشی در حد نرمال هست و کیفیت قابل قبولی رو ارائه میده، به شخصه بیشترین استفادم از گوشی استفاده از قسمت موزیک هست و این گوشی تونست من رو راضی نگه داره.
کیفیت صفحه نمایش با توجه به تراکم پیکسلی بالایی که از خودش نشون میده فوق العاده ست و نه تنها قابل رقابت با گوشی های هم رده هست بلکه رقیب جدی محصولات میان رده بازار با قیمت یک الا ک و نیم میلیون هم میتونه باشه.
شفافیت تصویر و طبیعی نشون دادن رنگ ها از خصوصیات بارز صفحه نمایش Mi4 هست.
باتری گوشی دوام خوبی داره وپیشنهاد می کنم بعد از دریافت گوشی شارژش رو تا 5 % برسونید و بعد نزدیک به 2 ساعت بزنید تا شارژ تا فول شارژ بشه و از شارژ اولیه با مدت زیاد پرهیز کنید.
در خصوص سخت افزار میشه به راحتی این ادعا رو داشت که شیائومی برای این گوشی ارزش زیادی قائل شده. ذکر تست ها های سخت افزاری انجام شده رو گوشی در قالب این نقد نمی گنجه، فقط میشه به این جمله که عالی بود اشاره کرد.
با تمام خوبی های ذکر شده باید این نکته رو هم عنوان کنم با توجه به ریز عملکرد هایی که کمپانی برای هر بخش قائل شده در حین استفاده از گوشی به یک سری ریز مشکلات نرم افزاری برخورد می کنید که میشه به راحتی از کنارشون عبور کرد. کما اینکه پشتیبانی قوی شرکت با سرعت تمام در حال رفع تمام موانع موجود در گوشی هست تا کاربر مشکلی نداشته باشه. سیستم گزارش دهی مشکلات گوشی و پشتیبانی سریع شیائومی از مشکلات قابل تحسینه.
امیدوارم کسایی که تو آینده این گوشی رو خریداری می کنند بیشترین لذت و استفاده رو ازش ببرن.",10,3,5,4,4,3,3,4
,,"نمیدونم چرا بعضی از دوستان عنوان کردند اندرویدش ارتقا پیدا میکنه...لطفا وقتی فرق اندروید وMIUI رو نمیدونید نظر ندید و دیگران رو گمراه نکنید",8,12,3,4,3,4,3,3
,,"اندرویدش کیت کته و متاسفانه نمیشه ارتقاش هم داد..خیلی خورد تو ذوقم",2,18,3,4,3,4,3,3
"دوربين فوق‌العاده
سخت‌افزار بالارده
بدنه با کيفيت ( قاب کناري فولاد ضدزنگ)
MIUI","حافظه جانبي نميخورد","بسیار عالی!
مدتی هست که از دیجی کالا خریدم. متاسفانه دیجی کالا لوازم جانبیشو نداشتم، اجبارا از بیرون خریدم(قیمت‌های باورنکردنی!)
به هر حال گوشی توی سه چهار روز سه بار آپدیت شد. یه بار به miui7. یه بار miui8 و یه بارم یه آپدیت جزئی روی همین miui8. الآن اندروید 6 هست و قرارم نیست اندروید7 برا این ورژن گوشی بیاد که از نظرم خیلی عیب نداره. به هرحال پول زیادی ندادم براش. البته باید گفت که miui واقعا کامله و بخش اعظم نرم‌افزارایی که روی گوشی‌های دیگه باید ریخت تا قابل استفاده بشن، روی این گوشی هیچ نیازی بهشون نیست.
از بدنش شروع کنم، خیلی زیباس! هرچند ظاهرش یه چیز خیلی حساس و ظریف رو نشون می‌ده. به همین خاطر شخصا خیلی مراقبم از دستم نیفته. اما یکی دوباری که روی موکت از 70-80 سانتی افتاده (قاب ژله‌ای دورش بوده) چیزیش نشده. من قبل از این گوشی یه Xperia C داشتم. وقتی با اون مقایسه می‌کنم، به غایت جمع و جور تره. هرچند باید توجه کرد در گوشی قبلیم باز میشد که این یکی همچین چیزی نداره.
صفحه‌ نمایش گوشی خارق‌العادس! همچین صفحه نمایشی رو فقط توی یه گوشی خیلی قدیمی خودم (Nokia 603) دیدم. اون زمان صفحه نمایش اونو کنار پرچم‌دارای سامسونگ می‌ذاشتم و به بقیه فخر می‌فروختم. الآن هم با این یه همچین حسی دارم. رنگ‌ها به غایت شفاف هستن. همچنین نور صفحه خیلی خوب از کمِ کم توی شب تا خیلی زیاد زیر نور آفتاب بدون استفاده از نرم‌افزار جانبی (مثل lux) به طور خودکار تنظیم می‌شه که خیلی رضایت بخشه برام. همچنین تراکم پیکسلی صفحه‌ی گوشی واقعا خوبه. البته همین هم یک نقطه ضعفه. معمولا 20 تا 30 درصد مصرف برق گوشی برای من صفحه نمایششه (من بازی نمی‌کنم با گوشی به همین خاطر حسی نسبت به مصرف برق snap 801 ندارم.)
دوربین گوشی به معنای واقعی کلمه عالیه. هم long exposure داره و هم slow motion . از نظر زنده بودن رنگ‌ها محشره. رنگ‌های خوب و نویز کم، هم روی دوربین پشتی صادقه هم دوربین جلو. اگه بخواید یه گوشی بخرید که همچین دوربینی داشته باشه، بعد از این مدل بعید می‌دونم زیر نه‌صد هزار تومن چیزی گیرتون بیاد.
متاسفانه گوشی کارت حافظه نمی‌خوره. البته این یه نکته‌ی مثبت هم هست. باعث می‌شه اجبارا گوشی رو خالی نگه‌دارید و چیزای اضافه رو انبار نکنید.
در کل تجربه‌ی چند هفته‌ای استفاده‌ی خودم رو باور نکردنی توصیف می‌کنم. تغییراتی که شیاومی توی اندروید خالص داده، اندروید رو به یه چیز قابل استفاده تبدیل کرده. من شخصا روی گوشی قبلیم Z launcer ریخته بودم و بدون اون نمی‌تونستم تکون بخورم. اما روی این یکی، هیچ نیازی به لانچر جدا احساس نمی‌کنم.
برای بعضی از مصرف‌کننده‌ها ممکنه نداشتن 4G نقطه ضعف تلقی بشه. اما خب من شخصا با اینترنت همراه اول و فعال کردن 3G مشکلی توی وب گردی نداشتم. سرعت بسیار خوبی بهم داده(البته جاهایی که همراه اول سرعت می‌ده!!) شاید اگه بخوام فیلم رو استریم ببینم نشه با FullHd دید. اما این مشکلی ایجاد نمی‌کنه. به هر حال مواردی که یک نفر توی ایران بخواد فیلم رو استریم نگاه کنه زیاد نیستن.
در نهایت این گوشی رو برای تمام کسایی که یه گوشی خوب و قدرتمند به همراه یه دوربین محشر لازم دارن توصیه می‌کنم. همچنین باید بگم کنار گوشی یک فلش که میکرو یو اس بی داره همراه داشته باشید. چون اگه زیاد عکس یا فیلم بگیرید، توی چشم به هم زدنی حافظش پر می‌شه.",7,1,5,5,4,5,5,5
