,,"من نظرات ضد و نقیضی رو اینجا دیدم که دوست دارم با توجه به تجربه یک سال و نیمه خودم از داشتن این گوشی (من یک سال و نیم پیش این گوشی رو از چین آوردم) بگم.
بیاید این گوشی رو با پرچمدارهای امروز برندهای مختلف مقایسه نکنیم بلکه با گوشی هایی که همزمان با این گوشی در 2سال و نیم گذشته معرفی شدن مقایسه کنیم.
این گوشی در زمان معرفی به غیر از آیفون از معدود گوشی هایی بود که از شاسی فلزی برخوردار بود و فوق العاده خوش دست و من با اینکه آیفون 6 پلاس هم دارم خوش دستی این گوشی فوق العاده بهتر از آیفونه و جنس شاسی آیفون از آلمینیومه و فوق العاده آسیب پذیر ولی شاسی این گوشی استیل هست که بسیار محکم و مقاومه.
در زمان معرفی قوی ترین دوربین سلفی رو داشت که هنوز هم دوربین سلفی 8 مگاپیکسلش از خیلی از گوشی های روز قوی تره و جزو اولین گوشی هایی بود که 4k فیلم برداری می کرد.
در قدرت سخت افزاریش شک نکنید که فوق العادست و با بنچمارک 52000 ANTUTU این مساله رو ثابت می کنه. و اصلا به هنگ و لگ زدن و اینجور چیزها حتی فکر هم نکنید( بعد از یک سال و نیم کارکرد هنوز هم مثل روز اول روون کار میکنه و حتی یکبار هم ریستش نکردم).
کیفیت رنگ های صفحه نمایش این گوشی عالیه و من زمانی که یک تصویر مشابه رو توی این گوشی و آیفون 6پلاس میذارم و کنار هم قرار میدم این گوشی رنگ ها رو به مراتب زیباتر نشون میده.
از نظر سیستم عامل که با توجه به اینکه روی این گوشی رام MIUI که توسط شیائومی برای گوشی های اندروید ارائه میشه نصبه به جرأت میتونم بگم هیچ رام اندرویدی حتی تاچ ویز سامسونگ هم از نظر امکانات قادر به همپایی با MIUI شیائومی نیست و از جمله قابلیت های این رام ها ارائه آپدیت های ماهانه ( در حال حاضر به MIUI نسخه 8 آپدیت شده که بر پایه اندروید6.01 هست). این رام ها به طور پیشفرض دارای منشی تلفنی،بلک لیست، آنتی ویروس و هزار و یک قابلیت دیگه هستن و یکی از قابلیت های جدیدی که تو آخرین آپدیتش ارائه شده این هست که شما میاتونید همزمان 2 دیوایس مجزا رو توی یک دستگاه داشته باشید و بین اونا سوویچ کنید مثل 2تا ویندوز روی یک سیستم که هر کدوم گالری و مخاطبین و تمامی دیتاهاشون از هم جداست،انگار که 2تا گوشی دارید) و اینکه از نظر ارائه آپدیت با نکسوس گوگل هم جلوتره!!! (برای گوشی 4سال پیشش هم آپدیت میده) نه مثل اکثر گوشی های هووآوی که هیچ وقت هیچ آپدیتی نخواهند گرفت.
از ویژگیهای دیگه MIUI شخصی سازس بی نظیری هست که داره با دنیایی از تم و والپیپر در استور خودش که در تعویض تم حتی DIAL PAD و شکل آنتن و باطری و خلاصه همه چیز قابل تغییره( همانند رام های سیانوژن و نه مثل تمام گوشی ها که اکثرا فقط شکل آیکون هاشون عوض میشه)
باطری این گوشی عالیه
از نظر حافظه داخلی نسخه 64 گیگ هم تولید شده و نسخه 4‌G هم داره که متاسفانه وارد ایران نشدن.
تاچ این گوشی دیدنیه بطوری که با اندکی فاصله از صفحه نمایش عمل میکنه و باید گفت به اصطلاح رو هوا میگیره و glove mode هم داره) برخلاف بیشتر گوشی های میان رده که دوستان مقایسه کردن)
این گوشی پرچمدار زمان خودش بوده و بنده یک سال و نیم پیش این گوشی رو از چین خریدم در حالی که نوت4 سامسونگ که از نظر قدرت با این گوشی برابری میکرد داخل ایران قیمتشبالاتر بود، و اون موقع با این قیمت توی ایران باید s 3 سامسونگ میخریدم.
در کل به نظر من گوشی های برند شیائومی و این گوشی فوق العادن و تنها پس از کارکردن و استفاده ازشون میشه به این نکته پی برد و به هیچ وجه این برند و گوشی هاش با برندی مثل هووآوی و لنوو و ZTE قابل قیاس نیست.",43,7,4,5,5,5,5,4
,,"تو خریدش شک نکنید سخت افزار قوی این گوشه هر برنامه ای که فکرش بکنید اجرا میکنه رم 3 که تقریبا حدود 2 گیگش خالیه
بابت حافظه هم هیچ نگرانی نداشته باشید 16 گیگ خوبه و در صورت نیاز به حافظه بیشتر شما میتوانید از حافظه ابری که در اختیارتان قرار میگیره استفاده کنید یا با استفاده از otg فایلها کلیپها وعکسهاتون رو فلش یا مموری انتقال بدید و به سادگی در دسترس داشته باشید فقط کافیه فلش یا مموری به وسیله کابل otg به گوشی وصل کنید و کلیپها و وعکسهاتون تماشا کنید وضوح و روشنایی این گوشی تو 25 درصد با وضوح و روشنایی 100 درصد گوشی مثل هواوی p8 برابری میکنه
در حالت 100 درصد تو نور شدید آفتاب کوچکترین جزئیات قابل مشاهده میباشد",4,4,5,5,5,5,5,5
,,"سلام.دیجیکالا شما که دیگه میدونین این شرکتای چینی چقد خوبن.لطفا گوشیهاشونو موجود کنین چون maxامکانت رو باmin قیمت ارایه میدن.
خواهشا این 4 تا گوشی رو موجود کنین:
xiomi redmi pro
xiaomi redmi note 4
xiaomi mi max
huawei honor v8
این 4 تا گوشی های فوق العاده ند.قیمت هیچکدومشونم بالای 300 دلار نیست.لطفا موجود کنین.بچه های سایت هم برین مشخصات این
گوشی هارو ببینید و به حرفم پی ببرین.دیجیکالا لطفا موجود کن.سایتای دیگه دارن ولی حتما میخوام که از دیجیکالا بخرم گوشیمو.مرسی که خوندین",13,2,3,3,3,3,3,3
,,"این شیا ها گوشیایی خوبی ان بشرطی ک فیک ورفرش نباشن و شما بتونید اصلیشو پیدا کنید ک فک نکنم جز دیجی کالا جای دیگه پیدا کرد البته من تو نخشون نیستم چون خودم ردمی نوت 3 خریدم و اومدم سریالشو تو سایت خارجی سریالهای گوشی زدم ودیدم نیستش و فیکه .سایت ای می رو میتونید سرچ کنید وببینید وبا نوشتن سریال گوشیتون اصل یا فیک بودنشو بفهمید بدین ترتیب ک اگه تو یه کادری ک تو اون سایته سریال گوشی نوشته بشه اگه گوشی اصل باشه مشخصاتشو میاره بالا ولی اگه نباشه چیزی نمیاد ونشون دهنده رف بودن گوشی هسش .هرچند من نمیدونم چقدر میشه به این سایت اعتماد کرد ولی چون اون گوشی ک من گرفتم فیک بود ردش کردم رفت. واز دیجی بخاطر اصل بودن کالاهاش سپاسگزارم.اینکه بعضی کالاها خصوصا گوشی ها رو میبینید نوشته بزودی و‌ماهها طول میکشه بیاد بنظرمن دلیلش همینه ک دیجی تمام تلاششو‌میکنه ک جنس اصلی رو بیاره و بزاره برای فروش. واین زمان میبره . درمورد این گوشی هم بگم ک از بهترین نقاط قوتش اندازه پنج اینچی ک خیلی مناسبه ودرعین حال تراکم پیکسلی چارصدتاییه ک معمولا نیست .این تراکم پیکسلی بالا همش تو سایزهای پنج و نیمه ک بنظر من زیادی بزرگه . من اگه مدل می فور اس رو دیجی میاورد فورا میخریدم ک حافظش 64 دوسیمه پشتیبانی از کارت حافظه داره فورجی هسش وتمام نقاط ضعف همین مدلو پوشش داده ... مرسی از نگاهتون",11,3,3,3,3,3,3,3
,,"گوشی های شیائومی در کشورهایی همچون چین، هند، روسیه، برزیل، تایلند، مالزی، سنگاپور که خود شرکت بصورت مستقیم معرفی میکند، معروف هستند به گوشیهایی با کیفیت خوب و قیمت مناسب، اما در ایران گزینه دوم یعنی قیمت مناسب حذف میشود، و خریدار با این قیمت به سراغ مارکهای دیگر میرود.",5,7,1,5,4,4,4,3
"[""دوربين"",""صفحه نمايش"",""ظاهر تقريبا خوب و خوش دست بودنش""]","[""رم نميخوره""]","من redmi 3 pro دارم و راضی ام
اول شک کردم برند خوبی نباشه بعد رفتم نمایندگی با گوشی هاشون کار کردم نظرم عوض شد و تا حالا بدی ازش ندیدم",7,1,3,3,3,3,3,3
,,"با سلام خدمت دوستان عزیز
چند وقتی هست که تحقیقات زیادی رو در خصوص 3 برند چینی Xiaomi و Meizu و Oneplus و محصولاتشون انجام دادم و به نکات جالبی رسیدم ...
در خصوص آشنایی دوستان با شرکت چینی Xiaomi کافیه که واژه های ""شرکت چینی شیائومی"" رو توی گوگل جستجو کنید تا متوجه بشید که برترین برند تلفن همراه حتی در کشور چین شیائومی هست نه هوآوی ...
لازمه ی مقایسه دو محصول اونم از نوع تلفن همراه، تحقیقات بمراتب گسترده تر از اون چیزی هست که شما عنوان کردید!
با یه جستجوی ساده حتی در خصوص امتیاز بنچمارک Antutu این 2 محصولی که شما مقایسه کردید متوجه میشید که کدام گوشی برتر هست!
هوآوی 4ایکس :
21053
شیائومی mi4 :
36763
ارقام فوق خبر از برتری قاطعانه شیائومی میده! و همه این ها در حالیه که MI4 بمدت 4 ماه در رده بندی بنچمارک antutu پیشتاز بود تا اینکه گلکسی اس5 اومد و صدر جدول رو پس گرفت!
در مورد دوربین، بایستی بگم دوربین شیائومی بدلیل فاصله کانونی کمتر بمراتب عکس های با کیفیت تری خصوصاً در تاریکی نسبت به هواوی 4x ثبت میکنه و برخلاف نظر بسیاری از مردم جامعه ی ما، صرفاً عدد مگا پیکسل بیان کننده کیفیت عکسبرداری نیست!
وارد مقوله فیلمبرداری هم اصلا نمیشم که بحث بسیار گسترده ایست. ولی همینقدر بدانید که مدل هواوی 4x در زمینه فیلمبرداری بسیار معمولیه اما فیلمبرداری شیائومی Mi4 تقریباًدر حد 4k هست.
کیفیت صفحه نمایش شیائومی کلا قابل مقایسه با 4x نیست چراکه Mi4 بدلیل تراکم پیکسلی بمراتب بالاتر خیلی از رقباش رو شکست میده! اینجا اضافه کنم که 4x اصلاً توان رقابت در این زمینه رو نداره!
در مورد قدرت پردازشی به نکات جالب تری می رسیم. هم گوشی Mi4 و هم هواوی 4x از پردازنده های شرکت کوالکام استفاده میکنن اما شیائومی Mi4 با رم 3 گیگ و پردازنده غول صفت 4 هسته ای خودش بنام Krait 400 با گنجایش 2.5 گیگاهرتس براحتی cpu معمولی گوشی هواوی 4x رو که از cpu مدل Cortex-A53 با گنجایش1.2 گیگاهرتس استفاده میکنه رو شکست میده!
در مورد عدم پشتیبانی از مموری کارت و 4g حق با آقای اوندری هست. اگر این دو مورد واقعا برای کسی خیلی مهمه باید یه گوشی دیگه رو انتخاب کنه.
اما اگر برآیند مقایسه مون رو بخوایم بررسی کنیم، می بینیم که Mi4 دو-سه سر و گردن از 4x هواوی برتر هست. بیش از این بحث رو کش نمیدم چون هنوز میشه در زمینه هایی مثل (ظاهر گوشی، درگاه مادون قرمز، ظرفیت باتری، پردازنده گرافیکی، قابلیت شارژ سریع و و و ...) که در تمامی این موارد Mi4 برنده میدان خواهد بود، بحث کرد!!! اما فقط مِن باب یک توصیه دوستانه خدمتتون عرض میکنم که اگر میخواید دو گوشی رو باهم مقایسه کنید و اون هم در جایگاهی که قرار هست نظر افراد رو تغییر بدید و افراد رو راغب کنید که مدل مد نظر شما رو خریداری کنند، جا داره که با دقت و مطالعه بیشتری این مقایسه رو انجام بدید.
موفق و پیروز باشید دوستان!",11,2,5,5,4,5,5,3
"سخت افزار -دوربين","کارت حافظه-رنگ فقط سفيدموجوده","درود
اولًا برا این گوشی اندروید 6 خیلی وقته اومده
دوربین ان گوشی اصلا قابل قیاس با هانر 4 ایکس شما نیس و خیلی سرتره(میتونید همین دیجی کالا؛ قسمت مقایسه دوربین ببینید)
بدنه فلزی
صفحه گوریلا گلس 4
سخت افزار عالی و رم 3
و.....",4,1,3,3,3,3,3,3
,,"این گوشی بخاطر منتشر نشدن داریور چیپستش برای اندروید 7 قابلیت اپدیت به این ورژن رو نداره پس حواستون باشه که. دارین یه گوشی میخرین که نهایتا به اندروید 6 که ماله پارساله اپدیت میشه موفق باشین",1,9,2,4,2,5,3,2
"[""ندارد""]",,"به نظر من این گوشی ارزش خرید نداره",4,8,0,1,2,2,2,1
,,"اساتید سال ساختش 2014 هستش
دوستانی ک انتظار دارن با پرچم دارا مقایسش کنن برن
xiaomi mi5
بخرن",4,2,5,5,5,5,5,4
"صفحه نمايش خوب","سيستم عامل بسيار قديمي و غيرقابل ارتقا سخت افزار قديمي عدم پشتيباني از کارت حافظه عدم پشتيباني از شبکه 4G قيمت نسبتا گران","با توجه به معایب زیاد ارزش خرید ندارد.",4,5,1,2,2,3,3,1
,,"با سلام این گوشی شیاموی هست و مارک های شیاومی و میزو از اپل هم بهترند و حتی سامی ده ها مدل نوت 7 داده که بهترین ان ابتدا به چین برای رقبت با میزو و دومی برای رقبت برای اپل به امریکا رفته و هواوای یک شرکت ای برای خاورمیانه است پس شیاموی را دست کم مگیرید
بعدش هونور 4X نه اثر انگشت داره(غالبا گوشیای بالا 1 تومن دارن) و دوربین هر دو 13 و مساویه و پردازنده قوی تر که خودتون فرمودید وغالبا اندروید کم تر هیچ اشکالی نداره و اپدیت 6.0.1 هشت روز پیش بیست اگوست اومده پس لطفا قبل از گذاشتن نظر اطلاعات جمع اوری و با تعصب نظر ندهید",1,3,5,5,5,5,5,5
,,"این گوشی هم از نظر پردازنده که خودتون فرمودید و هم رم و دوربین بسیار قوی هستش",2,0,3,3,3,3,3,3
,,"گوشی honor 4x اثر انگشت نداره",2,3,3,3,3,3,3,3
"پردازنده . سيستم عامل . باتري . صفحه نمايش و ...","عدم پشتيباني از حافظه و نداشتن 4g","دوستانی که نگران سیستم عاملش هستن بدونن که این گوشی قرار هستش به اندروید 6.0.1 آپدیت بشه . از لحاظ سخت افزار و نرم افزار هم خیالتون راحت باشه . امتحانشو پس داده !",0,1,5,5,5,3,3,4
,,"دوستان لطفا زود قضاوت نکنید دیجی کالا مدل های جدید شیا رو نیاورده وگرنه شیا برند خوبیه مخصوصا note 3 pro که به راحتی هواوی های هم قیمتشو میخوره",1,0,3,3,3,3,3,3
,,"در عمل خیلی گوشی ضعیفیه",0,1,3,3,3,3,3,3
"پردازنده قوي","خيلي!!!!
1-عدم پشتيباني از حافظه جانبي
2-اندرويد خيلي پايين واقعا فاجعه هستش
3-قيمت نسبتا بالا
4-نداشتن 4g","واقعا نظرم درباره شیائومی با خوندن مشخصات این گوشی کلا عوض شد ، من خیلی انتظارم از شیائومی بالاتر از این بود . بهر حال!!!! من یه پیشنهاد دارم واسه اونایی که قصد خرید این گوشی رو دارن و اون این هستش که یه سر به برند هوآوی سری هانر بزنن و گوشی honr 4x رو بررسی بکنن من خودم از این گوشی استفاده میکنم و مزایای اون نسبت به این مدل شیائومی عبارتند از :1- قیمت پایین تر -دوربین قویتر 3-ساپورت کارت حافظه 4-داشتن اینترنت 4g ، اندروید 5.1.1 (که به تازگی به 6 ارتقا پیدا کرده) و از همه مهمتر داشتن حسگر اثر انگشت
و اما معایب اون نسبت به این گوشی : فقط اینکه پردازندش کمی ضعیفتر از این مدل هستش
حالا خود دانید",35,38,2,4,3,4,3,2
"نو آوري. کيفيت عالي ساخت. و.....","ساپورت نکردن کارت حافظه داخلي","خیلی جالبه. من گوشی های سونی و سامسونگ. ال جی 4 داشتم این عالیه در ضمن نگهداری شارژ برق خوبه من ایرادی ندیدم جز ساپورت نکردن کارت حافظه. حتماً بخرید پشیمان نمیشوید",12,20,5,5,5,5,5,5
"پردازنده بسيار خب
کيفيت تصوير عالي
دوربين در سطح قيمت عالي","نداشتن حافظه کافي
پشتيباني نکردن از 4جي","خب من بعد از یک ماه استفاده میتونم بگم ک هنوز لگ نزده!
دوربین در فضای باز . روز خوب جواب داده!
باطری منو غافلگیر کرد چون با داشتن یک بلک بری و تجربه سامسونگ و ال جی و ایسوس هنوز هیچکدم به نصف عمر باطری این گوشی نرسیدن
از لحاظ روان بودن و پردازش عالی بوده بنظر من با پردازنده مثل اس 5 سامسونگ خیلی بهتر بوده
اما اقعا نداشتن کارت حافظه اذیت میکنه
نداشتن 4جی هنز برا من مشکلی نبوده چون وقتی از دیال آپ شروع کردم همین 3 جی خودش یه دنیاس البته اینم بگم واقعا استفاده ما از 4 جی چی میتونه باشه وقت برامون طلاس؟",7,13,4,4,5,4,2,4
"[""کيفيت عالي در سخت افزار و نو آوري ""]","[""ساپورت نکردن کارت حافظه ""]","من الان 7ماه دارم عالیه تاچ بسیار عالی و نگهداری شارژ در ضمن رابط کاربری مثل آیفون وعالی منظورم منو من مشکلی ندیدم 3gدارم در ضمن گوشی تک دست هر کسی نیست",8,8,5,5,5,5,5,5
کيفيت،زيبايي,خدمات,"گذشته از ضعف خدمات که گذشتنی بسیار دشوار است..برند شیاومی دارای محصولاتی با کیفیت بسیار بالاست و در بعضی موارد برند های شناخته شده در کنار کیفیت و همچنین طراحی منحصر به فردی که در اکثر کالاهای تولید شده توسط این شرکت به چشم می خورد حرفی برای گفتن ندارند.",15,6,4,5,4,5,5,4
[],[],"مشخصات این گوشی مشابه پرچم دارا های دو یا سه سال قبل سامسونگ هستش ..بنظرم کسایی که با گوشی بازی نمی کنند بهتره از میان رده های به روز استفاده کنند چون دستورات سبک مثل پیامک تلگرام تماس عکاسی وسرچ بسیار سریع تر انجام میشه ...دلیلشم نوشتن رابط کاربری بهینه تر است..راستی کیفیت گوشی های این برند به مراتب بهتر از هواوی است",11,9,0,0,0,0,0,0
,,"سلام
با قیمتی که داره و پشتیبانی نکردن از کارت حافظه،بنظرم خرید الجی جی3 خیلی بهتر و معقول تر باشه",15,14,3,3,3,3,3,3
,,"با سلام خدمت دوستان عزیز، راجع به برند چیزی نمیگم چون خیلی وقتا محصولات فقط پول برندشون میخورن مثل سامسونگ یا سونی و خیلی از محصولات با برندهای نه چندان شناخته شده واقعا خیلی برترند. این گوشی به نصبت امکانات و کاراییش به نظرم قیمت خیلی بالایی داره، با قیمت خیلی کمتر از این میشه لنوو وایب پی 1 ام خرید که گوشی بی نظیریه، از همه جهت. با تشکر",10,19,1,2,2,3,3,1
[],[],"با 16 گیگ . حافظه داخلی و بدون پشتیبانب از کارت حافظه و پردازنده 32 ارزش خرید نداره حتی اگه قیمتش پایین تر باشه",10,10,1,4,3,3,3,2
"[""ارتقا به آندرويد 6. رابط کاربري زيبا. سخت افزار قدرتمند. دوربين با کيفيت ""]","[""در فضاي آزاد بعضي وقت ها تو فيلم هايي که گرفته مي شه صداي سوت شنيده مي شه ""]","در کل گوشی خوبیه",13,4,4,5,3,4,5,5
"cpu قدرتمند ram 3 کيفيت صفحه 441ppi","نداشتن 4g و عدم شيار sd card","عالیه شک نکنید.",16,4,4,4,4,4,4,3
"پردازنده خوب","حافظه کم و قيمت گذاري نامناسب در بازار ايران","بدون درگاه کارت حافظه نسخه 16 گیگ اصلا توجیه خرید ندارد.
نسخه پیش فرض اندروید پایین است
شیائومی در بازار ایران بسیار جای پیشرفت دارد اما به شرط قیمت گذاری مناسب!",24,8,4,4,4,5,4,3
"صفحه نمايش
باطري","کمبود لوازم","واقعا جا خوردم وقتی دیدم دیجی کالا اورده چون چند بار خاستم بخرم این برند و ولی دو دل بودم چون سایت درست حسابی نبود که بفروش و خدمات بده
مطمعنم این برند بسیار بهتر از هواوی این حرف و یه فروشنده 6 ساله موبایل داره بهتون میگه شک نکنید تو خریدش تنها ریسک این برند لوازم و خدماتش وگرنه عالیه مطمعنم تا چند روز اینده میخرم",19,7,3,3,3,3,3,3
,,"خودتون قضاوت کنید؛ ظرفیت حافظه داخلی 16 گیگ بدون حافظه جانبی اندروید 4.4 که داره منسوخ میشه
مشخصاتش رو یه بار دیگه بخونید ببینید بااین قیمت ارزش خرید داره",15,12,3,3,3,3,3,3
"[""همه چيز""]","[""هيچ چيز""]","این برند در کشور چین با نام اپل چین شهرت دارد",12,1,5,5,5,5,3,5
,,"گوشی دارای قابلیت 4G نمی باشد",3,8,3,3,3,3,3,3
[],[],"دیجی جون حقیقش اگه من بودم بجا این همه مارکهایه مختلف چینی و با کیفیت پاین و قیمتهایه بالا بیشتر رو برند شیائومی سرمایه گذاری میکردم میتونن بگم تنها برندی هست که نه نیاز به پیشنهاد ویژه و تخفیف داره نه تبلیغات نه افت قیمت زیاد داره
حتا رو دست ایفون و سامسونگ زده
اگه شک دارید من حاظرم سرمایه گذاری کنم",33,14,5,5,5,5,5,5
