positivePoints,negativePoints,commentText,like,dislike,"ارزش خرید به نسبت قیمت",نوآوری,"کیفیت ساخت","امکانات و قابلیت ها","سهولت استفاده","طراحی و ظاهر"
"اکثر موارد",دوربين,"دوستان این فبلت ا ز همه نظر در حداقل امکانات لازم برای کاربر معمولی خوب و کافی است! رم وحافظه داخلی و اندازه صفحه وپردازنده و .... ، خصوصاً باقیمت مناسب اش. تنها و تنها نقص را می توان از دوربین آن گرفت ! اگر با رزولوشن 5 مگاپیکسل اش کنار بیاییم ، با عدم اتوفوکوس شخصاً نمیتوانم کنار بیایم! چرا که اگر بخواهم از یک صفحه A4 که نوشته های نسبتاً ریزی در آن است عکس بگیرم آنگاه نوشته ها خوانا نخواهد بود! گوشی فعلی ام نیز دقیقاً 5 مگا پیکسل است و اتوفوکوس ندارد و این ایراد به دلیل نیازم به کپی کرفتن از صفحه ها بسیار برایم مشکل آفرین شده است، هر چند ممکن است برای خیلی ها مهم نباشد. با وجود این اگر دوستانی که خریداری کرده اند و از دوربین در این حالت استفاده کرده اند ، لطفاً اطلاع رسانی کنند ، اگر خوب باشد خودم یکی از این دستگاهها را شدید نیاز دارم. با تشکر فراوان .",8,3,3,3,3,3,3,3
"ارزان بودن",,"پردازندش بشدت لگ داره",2,3,3,2,1,4,4,1
,,"لطفا افرادی که این گوشی را خریداری کرده اند، دقیقتر از امکانات گوشی صحبت کنند تا قابل استفاده باشد. نظراتی که صرفا میگن: خوب نیست، بدرد نمی خوره، خیلی خوبه، به کاربران دیگر کمکی در تصمیم گیری نمی کنه.",10,3,4,3,3,3,3,3
,,"خوب نیست. خیلی ضعف
اندروید پایین.سخت افزارباهم هماهنگ نیستند.این چیپست هابیشتردرتبلت هابه کارشده میره",8,3,3,3,3,3,3,3
هيچي,"خود گوشي نقطه ضعفه کيفيت ساختش پايينه","صفحه نمایش با تراکم پیکسل کم و نور کم که کیفیتش خیلی پایینه
پردازندشم که مدیا تک هستش
اندازه صفحه نمایشش نامعقول هست
دکمه های هوم رو با خودکار میکشیدن بهتر بود
درب پشتی کیفت کمی داره و انگار از ی گوشی مثل سامسونگ اس 5 کپی شده
باتری رو کاغذ خوبه ولی تو عمل نه
با این فیمت مدل های بهتری تو دیجی کالا هست
نصبت به قیمتش 1درصد ارزش خرید داره اونم فقط بخاطر تجربش
نقاط قوت نداره
ممنون از دیجی کالا
یاعلی
خدانگهدار",10,4,3,3,3,3,3,3
"باتري فوق قوي","اندرويد قديمي","این گوشی برای اونای خوبه که با گوشی زیاد ور میرن و باتری کم میارن",3,0,5,5,3,5,5,1
"باتري
دو سيم کارته بودن","دوربين ضعيف کيفيت ساخت پايين
تراکم پيکسلي بسيار پايين
صفحه نمايش بزرگ که باعث بي کيفيتي صفحه شده
عدم پشتيباني از 4G ظاهري نه چندان دلچسب
نسخه اندرويد 4.4 و...","نخریدمش
ولی از مشخصات روی کاغذ معلومه گوشی خوب طراحی نشده
اصلا سخت افزارش با هم هماهنگ نیستن
تراکم پیکسلی واقعا خیلی پایینه که بقیه ضعفا و نقاط قوتشو گفتم
ولی قیمتش رو هم نباید نادیده گرفت
درکل خرید این گوشی از نظر من معقول نیست
موفق باشید",9,6,3,3,3,3,3,3
