,,"در جواب دوستمون که گفتن اسپیکرشون مشکل داشته:

من هم همین مشکل برام پیش اومد و میخواستمن ب نمایندگی اهواز ارجاع بدم گوشی رو که حدود دو هفته پیش اپدیت 500 مگابایتی برای گوشی منتشر شد که کاملا اسپیکر گوشی درست شد و از نظر سرعت و رومان بودن هم بهتر شده و مصرف باتری هم در حالت ساستند بای بسیار بهینه شده ینی مثلا اگر سه ساعت به گوشی دست نزنید و بعدش برید سراغش میبنید که شارژش همون مونده

خداکنه که ال جی واسه این گوشی حداقل اپدیتای خوبی بده که استفاده ازش رو لذت بخش تر و راحت تر

انشالله تا چند روز دیگه با بررسی کامل این گوشی(البته از نظر خودم)در خدمت شما دوستان خواهم بود",7,0,4,5,5,5,4,3
"صفحه نمايش با وضوح و روشنايي بالا. مولتي تسکينگ بسيار عالي. خوش قيمت","عدم تبليغ درست الجي که بعضي ها با شايعه پرش آنتن سعي ميکند اين محصول رو زير سوال ببرند","همان‌طور که بالا بودن تعداد پیکسل‌های دوربین گوشی‌ها نشان از کیفیت بالای‌ آن‌ها نیست، بیشتر بودن تعداد هسته‌ها نیز همواره به معنای بهتر بودن قدرت پردازش نیست.
یکی گفته گلگسیa9 pro بهتر چونcpu هشت هسته ای داره .یعنی رسما اسنپدراگون 820 نابود کرد با این حرف",8,1,5,4,5,5,4,5
"همه چي داره",نداره,"کولاک کرده از هرکی میپرسم میگه عالیه",11,0,4,4,5,4,4,4
"جنس بدنه خوب کيفيت صفحه نمايش نمايشگر دوم فوق العاده کاربردي درگاه اينفرارد براي کنترل دستگاه هاي داراي ريموت به همراه برنامه بي نقص ال جي مخصوص اين کار گارانتي قابل اعتماد ماديران دوربين پشت عالي حافظه داخلي 64 مجزا بودن درگاه سيم 2 و کارت حافظه قابليت ضبط صداي بينظير","دوربين سلفي ميتونست بهتر باشه ولي بد نيست جايگيري حسگر اثر انگشت ايده آل نيست کمبود لوازم جانبي نسبت به ساير برندها","دوستان تمام موارد مورد نیاز رو در نظرات اشاره کردن و من نمیخوام نظرات تکراری بدم فقط در مورد باطری نظر خودمو بگم که کاملا قابل قبوله و مورد دیگه میخواستم در مورد اسمارت لاک تو تنظیمات گوشی اشاهره کنم چون فوق العاده چیر جذابیه و شاید کس دیگه ای مثل من توش گیر کنه و زمان ببره تا بفهمه از کجاست.
تو تنظیمات گوشی گزینه ای به نام اسمارت لاک وجود داره که این گزینه لاک اسکرینی که واسه گوشی تنظیم کردید رو در برخی موارد غیر فعال میکنه مثل زمانی که گوشی به ساعت وصله یا یک شبکه وای فایخاصی واسش تعریف کردید مثلا وای فای خونه یا با gps یک موقعیت خاصی تعریف کردید تو اون مکان نیاز به زرن کد یا پترن نباشه یا حتی چهرتون رو با دوربین جلو میشناسه، در واقع اسمارت لاک قابلیتیه که با کمک برخی گزینه ها صاحب گوشی رو شناسایی میکنه و تو اون مواقع بدون باز کردن قفل وارد میشید. من گوشیم به ساعتم وصل بود و وقتی میخواستم بدون حسگر اثر انگشت با دابل تپ وارد شم گوشی پترن نمیخواست اول فکر کردم قاطی کرده و میخواستم ریست فکتری کنم ولی بعد متوجه این مورد شدم
شاید کس دیگه ای هم مثل من تو این مورد گیر کرده باشه و به دردش بخوره و کمکی باشه واسش",7,1,4,5,5,4,4,5
,,"فقط یک مورد حتی یک مورد هم کمی کاستی و نقص ندارد",20,10,5,5,5,5,5,5
"رزوليشن بالا و با کيفيت
باطري خوب با سرعت شارژ بالا
دوربين عالي و کنترل جادويي
بدنه فلزي و محکم
اثر انگشت فوق سري",هيچي,"دوستان در خریدش شک نکنید من بالاخره 10/19 خریدم و بسیار راضی هستم نقطه ضعفی ندیدم همه چیز عالی مثل همیشه دوربین با کیفیت خیلی بالاست و (سرعت شارژ شدن عالیه quick charge 3 ) در خصوص باطری نگران نباشید خیلی معمولی و متعادل مصرف میکنه و اصلا داغ نمیکنه اثر انگشت هم در یک ثانیه عمل میکنه بدون اشتباه ) سیستم کنترل جادویی هم داره کنترل تمام وسیله های الکترونیکی )به شما هم توصیه میکنم این غول 2016 رو بخرید و لذت ببرید.",14,2,3,5,5,5,5,5
"جنس عالي بدنه و ظاهري جذاب
صفحه نمايش با کيفيت و دلنشين و بزرگ +صفحه نمايش دوم کاربردي
سخت افزار قوي
دوربين هاي فوق العاده
باتري قابل تعويض",ندارد,"با عرض سلام خدمت دوستان گرامی و دیجی کالای عزیز.
اگه حرفام طولانی شد به بزرگی خودتون ببخشید.
بالاخره 15 دی این گوشی رو خریدم. از همون اول که گوشی معرفی شد دربارش تحقیق کردم و از هر لحاظ بررسی اش کردم.من تو انتخاب همه چی خیلی مشکل پسندم و فکر میکنم گوشی های الجی هم مخصوص مشکل پسند هاست.این گوشی بهترین گوشی هست که تا به حال دیدم.عالی عالی خیلی عالیه.اگه شک دارید تو خریدنش اصلا شک نکنید بخرید.کسایی هم که طرفدار برند های دیگه هستن وقتی این گوشی رو تو دستم میبینن به فوق العاده بودن گوشی اعتراف میکنن!
آدم وقتی جعبه ی گوشی رو میبینه و بازش میکنه به اصالت گوشی پی میبره اصلا دلش نمیخواد گوشی رو از تو جعبه برداره خیلی خوشگل چیدن جعبه شو.
طراحی:اولین باری که گوشی رو تو دستت میگیری حس استحکام و لوکس بودن بهت منتقل میشه خیلی خوشگله اصلا ظاهر گوشی یه شخصیتی داره که نگو و نپرس !گواهی نامه استاندارد نظامی بدنه هم یکی از مزیت هاشه که خیلی عالیه.درسته تو تاریخ گوشی های الجی،طراحی ظاهری LG V10 دیگه تکرار نمیشه و یک طراحی خارق العاده بود اما ظاهر V20 هم در مجموع خوبه و آدم روز به روز عاشقش میشه!
صفحه نمایش:من از صفحه نمایش IPS خیلی خوشم میاد و واسه همینم طرفدار گوشی های الجی هستم.تراکم پیکسلی صفحه نمایش خیلی بالاست. کیف میکنی وقتی داری با گوشی کار میکنی.صفحه نمایش دوم هم که دیگه حرفی واسه گفتن نذاشته من اولش فکر میکردم یه چیز تبلیغاتی هست و خیلی کاربرد نداره اما تا باهاش کار نکنی نمیدونی چه عضو مهمی از گوشیه.
سخت افزار:این گوشی به لطف اسنپ دراگون 820 و رم 4 خیلی روان و نرم کار میکنه و بازی های با حجم بالا رو هم خیلی خوب اجرا میکنه.سخت افزارش خیلی عالی با هم هماهنگه.کوچکترین هنگی تو این چند روز ندیدم.
دوربین:وای دوربینش!آدم محو کیفیتش میشه! دلش میخواد بره تو دل طبیعت فقط عکس بندازه خخخ!درسته دوربین سلفیش بازم جای پیشرفت داشت اما در مجموع سلفیش هم خوبه مخصوصا با درجه های متفاوت.به دوربینش نمره 20 رو میدم.
باتری قابل تعویض:این قابلیت هم یکی از مهم ترین قابلیت های این گوشیه و به نظر من می ارزه باتری قابل تعویض باشه اما گوشی ضد آب نباشه البته این گوشی در برابر رطوبت مقام هست ضد آب نیست.
حسگر اثر انشگتش هم یه اشاره کوچک لازمه تا قفل گوشی باز بشه من تا به حال حسگر اثر انگشتی با این حساسیت ندیده بودم.
سیستم صوتی گوشی هم که عالیه،یعنی وقتی بخوای چیزی رو ضبط کنی کیف میکنی از کیفیت صدا! فقط من امیدوار بودم که نسخه B&O این گوشی به طور رسمی وارد ایران بشه که متاسفانه نسخه معمولیشو آوردن.البته نسخه B&O هم تو بازار هست ولی بدون گارانتیه که دلم نیومد بخرم!
در مورد باتری این گوشی بگم که با وجود دو صفحه نمایش و تراکم پیکسلی خیلی بالا مصرف باتری خیلی طبیعی و عادیه.اون دسته از دوستان عزیزی که میگن باتریش ضعیفه اینو در نظر داشته باشن که با این صفحه نمایش با کیفیت خیلی هم باتری خوبی داره.یه روزو کامل دووم میاره.
حافظه داخلی 64 گیگ هم عالیه.
فست شارژ هم که دیگه این مجموعه رو کامل کامل کرده.
به جرئت میتونم بگم که این گوشی رو با آیفون 7 پلاس هم عوض نمیکنم!
این خیلی خوبه که الجی میتونه گوشی هایی رو بسازه که قیافه گوشی 500 تومنی با گوشی 2 میلیونی اش فرق داشته باشه!بر عکس بعضی از شرکت ها!این خیلی خوبه!اصلا برند LG که حک شده روی گوشی یه ابهت خاصی به گوشی میبخشه!
متاسفانه لوازم جانبی این گوشی خیلی تو بازار کمه و دیجی کالا هم از وقتی نا موجود شد دیگه موجودشون نمیکنه.دیجی کالا جون من منتظرم تا کاور اسپیگن واسه این گوشی بیاری خیلی زود!گوشی های الجی بدون کاور های اسپیگن یعنی هیچ!پس منتظرم دیجی کالای دوست داشتنی!
ببخشید که دوستان سرتونو درد آوردم،امیدوارم کمکی در مورد خرید این محصول به شما کرده باشم.
Just LG
Just V20",48,6,5,5,4,4,4,5
,,"حدود یک ماه استفاده میکنم خیلی گوشیه خوبیه
من در مجموع از خریدی که کردم رضایت کامل دارم",23,2,3,5,5,5,5,5
,,"یکی اومده نوشته سامسونگ a9سوپر امولد هستش خب تو اگه سوپر امولد اونو می بینی 4 گیگ رام اینم ببین 64 گیگ حافظش رو ببین واین که سامسونگ از اگزینوس استفاده میکنه که هیچ جور به اسنپدراگون نمیرسه .",23,5,5,5,5,5,5,5
,,"دوست عزیز هیچ وقت نباید یه گوشی میان رده رو با پرچمدار سال مقایسه کرد،، اصلا قابل مقایسه نیست میان رده با پرچمدار،، خود سامسونگ گوشی A9 رو میان رده معرفی کرده.",1,0,3,3,3,3,3,3
"سرعت بالاي گوشي_کيفيت بالاي صفحه نمايش_دوربين خيلي با کيفيت","باتري متوسط","سلام من حدودن این گوشی رو. یک هفته دارم قبل این همLG V10داشتم الان همLGV20دارم از نظر همه چی گوشی عالی هست سرعت بالا مخصوصن کیفیت گوش دادن اهنگ با هدفون دوربینش هم که عالی هست چه تو شب چه تو روز. فقط بدی که داره باتریش هست باتریش متوسطه استفاده سنگین کنی یه رو جواب میده",17,4,4,4,4,4,3,4
"سخت افزار","قوي تر کردن v10 در پوسته اي زشت و نه چندان مقاوم","از نظر من گوشی v10 واقعا زیباتر و از نظر استحکام قابل رویت تر و لمس پذیرتر بود ولی v20 فقط از لحاظ سخت افزار پیشرفت داشت ولی در ظاهرش اصلا دچار تغییرات اساسی نشد. مثلا دوربین جلو دوگانه در v10 کاملا کارآمد هست در حالی که در v20 در پشت گوشی که بیشتر مواقع زاویه دید بازتری برای عکاسی هست بلااستفاده است در v10 بدنه فولادی با قاب پشت سیلیکونی بود که مطمئنا در تمامی تست ها بهتر عمل کرد در حالی که در v20 اینطوری نیست ولی در کل v20 سخت افزار فوق العاده ای داره که اگر فقط این سخت افزار در v10 قرار داده میشد مطمئنا هیچ کس سراغ v20 نمیرفت.",7,31,5,3,5,2,0,0
,"کيفيت پايين بلندگو","این گوشیو توی طرح پیش خرید دیجی کالا خریدیم گوشی خیلی خوب و بدون عیبی است ولی دقت به چندتا نکته ضروری . بدنه این گوشی با اینکه فلزی ولی خیلی محکم حس نمیشه توی دست. دو تا قسمت پلاستیکی بالا و پایین گوشی هم خیلی حساس به ضربه است مراقب باشید خش نیافته. و حتما یه کیف بخرید واسش چون بدنه فلزیش خیلی لغزندس. روی لنز دروبین پشت یک صفحه وجود داره که در نگاه اول مثل محافظ میمونه ولی شیشست و اگر بشکنه باید عوض شه. چون بیرون زدگی هم داره خطر شکستنش زیاده. بیشترین خرابی که واسه این گوشی گزارش شده همینه. اما مشکل بعدی بلندگو این گوشی که واسه منم پیش اومد. صداش بطور خودکار عوض شد و اعوجاج افتاد توش بدون ورود هیچیز حتی رطوبت و یا ضربه. و صدای صافش ازبین رفت وقتی گشتم دیدم خیلیا میگن اپدیت میاد درس میشه ولی واسه خیلی از افراد یک ماه این طور شده و هنوز درس نشده می تونید توی گوگل LG V20 Blown speaker یا Distortion in LGV20 speaker رو جسن وجو کنید و ببینید. خود lg یه جا گفته بود استفاده از کابل ucb c بی کیفیت دلیلیشه ولی من از فابریکیش استفاده می کنم و خیلی ها هم همینطور. به گارانتی که مراجعه کردم گفتن همچین چیزی گزارش نشده ولی خوشبختانه ننداختن گردن خودم و منتظر تعویض بلندگو گوشیم. واقعا جای تاسفه که گوشی با این قیمت کیفیت ساخت قطعاتش انقدر پایینه. واقعا از چشمم افتاد...",5,14,3,1,2,4,3,4
"ضد ضربه اندرويد 7","cpu دوربين سلفي باتري صفحه نمايشlcd","دوستان من تا حالا با lg کارنکردم
ولی با یه مقایسه کوچیک میشه فهمید که سامسونگ a9 pro از این خیلی بهتره
a9 pro: دوربین سلفی 8 مگاپیکسل cpu 8 هسته ای باتری 5000 میلی امپر صفحه نمایش سوپرامولد",3,41,3,3,3,3,3,3
"مصرف کم باطري وصفحه 5/7 اينچي باتاچ ورزولوشن مناسب و سه جايگاه جهت دو سيم کارت و کارت حافظه","نامناسب بودن محل قرارگرفتن بلند گو و درگاه شارژر","درخصوص آنتن دهی که اختلاف بین نظرات مطرح شده وجود داره باید بگم هردو گروه درست میگن
واقعیت این بود که سیم کارت دوم گاهی آنتنش می پرید وبه اوپراتور وصل نمی شد مگه اینکه یک بار خاموش وروشن میکردیم .
اما با آخرین آپدیت که هفته گذشته آمد و حدود پانصد مگابایت بود
خوشبختانه به کل این مشکل از بین رفت .",8,5,4,4,5,5,4,5
"دوربين خوب
کيفيت ساخت خوب
قيمت مناسب
سخت افزار به روز","باتري متوسط","حتماً به کسایی که می خوان یه گوشی خوب با یه قیمت مناسب تهیه کنند پیشنهاد می کنم.
من که کاملاً راضیم.",10,2,5,5,5,5,5,5
,,"زیاد گوشی عوض میکنم. طی این چندماه این گوشیا رو داشتم
Samsung s7 flat
Microsoft 950 xl
iPhone s6
اگر ضرر فروشش برات خیلی مهم نباشه عالیه
واقعا دوستداشتنیه...",8,4,5,5,5,5,5,3
,,"من اهل گوشی بازیم و تندتند گوشی عوض میکنم.سامسونگ s7.... Microsoft 950xl ...... s6 iPhone .... اگر ضرر فروش و بورس بودن برات خیلی مشکل نیست.....این گوشی خوشحالت میکنه و راضی......",7,4,5,5,5,5,5,3
,,"سلام، من دوهفتست این گوشی رو گرفتم،، خواستم بگم که این گوشی به هیچ عنوان مشکل آنتن دهی نداره و مشکل پوشش دهی اپراتور شماست که میگید انتن میره و میاد،، برای برطرف کردن مشکل اون دوستانی هم که مشکل دارند عرض میکنم که توی تنظیمات قسمت network mod که برید میبینید چندتا انتخاب وجود داره که من به ترتیب از پایین میگم : فقط شبکه 2‌‌G_فقط شبکه 3G_انتخاب اتوماتیک بین شبکه 2G‌ و 3G_انتخاب اتوماتیک بین شبکه 2G و ‌3G و 4‌G
شما وقتی از اون دو گزینه اتوماتیک استفاده کنید گوشیتون بسته به موقعیتی که قرار دارید و قدرت سیگنال های اطرافتون شبکه گوشی رو تغییر میده تا قوی ترین رو بگیره و ممکنه بعضی از نقاطی که قرار دارید به دلیل سیگنال ها گوشی مدام بین شبکه ها سوییچ کنه و انتن کم و زیاد بشه.",29,3,3,3,3,3,3,3
"کيفيت همه جانبه ي بالا در ساخت","باطري متوسط","سلام
به عنوان یک کاربر حرفه ای دیوایس های هوشمند باید خدمت شما عرض کنم تجربه کاربری بنده که 20 روزه است ازین تلفن بدون نقص بوده .
مولتی تسکینگ عالی به همراه خنک ماندن دستگاه در پرداش های سنگین.
اجرای نرم افزار های سنگین. با دقت خیلی خوب.
تنها ایراد وارده مربوط به اجرای real racing 3 بود که در متوسط زمان یک دقیقه بازی یک ثانیه لگ به بازی وارد شد. هرچند اجرای modern combat 5 و mortal combat x کاملا بی نقص بود .
از لحاظ امکانات و کیفیت مولتی مدیا این دستگاه از بالاترین پرفورمنس موجود برخوردار است.
بهشت صدا و کیفیت تصویر مرغوب )هم رده با آیفون 7 و کمتر از گلکسی اس7 اج(",18,2,5,5,5,4,4,4
"صداشو با يه هدفون امپدانس بالا تست کنيد ميارزه به شنيدنش من تبليغ نکنم
صفحه اصلي بزرگ شفاف و زيبا و صفحه دوم و فينگرپرينت بسيار دقيق و سريع و تاچ بسيار سريع و قدرت سخت افزاري فوق العاده
دوربين محشر و دوربين جلو خوب و فيلمبرداري شگفت انگيز
باتري بسيار عالي و قابل تعويض
جنس بدنه بسيار پريميوم و سبک و طراحي باکلاس و قشنگ","اينترفيسش به رووني پيکسل نيست و گهگاه باگ داره. نه که لگ بزنه يا هنگ کنه ها. باگ هاي ريز داره مثلا ممکنه از ده باري که گوگل now رو لانچ ميکنيد يه بار بازش نکنه و ازين چيزاي ريز. بنظرم اين اصلا چيز جدي اي نيست فقط ميگم که نگين نگفت
نبودن لوازم جانبي
انصافا گوشي بزرگيه و اصلا راه نداره با يه دست بتونيد کار کنيد باهاش","واقعا تبلیغ الکی و زیادیشو نمیکنم خودتون برید تست کنید فوق العادس مخصوصا با قیمتایی که رقباش دارن واقعا میارزه. اگر وان پلاس 3 تی با قیمت یک و پونصد مثلا میومد تو بازار کلا بازار و جمع میکرد. ولی نیست و فعلا بهترین ارزش خرید به کارایی بنظرم مال این گوشیه.
واقعا دارم لذت میبرم مخصوصا از این صفحه دومش. همچنان تاکیدم روی کیفیت صدای عالیشه که دوستان تاکید دارن شیاومی (!) بهتره. هیچ گوشی تو بازار غیر از الجی وی20 و Htc10 نمیشناسم هدفون های حرفه ای شور رو درایو کنه. مخصوصا اپل و شیاومی وقتی پای موزیک های فرمت های لاسلس بیاد وسط دیگه هیچ حرفی ندارن واسه گفتن. حالا باز میگم تست کنید خودتون مطمئن شید به حرفای منم صد درصد اعتماد نکنید. فیلمبرداری با این گوشی رو تست کنید تعجب میکنید از کیفیت کار مخصوصا مود های منوال دوربین. در کل قبلا هم گفتم این گوشی برای همه نیست واسه کاربرای حرفه ایه و کاربرای ساده پسند سامسونگ اس7 اج و آیفون و پیکسل. رو بیشتر خواهند پسندید. موفق باشید",18,4,3,5,5,4,4,4
,,"نمیدونم چرا بعضی دوستان میگن ضعف آنتن. واقعا همچین مشکلی نداره. البته اونایی که گفتن هیچکدوم از خریدارای این محصول نبودن. من دارم استفاده میکنم. یک هفتست. اصلا ضعف آنتن نداره",19,4,5,5,5,5,5,5
"بسياري از موارد","دوربين سلفي /انتن دهي خيلي ضعيف","از خیلی ها شنیدم که این گوشی عالیه فقط انتن دهی همش کم و زیاد میشه(حتی خط های انتن دهی صفر) واین ضعف همه ی خوبی های گوشی رو صفر میکنه.گوشی که انتن دهی ش مشکل داشته باشه نباید انتظار گوشی موبایل رو ازش داشته باشیم.به کلی از خریدش دو دل شدم",3,24,1,3,4,3,2,4
,"ضعف در آنتن دهي و پرش آنتن - باتري ضعيف، نسبت به رقبا","نسبت به گوشی قبلیم که هواووی بود، آنتن دهی بسیار ضعیفتری داره و همین مسله باعث شده که کلا از خریدم ناراضی باشم. بعلت همین مشکل به نمایندگی مراجعه کردم که پس از دو روز نگه داشتن گوشی ، گفتند که مشکلی نداره!!!!!!",5,19,3,3,3,3,3,3
"طراحي
دوربين قوي
کيفيت صدا
سرعت پردازش
شارژ باطري بالا و قابليت تعويض باطري","چيز خاصي که ضعف محسوب بشه مشاهده نکردم","برای خرید این گوشی یک ماه تحقیق کردم و با برند های برابر دیگه ای که تو بازار وجود داشت مقایسه میدانی انجام دادم و در نهایت تصمیم به خرید این گوشی گرفتم و به هیچ عنوان هم از خرید آن پشیمان نیستم . خدمت دوستان عزیزی که در مورد افت کیفیت باطری اعلام نظر میکنن با همه احترام پیشنهاد میکنم این گوشی را به صورت هم زمان با گوشی های S7 سامسونگ و آیفون 7 مقایسه انجام کنند چون من من خودم این کار را انجام دادم و سرعت تخلیه شارژ باطری در زمان استفاده از نت در سامسونگ S7 و آیفون 7 به مراتب بالا تر و بیشتر از ال جی V20 می باشد و با در نظر گرفتن اینکه باطری V20 از نظر آمپر 3200 می باشد ولی سامسونگ و آیفون آمپر بالاتری را دارا می باشند گوشی V20 ساعت بیشتری را در مقایسه شارژ نگه میدارد .",13,4,5,5,4,5,5,4
