"همه چيزش خوبه","هيچ گوشي بي نقص نيست ولي من تا حالا چيزي نديدم","رنگ نوک مدادی رو گرفتم.قبل از اینکه بگیرم همه نظرات خوندم.خیلیا عیب بی خود روی گوشی گذاشتن.به نظرم رنگ نوک مدادی فوق العاده قشنگه.همه چیز از طراحی گرفته تا کارایی فوق العادس.تشکر اخر از دیجی کالا.دیجی ممنون که هستی",26,1,3,3,3,3,3,3
"بسيار بسيار عالي",,"عالی و نسبت به قیمت کارآیی فوق العاده ای داره",17,3,5,5,5,5,5,5
"دوربينش عاليه فوق العادست سرعت خيلي خوبه و بسيار زيباست","به نظر من هيچ نقطه ظعفي نداره","من این گوشیو 2 ماهه دارم همچیش عالیه مخصوصا دوربینش اونایی که میخوان بخرن ولی ظک دارن نگران نباشن گوشیه عای هستش سرعتش بالاست و هنگم نمیکنه فوق العادس",22,3,3,5,5,4,5,5
"همه چيز","بزرگ بودن
نداشتن چراغ نوتيفيکيشن
ديگه هيچي","بهتر از اینم هست مگه؟
واقعا عالیه از همه نظر پیشنهاد میکنم
قبل از خرید حتما دستتون بگیرید
شاید کمی بزرگ باشه
ولی دستت ک میگیری دیگه نمیخوای
ولش کنی",34,5,5,5,5,4,2,5
"دوربين
صفحه نمايش","تنظيمات ناقص شبکه","هر دو سیم کارت در حالت 4g قرار میگیره . در صورتیکه تو سامی خیلی راحت میشه انتخاب کرد که سیم 1 چه شبکه ای داشته باشه و سیم 2 چه شبکه ای . الان من سیم 1 همراه اول دارم و سیم 2 رایتل . از همراه اول فقط برای تماس استفاده می کنم . ولی چون تنظیمات کامل نیست همش رو 4g هست",9,26,5,5,5,3,4,5
"صفحه نمايش
دوربين عکاسي و فيلمبرداري فوق الاده
کيفيت ساخت بالا
هندزفري خفن...!
رابط کاربري","دوربين بيرون زده
وزنه زياد که کاملا طبيعيه بخاطر مواد بکار رفته و بزرگ بودن گوشي
کاش طراحي دکمه هاشو تغيير نميداد...!","4ساله که g2 دارم با قاطعیت میگم کاملا از الجی راضیم الانم نیازی به تعویض گوشیم ندارم چون فوق العادس اون زمان ک خریدمش خیلیا گفتن اشتباه میکنی من بین g2 و note3 و z1 گیر کرده بودم ولی آخرش g2 انتخاب کردم گوشی بعدیمم یا v20 یا g6!
خلاصه بگم کسایی که از الجی بد میگن تجربه فوق العاده کار کردن با رابط کاربریشو ندارن خیلی کاربردیه صفحه نمایش و دوربین که جای خود داره...!",41,6,5,5,4,5,5,4
"سخت افزار قدرتمند بلندگو و سيستم صداي هاي فاي عالي بدنه فلزي با کيفيت حسگر اثر انگشت دقيق و عالي باطري فست شارژر قوي","دوربين گوشي ميتونست بهتر باشه","واقعا گوشیه عالییه از همه نظر عالیه میشه گفت برند ال جی برای اولین بار از سایر رقبای خودش سامسونگ و سونی و .....جلو زده",31,5,3,3,5,3,4,5
,,"من این گوشی رو در جشنواره دهه فجر ال جی از بازار موبایل خریدم و از نمایندگی ال جی یک هدست وایرلس ال جی هدیه گرفتم:)
از همه چی هم راضی ام
در یک کلام این گوشی حرف نداره",34,2,4,4,4,4,4,4
"از همه گوشيها بهتره",ندارد,"سلام دوستان عزیز و دیجیکالا
من از روز اول سال میلادی2017 برایم آورده اند و مرتب استفاده می کنم
دو سیم کارته نیست . زبان فارسی ندارد ولی با اینکه قبلأ اس6 و قبل اس4 همگی ادج و قبل نوت3 داشته ام وی20 بهترین گوشی کم بودی ندارد و تا در دست نگیری و استفاده نکنی نمی دانی وی20 یعنی چه...دوستان عزیز شک نکنید
ممنون از لطف شما",24,4,5,3,3,3,4,3
"طراحي جالب .. حسگر انگشتي و شبکه هاي ارتباطي و ....","بسيار ظريف در مقابل ضربه و همچنين بعد چند ماهي داغ کرده و از نظر انتن دهي ضعيف مي باشد لطفا نخريد لطفا","بسیار گوشی بدی هستند مارک ال جی لطفا نخرید من که پشیمانم ...",10,94,1,5,5,5,5,5
"اندرويد ناب
سرعت
کيفيت ساخت عالي","نداره!يه هفتس خريدم همه چيشو بررسي کردم هيچ عيبي نديدم","بعد از دوماه سرچ و تحقیق تو این رنج قیمت بهتر از این ندیدم قیمتشم ک نسبت ب رقباش عالیه",44,3,3,5,4,5,4,5
,اسپيکر,"توی سایت xda خیلیها اشاره کردن به مشکل اسپیکر گوشی الان واس منم از روزی که خریدم پیش اومده ولی هنوز قانع نشدم واس بردنش به گارانتی چون فقط توی صدای کم و خیلی زیاد هست
مثلا توی صدای کم یعنی اولین درجه ولووم وقتی یه اهنگ بزاری و اسپیکر رو روی گوشت بگیری متوجه نویز شدید میشی
یا وقتی صدای زیاد باشه اخرین ولووم نویز داره خش خش میکنه گاهی وقتا کرک میکنه یعنی تیک میزنه مخصوصا روی صدا های مردونه با فرکانس های خاص
هرچند واس همه نیست ولی کم هم نیست",14,7,3,5,5,5,5,5
"بدنه فلزي
باتري قابل تعويض
اندروييد 7 بصورت پيش فرض
سخت افزار مناسب","دوربين بيرون زده
نداشتن نوتيفيکيشن لايت","طراحی در مجموع خوبه و بخصوص جلوی گوشی جذابه اما پشت گوشی دوربین برجسته جالب نیست. اگرچه قاب پشتی فلزی احساس مرغوبیت میده. شاید یک نقیصه مهم نداشتن نوتیفیکیشن لایت باشه. درسته که صفحه نمایش دوم نوتیفیکیشنها رو در حالتی که صفحه نمایش اصلی خاموشه نشون میده اما کافی نیست. با نوتیفیکیشن لایت با رنگهای مختلفی که داره میشه از فاصله چند متری به ماهیت نوتیفیکیشن پی ببریم که متاسفانه نبودش حس میشه. در پایان باید بگم که من اصلا روی برند ال جی حساب باز نمی کردم و هیچ وقت هم پی گیر محصولاتش نبودم و الان چون گوشی سونی زد5 پرمیومم سوخت مجبور به خرید گوشی جدید شدم و توی بررسی انواع گوشیهای فعلی v20 رو انتخاب کردم و در حال حاضر از این انتخاب در مجموع راضی ام",16,8,4,4,4,4,4,4
"همه چيز عالي",هيچي,"من این گوشی رو دو روزه خریدم
انصافا علاوه بر زیبایی خاصی که داره همه امکانات رو هم داره:
شیار کارت حافظه و سیم کارت به صورت مجزا
وجود اینفرارد برای کنترل انواع لوازم خانگی و صوتی و تصویری
دو سیم کارته بودن و عدم پرش آنتن
قاب فلزی زیبا بنظرم این گوشی شباهت زیادی به گوشی های htc داره
طراحی بی نقص داره البته من v10 هم دارم بنظرم طراحی v10 یه مقدار بهتره البته v10 دو سیم کارت نیست اگرم باشه تو بازار داخل من ندیدم
از لحاظ تست سرعت با دو تا گوشی اندرویدی v10 و note 3 n9005 مقایسه کردم تقریبا از لحاظ سرعت با v10 مساوی بود! نوت 3 هم که دیگه قدیمی شده کم آورد
بعدا با آیفون 6s هم مقایسه میکنم و نتیجشو میگم
خلاصه کلام اینکه اگه یه گوشی هم فن حریف و بسیار زیبا با سرعت بالا و امکانات فوق العاده میخواید و اهل استفاده از برنامه های مختلف و بازی های سنگین و برنامه های همراه بانک هستید این گوشی خیلی خیلی خوبی هست و نیازتون رو رفع میکنه و در ضمن مثل بعضی از گوشی های دو سیمکارته (هواوی) دچار اختلال تو برنامه های همراه بانک نمیشه.",17,3,5,5,5,5,5,5
,,"سلام ب همه عزیزان.
من از طرفداران برند الجی هستم.پارسال همین موقع گوشی v10 رو خریدم.البته بعد از تحقیق فراوون.ک یکی از منابعی ک بهش مراجعه میکردم همین دیجی کالا و نظرات عزیزان بود.ازتون میخام ک اگه نظری راجب گوشی میدین با تحقیق و بدور از تعصب باشه.چون نظر شما میتونه معیاری برای انتخاب عزیزان باشه.و الانم کاملا از خریدم راضیم.
تنها مشکلی ک الان باهاش دارم بعد یکسال مشکل سایه انداختنه.ک تو نظرات خوندم‌مشکل از اپدیت اندروید 6هس.ک امیدوارم با اندروید نوقا رفع بشه.
و اما v20. بنظرم مهمترین فاکتورها برای خرید یک گوشی نمایشگر با کیفیت.دوربین.استحکام گوشی هست.اول برید سراغ نیازهاتون.ببینید مهمترین فاکتور براتون چی هست.نمایشگر بزرگ یا کوچک.دوربین یا صدای با کیفیت.باطری قابل تعویض یا ضد اب بودن.زیبایی یا مقاومت بالا.اونوقت میتونید براحتی انتخاب کنید.ا
اگه گوشی با نمایشگر بزرگ میخواهید بهترین انتخاب هس.اگه ن برید سراغ s7edge
اگه استحکام بالا و باطری قاب تعویض میخواهید باز هم بهترین انتخاب هست.
ولی اگه ضد اب بودن براتون فاکتور مهمی هس خب بهتره برید سراغ سونی و سامسونگ.
در زمینه دوربین جزو بهتریناست.و بدون شک در زمینه فیلمبرداری و دنیایی از قابلیت ها و تنظیمات بی رقیب هست.البته میتونست دوربین سلفی بهتری داشته باشه.
در زمینه سهولت استفاده با استفاده از نمایشگر دوم ک واقعا کاربردی هست و سرعت بالا لذت کاربری فوق العاده ای بهتون میده.
اگه گوشی با نمایشگر بزرگ.دوربین عالی.ظاهر زیبا.صدای فوق العاده باطری قابل تعویض میخواهید این‌گوشی بهترین انتخابه.
اگه طول عمر بیشتر باطری.اندازه نمایشگر کوچکتر.ضد اب بودن ملاک اصلیتون هست میتونید سراغ s 7 edge برید
همچیز بر میگرده ب سلیقه ی شما.اگه دنبال گوشی خاص هستید حتما این گوشی و بخرید.
ولی اگه دنبال خاص بودن نیستید و ترجیح میدید مثل طیف اکثریت باشید برید دنبال گوشی های دگ ولی انتظار نداشته باشید تو یه جمع بدرخشید.چون خاص نخواهید بود.",35,1,4,4,4,3,4,5
,,"نکته قابل توجه در مورد این گوشی که هر گوشی حتی تو این رنج قیمتم نداره دوترابایت حافظه و اندروید هفتشه و نیز بدنش که باعث میشه این گوشی از گوشی های دیگه حتی تو این رنج قیمتم متمایز بشه",15,2,3,5,5,5,5,5
"نسبت به گوشي هاي سامسونگ امکاناتش بيشتره
خوش دسته
قدرتمنده","يکم قيمتش زياده
طراحيش جالب نيس","فقط میتونم بگم خیلی قویه بازی های خیلی سنگین رو حتی سریع تر از s6سامسونگ اجرامیکنه عالیه",20,1,3,5,5,5,2,5
,,"سلام ببینید این گوشی خیلی خوبه فقط اگه هدفون بی اند او روش بود و های فای رو همه اهنگا کار میکر بهتر بود
دوربین دوم در نور ضعیف یکم بده نه خیلی ولی یکم نویز داره
در مورد عملکرد نسبت به همه سامسونگی ها میگم که شما رو میگیره خودتون سرچ کنید بنچمارک پیاپی اس 7 و شیاومی می پنج در اخرین تستش به سه بعدی سامسونگ دقت کنید",10,2,4,5,5,5,3,5
"همش نقاط قوته","دوربين دوم در نور کم بده
اندازش يکمي بزرگه و توجيب شلوارت اذيت ميکنه","سلام حدود دو ماهه خریدمش عالیه ولی...اول اینکه های فای فقط روی بعضی آهنگ ها کار میکنه ولی کیفیت کلی صداش به طور وحشتناکی عالیه هم بلند هم واضح دوم اینکه خیلی بزرگه و تو شلوار اذیتت میکنه البته اگه یکم شلوارت گشاد باشه مشکلی نیس طراحیش قشنگه دوربین که هیچی اصن دهنم کف کرد از اس 7 هم بهتره ولی دوربین دومش یکم تو نور کم بده سلفیش هم خوبه هندزفری هاش متاسفانه معمولیه و خود الجی زده البته کیفیتش خوبه ولی من هندزفری بی اند او میخواسم اثر انگشت خوبه و بعد از اپل به نظر من در رده دوم هس از لحاظ سرعت متاسفانه اگه دستت خشک باشه سریع لیز میخوره ولی با خرید یه قابی چیزی درست میشه خلاصه همه چیش خوبه ولی کاش یه امکاناتی مثل ضربان قلب رو توش میزاشتن از نظر من از تمام گوشی های سال 2016 بهتره",15,0,4,5,5,5,3,5
"دوربين هاي عقب عالي ؛دوربين جلو معمولي رو به خوب
حسگر اثر انگشت عالي و همچنين کيفيت صداي عالي
کيفيت صفحه نمايش بي نظيرو صفحه نمايش دوم فوق العاده
سرعت پردازش عالي و حافظه رم بالا و حافظه داخلي بالا
خوش قيافه و کيفيت ساخت عالي","برآمدگي دوربين (که با کيف يا کاور برطرف ميشه)","سلام.من گوشی قبلیم s5 سامسونگ بود و فروختم وی 20 خریدم.اصلا پشیمون نیستم چون واقعا از هرلحاظ گوشی خوبی هست.از نظر آنتن دهی و شارژ باطری هم که دوستان میگن خوب نیست باید بگم که مثل بقیه گوشیا خوبه و راضی کننده است .از نظر کیفیت صفحه نمایش واقعا عالیه و صفحه نمایش دوم بسیار کاربردی و عالی هستش. کیفیت دوربین هم دوتا دوربین عقب خیلی خوب هستن و به نظر من کیفیت دوربینش از سامسونگ بهتره چون سامسونگ زیادی رنگارو شفاف و میشه گفت اغراق آمیز نشون میده .دوربین دومش هم کیفیت معمولی داره و میشه گفت فقط خوبه همین. از نظر سرعت و پردازش برنامه ها هم میشه گفت در نوع خودش بهترینه واقعا تو این یک ماهی که دارمش اصلا لگ و کندی نداشته و همیشه به بهترین شکل ممکن برنامه هارو اجرا کرده.سنسور اثر انگشت هم که دیگه حرف نداره با کوچکترین اشاره ای عمل میکنه .ازنظر کیفیت ساخت خیلی عالی هست و خوش دست هستش چون من خودم گوشی بزرگ دوست دارم اینو میگم وگرنه ممکنه خیلیا این نظر رو نداشته باشن ؛فقط برآمدگی دوربینش کمی آزاد دهندس که اونم با گرفتن یه کاور یا کیف درست میشه (اینم در نظر داشته باشید که همه برا گوشیشون یه کیف یا کاور میگیرن که درکل مشکل خاصی نیست).در کل تورنج قیمت خودش گزینه بسیار مناسبی هستش و نسبت به اچ تی سی و سونی واقعا با قاطعیت میگم که سرتره اما نسبت به سامسونگ اگه سرتر نباشه کمتر هم نیست. امیدوارم کمکتون کرده باشم با تشکر یاحق",12,0,5,5,5,5,5,5
,,"من هنوز این گوشیو نخریدم و تا چند روز پیش قصد خریدشو داشتم ولی الان یکم دودل شدم. به نظرم اگه یکی دوماه دیگه وایسیم سامسونگ اس 8 بیاد بهتره فک کنم همه کارایی که تو نوت 7 کردو پروندش بسته شد تو اس 8 هم به کار بگیره و اون موقع دیگه وی 20 هیچ ارزشی واسه خرید نداره . شایدم اینطور نباشه",6,12,3,3,3,3,3,3
,,"گوشی خوبیه ولی اگه باتریش 4000 یا بیشتر بود دیگه عالی بود",10,0,3,4,4,4,1,4
"باتري صفحه نمايش شارژ سريع دوربين امکانات جانبي صفحه دوم","واقعا نداره","گوشی بسیاااار عالی ای هستش
خیلی زود شارژ میشه
وضوح تصویرش عالیه
دوربینش معرکس
به نظرم توی رنج قیمتیش از همه پرچمدارهای دیگه بهتره",15,1,3,4,4,4,5,5
"براي وي20 نقات قوت همه چيزايي هستن که در مورد اس7 اج نميگم. شامل باتري و سرعت و رووني و دوربين ها و استحکام و قابليت ساپورت 2 سيم و مموري همزمان بعلاوه باتري قابل تعويض و صداي فوق العادش و ضبط صداي عالي با ميکروفون هاي AOP و همچنين فيلمبرداري و صفحه دوم بسيار کاربردي و ...
براي اس7 اج طراحي زيبا .صفحه بسيار جالب با رنگ مشکي فوق العاده که بنظرم سليقس البته و بستگي داره شارپ بودن وي20 رو دوست داشته باشيد يا بيرون زدگي رنگ هاي اس7 رو. ضد آب بودن بعلاوه فينگرپرينت در جلوي گوشي هست که براي مني که گوشيم هميشه روي ميز يا سطح صاف ديگس فينگرپرينت پشت وي20 خيلي آزار دهندس","براي وي20 سايز بزرگش نسبت به دستاي من. بشدت ليز بودنش و اينکه فينگرپرينت پشت گوشي هست و اينترفيس نه چندان جذاب که پاشنه آشيل الان الجي هست و تمام
براي اس7 اج فقط يه سيمکارت 4جي ساپورت ميکنه. صفحش بشدت اغراق شدس که چشم رو خسته ميکنه و رنگ سفيد مايل به زرد تحويلتون ميده که واقعا توي روز متوجه ميشيد سفيد داريم تا سفيد. براي مثال آيفون 7 هم صفحش به زرد مايل هست اما اون رنگ سفيدي که آيفون 7 توليد ميکنه يه سفيد بسيار دقيق با معياراي سينماييه و به هيچ عنوان منظورم نيست صفحه خوب نيست اما به خوبي اون تعاريفي هم که ازش ميکنن نيست. بسيار گوشي خش پذير و شکننده اي هست. بسيار صداي ضعيفي ميده و برعکس چيزي که ميگن حتي اسپيکر ضعيفي هم داره. باتريش هم با اينکه حجمش از وي20 بيشتره و صفحش کوچيکتره زمان کمتري گوشي رو روشن نگه ميداره. مهمتر از همه و آزار دهنده ترينش اينه که بر خلاف خوشدستي خود گوشي موقع کارکردن با گوشي متوجه ميشيد که تاچ گوشي کار نميکنه و اونم بخاطر اين هست که دست شما با اج تماس پيدا کرده و بايد به طرز عجيب غريبي عادت کنيد چطور نگه داريد گوشي رو. در آخر هم به کيفيت دوربين اشاره ميکنم که با اينکه توي سايت ها اشاره هاي زيادي شده که توي شب بهترين هست و فلان. اما توي تست هاي من واقعا توي شب خيلي ضعيف تر از وي20 عمل کرد و خب خودتون ميتونيد تست کنيد.","سلام. سعی کردم بشدت صادق باشم. در عین حال چیزی که باعث شد از فکر اس7 بیام بیرون این بود که واقعا a5 2016 ای که قبل از این داشتم اگر بهتر از اس7 نبود به هیچ عنوان بدتر نبود. یعنی میخوام بگم گول تبلیغات الکی و ظاهر زیبای اس7 اج رو نخورید حتما تست کنیدش. منو حسابی ناامید کرد. توی بنچمارک و تست های توی شرایط آزمایشگاهی رو ولش کنید توی عمل ببینید که مرد میدون کی هست. همین a5 2016 که میگم هم سریع و روون (نه به این سرعت و روونی اما قیمتش!!!) بود و همین فینگرپرینت روش بود و دوربینش تقریبا همین بود (البته نه دقیقا به این خوبی) و باتریش هم حتی بهتر بود و حتی دو تا سیمکارت 4جی میگرفت و هر دو سیمکارت هم به علاوه مموری کارد توی گوشی جا داشتن.. تعجب میکنم که توی نقد ها همش میگن اس7 گوشی بهتریه و... طبق استفاده ای که من داشتم واقعا جا داره تحسین کنم الجی رو که اگر اینترفیس گوشیهاشو اصلاح کنه واقعا محشره و لذت بردم از اینهمه کیفیت. تاچ وی20 رو تست کنید چون من حتی اگر بگم در کنار آیفون 7 پلاس این بهترین پاسخگویی به لمس رو داره باورتون نمیشه. خودتون تست کنید و لذت ببرید. دوست دارم همه از این گوشی استفاده کنن و لذت ببرن و خب قطعا اگر راهنمایی منم این وسط مفید بوده باشه واسه من افتخاریه. موفق و پیروز باشید.
ناصری",25,6,3,5,5,4,4,4
زياده,"دوربين دوم کمي ضعيفه","احتمالا اگر مثل آیفون و سامی بیخود گرون بود و از مغازه دار گرفته تا ....تبلیغاتش زیاد میبود (چون فروشنده ها از فروختن سامی و آیفون سود بیشتری میکنن) دوستانی که فقط عکسهای این گوشی رو دیدن و از نزدیک ندیدنش ,میفهمیدن چقدر زیباست .مورد دوم صداشه که دوستانم که داشتم چت صوتی میکردم از کیفیت فوق‌العاده و شنیدن صداهای محیط. با جزیات زیادکه فاصله زیادی از من داشتن متعجب شده بودن .برای امتحان صدا با سیم گوشی رو به سینما خانگی وصل کردم و چند آهنگ گوش کردم که اون موقع خودم هم از کیفیت های فای شوکه شدم عالی بود .",28,10,3,3,3,3,3,3
