positivePoints,negativePoints,commentText,like,dislike,"ارزش خرید به نسبت قیمت",نوآوری,"کیفیت ساخت","امکانات و قابلیت ها","سهولت استفاده","طراحی و ظاهر"
"همه چيز بجز دوربين","دوربين ضعيف نسبت به g5","حیف که این گوشی دوربینش از g5 ضعیفتره ضعیف هم نباشه عملکردش خوب نیس ولی همه چیزش عالیه",2,30,2,4,4,4,4,3
,,"من الان 3 ماهه این گوشی رو دارم از لحاظ باتری و دوربین خیلی خوبه سرعتش هم بد نیست ظاهرش هم میپسندم یعنی واسم تکراری نشده سنسور اثر انگشت هم عالی و بی نقص عمل میکنه تنها ایراد به این گوشی آنتن دهی بدش نصبت به باقی هم رده های خودش است بخاطر همین میخوام عوض کنم و اس 8 سامسونگ بگیرم",5,24,2,4,4,3,4,2
"طراحي و خوش ساخت
دوربين
آنتن دهي خوب واي فاي
عملکرد عالي ديتاCAT12","از نظر من فقط باتري","سلام خدمت دوستان
تجربه حدود یک ماه استفاده از گوشی وی 20 چندتا مورد مختصر میگم
گوشی خوش ساخت و دوست داشتنی هست
بابت دوربین میشه گفت رضایت بخشه،فقط دوربین وایدش تو شب و تاریکی نویز داره،دوربین سلفیشم در حد قابل قبوله
در مورد آنتن دهی برای سیم کارت اتفاق افتاده جایی که چندنفر انتن داشتن تو ی محیط ولی من دسترسی به شبکه نداشتم
در خصوص ارتباطات دیتا و وای فای عالی عمل میکنه
تنها موردی که جالب نیست و میشه از نظر من ایراد گرفت باتری گوشی هست که ضعیفه،دوستانی که استفاده زیاد دارن با گوشی من پیشنهاد نمیکنم
ولی ب لطف شارژ سریع میشه گفت میتونید کنار بیایید
اندازه گوشی هم بستگی ب سلیقه فرد داره که بتونه کنار بیاد یا نه
صفحه نمایش دوم تا حدودی کاربردی هست(نسبت ب عزیزانی که میگن خیلی کاربردی)لااقل برای من،ولی بهتر از قابلیت همیشه روشن هست",5,4,4,5,4,5,5,4
,,"نسبت به سامسونگ و سونی هم رده خودش خوب نیست
و زیاد داغ میکنه",7,34,1,3,2,3,3,2
"درمقايسه باg4:اثرانگشت،دوربين16،اندرويد7.","ب راحتي خش افتادن روي قسمت بالاوپايين v20ب دليل آلوينيوم بودن.خوش دست نبودن.","سلام من v20روخریداری کردم واقعاالان پشیمونم چون تقریباباg4برابری می کنه فقط اندرویدوباتریش ازg4بالاتره ک انروید5.1کارموراه مینداخت باتریشم ک ب خاطر ابعادبزرگ v20همون اندازهg4 نگه میداره.",3,24,1,2,5,5,2,5
"حسگر اثر انگشت
سرعت و استحکام بالاي گوشي
زيبايي
رزوليشن بالا و بزرگي صفحه نمايش
ضبط صداي عاليييي","خالي شدن سريع باطري","من بین این گوشی و اپل 7پلاس مونده بودم
ولی چون من عاشق اپلیکیشنم .محدودیت اپل رو نپسندیدم از یه طرف گوشی هم خیلی میندازم زمین استحکام گوشی خیلی مهم بود برام
الان یک ماههv20 نقره ای خریدم کلی برنامه و بازی زدم سرعتش عالیههه اصلا لگ و هنگی نداره.
دوبار از دستم رو اسفالت افتاده اخ نگفته.زیبایش عالیه همه خوششون میاد
من 24 ساعته نتم بازه و فقط بازی میکنم در روز 2 بار الی 3 بار شارژ میکنم
بدون اینترنت و بازی صبح تا شب شارژ دارین
درکل من که خیلییییی راضیم
به عنوان اشانتیوم هم هدست بی سیم الجی کادو داد خود شرکت .کیفیت صدای هدستشم عالیهههه ویبره هم میزنه تازه خخخ
در کل برای خریدنش اصلا شک نکنید
فقط حتما اصل بخرید و موقع خرید کارت گارانتی طلایی بگیرید چون پشتیبانی شرکت الجی عالیهههه.
بابت باطری هم نگران نباشید پاوربانک های همراه دیگه مشکل شارژ رو حل کردن",14,2,5,5,5,5,5,4
"بدنه مقاوم
دوربين 135 درجه
کيفيت بسيار بالاي تصوير برداري در حالت منوال و اتوماتيک
ضبط صداي بسيار قوي
کيفيت خروجي هندزفري بي نظير",ندارد,"نمیدونم به غیر از همه اینهایی که توی وی بیست هست, چه توقعی از یک پرچمدار میشه داشت. بهترین انتخاب موجود هست ببن پرچمدارها. در مورد جی6 هم که دوستان سوال کردن, فقط توی سی پی یو که 821 هست نسبت به وی بیست برتری داره و با توجه با قیمت های موجود , جی 6 در مقابل وی بیست با قابلیت تعویض باتری اصلا ارزش خرید نداره.
ضمن اینکه یکی از دوستان در مورد مقاومت گوشی گفته, واقعا بی نظیره. لبه بالای گوشی من خیلی محکم افتاد روی لبه آهنی که برای چارچوب در اتاق درنظر گرفته شده بود و هیچ اتفاقی برای بدنه نیفتاد. حتما پیشنهاد میکنم.",8,2,5,5,5,5,5,5
"دوربين بسيار عالي
طراحي زيبا در مقايسه با بقيه گوشي هاي هم قميت
باتري قوي
کيفيت صداي عالي
اندرويدي متفاوت","هيچ مشکلي نداره","همه چیش عالیه . اگه یکم تحقیق کنید میفهمید که عالیه . فقط لطفا رنگ مشکیش رو موجود کنید",7,2,5,4,4,3,4,4
,,"این گوشی در مقابل ضربه به صفحه دوربین بسیار حساس بوده و شیشه جلوی دوریبن خیل سریع میشکندو نمایندگی تعمیرات هم پاسخ میدهد که قسمت کامل پشت آن به همراه دوربین ها تعویض شودکه مبلغ آن بالا میشود به خاطر این مشکل از خرید آن جدا خودداری کنید",1,6,3,2,4,3,3,3
"همه چيز به جز باطري","تا حدي باتري.","باتری این گوشی با قابلیت های زیادی که داره باید باتری قویتری براش طراحی میشد. البته شارژ سریع تا حدی این ضعف رو جبران میکنه ولی مستلزم صرف وقت و زمان هست.
از اونجایی که باتری قابل تعویض هست شرکت ال جی میتونه باتری هایی با ظرفیت و توان بیشتر تولید کنه تا اگر کاربری صلاح دونست و نیاز داشت از باتری قوی تر استفاده کنه.",8,1,5,5,5,5,5,5
,,"در این که گوشی های موبایل ال جی واقعا عالی و بی نظیر هستن هیچ شکی نیست ولی نمیدونم چرا خود شرکت الجی داره در حق کشور ما و مشتری های پروپاقرصش کم لطفی میکنه اول از همین مدل وی بیست که نمونه 6 گیگ رم رو فقط به کشور ما نفرستاد بعد هم مدل کا10 که تقریبا همون مدل پارسالی رو در حقیقت فرستاده و مدل اثر انگشت دار رو برای بازار ایران نفرستاده و از همه مهمتر اینکه مدل جی 6 خیلی وقته وارد بازار شده ولی هنوز به صورت رسمی و با گارانتی به نمایندگیهای خودش توی ایران نداده.من اصلا نمی خوام مقایسه کنم ولی شرکت سامسونگ همزمان با عرضه جهانی اس8 رو در ایران هم عرضه و حتی با چند قلم هدیه ااز طریق دی جی خودمون پیش فروش کرد و گفت شرکت ها هم ماله یه کشورت و اگه مشکل تحریم یا هر چیز دیگه ای بود سامسونگ هم نمیتوانست گوشی اس 8 رو همزمان با عرضه جهانی وارد بازار ایران کنه.دوستان اینهمه در مورد شرکت اپل به خاطر عدم توجه به بازار ایران ناراحت و خریدن آیفون رو تحریم کردن در صورتی که اپل یک شرکت آمریکایی و باید از قانون کشورش پیروی کنه ولی ال جی چی حتی جدیدترین شاهکارش هم اینه که گوشی های موبایل ال جی به صورت منوی فارسی رو هم ندارن.پس بیان واقعا این شرکت رو تحریم کنیم و میدونم دی جی نظرم رو نمی زاره و اگه هم زاره کلی دیس لاکی میخوره ولی من واقعیت رو گفتم.ببخشید خیلی طولانی شد.",10,9,3,3,3,3,3,3
,,"سلام دوستان من بین v 20و g6 موندم کدومو بگیرم از همه لحاظ جفتشونو قبول دارم ولی از لحاظ دوربین موندم کدومو بگیرم.کیفیت عکس در شب برام مهمه",6,11,3,3,3,3,3,3
"خاص و متفاوت از همه لحاظ","نقطه ضعف نديدم","گوشیهای شرکتهای دیگه مشابه به هم هستند اما الجی با اندروید 7 متفاوت بوده و به روز بودن و آدم نسبت به اندرویدهای دیگه احساس میکنه ... فکر نکنم کسی از خریدش پشیمان بشه یا بتونه دلیل خیلی قانع کننده ای بیاره نسبت ضعیف بودنش",23,6,4,5,5,5,4,5
,,"از دستم افتاد روی فرش و قابش جدا شد و باطریش افتاد بیرون و جلد پشتشم در اومد!!! استاندارد نظامی!!! البته بعدش که سرهمش کردم سالم بود و آب از آب تکون نخورده بود ولی اگه تو خیابونم از دستم می افتاد نمیدونم همینطور میشد یا... !!",19,35,5,4,5,5,4,5
"زود ميشه باهاش ارتباط برقرار کرد
دوربينش حرف نداره","جک مربوط به شارژ متفاوته","تقریبا 1 هفته است خریدم راضیم و نگهش میدارم",16,4,4,3,4,5,4,4
"خوش دست
پردازنده قدرتمنـــد
ميکرو اس دي تا دو ترا
ضبط صدا عالـي
دوربين دوتايي.دو تا نمايشگر","نگرد که پيدا نمي کني","عالی اگه می گیرید زود بگیرید تموم نشه.",19,3,5,5,5,5,5,5
"ندارد مثل بقيه گوشي ها","باتري . صفحه نمايش .","اگه کسی از پرچم دارای سامسونگ استفاده کنه محاله بتونه بیشتر از دو ماه این گوشی رو نگه داره .",24,75,2,2,4,3,2,2
,,"سلام من گوشی رو دوماهه که دارم واقعا عالیه برای اون دوستمون که گفتن گوشی رو دوباره در روز شارژ میکنن و هیچ کاری هم انجام نمی دن شما شک نکن که باتری گوشی خرابه من از صبح که شارژ می کنم تا آخر شب درسته دوبار شارژ می کنم ولی کامل دارم بازی می کنم ویک ثانیه هم از دستم جدا نمی شه گوشی که بنظرم باتری نسبت به صفحه گوشی خیلی خوبه برای هنگ زمان فیلم برداری هم شما وقتی زوم می کنیدواز حالت معمولی به واید یا برعکس می رید یک پرش داره که طبیعیه و اصلا هنگ حساب نمی شه نمی دونم چطور بعضی ها کاملا متعصبانه نسبت به یک برند نظر می دن بعد ادعای بی طرفی هم دارن",23,3,5,5,5,5,4,5
,,"عالیه فوقالعاده دوربیناشو با بهترین دوربینای دنیا هم میشه مقایسه کرد اصلا فعلا بهترین گوشی الجیه",16,4,3,3,3,3,3,3
"از هر نظر عالي","باطري به نسبت ضعيف","گوشی الجی v20 گوشی عالیه ولی از نظر باطری کمی ضعیفه .اونم بخاطر مصرف زیادمونه که خداروشکر هم میشه از شارژ سریع استفاده کرد .اگر هم نمیتونین از پاور بانک استفاده کنین .",19,0,4,4,4,5,5,5
"همه چي عالي",هيچي,"عالیههههه عالی شک نکنید اصلا بخرید بهترین گوشیه",13,2,4,4,4,4,4,4
"نوآوري و امکانات چشم گير","صفحه نمايش هنوزم LCD !
هميشه ال جي تو باتري مشکل داشته ولي مورد خاصي نيست","من خودم حدود دو سال گوشی ال جی داشتم ، خیلی هم ازش راضی بودم ، اما تنها چیز ، یا بهتره بگم مهمترین عیبی که گوشی های ال جی دارن اینه که هاردهاشون و قطعات به برد چسبیده شده و قابل تعویض نیست
به فرض مثال اگر هارد این گوشی بسوزه باید کل برد رو عوض کنید که هزینش برابر با کل خود گوشیه .
این اتقاق برای من افتاده البته توی گوشی g4 lg که خیلی شیک و مجلسی انداختمش دور چون دیگه ارزش تعمیر نداشت
در کل اگر ال جی این موردشو بتونه برطرف کنه گوشی محبوب و حتی از سامسونگ هم بهتر میشه
و از خریداران و طرفداران محصولات ال جی خواهش میکنم به این موارد خیلی دقت کنن ، مرسی",7,11,3,4,5,5,5,5
"بدنه
صفحه نمايش
سخت افزار
رابط کاربري",,"من این گوشی 2 هفته است که خریدم
از هر نظر که بگید چه کیفیت صفحه چه کیفیت بدنه
صدای عالی و سهولت رابط کاربری
از همه مهمتر باطری عالیشه که تقریبا 1 روز کامل با انواع اقسام کارها جواب میده",14,0,5,5,5,5,5,5
"پردازنده قدرتمند Snapdragon 820
قابليت ارتباطي LTE Cat. 12
جنس بدنه از آلومينيوم
قاليت پخش HiFi","عدم قابليت ضد رطوبت
دوربين هاي ميان رده","سلام
اواخر اسفند ماه در جشنواره فروش ویژه ال جی به همراه هدست بی سیم و سیم کارت USIM همراه اول و بسته اینترنت نوترینو و همچنین کارت گارانتی دو ساله خریداری کردم.سرعت گوشی خوب و پردازنده قوی داره.تکنولوژی ارتباطی جدید cat 12 توی جاهایی که حتی آنتن دهی ضعیف هست ارتباط خودشو با باند LTE حفظ میکنه و همیشه سرعت خوبی رو تجربه میکنید در حالت ایده آل سرعت 40Mbp رو تجربه کردم که رقیب بسیار خوبی در حوزه سرعت و سهولت در دسترسی برای اینترنت های خانگی به حساب میاد.پس از G5 که از پروژه نا موفق 2016 ال جی میشه نام برد این شرکت V20 رو روانه بازار کرد تا در اواخر سال میلادی خودش رو در کورس رقابت نگهداره ولی به دلیل فاصله کم با شروع سال میلادی 2017 و رونمایی گوشی های جدید دیگر برند ها ال جی درصدد ترغیب مشتریان به خرید با اجرای طرح های مختلف کرد.شاید به همین علت بر روی قابلیت ضد رطوبت و کیفیت دور بین ها مانور زیادی نداده تا این موارد در بهبوهه سال نو میلادی تاثیر خود را از دست نداده و به عنوان برگ برنده در محصولات بعدی استفاده کند.",13,7,4,4,4,4,3,4
"صفحه بزرگ و با کيفيت صفحه نمايش دوم","ليز بودن و نداشتن چراغ نتفيکشن","گوشی خوبیه من راضیم سریع شارژ میشه کیفیت پخش هنزفری عالی و واقعا صفحه نمایش دوم خیلی به کار میاد وسط فیلم یا بازی اگه زنگ بخوره یا داستانی باشه صفحه نمایش دوم نشون میده و مزاحم کار نمیشه در کل تو خریدش شک نکنید کیفیت ساختش هم عالیه خوب مهندسی شده",13,4,3,3,3,3,3,3
"صفحه نمايش با کيفيت
خوش ساخت
باکيفيت
صفحه نمايش دوم",,"گوشی واقعا با کیفیتی هست. دوربینش زاوبه دید وسیعی داره که خیلی کاربردی. کیفیت میکروفنشم هنگام فیلم برداری واقعا عالی هست. صفحه نمایش دومش هم کاملا کاربردیه. کلا میشه گفت بی نقصه",17,1,5,5,5,5,5,5
"دوربين هم سلفي هم دوربين اصلي مخصوصا سلفي
تاچ صفحه
صفحه نمايش دوم
باتري
ٖآنتن دهي اينترنت","من تا الان که نقطه ضعفي نديدم خداروشکر","من همیشه عادت دارم که ساعت رو از گوشیم ببینم و این گوشی محشره چون همیشه ساعت و روز رو نشون میده بدون اینکه بخواید دکمه ای فشار بدید
نسبت به صفحه نمایش بزرگی که داره به نظرم باتریش خوبه - یه روز کامل باتری رو نگه میداره با استفاده از دیتا و گوش دادن موسیقی هر جا که قبلا آنتن نداشتم الان دارم مخصوصا تو مترو خط 5 تهران",17,1,3,5,5,5,5,5
"کيفيت صفحه نمايش+اندرويد7
دوربين وايد با کارايي بالا+دو سيم کارت
صفحه نمايش دوم+ ساپورت مموري تا 2 ترا
باتري قابل تعويض+ بدنه قوي
حافظه 64 با سرعت بالا+رم4 ddr4","سلفي نسسسسبتا متوسط(راضي کننده)
باتري نسسسسبتا متوسط(راضي کننده)
بلندي صداي متوسط
امکان خش گرفتن لنز دوربين(با بک کاور حل مي شه)","قبلا نوت 3 و 4 و ال جی جی 4 داشتم.

خلاصه بگم ال جی نسبت به سامسونگ رضایت بیشتری دارم.(باهاش راحت ترم)
از وقتی ال جی گرفتم دیگه گوشیه دیگه رو دست نگرفتم!
هر چی خواستم برم سراغ برند های دیگه نتونستم از ال جی بگذرم!
(اونم از وی 20)

*ال جی داشتم،دارم و خواهم داشت!*

پیروز و سربلند باشید",21,8,4,5,5,5,5,5
,,"به قیمتش می ارزه",10,4,5,5,5,5,5,5
"همه چيز",نداره,"من بعد چندماه تحقیق خریدمش
ب نظرم عااالیه
البته گوشیه بزرگ سلیقه ایه
ولی درکل خوش دسته",23,1,5,4,5,4,4,4
"دوربين فوق العاده
سرعت عالي
کيفيت ساخت عالي
امکانات جديد صفحه دوم",ندارد,"گوشی به لحاظ ظاهری و امکانات عالیه، سرعت خودش، برداشت عکسش، سنسور اثر انگشت و... عالیه. کیفیت دوربین چه برای عکس و‌چه برای فیلم عالیه، صفحه نمایش دوم فوق العاده کاربردیه، شارژدهی کاملا مناسب، یعنی با کار سنگین، حتما یکروز رو باتری نگه میداره و‌ جالب که باتری قابل تعویض داره. کیفیت ضبط صدا فوق العاده قوی و‌حرفه ای به نظرم گوشی تمام عیار و‌بی نقصیه",21,0,5,5,5,5,5,4
"دوربين وايد
صفحه نمايش دوم با کارايي بسيار زياد
کيفيت ساخت خوب (ساخت کره)
سنسور اثر انگشت سريع
اينفرارد با قابليت کپي کردن ريموت",نديدم,"گوشی خوب با امکانات خاص.
ضبط حرفه ای صدا، پخش صدای hifi ، دوربین باقابلیت های دستی فراوان و حرفه ای و...",21,0,4,5,5,5,5,5
,,"فقط دک و امپ این گوشی به تنهایی قیمتشو توجیح میکنه . چرا تو نقد و بررسی ارزش پایینی بهش دادن نمیدونم .
در کل جدا از تمام قابلیت های عالیش بهترین گوشی ممکن برای افراد اودیوفایله . پلیر های هم رده این گوشی از خود این گوشی بسیار گرون ترند .
این گوشی خیلی شیک و مجلسی هدفون های تا 300 اهم رو درایو میکنه .",9,1,5,5,5,5,5,5
"صفحه نمايش
دوربين عريض دوتايي
کيفيت ساخت
پردازنده و دوربين",,"با سلام وخسته نباشید بنده این گوشیو یک ماه میشه تهیه کردم خیلی عالیه و خریدشو پیشنهاد میکنم شارژ خیلی پرسرعت پردازنده عالی کیفیت ساخت بسیار بالا
فقط نمیدنم کیفیت عکاسیش از الجی جی4 کمتر شده چرا ولی تو عکاسی رقیبی نداره با این همه تو خریدش شک نکنید",5,3,5,5,5,5,5,5
"آنتن دهي قوي","باتري خيلي ضعيف
اندازه خيلي بزرگ
دوربين عقب خيلي بد","دوستان اول از همه از دیجیکالا تشکر میکنم من این گوشی رو 3 روز پیش از دیجیکالا خریدم هیچ تعصبی هم به هیچ برندی ندارم ولی باید بگم طی این سه روز من این گوشی رو 7 بار شارژ کردم یعنی بطور متوسط روزی دو بار هیج گونه بازی هم روش نصب نکرده بودم فقط تلگرام و اینستاگرام و استفاده در حد کاملا معمولی باتریش واقعا کلافم کرد نکته دوم اینکه زمان فیلمبرداری وقتی که زوم میکردم تصویر یه لحظه هنگ میکرد اولش فکر کردم شاید تویه فرمت خروجی تاثیری نزاره و این هنگ کردن فقط تویه گوشی اتفاق میوفته ولی وقتی که فایل ویدیویی رو با کامپیوتر نگاه کردم دیدم تویه تصویر خروجی هم همین مشکل بوده که کلا دلچرکین شدم از گوشی و یه نکتیه دیگه ایی هم که داشت اندازیه بیش از حد بزرگش بود که اصلا تو جیب جا نمیگیره در ضمن سلفیش هم نامید کنندس خلاصه بعد از سه روز استفاده با ضرر فروختمش و به نظر من این گوشی کلا ارزش خرید نداره با تشکر",17,53,3,3,3,3,3,3
