positivePoints,negativePoints,commentText,like,dislike,"ارزش خرید به نسبت قیمت",نوآوری,"کیفیت ساخت","امکانات و قابلیت ها","سهولت استفاده","طراحی و ظاهر"
,,"همه چی در این گوشی فوق العاده است ولی به نظرم طراحی گوشی میتونست خیلی خیلی بهتر باشه .
همچنین بهتر بود که از بدنه فلز و شیشه استفاده میکردند تا این بدنه فلزی",2,2,5,5,5,5,1,3
,,"از همین برند دوتا گوشی رده پایین تر ارزون برای آشنایان گرفتم که عالی بودن و و رضایت رو جلب کردن ! اسمارت شرکت خوبیه که امکانات خوبی در قیاس با هزینه ای که میکنی در اختیارت میذاره واقعا خوبه ! رم 4 و حافظه 32 با دوربین 16 و باتری 3 هزار برای این رنج یه استثناست",2,1,3,3,3,3,3,3
,,"باید افتخار کنیم که کشورمون موبایل های با کیفیت تولید میکنه و وظیفه ما اعتماد به اسمارت و جی ال ایکسه ... و با خرید این محصولات کمک میکنیم به پیشرفت بیشتر انها",2,1,5,5,5,5,5,5
"همه چي ...قيمت مفت",ندارد,"عالی....بخرید....مفته....امکاناتش عالیه",3,0,3,4,4,4,5,5
"زيبا ...امکانات خوب قيمت مناسب","پيکسل صفحه...","اسمارت گوشی خوبیه....گوشی رم 4 با این قیمت عالیه.....",4,1,3,4,4,4,5,5
"همه چي",نداره,"اسمارت با این گوشهای با کیفیت بزودی جای هواوی رو میگیره چون خودم دارم میگم هم کیفیت هم مشخصات خوب واز هم مهم تر قیمت عالی من سامسونک j7 داشتم فروختم واسمارت خریدم واقعا از اسمارت راضی هستم به شما هم پیشنهاد میکنم سامسونک فقط پول برند مگیره وزیاد هنگ میکنه حالا تصمیم با خودتونه",14,0,3,5,5,5,3,5
"سنسور اثر انگشت ،سرعت بالا و...","دوربين ي مقدار ضعيفه ولي بازم نصبت به قيمتش ضعف حساب نميشه","گوشی عالی با صرفه و با کارایی بالا نصبت به قیمت گوشی",9,1,5,4,5,3,3,3
