positive_points,negative_points,text,like,dislike,"ارزش خرید به نسبت قیمت",نوآوری,"کیفیت ساخت","امکانات و قابلیت ها","سهولت استفاده","طراحی و ظاهر"
"حسگر انگشت
خوش دست
دوربين عالي
رم بالا
2 سيم - 4جي","باطري خيلي زود خالي ميشه","این گوشی خوش دست و سبک و کلی امکانات خفن داره خوبیاش نیاز به تعریف نداره خیلی خوشم اومد اما باطری زود خالی میشه یه جوری که وقتی چندتا کار میکنی قشنگ کم شدن درصد شارژ رو میبینی و حس بدی میده همش استرس داری شارژ تموم شه و اینا خونده بودم زود خالی میشه اما حس میکنم گوشی که من خریدم خیلی زود خالی میکنه نصف روز باش کار نکردم نصف روز بهش ور رفتم و اینترنت و... شب زدمش شارژ! در ضمن من از دیجی خریدم و ضمانت نامش از اردیبهشت بوده و تا اردیبهشت سال دیگه یعنی 18 ماه نمیشه",0,0,3,4,4,4,5,5
"سرعت بالا
تاچ قوي
هيچگونه کندي عملکرد يا هنگ","کيفيت عکس","حدود هشت ماه هست که گرفتم از همه لحاظ ازش راضیم اینم بگم که من خیلی به کیفیت عملکرد گوشی حساس هستم مطمئن باشید هیچ نقصی نداره تنها ایرادی که میشه ازش گرفت اینه که کیفیت عکسش عالی نیست(در مقایسه با دوربین گوشیهای آیفون )بدنه بسیار خوب و محکمی داره با وجود اینکه دو سه بار از دستم افتاده روی آسفالت هیچ خط و خشی روش نیوفتاده ضمنا اندرویدش هم به ورژن 6 با اتصال به سرور خود هوآوی ارتقا پیدا کرد هیچ مشکلی هم برای گوشی پیش نیومده همچنان با سرعت اجرایی بالا کار میکنه .
موفق باشید.",3,0,5,5,5,5,5,5
,,"با همین پول می توانید گوشی Huawei p9 lite بخرید که از نظر سخت افزاری خیلی بهتر از این گوشی است",0,8,3,3,3,3,3,3
"دوربين
طراحي","دير شارژ شدن","حدود 5 الی 6 ماه هست که دارمش همه بلایی هم سرش اوردم کارای سنگین منظورمه به خوبی جواب داده تا حالا تو اجرای بازی ای هم اذیتم نکرده هنگ و...نداره اپدیت اندروید 6هم براش اومده که با بروز کردن سیستم عامل مصرف باتری کمتر میشه و سرعت شارژ افزایش پیدا میکنه البته کمه ولی باز خوب شده.
درکل پیشنهاد میکنم بخرید اگه دوسش دارید.",3,0,5,5,5,5,5,5
,,"من تجربه کار با این گوشی رو دارم.و از روزی که به آندروید 6 آپدیت شد خیلی سریعتر و ظاهری شیک پیدا کرده",4,0,3,4,5,5,5,4
"همه چيز",هيچ,"الان چند ماهه خریدم. هیچ مشکلی نداشته.
خیلی عالیه.",3,1,5,5,5,5,5,5
"از تمام هم رده هاش بهتره","حرف ندارع","سلام
من قصد خرید این گوشی رو دارم
تمامی گوشی های در این سطح رو با این گوشی مقایسه کردم
این گوشی یه گوشی فوق العادس
تمامی سایت ها رو مشاهده کردم و کلی نظرات رو خوندم
یه درخواستی از کسایی که این گوشی رو خریدن دارم
لطفا بیشتر امکانات این گوشی را که در سایت ها و .. نوشته نشده رو بگین
نوع قفل ها . کیفیت . ارزش خرید و...
متشکرم از همه",6,1,5,5,5,5,5,5
"حسگر اثر انگشت رم","باتريش يه زود خالي ميشه و دير فول ميشه","من بعد از کلی بررسی تو اینترنت و خوندن نظرات بلاخره به این گوشی رسیدم بعد از چند روز استفاده تنها نقطه ضعفش به نظرم باتریشه که در مقابل نقاط قوتش زیاد به چشم نمیاد شبا قبل خواب شارژش میکنم و روز ازش لذت میبرم البته وایفای مدام روشنه و ازش کار میکشم
روی هم رفته از خریدم راضیم گزینه دومم سامسونگ a5بود ولی رم و چراغ نوتیفبکیشن این نظرمو جلب کرد ضمن اینکه گوشی قبلیم هواوی بود و تجربه خوبی ازش داشتم اخ نگفت تو این سه سال اخرشم دزدیدنش والا فعلا کار میکرد
خلاصه اگه باتری براتون مسءله نیس انتخاب خوبیه",6,1,5,4,5,4,3,4
"سلام ظاهر شيک حسگر اثر انگشت",,"باطری بیشتر 2000 میلی امپر میخوره خانمم ساسونگ j7 داره یکسالم هست باطریش خیلی بهتر شارژ نگه میداره نسبت به این که ی هفته خریدم اگرم بخوای همزمان چند برنامه رو نصب کنی بازم کم میاره ولی j7 بارم 1/5 خیلی بهتر عمل میکنه",1,17,3,3,3,3,3,3
"اندرويد بالا
حافظه داخلي 32گيگ
دوربين بالا
سي پي يو قوي","باتري ضعيف
ال سي دي بودن صفحه","گوشی خوبیه فقط صفحش ای سی دی هستش که از گوشه نگا کنی صفحه تاریک میشه",0,13,5,4,5,3,3,4
"رم3
حافظه24GB در دسترس
حسگر اثر انگشت
باتري قوي
دوربين خيلي خوبي داره","خميدگي داره که گلس روش نميخوره درست
يکم دير شارج ميشه
ديگ نداره دنبالش نگرد","با سلام و خسته نباشید امیدوارم بتونم با دادن نظر خودم کمکتون بکنم بنده یک سوال میکنم ایا گوشی تو این رنج قیمت که حسگر اثرانگشت-رم3-حافظه32-باتری قوی-دوربین خوب داشته باشه پیدا میشه؟اگر تونستین پیدا کنین به منم اطاع بدین بنده خودم همه گوشی هارو چک کردم تا این گوشی رو پیدا کردم و گرفتمش من که از خریدم پشیمون نیستم لطفا گول کسانی که با دادن رای منفی به این گوشی که سرفا برای گمراه کردن مردم این کار رو میکنن رو نخورین امیدوارم تونسته باشم کمکتون کنم
قضاوت با شماست.",14,0,3,5,5,5,3,5
"رم 3
اندرويد6
داشتن 24جيب حافظه ازاد
باتري قوي
دوربين عالي","من که هرچي دنبالش گشتم ضعفي نديدم
فقط گوشي داراي کمي خميدگي است که گلس روش نميفته","با سلام و خسته نباشید خدمت دوستان گلم
لطفا در خریدش شک نکنید من تضمین میکنم که پشیمان نخواهید شد
مطمعن باشین که گوشی دارای رم3و حافظه32و دارای حسگر اثر انگشت و...توی این رنج قیمت پیدا نمیکنی پس بیخود دنبالش نگردین
دوربین این گوشی منحصر به فرده مخصوصا دوربین سلفی اش ولی در شب یکم دوربین کیفیتش میاد پایین حسگر اثر انگشتش رو که خیلی سریع عمل میکنه و خیلی خوبه باتری این گوشی اگر مصرفتان خیلی خیلی زیاد باشد راحت یک رو رو جواب میده گوشی دارای 3 گیگ رمه که دیگر جایی واسه لق و هنگ باقی نمیزاره من که تاحالا لق یا هگی ندیدم از همه مهمتر حافظه گوشی که 32جیب اه و 24جیب اون خالیه که دیگر ناراحتی برای کم بود حافظه نخواهید داشت و امکانات خود گوشی خیلی زیاده
بنده اگر میخواستم چنین گوشی با داری این همه امکانات منحصر به فرد از برند دیگر میخریدم بدون شک باید حدود1ملیون. و نیم پول میدادم",8,0,3,5,5,5,3,5
"رم 3 حافظه 24گيگ قابل دسترس انتن دهي عالي و...","مادون قرمز ندارد","من حدودا 5ماه این گوشی رو دارم خیلی زیباس خیلی خوش دسته اصلا هنگ کردن رو با این گوشی فراموش کردم حافظه داخلی 24گیگ قابل دسترس و 3گیگ رام راحت بازی ها و برنامه ها رو اجرا میکنم تو اندروید 6رونتر شده قیمت خیلی عالیه حسگر انگشت قابلیت لمس با دستکش وصل شدن اینترنت گوشی ب کامپیوتر از طریق کابل یو اس بی و...انتن دهی خیلی عالیه فقط هم با 4جی کار کردم باتری آخ نگفته خیلی راضیم بنظرم گوشی ک از جی هشت بهتر باشه باید رام 4و حافظه 64گیگ داشته باشه تشکر",8,1,5,5,5,5,3,5
"قابليت هاي نرم افزاري و سخت افزاري خوب
ارزش خريد به نسبت کيفيت ساخت
قابل رقابت با مدل هاي بالاتر
زيبايي و جذابيت فوق العاده","داغ کردن گوشي در زمان کار زياد
سريع شارژ از دست دادن","تازه این گوشی رو خریداری کردم و گوشی بسیار زیبا و جذابی هست، قابلیت های سخت افزاری خوبی داره مثل دوربین با کیفیتش و . . . .

به کسانی که در این سطح قیمتی میخواهند گوشی بخرند، خرید این گوشی رو توصیه می کنم.",6,3,4,5,3,4,5,5
"[""حسگر اثر انگشت""]","[""داغ کردن باتري و کم بودن نور آن در زير نور خورشيد""]","در کل j7مدل 2016 بهتر از ینه",3,40,5,5,2,5,5,4
"رزولوشن مناسب و نه تبليغاتي
دوربين با کيفيت به همراه لرزشگير اپتيکال
پردازنده و رم مناسب به عنوان يک ميان رده
حافظه جانبي کافي براي خيلي از کاربرها","لبه‌هاي تيز و آزار دهنده
شارژر سه شاخ؟؟؟!!!","در نگاه اول خوش ظاهر و مقرون به صرفه هست. رابط کاربری خوبی داره و من از نبود دکمه منو واقعا راضی هستم. خیلی تلاش کرده شبه به iOS در بیاد اما تفاوت‌هایی تو عملکردهاش دیده میشه و خیلی نمیشه به پاسخ سنسورها و خطاهای لمسش خرده گرفت. حاشیه کم نمایشگر خیلی وقتا سبب کلیک اشتباهی میشه اما همین حاشیه کم خوش ظاهرش کرده. سنسور اثر انگشت برای خیلی‌ها خوب کار میکنه اما در صورتی که رطوبت دستتون زیاد باشه خیلی وقتا نمیتونه انگشتتون رو تشخیص بده. زیر نور خورشید نمی‌تونید عکس و فیلم با جزئیاتش ببینید از همه بدتر تاخیر در افزایش یا کاهش نور صفحه در حالت اتومات با نور محیطه که سبب میشه برای چند لحظه در زیر نور خورشید واقعا مایوس بشید.
باز ی روش نصب نکردم اما در انجام فرامین روونه ولی اکیدن توصیه میکنم آپدیت نکنید یکسری لگ در صفحه بستن اپلیکشن‌ها ظاهر میشه. دوربینش تمام انتظارات شما رو به عنوان یک کاربر معمولی بر آورده میکنه و از تار شدن عکس به علت لرز‌ش‌های جزئی جلوگیری میکنه. تو تاریکی در محیط بسته و یا فواصل نزدیک به علت فلش دوتایی عکس‌های خوبی میگیره. اما برای عکاسی از منظره در شب روش حساب نکنید.
کیفیت بلندگوی مونوش خوب نیس و فقط در حد رفع نیاز هست.
بدترین و بزرگترین ایراد در طی بیش از چهار ماه استفاده لبه‌های تیز و خوش دست نبودنشه که شما رو مجبور به استفاده از قاب میکنه. فلز آلومینیوم پشتش واقعا سره و وقتی روی سطح قرارش میدید ترس از خش برداشتن لنز دوربینش هست چون حتما رو سطح کشیده میشه.
کیفیت آلومینیوم بدنش خیلی خوب نیس و در برخورد با زمین از ارتفاع نیم متری لبه پایینش غر شد، البته این مشکل کوچیک هست اما اگه لبه‌های خمیده‌ای مثل آیفون میداشت اینطور نمی‌شود.
شارژر با آمپر خروجی پایین و ظرفیت بالای باطری، زمان شارژو حدودا سه ساعت میکنه اما حد اقل یه روز کامل براتون کار میکنه، من که با باطریش مشکلی نداشتم. اما واقع شارژر سه شاخی که روشه اعصاب آدمه خرد میکنه. من قبلا هم هواوی دیدم دو شاخ بوده.
به عنوان جمع بندی گوشی خوبیه و نسبت به قیمتش امکانات شایسته‌ای رو در اختیار شما قرار میده، من یک رنگ دیگشم برای یک نفر دیگه گرفتم و به خریدش تو این رنج قیمت توصیه می‌کنم.",7,17,5,4,4,4,5,3
"[""دوربين بالا صفحه نمايش بالا قابليت هاي عالي و باتري قوي و .....""]","[""اصلا نداره""]","بهترین گوشی تو این قیمت",17,2,5,5,5,5,5,5
[],[],"واقعا میشه گفت تو این قیمت، بهترین و کاملترین اسمارتفون هس. غولیه برا خودش تو خریدش لحظه ای شک نکنید",23,2,5,5,5,5,5,5
"همه چيز",نداره,"سلام ب همه دوستان چند ماهی میشه این گوشیو دارم قبلش پی 8 داشتم از جفتش خیلی راضیم ولی این بیشتر ب کارم میاد و ب نظرم ارزش خرید بیشتر ی داره نسبت ب پی 8
در ضمن دیروز اپدیت کردم ب اندروید 6.0.1
سرعت گوشی ده برابر زیاد شده خیلی روون تر از قبل شده و کلی امکانات جدید اضافه شده ب همهتون پیشنهاد میکنم اپدیت کنید انگار ی گوشی جدید خریدین ی تم هم اضافه میشه مال هواوی پی9 هستش و خیلی خوشگل و روون عمل میکنه در کل ای گوشی با اندروید 6 عالیه عالی",15,2,5,5,5,5,5,5
"اولينش نگه داشنم دوروز شارژه
دوم طراحي بسيار خاص و شيک
سوم صداي بلند اسپيکر خروجي باکيفيت
چهارم دارا بودن رم 3 و حافظه داخلي 32
پنجم صفحه نمايش باکيفيت بسيارعالي","استفاده سيمکارت دوم يا مموري
مي تونست کمي سبک تر باشه
لنز دوربين برجسته تر از بدنه است
کمي باريک تر مي تونست طراحي بشه
در کل خيلي سخته عيب ازش بگيري","من گوشی های مختلفی داشتم
از نوت 4 گرفته تا سونی c5 ultra ، سامسونگ a5 2015 ، سامسونگ مگا 6.3 تا هونور 6 هواوی و خیلی گوشیهای دیگه
به شخصه از طراحی هواوی خیلی لذت می برم
گوشی قبلیم سونی c5 ultra بود که اون هم گوشی خوبی زیر یک تومن محسوب میشه مخصوصا بخاطر صفحه نمایش 6 اینچی
اما واقعا برای استفاده روزمره ، وب گردی و دیگر کارها یه گوشی نهایتا 5.5 اینچ کافیه
از گوشی سونی هم راضی بودم اما تو تست هایی که انجام دادم آنتن دهی هواوی جی8 رو بهتر دیدم
طراحی هواوی یه سر و گردن بالاتر از سونی هستش
واقعا نامبر 1 هستش تو طراحی این جی8 مخصوصا رنگ طلایی
کیفیت هر دو دوربین عالی ، فلش گوشی بسیار پرقدرت
در کل بگم ، خوشحالم از معاوضه ی سونی c5 ultra با هواوی جی 8
ازنظر من مهم ترین مسئله قابل تامل توی این گوشی دارا بودن رم 3 هست که کمتر گوشی ای پیدا میشه زیر یک تومن با این ظرفیت رم
هشت هسته ای هم که هست پس اصلا نگران هنگی یا کم آوردن گوشی نکنین
بزرگ ترین مزیت این گوشی طراحی زیباشه .
یاعلی",15,0,4,4,4,4,5,4
[],[],"صفحه نمایش برآمده اون اذیت میکنه
حاشیه زیادی هم داره",7,7,3,3,3,3,3,3
,,"به نظر من 5x از این بهتره فقط رمش 2",6,36,2,4,4,4,2,3
,,"اپدیت کنید.نسخه مصر کاملا سازگاره.بیلد من 160
خیلی خوب میشه.بعداز اپدیت مربع رو که نگه داری صفحه دو قسمت میشه و میتونی دوتا برنامه رو همزمان باهاش کارکنی.مث پی سی.محشره شاد باشید",12,1,5,5,5,5,5,4
,,"سلام
این گوشی از نظر انتن دهی فوق العاده است طوریکه توی منزل با گوشی قبلیم انتن 3g نداشتم اما با این گوشی 3g شد. بقیه مزایا هم دوستان گفتند.",7,1,5,4,3,4,4,3
"[""زيبايي..امکانات مناسب در برابر قيمت""]","[""تا حدودي وزن بالا....محل قرار گيري سنسور اثر انگشت...اسپيکر معمولي...""]","یک ماهی هست خریدم درکل پیشنهاد میکنم گوشیرو تو این رنج قیمت ....وقتی گوشی رو میز یا هر سطحی باشه چون سنسور پشتش قرار داره باید برش دارین تا بازش کنیدیا رمز بدین بجای اثر انگشت....من ندیدم داغ کنه مگه وقتی تو شارزه و کار سنگین ازش بکشین که در حد طبیعیه...اون مشکل ننشستن گلس هم که وجود داره و دوستان هم گفتن",5,3,4,4,4,3,4,3
[],[],"اپدیت کنید دوستان.هیچ مشکلی پیدا نمیکنه.رابط کاربریش خوشگل تر میشه و به دوربین هم تنظیمات عکاسی حرفه ای اضافه میشه
خلاصه تجربه جالبیه.البته بگم که رام مصر رو دانلود کنید و نصب کنید. بیلدش با از من که 160 بود یکسان نبود ولی مشکلی نداره و عالیه
موفق باشید",5,0,5,5,5,5,5,4
"[""همه چيزش عاليست""]","[""باتري مي توانست بهتر باشد""]","من الان یک ماهه که هوآوری G8 را خریدم و الان هم با همان دارم نظر می دهم من به اندروید شش هم آپدیتش کرده ام نمی خواهم تعریف کنم ولی تو این رنج قیمت فوق العاده عالی است از هر نظر صفحه نمایشگر،سی پی یو،صدا و ... من همه جور گوشی ای را تجربه کردم ولی این گوشی حس یک گوشی گران قیمت را می دهد و واقعا زیباست حتما بخرید شک نکنید پیشنهاد می کنمش",5,0,5,5,5,5,5,5
[],[],"سلام لطفا کیف و کاور و گلس این گوشی موجود کنید",3,0,5,5,5,5,5,5
