"[""کيفيت صفحه عالي \n3دي تاچ\nسيستم عمل ios \nدوربين عالي \nباتري بهينه\nساپورت نرم افزاري\nدوربين عالي \nارزش خريد بالا نسبت به کيفيت محصول ""]","[""هيچي ""]","من نمیدونم چرا بعضی ها میان میگن اپل فقط کلاس داره آخه چرا بدون فهمیدن اپل چه کارایی داره این حرفا میزنن اپل کلاس نیست دوستان درست بعضی ها به کلاس دست میگیرن هیچی از اپل حالیشون نیست اپل در دستان کاربرای حرفه ای باید باشه که از امکانات اپل استفاده میکنن دانش کار با اپل ندارن میان میگن اپل بدرد نمی خوره اپل ساپورت نرم افزاریش همه می دونن بهترینه کیفیت ساخت دوربین از همه مهمتر سیستم عاملش که تکه برید نحوه ی استفاده از اپل یاد بگیرید تا بفهمید چه الماسی در دستانتان هست مه به کسانی که پولشو دارن و استفاده کامل از تمام امکاناتش میکنن پیشنهاد میکنم این گوشی عالیه",11,3,5,5,5,5,5,5
"3D touch
طراحى زيبا و شيک","باترى ضعيف","این موبایل بسیار شیک و زیباست ولى شارژش سریع تموم میشه",3,7,5,5,5,5,5,5
"[""سخت افزار قوي"",""دوربين خوب"",""رابط کاربري هماهنگ با سخت افزاز"",""حسگر اثر انگشت""]","[""قيمت زياد در ايران"",""کاربرد نداشتن بيشتر امکانات در ايران"",""مناسب فقط براي کاربران حرفه اي در ايران""]","گوشی های ایفون در ایران اصلا کاربردی به غیر از کلاس ندارن این حرفی هست که همه حتی طرفدار های خود اپل هم می دونن! ولی این گوشی در خارج درست برعکس می شه و امکاناتش دو سه برابر میشه و اونایی که در ایران هم دارن( تمام خواننده ها، تمام بازیگران و تمام شخصیت های معروف)فقط برای کلاسش دارن و هیچ کدوم از امکاناتش استفاده نمی کنن.
در کل این گوشی رو اصلا به ایرانی ها پیشنهاد نمی کنم.",10,24,1,4,2,4,3,1
,,"چون در اپل هاهنگى بین سیستم عامل و سخت افزار هست رم دو هم براى این گوشى زیاده و پکیج ایسوس رو راحت قورت میده من خودم این گوشیو دارم و تا حالا هم با گوشى هاى دوستام که نوت 5 و اس سون داشتن مقایسه کردم و گوشى من همیشه برتر بوده و حاضرم با هر گوشى کل بندازم",12,3,5,5,5,5,5,5
,,"من 9 ماهه دارم از این گوشی استفاده میکنم ...
اومدم اتفاقی نظرات رو خوندم و واقعا تعجب کردم...
این گوشی روانترین و بیدردسرترین و بهترین و باحال ترین گوشی حال حاضر بازاره و واقعا تو این نه ماه شاید کل بدی که ازش دیدم دو سه بار مجبور شدم گوشی رو خاموش و روشن کنم بقیه چیزا فوق العادس و قابل مقایسه با گوشیای دیگه نیس
لذت وبگردی
باطری عالی
دوربین فوق فوق العاده
نرم افزار بدون مشکل
روان بودن سیستم عامل
تنوع اپهای با کیفیت و اپتیمایز شده برای خود گوشی
مکالمه عالی
انتن دهی بی نظیر
کلا همه چیش فوق العادس و من به شخصه ایرادی واسش نمیتونم بگیرم",22,4,5,5,5,5,5,5
,,"خب من خودم سیکس پلاس دارم. کلن گوشی اپل بنظر من تا سه سال میتونه کامل تکنولوژیش دوام بیاره و بعد از اون هم خوده گوشی دوام خواهد کرد. اما پلاس باهاش یکم طولانی حرف زدن سخته. یکم گاهی اوقات تو دست سنگینی میکنه. چون زیاد تو دست نیست میوفته گاهی. و نکته مهم این که شبا ک میخواین تو جای خواب با گوشی کار کنین یکم سختتونه و حتی موقعی که میخواین خم شین کفش بپوشین باید از جیبتون در بیارینش. اما خب صفحه بزرگ جذابیتای خودشو داره. عکسهای بهتر بزرگتر. دیدن ویدئو جذابتره. بطور کلی میخوام بگم جذابیتش به سختیاش میارزه. باتریشم برای من با یک استفاده معمولیو چن ساعت چت کردن و 3جی و چن ساعت آهنگ راحت یک روز دوام میاره",14,3,5,4,5,5,5,5
"ظاهري ساده اما بسيار شيک و زيبا
کيفيت دوربين و صداي فوق العاده
سخت افزار بسيار قدرتمند
صفحه نمايش با کفيت عالي
داراي تکنولوژي و فناوري مدرن",-,"سلام به همه دوستان عزیز
من گله دارم از دوستانی که با بی انصافی و چشم بسته برند اپل رو میبرن زیر سوال!
واقع بینانه بگم که اپل قابل مقایسه با هیچ برند دیگه ای نیست که البته احترام میزارم به کسانی که با سیستم عامل اندروید کار میکنن.
دنیای ای او اس فراتر از اندروید هست و فقط کسانی که با اپل کار کردن خیلی خوب متوجه حرفم میشن.
لذت کار با اپل و ای او اس وصف نشدنی هست.
بهترین هارو براتون ارزو دارم.موفق باشید",18,4,5,5,5,5,5,5
[],[],"چرا سریع افزایش قیمت داشت بزارید پیشنهاد ویژه",8,2,3,5,5,4,5,4
,,"من خودم این گوشی داشتم و ازش راضی بودم ولی ی روز ب خودم اومدم و دیدم اپل فقط کلاس داره اوناییم ک اپل میخرن بیشتر واسه کلاس میخرن همین پولو راحت میتونین با نصفش گوشی با امکانات بهتر و کارایی بهتر گرفت",10,29,0,0,0,0,0,0
"[""قيمتش خيلي بالاست نمي تونيم بخريم""]","[""خيلي گرونه""]","لطفا با وجود قدیمی شدن این مدل و نزدیک شدن به معرفی آیفون 7 یا pro خواهشا قیمتش رو بیارید پایین تا بخریم",21,4,3,3,3,3,3,3
[],[],"رامش دو خیلی کمه برا همچین پولی با این میشه یه پکیج ایسوس مشخصات بالا تر رامش 4",4,33,3,3,3,3,3,3
[],[],"به نظرشما چرا اختلاف قیمت آیفون 6splus 64بامدل128اون اینقدرکمه اما مدلهای دیگه اختلاف قیمتشون درمدلهای128و64زیاده .اگه نگاه کنین متوجه میشین.",13,3,4,5,5,3,3,5
,,"مدل گلد را لطفا موجود کنید. منتظر هستم...",3,3,3,3,3,3,3,3
[],[],"سلام.من این گوشی و دو ماه دارم واقعا ازش راضی هستم.من نظرات دیگر دوستان و خوندم ک میان این گوشی با اس 7 یا اچ تی سی مقایسه میکنن.باید بگم ک این گوشی برای سال 2015 ولی اونا برا 2016 هستن.این گوشی از همه نظر عالیه تنها مشکلش اینه کمی بزرگه ولی برای مشاهده فیلم و بازی واقعا عالی......من ب طور کامل از این گوشی راضی هستم",22,4,3,4,4,4,4,3
,,"الان بهترین گوشى دنیا تو دست منه.. به همه کسایى که اپل دارن باید بگم بهترین گوشى دنیا رو دارن از فور اس گرفته تا سیکس اس پلاس . من از گوشیم که سیکس اس پلاسه واقعا راضیم . اپل همیشه پوز سامسونگ رو به خاک میزنه .... اونایى موافقت اپل بهترینه دنیاست و سامسونگ بد ترینه . بکوبه لایکو",84,24,5,5,5,5,5,5
,,"باید بگم که اپل امکانات فوق العاده ای
داره و اگر بلد باشی باهاش کار کنی ، تازه میفهمی که دنیای خیلی وسیع تری نسبت به اندرویید داره.
بعدشم کیفیت معیار اصلی ارزش یک محصوله که اندروییدی ها فاقد اون هستند. گوشی یعنی فقط آیفون",37,11,4,5,4,3,5,4
"[""زيبايي""]",,"من خودم 6اس پلاس دارم ونه شکست نه چیزی من نظرم این است که اول ایفون
دوم سونی
سوم سامسنگ
چهارم اجی
پنجم اجتی سی
ششم هواوی
هفتم و.......",21,7,5,4,5,5,5,5
"سيب گاز زده",,"در جواب دوستی که گفته بود...کسانی که گوشی اندروید دارن نظر ندن باید بگم...این گوشی در مقابل S7edge تست شده که کلیپاش هم موجوده،حرفی برای گفتن نداره.....
گوشی یعنی امکانات عالی و کاربری آسان....
که آیفون اینجوری نیست...
گوشی چینی که این همه تعریف نداره....",6,53,3,3,3,3,3,3
"پردازش بي نقص و قدرتمند
طراحي و کيفيت ساخت
کيفيت بالاي صفحه نمايش","گرم کردن پشت گوشي","من قبلا سامسونگ اس 5 داشتم. اما تصمیم گرفتم که آیفون بخرم و
بنابراین از فروشگاه دیجی کالا نسخه 6s پلاس رنگ خاکستری رو خریداری کردم.
باید بگم که نسبت به سامسونگ قبلی یک سری تغییرات مثبت و منفی
برام به وجود اومده. مثلا کارکرد با سامسونگ راحت تر و آزادتر از آیفون
بود اما در عوض سامسونگ کیفیت نداشت و در پردازش کم می آورد.
من هم بیشتر برام کیفیت گوشی مهمه تا آزادی عمل گوشی.
بر همین اساس کیفیت عالی و مثال زدنی آیفون 6s پلاس در پردازش
سریع و روان و قدرتمند ، دوربین ، صفحه نمایش ، طراحی و ساخت و همچنین در کیفیت و وضوح تماس های تلفنی ، باعث راضی بودن همه جانبه من از این گوشی شده ...
تنها ایرادی که میتونم به عملکرد این گوشی وارد کنم ، گرم کردن پشت
گوشی در زمان مرورگری اینترنت و اجرای بازی هاست که البته این روزها
با بالا رفتن حجم بازی ها تقریبا همه گوشی های لمسی گرم می کنند و
نمی توان گفت که این مشکل تنها مختص آیفون است.
برای انتقال موسیقی به قسمت music آیفون ، حتما باید از برنامه iTunes
بر روی کامپیوتر یا لب تاپ استفاده کنید.
برای انتقال ویدیو و عکس هم میتونید از برنامه های مخصوصی نظیر
استفاده کنیدZapya و Shareit
که البته کارآیی این برنامه ها در ios یک مقدار سخته و به آسانی اندروییدی ها نیست.
در ضمن حتما باید یک Apple ID فعال داشته باشید تا برنامه هاتون رو
از App Store بتونید دانلود و یا آپدیت کنید.
خلاصه کارآیی محصولات اپل یک مقدار سخته و در طول زمان بهش عادت می کنید. اما اپل تنها برای یک اصل این سیاست رو در محصولاتش پیاده میکنه و اونم کیفیت و ماندگاری محصولاتشه و همین
راز موفقیت اپل و بنیان گذار نابغه اش استیو جابزه.",22,5,4,5,4,3,5,4
"باتري فوق العاده
کيفيت صفحه نمايش عالي
کيفيت ساخت عالي
دوربين خوب
سيستم عامل خوب و سخت افزار قدرتمند","بعضي وقتا قاطي ميکنه و بايد ريست بشه","سلام خدمت همه دوستان
من قبل از این گوشی نوت 4 سامسونگ داشتم و قبل از خرید این گوشی همش دودل بودم که منتظر بشم اس 7 سامسونگ بیاد و بخرمش یا همین گوشی رو بخرم(میدونم خیلیا الان وضعیت اونموقع من رو دارن).ولی الان با قاطعیت میگم که کاملا از انتخابم راضی هستم به چند دلیل:
1. سیستم عامل ios که کاملا بصورت روان کار میکنه بدون هیچ لگ و هنگ (بر خلاف اندروید)
2. کیفیت بدنه عالی که وقتی میگیریش تو دستت یه حس خیلی خوبی بهت میده
3. صفحه نمایش با کیفیت که زیر نور آفتاب هم خیلی خوبه وضوحش
4. سخت افزار قدرتمند که اصلا کم نمیاره
5. آپدیت های نرم افزاری که زود به زود از طرف اپل ارائه میشن
6. وجود سیب گاز زده پشت گوشی که یه کلاس خاصی داره:)
اما یه عیب هایی هم داره که در مقابل محاسنش زیاد به چشم نمیان.مثلا بعضی وقتا قاطی میکنه ولی با یه ریست ساده حل میشه در ضمن قاطی کردنش اینطور نیست که کار کردن با گوشی رو مختل کنه.یه نمونش اینکه بعضی وقتا وقتی میخوای صدای زنگ رو با کلیدای تنظیم صدا کم و زیاد کنی به جای صدای زنگ، صدای مدیا کم میشه.و ios یه سری محدودیت ها هم داره که میشه خیلیاشون رو با نصب نرم افزارهای جانبی حل کرد.تو نظرات خوندم یه دوستی گفته بودن نمیشه آهنگ رو با مرورگر گوشی دانلود کرد، باید خدمت ایشون عرض کنم که میشه با نصب نرم افزار Documents و استفاده از مرورگر این نرم افزار آهنگ هم دانلود کرد.
و اما خدمت دوستانی که بین خرید پلاس و معمولی مردد هستند عرض کنم که بدون هیچ شک و تردیدی مدل پلاس رو انتخال کنن به چند دلیل:
1. صفحه نمایش بزرگتر و با کیفیت تر که موقع وبگردی و تماشای فیلم واقعا لذت بخشه
2. دوربین مجهز به لرزش گیر اپتیکال که در مدل معمولی وجود نداره
3. باطری فوق العاده قوی
امیدوارم بررسی من به دردتون بخوره",17,7,4,5,4,5,5,4
عالي,,"سلام دوستان دی جی کالایی این درخواست فقط یک نظرسنجی هست شاید مقایسه اون به نظر بعضیا درست نباشه دوستایی که با نوع 6s موافقن لایک و اگه با نوع 6s plus موافقین آنلایک کنید ممنون میشم ازتون",10,64,5,5,5,5,5,5
[],[],"سلام دوستان موبایل ایفون موبایل خوبی حالا من بهتون توضیع میدم برای چی
اگه دقت کنین بیشر هنرمند ها و خواننده های مشهور از ایفون استفاده میکنند
ولی این ربطی به نظر عقاید شما نداره پس برای چی گفتم برای این گفتم اگه یه گوشی بهتری وجود داشت اونها میرفتن سراغ بهترین
خوب تا اینجا منظورم رو گرفتید که چی میگم
گوشی بهترین گوشی دنیا هست از نظر گیفیت از نظر با دوامی البته باید دقت کنید که برای افراد زیر 15سال خریداری نشه که عرضه نگهداری ندارن
از نظر سخت افزاری هم عالیه امدوارم شما هم از ایفون استفاده و لذت ببرین",18,23,3,3,3,3,3,3
"کيفيت صفحه بالا","ابعاد بزرگ","سلام دوستان من ایفون شیش داشتم بعد بخاطر اندازش رفتم شیش پلاس گرفتم و همون هفته پلاس و فروختم و فقط ضرر کردم واقعا اصلا خوش دست نیست فقط کیفیت صفحه نمایشش بیشتره و من بخاطر بزرگ بودنش سریع ردش کردم و در حال حاظر شیش اس دارم واقعا پلاس نخرید چون واقعا از خریدتون پشیمون میشین",6,40,3,3,3,3,5,4
,,"دوست عزیز دانلود برنامه از اپ ستور ای او اس سرور قوی میخواد و باید اپل ایدی داشته باشه که تو ایران ضعیفه نمیدونم خبر داشتی یا نه یه مدتی هم سال قبل 94 اپل تو ایران تحریم شده بود و هیچ اپلیکیشنی رو باز نمیکرد و باطریشم که زیاد دوم نداره یعنی در مقابل اس 6 و اس 7 سامسونگ چیز زیادی بشمار نمیاد اون خط سفیدی که داره پر میشه داره زمان ارسال پیام یا تکستت رو نشون میده که وقتی جایی موبایلت خط نده این خط سفید پر نمیشه و یا در جا های دیگه داخل شهر پر میشه .",2,25,2,3,1,2,5,5
[],[],"سلام ، اگه میشه تو پیشنهاد ویژه قرار بدین هرچه زودتر بهتر",9,1,2,4,5,3,5,4
"[""هيچي""]","[""همه چي بجز هنگ نکردن""]","گوشی خیلی دلچسبی نیست و از نظر ظاهر خیلی بد است و زیاد چیز بدرد بخوری ندارد وقط هنگ نمی کند ولی سامسونگ بهتر است",7,47,0,0,2,0,0,0
"[""از نظر همه چي عالي""]","[""از مرورگر نميشه فيلم و بازي دانلود کرد""]","شما اگر میخواهید خش نیوفته باید گلس و یک گارد بزنید بعد باخیال راحت ده بارم بیفته فقط ممکنه گلسش بشکنه کن راحت عوش میشه و این مشکل برای همه ی گوشی هاست چون گوشی و باید ازش مواظبت کنی و برای هر گوشی این کارو نکنی خش و خراب میشه من ازش خیلی راضی کاش در اینده ایفون بزاره مثل اندروید از تو مرورگر هم بشه دانلود کرد",9,4,4,5,5,5,4,5
,,"سلام خدمت همه
من این گوشیو حدودا یه ماهی میشه خریدم
به نظرم بد نیس یعنی خیلی نسبت به گوشیه اندرویدی که داشتم بهتره
ولی چندتا چیزو سر در نمیارم
1- این که وقتی پیامک ارسال میکنم یه خط سفیدی در حین ارسال زیر نوشته ظاهر میشه و میره
2- این که نمیتونم با نت گوشی بازی یا برنامه با حجم بالا رو دانلود کنم
3-باتریشم حدودا اگه معمولی استفاده کنم یک روز دووم میاره ولی اگه نت روشن باشه و بازی کنم و... خیلی کمتر از یه روز میشه
نهایتا 12 ساعت
میخاستم ببینم عادیه یا نه
اخه تعریف باتریشو شنیده بودم از دوستان
ممنون بابت کمکی که میخاین بکنین
موفق باشین",7,3,4,5,3,3,5,4
,,"لطفا رنگ گلد را موجود کنید",9,2,5,5,5,5,5,5
"شعار: تو اپل قاونه بايد حتما لقمه رو از پشت گردن بياري بخوري...!:))","اينه که اپل رو با گوشيهاي بي ارزشي مثل سامسونگ و اين قبيل گوشيها مقايسه ميکنن...","سلام...
به نظر من دوستان عزیزی که با اندروید کار می‌کنن اینجا جایی برای نظر دادن ندارن. بهتره برن و اطلاعات درست بدس بیارن و نظر بدن.
>> اندروید برای دوستانی خوبه که انتظار زیادی از گوشی ندارن و فقط میخوان برن و از شبکه های پیامرسانیش استفاده و اطلاعات پوچ و بی ارزش ردوبدل کنن...!
>> دوستانی که اپل دارن و در مورد خدماتش گلایه می‌کنن بهتره سطح اطلاعات خودشونی در مورد اپل بالا ببرن تا به مشکل بر نخورن.
>> راستی‌ یه جریان خیلی‌ جالب براتون بگم، ما یکی‌ از بهترین برندهای سامسونگ به نظر خودشون رو با نرم افزار بنچ مارک اتوتو تست کردیم جالب بود سخت افزار زده بود 46 بیت بد اندریدشو زده بود 32 بیت...!
>> اگر دوست دارید با اندروید کار کنید بهتره فقط برند اچ‌تی‌سی بخرید و به معنی‌ واقعی کلمه با اندرید کار کنید...
موفق باشید.",12,32,5,5,5,5,5,4
[],[],"رنگ گلدش رو موجود کنید",8,7,3,5,4,5,5,5
"دوربين فوق العاده
سخت افزار عالي
باتري فوق العاده قوي
وجود لرزشگير اپتيکال","ابعاد بزرگ
وزن زياد","سلام.
بنظرم سیکس اس خیلی بهتره چون خوش دست تر و کوچیک تره و راحت تر تو دست جا میشه و کار کردن باهاش آسونه ولی سیکس اس پلاس دقیقا عکس این موضوع رو به من ثابت کرده واقعا ابعادش خیلی آزار دهندس (حداقل برای من )
خواستید بگیرید پلاس نگیرید ضرر میکنید. البته از نظر سخت افزاری و غیره فوق العادس ولی از نظر ابعاد دچار مشکل میشید با تشکررر...",10,15,4,4,4,2,2,5
[],[],"لطفاً رنگ طلاییش رو موجود کنید !",6,4,5,4,5,4,5,5
,"[""ندااااره""]","بهترین گوشی دنیاس حرف نداره واقعا",10,7,5,5,5,3,5,5
[],[],"لطفا رنگ گلد رو هم اضاف کنید",15,4,3,5,4,5,5,5
"محبوبيت در بين گوشي ها",,"دریک کلام بهترین دنیا",12,8,5,5,5,5,5,5
,,"اگه کل نظر منو میخوندید میدید که کل گوشی های من اندرویدی بوده و برای اولین باره ایفون میگیریم پس دلیل نداره سر دو ماه داشتن این گوشی روش تعصب داشته باشم و برعکس قبل از گرفتن این گوشی رو اندروید تعصب داشتم و مثه شما از گوشی های اندرویدی طرفداری میکردم و ایفون رو اصلا گوشی نمیدیدم و فقط فک میکردم پول سیب گاز زدشو داره میگیره!!! پس در این صورت نظرات شما دقیقا مثه خودم قبل از این دوماه هستش و با تعصب نظر میذارید!! من با وجود استفاده از هردو سیستم عامل به این نتیجه رسیدم با وجود سرتری اندروید به ios هنوز راه زیادی رو پیش رو داره تا مثه ios کامل بشه و حتی سبک تر بشه!!! در کل هردو سیستم عامل فوق العاده هستن اما اگه دوستان بتونن با این سیستم عامل کنار بیان و کار کنن متوجه میشن که یه گوشی بدون لگ با سیستم عامل سبک یعنی چی و بعد از یه مدت با گرفتن گوشی های اندرویدی سنگین بودن اندروید با لگ های زیاد رو متوجه میشه. در ضمن هر سیستم عمل یه مزایا و یه معایبی هم داره که هم اندروید و هم ios از این قاعده مستثنی نیستن!!!!
من تو نظر قبلیم یادم رفت بگم تنها بدی این گوشی بیرون زدگی لنز گوشی هستش که فکر نمیکنم چیز شاخی باشه برا ایراد گرفتن این گوشی.",20,3,5,5,5,5,5,5
