,,"با سلام
دوستان من شنیدم پارت نامبر گوشی های اپل دیجی کالا AA یا همون خاور میانه هست
سوالم از دوستانی که خریدن اینه که پارت نامبر گوشی شون چیه؟؟؟؟
ممنون میشم اگه جواب بدید",1,0,0,0,0,0,0,0
,,"سلام من شنیدم که پارت نامبر امریکا (LLA) در داخل بستش یک عدد سیمکارت وجود دارد این سیم کارت قضیش چیه لطفا کسانی که پارت نامبرشون امریکا هست راهنمای کنن .",2,0,0,0,0,0,0,0
,,"سلام
ب نظر من بحث کردن سر این که (ایفون بهتره یا سامسونگ یا مردم بخاطر پز و اینجور چیز ها ایفون میخرن و ...) واقعا حرف الکی هست چون ی سری افراد هستن مثلا کلا از اول ایفون خریدن و ازش راضین و زیاد میلی هم ندارن که بیان بیان از یه برند دیگه خرید کنن و دسته ای دیگه ای هم هستن که کارشون بیزینسی هست و کسایی که تو کار بیزینس باشن میدونن که هرکی بخواد با ی شرکتی قرارداد یا ... ببنده اول از همه نوع تیپ و لباس و کلاس اون فرد رو برای اون کار در نظر میگیرن بعد اون کاری که باهاش دارند رو و در این شکی نیس که ایفون ها واقعا گوشی های باکلاسی هستند. اما خب واقعا این هم نمیشه گقت که همه افراد باسه نیازهاشون ایفون میخرن ، بعضی هم هستن که بخاطر پز میخرن.
اما کس های دیگری هم هستند که گیمرند(gamer) و واقعا سری های ایفون و ایپد و در کل iOS بازی راحت میتونید براشون از اپ استور دانلود کنید ولی باسه اندروید باید برید دیتا و ... دان کنید که این هم کار سختیه
ولی بعضی هام میگن اپل فقط پول سیستم عامل و ... میخوره منم باید در جوابشون بگم نوش جون اپل چون من خودم برنامه نویسی میکنم و میدونم که برنامه نویسی واقعا کار سختیه چه برسه به نوشتن سیستم عامل و رابط کاربری
هرکی با حرف های من موافقه + بزنه
از این که به نوشته های من توجه کردید ممنونم",15,0,0,0,0,0,0,0
,,"رز گلدشو موجود کنید لطفا",3,0,0,0,0,0,0,0
,,"سلام دوستان. لطفا راهنماییم کنید.
من بین این گوشی و 6اس شک دارم. وزن این گوشی آزار دهنده هست یا نه؟ تو جیب شلوار جین جا میشه؟ و آخر این که واقعا درسته که آیفون خیلی محدودیت داره؟
ممنون میشم افرادی که این گوشی رو دارن راهنمایی م کنند.",1,0,0,0,0,0,0,0
,,"هر وقت که ناموجود می‌شه، امیدوار می‌شم که با موجود شدن مجدد دو تا اتفاق خوب بیافته:
1. قیمت کاهش پیدا کنه
2. رنگ خاکستری موجود بشه.
ولی جدا آفرین به دیجی کالا، قیمت‌های 6اس معمولی رو خیلی خیلی خوب گذاشتین. اگه پلاس نمی‌خواستم فوری یکی از گوشی‌های 6اس رو می‌خریدم. قیمتتون اونم با گارانتی از جاهایی که گوشی رو قاچاق می‌کنن و گارانتی ندارن پایین‌تره. با این کارتون هم به مشتریان احترام می‌گذارید و هم فرهنگ خرید کالای قانونی و گارانتی‌دار رو ترویج می‌کنید.",8,0,0,0,0,0,0,0
,,"فقط رز گلد",1,0,0,0,0,0,0,0
,,"با سلام ،دیروز رسید به دستم با یک پک جدید.پارت نامبر llA و تراشه تایوان.",1,0,4,5,4,3,4,4
,,"بازم رزگلد. بابا کلافه شدیم دیگه. این همه تقاضای رنگ دیگه دارن. این کار شما واقعا بی احترامی به مشتری های ثابت خودتونه. خود من 3 هفتس منتظرم نقره ای موجود کنید از شما خرید کنم وگرنه خیلی راحت تر بود که از برادرم که موبایل فروشه خرید کنم!",6,0,0,0,0,0,0,0
,,"با سلام ،رنگ رز گلد سلیقه ای هست و جدیده در واقع (مردانه-زنانه) هست.",2,0,4,5,4,3,4,4
,,"خسته نباشی دیجی. قیمت‌هاتون خیلی رقابتی شده. رنگ خاکستری رو موجود نمی‌کنید؟",5,0,0,0,0,0,0,0
,,"سلام
ممنون میشم موجوذ کنید یجی جان
رز گلدش میخام",1,0,0,0,0,0,0,0
,,"با سلام . آیفون از اول بهترین بوده و خواهد بود چون سیستم عاملش واقعا بی رقیب هست و رابط کاربری خیلی راحتی داره . سامسونگ هر چی هم خوب باشه باید فکری به حال سیستم عامل اندروید بکنه که کاربرش مجبوره با هنگ کردن و ویروس مبارزه کنه .",2,0,0,0,0,0,0,0
,,"حالا اگه دنبال رنگ رز گلد بودیم پیدا نمیشد چون رنگ خاکستری دنبالشیم یا رنگای دیگه یه جور میگن نیست انگار با بدنه طلا 18 عیار میخوای سفارش بدی .....",4,1,0,0,0,0,0,0
,,"چرا بقیه رنگ ها رو نمیارید",4,0,0,0,0,0,0,0
,,"لطفا نقره ای موجود کنید. سه هفته گذشت!!!",2,0,0,0,0,0,0,0
,,"گوشی خوبیه ولی گرونه",0,0,4,5,5,5,5,5
,,"سلام من گرفتم واقعا عالیه و با مک بوک ایر و ایپد همگام سازی فوق العاده ای داره
بسیارر رنگ رز گلدش زیباست
اصلا ضخامتش نسبت به سری قبل قابل تشخیص نیست.
3d تاچ بسیار چیز باحالیه ولی اونقدر هم که اپ مانوور میده نیست
سرعتش بسیار عالی شده
دوربین فوق العاده است
ولی باتریش اذیت میکنه که با یک پاور بانک حل میشه",2,1,4,5,5,5,5,5
,,"هر رنگی غیر از رز گلد",5,2,5,5,5,5,5,5
,,"خواهش میکنم زودتر رنگ گلدشم بزارید",0,0,0,0,0,0,0,0
,,"سلام رنگهای دیگر موجود کنید با تشکر",5,0,0,0,0,0,0,0
,,"پس نقره ای چی؟ رز گلد اونم پلاس چه شود؟",2,0,0,0,0,0,0,0
,,"چقدر خوب بعضی هاتون دارین میگین چه رنگی از گوشی رو بیاره تا بخرین
بعضی هاهم مثل من در حسرتش",8,0,0,0,0,0,0,0
,,"من واقعا کسایی که میگن آیفون داشتم خوب نیود رفتم نوت سامسونگ گرفتم یا آیفون نخریدم لومیای ماکروسافت بخرم و از این جور حرفا رو درک نمیکنم ! آقا و خانم محترم شما اول باید تکلیف خودتو روشن کنی که توی چه اکوسیستمی میخوای باشی ! آیفون گوشیه فوق العاده ایه ولی واقعا لذت اینکه توی اکثسیستم اپل باشید و از همگام سازی تمامی دستگاهها تون ( گوشی و تبلت و لپ تاپ ) لذت ببرید رو تجربه کردید؟ اگر طرفدار مایکروسافت هستید خب یه کامپیوتر ویندوزی تهیه کنید و ترجیها گوشی هود مایکروسافت رو هم بخرید تا از سینک بودن اونها باهم چه با کاپل و چه وایرلس و از طریق سیستم ابریش لذت ببرید. به شخصه اکوسیستم اپل رو کاملا برتر و نوآورانه تر میدونم و همیشه هم از اون استفاده خواهم کرد. به عنوان کسی از آیفون 3gs هر سال گوشی آیفون جدید رو خریده و بیش از 150 دلار خرید از App Store و iTunes داشته دیگه هیچ موقع به این فکر نمیکنم که بخوام برم سراغ یک برند دیگه حتی اگه اونا هم دیگه این روزا محصولات خوبی تولید کنند مثل مایکروسافت! بلکه دوست دارم برند مورد علاقه ام روندش سعودی باشه که اپل تا به امروز اینجوری بوده.",3,0,5,5,5,5,5,5
,,"سلام
دیجی کالا چرا رز گلد ؟
والا من که دخترم هرگز دلم نمیخواد گوشی این رنگی دست بگیرم پسرا رو نمیدونم دیگه ..",13,1,0,0,0,0,0,0
,,"سلام دیجی
لطفا رنگ گلد.....",1,1,0,0,0,0,0,0
,,"از سایت دیجی کالا خواهش میکنم : یه صفحه درست کنه واسه پاسخ به سؤال های کاربرا (مثلا خیلیا بودن درباره نوع پردازنده این گوشی سوال پرسیدن ) و همچنین کاری کنه بشه یک متن رو هم لایک کرد و هم دیس لایک و در ضمن خواهشا قیمت گوشی های ایفون رو باز بیارید پایین تر. موافقا++++",21,1,0,0,0,0,0,0
,,"لطفاً به سوالات پاسخ بدید.
اینطوری به وقت مشتریاتون احترام میزارید.
مثلاً بدونم رنگای دیگه میارین یا نه .",3,0,4,4,4,3,4,4
,,"سلام.
گوشی های ایفون خیلی خوبن ولی من قدرت خریدش رو ندارم.ولی سونی رو خیلی دوست دارم الانz3 compact دارم خیلی خیلی ازش راضی هستم.",4,0,0,0,0,0,0,0
,,"سلام
دیجی کالا یه پیشنهاد دارم برات
یه قسمت برای جواب دادن به کار برا بزار لطفا
خیلی ها سوال های زیادی دارن
یه چیز دیگه هم هست
یکاری کن که هم بشه متن رو لایک کرد هم بهش منفی داد
اینا رو ترو خدا انجام بدهه
موافقا++",15,1,0,0,0,0,0,0
,,"پس چرا رنگ نقره ای موجود نمیکنین؟",2,0,0,0,0,0,0,0
,,"با درود به دیجی کالا و دیجی کالایی ها
امیدوارم که همیشه رزگلد رو موجود داشته باشه.",0,0,0,0,0,0,0,0
,,"نه علیرضا جان مشکی کجا بود؟؟ مشکی نداره ... رزگلد - طلایی - خاکستری - نقره ای",0,0,5,5,5,5,5,5
,,"سلام. خواهشا کمکم کنید بین 6splusو6s موندم کدومو بگیرم از همه نظر بهتره؟؟؟",2,0,0,0,0,0,0,0
,,"رنگ نقره ای موجود کن لطفا. خیلی منتظر شدیم دیگه",0,0,0,0,0,0,0,0
,,"با درود . . .
دیجیکالا فکر میکنم سیاست کاریت یکم عوض شده.فقط یک مدل و فقط یک رنگ؟؟؟ شرکت شما همیشه به عنوان نمونه بوده و خواهد بود.تا کی باید صبر کرد که مدل ها و رنگ های دیگه رو هم بیارید؟ خواهشا اهمیت بیشتری بدید و انعطاف بیشتری در قیمت کذاری داشته باشید.سپاس",3,0,5,5,5,5,5,5
,,"لطفا موجود کنید ممنون",1,0,0,0,0,0,0,0
,,"با سلام به همه طرفدارهای تکنولوژی موبایلی
این بار اپل با این گوشی که عرضه کرده فقط خواسته بصورت کاملا حرفه ای کنار گیری اندروید رو اثبات کنه تمام.",1,0,3,5,5,5,5,5
,,"من چند وقت پیش 6plus خریدم ولی الآن پشیمانم که چرا صبر نکردک که 6s بیاد بعدا گوشی بخرم از نظر من که عالیه
+ یادتون نره",2,1,5,5,5,5,5,5
,,"سلام دوستان میخواستم بدونم پارت نامبر محصولات دیجی چی هستش؟",5,0,5,5,5,5,5,5
,,"امیدوارم مشکل خم شدنش واقعا حل شده باشه. خودم پلاس دارم متاسفانه خم شد. البته شانسم زیاد خم نشد و برعکس فشار دادم تا حدودی درست شد. ولی وقتی روی سطح صاف میذارم مشخصه خم شده. باید منتظر شم اگه توی اس مشکل خم شدن نداره یه 6س پلاس بگیرم. ولی موندم کی و چرا خم شد چون خیلی حواسم بود جایی نذارم که خم شه",1,0,0,0,0,0,0,0
,,"سلام به همه دوستان من خودم موبایل فروش هستم و با تمام گوشی ها کار کردم و تمام پرچم دار هاشون منم مثل همه شما دوستدار گوشی هوشمند هستم اما باید بهتون بگم إینو باید قبول کنیم که ایفون استانداردی شده برأی گوشی های هوشمند اگه ایفون فناوری های تاچ أیدی و اپل پی وغیره رو ارایه کرد که بعد از اون ها بود که شرکت های دیگه از اینها استفاده کردن همین چنین روز پیش اخبار استفاده از فورس تاچ و تریدی تاچ در سامسونگ منتشر شد نمیخوام اسمشو کپی برداری بزارم ولی این ایفون و اپل بودند که این موارد رو تبدیل به استاندارد گوشی های هوشمند کردن و در نهایت کسی که گوشی سطح بالا و عالی میخواد و توان خرید ایفون رو داره بی شک نمیره گوشی کمپانی ای رو بخره که واسه فروش بیشتر فروشنده هاشو بفرسته تا در زمان کنفرانس برترین شرکت دنیا واسش جذب مشتری کنن یا بیاد گوشی هاشو أجاره بده تا خریداری ایفون رو منصرف کنه و ... اما این ها همش بی فایدس و همچنین این همه بحث هم بی فایدس چون اپل شخصیت خودشو و مشتریان خاص خودشو داره ممنون که خوندین",6,0,0,0,0,0,0,0
,,"بچه ها رنگ مشکی هم داره؟؟؟چون من هر چی دیدم و گشتم نبود و ندیدم شایدم اشتباه می کنم شما راهنماییم کنید.
ممنون",2,0,0,0,0,0,0,0
,,"دیجیکالا خاکستری هم بیار نه فقط رزگلد . کلی منتظر بودم حالا که اومده رزگلد ؟",7,0,0,0,0,0,0,0
,,"پرچم دارای اپل هر سال بهترینن امسال هم Apple Iphone 6s",11,0,5,5,5,5,5,5
,,"دیجی یه زره دیگه ارزون کن رز گلدشو بخریم",6,0,4,5,5,5,4,5
,,"سلام دوستان.میخواستم بدونم اونایی که این گوشی رو دارن تو استفاده از 3D touch دچار مشکل نمیشن؟",2,0,0,0,0,0,0,0
,,"بابا نخواستیم رز گلد خاکستری بیارید اینقدر صبر کردیم تا بیاد بد که اومد رز گلدشه",11,0,5,5,5,5,5,5
,,"زر گلد چیه توروخدا؟!!! همه دختر نیستن بخدا!!! مشکیشو بیارین رو هوا میبرنش..",10,2,0,0,0,0,0,0
,,"اپل برای گرفتن سلفی در نور کم چاره جالبی اندیشیده است. بعضی شرکت ها برای دوربین جلوی موبایلشان فلش می گذارند. اپل احتمالاً یا از ترس افزایش ضخامت فلش نگذاشته، یا ایده آن را هوشمندانه ندانسته است. بنابراین از صفحه نمایش آیفون به عنوان نور کمکی در محیط های تاریک استفاده کرده است.
در مواقعی که نیاز به نور باشد، نمایشگر در یک لحظه نوری 3 برابر حداکثر روشنایی اش می تاباند و جالب این که نتیجه آن واقعاً خوب از آب در می آید! از نمایشگر انتظار نداشتیم که بتواند نقش فلش را بازی کند اما به خوبی از پس آن بر می آید. مورد دیگر این که این نور، همیشه یک نور سفید ثابت نیست. حسگر نور آیفون با توجه به نور محیط، مشخص می کند که نمایشگر چه نوری بتاباند تا تصویر طبیعی به نظر برسد؛ گاهی سفید می تاباند، گاهی کِرِم رنگ.
تا 1ماه دیگه قصد خرید 6إس پلاس 64طوسی دارم و تازه متوجه شدم.",11,0,4,5,5,5,4,4
,,"اپل، آیفون جدید را با تغییرات زیادی روانه‌ی بازار کرده است. دوربین اصلی با سنسور 12 مگاپیکسل، دوربین سلفی 5 مگاپیکسلی، فن‌آوری جدید 3D Touch، استفاده از آلومینیوم سری 7000 برای مقاومت بیشتر بدنه، استفاده از حس‌گر اثر انگشت با دقت بیشتر و در انتها استفاده از تراشه‌ی A9 از تغییرات بزرگ این گوشی در مقایسه با نسل قبلی‌اش هستند. همه این تغییرات ایجاد شده‌اند تا در سال پیش‌ رو، آیفون 6s پلاس بتواند بر رقیبانی مثل اکسپریا Z5 پریمیوم و گلکسی نوت 5 پیروز شود.راستی دیجی جون 128gigهم بیار",6,0,0,0,0,0,0,0
,,"درود
بهترین رنگ اپل کدومش؟
رز گلد قشنگه؟",0,0,0,0,0,0,0,0
,,"آیفون 6 از نظر دوربین مخصوصا دوربین سلفی ضعیف بود . دوربین سلفیش نسبت به سامسونگ یه پسرفت حساب میشد.
ولی الان آیفون 6 اس این ضعف و جبران کرد و همه رو امیدوار کرد .
چون برای من دوربین خیلی مهمه قبلنا از آیفون خوشم نمیومد ولی الان که 4k هم شده نظرم عوض شد چه برسه به این که :
چیپستش شده A9
سی پی یو شده 2
3D TOUCH
4G قوی تر
بلوتوس نسخه 4.1
دوربین پشتی 12 وسلفی 5
فیلمبرداری با دو ربین سلفی 240 فرم بر ثانیه
IOS 9
ابعاد بزرگتر هم عرض هم طول هم ضخامت که از خم شدن احتمالی جلوگیری میکنه
دستشون درد نکنه با این همع تغییر .
هر کی موافقه + بده..............خدایی اگه نیگا کردی مثبت ندادی هیچ کاریت نمیکنم",88,10,0,0,0,0,0,0
,,"دیجی لطفا رنگ سفیدش رو بیاار",3,0,0,0,0,0,0,0
,,"ای کاش یک راهی داشت که میفهمیدیم چیپستش مال tsmc یا سامسونگ.",3,0,4,5,5,5,5,5
,,"نسبت به قیمتش ارزش خرید نداره",9,1,0,0,0,0,0,0
,,"دیجی کالا رنگ های دیگه غیر از رزگلد مثل سیاه رو هم بیار",12,0,0,0,0,0,0,0
,,"اگه دوربین با کیفیت و صفحه نمایش حرفه ای براتون مهمه (سامسونگ)
اگه بدنه شیشه ای و باتری خوب براتون مهمه (سونی)
اگه پردازنده قدرتمند و کیفیت ساخت بالا براتون مهمه (اچ تی سی)
اگه چیپست فوق العاده و رابط کاربری براتون مهمه (الجی)
ولی اگه همه این امکاناتو یکجا باهم بخواهید... فقط آیفون!
ممنون از اینکه نگاهتون رو صرف خوندن نظرم کردین.خدایی +یادتون نره میخوام بیشترین+بخوره .بای",183,14,0,0,0,0,0,0
,,"دیجی چرا نمیارید این رو پس؟!؟",2,0,2,5,5,3,4,4
,,"ایفون بهترینه و رقیب نداره",10,0,5,5,5,5,5,5
,,"با سلام خدمت دوستانی که فرمودن ایفون بی رقیبه و فروش بالایی داره و اینکه چرا هر سال عده ای مجذوب میشم باید عرض کنم متاسفانه ما همیشه به مبدا سازنده ی گوشی ها نگاه میکنیم و چون ساخت امریکاس پس حتما بهترینه!!!توی جامعه هنوزاستفاده از گوشی جا نیفتاده و مردم ما نمیدونن که از گوشی چه استفاده هایی میخوان بکنن در واقع چه ایفون و چه جدیدترین پرچم داران سامسونگ نیاز کاربر رو تامین میکنند من از دوستانی که فرمودن سامسونگ لگ داره و بقیه ی اشکالات ...این گوشی های جدید هیچ گونه مشکلی نداره و از پس تمام کارهای روزمره و سنگین بدون هیچ مشکلی بر میاندگ من نمیدونم دوستان با ایفون شون چی کار میخوان بکنن که سامسونگ از پسش بر نیاد و اینکه سخت افزار بالاتری داره به دلیل نیاز سیستم عامل هست وگرنه اگر اندروید روی ایفون نصب میشد گوشی به لگ میوفتاد هر دوتای این کمپانی ها گوگل و اپل متخصصانی دارن که مداوم بر روی بهبود سیستم شان کار میکنند پس لطفا این نظرات بچگانه که ایفون بهترینه و رقیب نداره رو ندین چون همونطور که دیجی کالا مگ نیز اشاره کرد ایفون تنها برای رودربایستی دوربین رو ارتقا داد وگرنه ایفون 8 مگاپیکسل هم میتونه 4 کا فیلمبرداری کنه....خواهشا کمی منطقی باشین و اگر زمانی کسی یادش بیاد گوشی های نوکیا ی جدید هم اینقدر محبوب بودن و کلاس!داشتند ببخشید طولانی شد متشکر",16,2,0,0,0,0,0,0
,,"دیجی کی این به زودی اعصاب خورد کن تموم میشه اخه؟کی چه ؟؟چه وقت -اذیت نکن دیگه",7,0,0,0,0,0,0,0
,,"آقای موسوی. باید خدمتتون عرض کنم که شما با دستای خودتون با آیفون های جدید کار کنید و بعد این نقص ها رو روش بذارین. چیپ a9 یه چیپ بسیار بی نقص و عالیه و هیچگونه داغی نداره. .سیستم عاملش هم بسیار سریع و عالیه و فاقد هرگونه لگ..این خبرها همیشه چند ماه بعد از انتشار این فون ها برای خراب کردن و از چشم افتادن ساخته میشه و متاسفانه همه هم باور میکنن! وگرنه نه آیفون 6و6+ خم میشد و نه اینا داغ میکنه ..چون اگر این مشکلات وجود داشت خود شرکت اپل روز بعد از انتشار اونها به حلش میپرداختن ..و اینکه میگید با این نظرات به عده منصرف میشن. ..الان دقیقا خود شما با نظراتتون دارین بین یک عده طرفدارای اپل دو دستگی میندازین و تبلیغ شرکت مورد علاقه خودتون که سامسونگ باشه و میکنین. .و اینکه میگید قدرت یعنی پرچمدارای سامسونگ. .این قدرت نیست، اینه که بعداز شش ماه استفاده با گردن کج برین تعمیر موبایلی و بگین این گوشی هنگ کرده یا هرمشکلی و برام درستش کن یا فلش کن و...برای سامسونگ پول سیستم عامل رو نمیدی. .دقیقا برعکسشه! شما پول آیفون میدی و در واقع پول سیستم عامل سبک، نرم و سریع رو میدی و لذت میبرید. چه خوب میشد که اگر طرفدار یه کمپانی دیگه هستیم، نریم و در مورد کمپانی های دیگه نظر بد بدیم طرفداراش رو منصرف کنیم. مرسی که نظرم رو خوندید. .موفق باشید.",8,0,0,0,0,0,0,0
,,"جناب اقای فرهانی شما که میگی اپل برا پز دادن نیست و رفتگر هم در خارج میتونه بخره شما قیمت جهانی این گوشیو با ایران مقایسه کن بعد بیاین نظر بدین که این از سطح پایینی مردم هست در واقع این مورد برای پز دادن هست و این قضیه در واقع مثل خرید ماشین صفر هست که من نمیخوامبیشتر توضیح بدم بله اگه قیمت واقعی این گوشی در ایران هم بود مردم هم استفاده میکردن و اینکه شما سامسونگ خوب نیست شما برو گلکسی اس 6 اج پلاس رو بگیر دستت میفهمی قدرت ینی چی در واقع شما پوله سیستم عامل رو داری میدی نه گوشی و اینکه خواهشا کسانی که گوشی های دیگر برند ها مثل پرچم داران سامسونگ رو امتحان نکردن نظر بی دلیل ندن شاید با این نظرات غیر منطقی تون کسی رو از خرید منصرف کنین و نکته ی اخر فروش گوشی ایفون فقط به دلیل فروش بالای ان در چین بود که این اعداد و ارقام رو رقم زد که این هم با جمعیت بسیار بالای این کشور و سطح درامد ملی ان هم خوانی کامل دارد",5,1,0,0,0,0,0,0
