positive_points,negative_points,text,like,dislike,"ارزش خرید به نسبت قیمت",نوآوری,"کیفیت ساخت","امکانات و قابلیت ها","سهولت استفاده","طراحی و ظاهر"
,,"هر کی بلده روتش کنه بگه
Iroot و kingo root و frama root نتونستن",1,0,0,0,0,0,0,0
,,"من میخواستم یه گوشی ساده سامسونگ بخرم ک گفتم خب این رو میخرم ک هم ارزونه هم میتونم از برنامه هایی نظیر تلگرام هم استفاده کنم. الان از خریدش پشیمونم، حتی برای تماس گرفتن کای وقتتو میگیره از بس داغونه این گوشی. از همین امروز ک بازش کردم بدون نصب هیچ برنامه ای متوجه کندی بسیار زیادش شدم. به هیچ وجه پیشنهادش نمیکنم. باطری هم زود خالی می کنه ضمنا.",1,1,0,0,0,0,0,0
,,"سلام دوستان عزیزمن میخاستم این گوشی رو روتش کنم نتونستم ازهربرنامه ای هم استفاده کردم ولی موفق نشدم لطفاراهنمایی کنید مرسی",1,0,5,4,4,5,5,3
,,"سلام دوستان من نتونستم باهاش اچ دی فیلم بگیرم اگه میتونه اچ دی بگیره لطفا راهنماییم کنید اگه نتونه پس میفرستم دیجی!!!",0,0,0,0,0,0,0,0
,,"لوازم جانبی این گوشی خیلی خیلی کم‌یابه حتی قاب و کاور و برچسبش هم گیرم نیومده!!!!",5,0,0,0,0,0,0,0
,,"سلام
بی زحمت باز هم از این گوشی ها بیارید و تو پیشنهاد ویژه بزارید می خوام بخرم
با تشکر",1,0,5,5,5,5,5,5
,,"با عرض سلام وخسته نباشید
اگه مقدوره این گوشی رو موجودش کنید.",1,0,5,4,4,4,4,5
,,"در جواب دوست عزیزی که درباره باتری و پیامک های فارسی این گوشی سوال کردن باید عرض کنم نه با استفاده عادی تماس و پیامک باتریش تقریبا یه روز رو دوام میاره اتفاقا من دیروز تو تنظیمات بخش باتری یه گزینه داره برای ذخیره باتری که اگه اون رو روشن کنید راحت یه روز کامل رو براتون شارژ نگه میداره فکر نکنم مشکلی پیش بیاد فقط به این افرادی میگن که باتری گوشی باید 6 ساعت بمونه شارژ و این حرفا گوشی ندید باتری های لیتیوم آیون از لحظه ای که به شارژ وصل کردید تا موقعی که به 100 درصد برسه نگه دارید بعدش کابل شارژ رو جدا کنید و در مورد پیامک فارسی گوشی به طور کامل از زبان فارسی پشتیبانی میکنه و مشکلی نداره در کل خوبه من که راضی ام",5,0,0,0,0,0,0,0
,,"دوستان نخرید که پشت 3 تا دکمه ی پایینش چراغ نداره",0,1,0,0,0,0,0,0
,,"آقای محمد جواد چهری خیلی ممنون که درباره این گوشی نقد نوشتی من 2 تا سوال دارم اگه امکانش هست جواب بده
1. اگه اینترنت گوشی غیر فعال باشه و فقط واسه مکالمه و اس ام اس از این گوشی استفاده کنی باطریش چقدر دوام میاره؟
2. بعضی از گوشیای الکاتل اس ام اس فارسی رو خالی میفرستن و خالی دریافت میکنن این گوشی این مشکلو نداره؟",1,0,0,0,0,0,0,0
,,"سلام
دوستانی که این گوشی رو دارن میشه لطفا نظرشون رو در مورد باطریش بگن ؟
با استفاده معمولی چقد شارژ نگه میداده ؟",0,0,0,0,0,0,0,0
,,"در جواب دوستان و بقیه کسانی این نظرو میخونن باید بگم شما اون مثلی که میگه هرچی پول بیشتر بدی آش بیشتر میخوری رو شنیدی انقدر پول دادی حتما میخواستی Galaxy S6 بهت بدن بعضی از مردم نمیدونم چرا ولی توقعاتشون شدید بالاست هم خدا رو میخوان هم خرما رو اتفاقا من همین 94/7/4 سفارش دادم از همین دیجیکالا و 94/7/5 هم بین ساعت 12 تا 15 که خواسته بودم آوردن تحویل دادن از اون روز تاحالا تمام برنامه هایی که میخواستم رو روش نصب کردم قبل از اینکه هر توضیحی بدم والا من که توش مشکلی ندیدم کیفیت ساختش که با گوشی هایی مثل سامسونگ و ال جی برابری میکرد چون خودم قبلا Galaxy Note 1 رو داشتم بریم سر وقت سخت افزار و نرم افزار گوشی من همیشه میخوام گوشی بخرم یه 2 ،3 روزی رو فقط تحقیق میکنم درباره قیمت درباره نظر فروشنده و همینطور خریدار ها بعد یه گوشی رو میخرم تو این رنج قیمت هیچ گوشی نیست که این مشخصات نرم افزاری خوب مثل اندروید خالص 4.4 به علاوه کلی برنامه از قبل نصب شده مفید رو داشته باشه وقتی روشنش کردم واقعا حال کردم عین گوشی های ویندوز فون روی خودش واتس اپ و وایبر نصب بود بعدش مشخصات سخت افزاریش شاید به چشم نیاد ولی من تا الان 5 تا بازی مهمی رو میخواستم نصب کردم و بدون هنگ اجرا کرده تازه 3تاش هم دیتا داره این لیست بازی ها : Clash of Clans - Boom Beach - Plants VS Zombies 2 و Rayman Origins که همین بازی ریمن و گیاهان در برابر زامبی های و بوم بیچ هر 3 تاشون دیتا دار هستن و دیتای هاشون بالای 100 مگ هستش شما میگی حافظه در دسترش کمه خوب عزیزم خاصیت اندروید همینه الان شما یه گوشی با حافظه 16 گیگ هم بخری حداکثر 12 گیگش در دسترس هستش باقی رو خود سیستم عامل گوشی ورمیداره یه حرفی شما میزنی آره دوربینش تو شب جالب نیست ولی تو روز خدایی کم لطفی خرده بهش بگیریم یکی هم تاچش هستش که یکم ضعیفه و باتری که روزی 2 بار باید شاید شارژ بشه البته من همیشه وای فای گوشیم روشنه و دارم با تلگرام چت میکنم کیفیت تماس و مکالمه عالی چون من قبلا تبلت پاپ 7 الکاتل رو داشتم این برند امتحانشو پس داده همینطور گارانتیش یاس عالی تبلت پاپ سون رو اشباه آپدیت کردم دیگه روشن نشد بردم گارانتی یاس و بدون هیچ هزینه درستش کردن و عالی هم بود بگذریم وقتی گوشی رو برای بار اول روشن کردید حداقل 3 صفحه برنامه روشه که یسریشون خوبه مثل وایبر واتس اپ ولی باقی رو میتونید حذف یا غیر فعال کنید کافیه تو بخش مدیریت برنامه هر برنامه ای رو که نمیخواید حذف و غیر فعالش کنید دیگه با این پول الان پاستیل خرسی هم نمیدن خرج یه آدم عادی توی روز بیشتر از 20 هزار تومن و در آخر اینم بگم کیفیت صفحه اش عالی با اینکه IPS نیست ولی فوق العاده شفاف و خوب و توی روز خوب جواب میده درضمن هیچ گوشی تو این رنج قیمت دوربین سلفی و دوربین پشتی 3.2 مگاپیکسل و این چیزا رو نداره در کل برند آلکاتل به خاطر استفاده از اندروید تقریبا میشه گفت خام گوشی هاش سریع و روونه و برای کسایی که میخوان یه گوشی به روز جدید داشته باشن پیشنهادش میکنم",8,0,0,0,0,0,0,0
,,"دوستان گوشی زیادجالبی نیست صفحه نمایش نه چندان خوب، زیادخوش دست نیست چندنرم افزارازجمله وایبرو واتس اپ روش نصبه،زیاد روان نیست حافظه دردسترس کمترازدوگیگابایت دوربینش هم زیادبدنیست یه محافظ صفحه وهندزفری همراشه منکه زیادپسندنکردم باهزینه کردن مبلغی اندک شایدبهترازاین گزینه میشه انتخاب کرد",1,0,5,4,4,5,5,3
,,"با عرض سلام و خسته نباشید خدمت دوستان دیجی کالا لطفا این گوشی را در پیشنهاد شگفت انگیز قرار دهید
باتشکر",2,0,0,0,0,0,0,0
,,"اگه باطری خوبی هم داشته باشه ، نسبت به قیمتش واقعا عالیه . حتی هواوی و الجی هم تو این سطح قیمتی ، به فلاش مجهز نیستند .",1,0,5,4,5,5,3,4
,,"بنظرم به نسبت قیمت، واقعا امکانات بی نظیری داره.. همین که اندرویده و میشه پیام رسان هایی مثل تلگرام و ... رو روش نصب کرد خیلی عالیه. با این گوشی دو سیم معمولی گیر میاد! اما این عالیه.
اگه دیجی بذارتش توو پیشنهاد ویژه و کمی هم تخفیف بخوره، حتما میخرمش D:",1,0,0,0,0,0,0,0
,,"این گوشی با توجه به قیمتش گوشی خوبیه",1,0,4,4,5,3,5,4
,,"چندین موردش باعث شده که بین ارزونترین اسمارت فون ها بهترین باشه!
1) فیلمبرداری اچ دی!
2) دوربین سلفی!
3) صفحه 4 اینچی!
4) قیمت مناسب
5) اندروید 4.4",2,0,0,0,0,0,0,0
,,"گوشی خوبیه.دمتگرم دی جی",2,0,5,5,5,5,5,5
,,"من الجی ال 40 رو پیشنهاد میکنم .",3,0,0,0,0,0,0,0
