positivePoints,negativePoints,commentText,like,dislike,"کيفيت ساخت"
"کليدهاي غير قابل ساخت
داراي مکان ياب",ندارد,"با نظر قبلی 100% موافق هستم برای کانتینرهای شرکت خریداری کردیم و واقعا جلوی دزد بری ها را که گرفته هیچ و هرجا که قفل باز بشه یا ظربه وارد شه به قفل همان لحظه رو گشی میبنم . واقعا قفل خوبیه",4,1,5
"کيفيت ساخت بسيار بالا
امکانات کامل
پشتيباني قوي",,"بنده قبل از اینکه در دیجی موجود بشه سه عدد از این محصول رو برای انبار شرکتمون خریداری کردم. بینظیره و فکر میکنم در دنیا مشابه دیگه ای نداره. برای کسانیکه کاربرد مشابه با من رو دارن پیشنهاد میکنم. در ضمن پشتیبانی شرکتش هم عالیه.",11,4,5
